Country_Region,Last_Update,Confirmed,Deaths,Recovered,Active,Delta_Confirmed,Delta_Recovered,Incident_Rate,People_Tested,People_Hospitalized,Province_State,FIPS,UID,iso3,Report_Date_String,Delta_Deaths,Doses_Admin,Delta_Doses_Admin
Afghanistan,3/5/22,174331,7622,,,117,,447.82540309128507,,,,,4,AFG,2022/03/05,3,5535254,0
Afghanistan,3/6/22,174582,7623,,,251,,448.4701775500785,,,,,4,AFG,2022/03/06,1,5597130,61876
Afghanistan,3/7/22,175000,7626,,,418,,449.54394537388583,,,,,4,AFG,2022/03/07,3,5597130,0
Afghanistan,3/8/22,175353,7630,,,353,,450.4507397322686,,,,,4,AFG,2022/03/08,4,5597130,0
Afghanistan,3/9/22,175525,7636,,,172,,450.89257721000746,,,,,4,AFG,2022/03/09,6,5597130,0
Afghanistan,3/10/22,175893,7639,,,368,,451.83790390656515,,,,,4,AFG,2022/03/10,3,5597130,0
Afghanistan,3/11/22,175974,7640,,,81,,452.0459785327096,,,,,4,AFG,2022/03/11,1,5597130,0
Afghanistan,3/12/22,176039,7641,,,65,,452.2129519981342,,,,,4,AFG,2022/03/12,1,5597130,0
Afghanistan,3/13/22,176201,7643,,,162,,452.62910125042316,,,,,4,AFG,2022/03/13,2,5597130,0
Afghanistan,3/14/22,176409,7645,,,208,,453.16341633978186,,,,,4,AFG,2022/03/14,2,5597130,0
Afghanistan,3/15/22,176571,7646,,,162,,453.5795655920708,,,,,4,AFG,2022/03/15,1,5597130,0
Afghanistan,3/16/22,176743,7651,,,172,,454.0214030698097,,,,,4,AFG,2022/03/16,5,5597130,0
Afghanistan,3/17/22,176918,7651,,,175,,454.47094701518364,,,,,4,AFG,2022/03/17,0,5597130,0
Afghanistan,3/18/22,176983,7651,,,65,,454.6379204806082,,,,,4,AFG,2022/03/18,0,5731146,134016
Afghanistan,3/19/22,177039,7652,,,56,,454.7817745431278,,,,,4,AFG,2022/03/19,1,5731146,0
Afghanistan,3/20/22,177093,7654,,,54,,454.9204909605575,,,,,4,AFG,2022/03/20,2,5731146,0
Afghanistan,3/21/22,177191,7654,,,98,,455.17223556996686,,,,,4,AFG,2022/03/21,0,5731146,0
Afghanistan,3/22/22,177255,7656,,,64,,455.3366402128465,,,,,4,AFG,2022/03/22,2,5731146,0
Afghanistan,3/23/22,177321,7657,,,66,,455.50618250081607,,,,,4,AFG,2022/03/23,1,5731146,0
Afghanistan,3/27/22,177520,7662,,,199,,456.0173781872698,,,,,4,AFG,2022/03/27,5,5751015,19869
Afghanistan,3/28/22,177602,7663,,,82,,456.22802163595924,,,,,4,AFG,2022/03/28,1,5751015,0
Afghanistan,3/29/22,177658,7665,,,56,,456.3718756984789,,,,,4,AFG,2022/03/29,2,5751015,0
Afghanistan,3/30/22,177716,7667,,,58,,456.52086740608854,,,,,4,AFG,2022/03/30,2,5751015,0
Afghanistan,3/31/22,177747,7670,,,31,,456.60050090498333,,,,,4,AFG,2022/03/31,3,5751015,0
Afghanistan,4/1/22,177782,7670,,,35,,456.69040969405813,,,,,4,AFG,2022/04/01,0,,
Albania,3/5/22,272030,3478,,,0,,9452.706928904025,,,,,8,ALB,2022/03/05,0,2708574,0
Albania,3/6/22,272210,3482,,,180,,9458.961706859407,,,,,8,ALB,2022/03/06,4,2708574,0
Albania,3/7/22,272250,3483,,,40,,9460.351657516158,,,,,8,ALB,2022/03/07,1,2708574,0
Albania,3/8/22,272337,3483,,,87,,9463.374800194593,,,,,8,ALB,2022/03/08,0,2708574,0
Albania,3/9/22,272412,3483,,,75,,9465.980957676002,,,,,8,ALB,2022/03/09,0,2723146,14572
Albania,3/10/22,272479,3484,,,67,,9468.309125026062,,,,,8,ALB,2022/03/10,1,2723146,0
Albania,3/11/22,272552,3485,,,73,,9470.845784974634,,,,,8,ALB,2022/03/11,1,2729969,6823
Albania,3/12/22,272621,3485,,,69,,9473.24344985753,,,,,8,ALB,2022/03/12,0,2729969,0
Albania,3/13/22,272663,3485,,,42,,9474.702898047119,,,,,8,ALB,2022/03/13,0,2729969,0
Albania,3/14/22,272689,3485,,,26,,9475.606365974008,,,,,8,ALB,2022/03/14,0,2729969,0
Albania,3/15/22,272711,3486,,,22,,9476.37083883522,,,,,8,ALB,2022/03/15,1,2729969,0
Albania,3/16/22,272804,3487,,,93,,9479.60247411217,,,,,8,ALB,2022/03/16,1,2735318,5349
Albania,3/17/22,272885,3487,,,81,,9482.41712419209,,,,,8,ALB,2022/03/17,0,2743218,7900
Albania,3/18/22,272961,3487,,,76,,9485.05803043992,,,,,8,ALB,2022/03/18,0,2743218,0
Albania,3/19/22,273040,3487,,,79,,9487.803182987003,,,,,8,ALB,2022/03/19,0,2743218,0
Albania,3/20/22,273088,3487,,,48,,9489.471123775105,,,,,8,ALB,2022/03/20,0,2743218,0
Albania,3/22/22,273146,3489,,,58,,9491.486552227396,,,,,8,ALB,2022/03/22,2,2743218,0
Albania,3/23/22,273164,3489,,,18,,9492.112030022934,,,,,8,ALB,2022/03/23,0,2743218,0
Albania,3/24/22,273257,3489,,,93,,9495.343665299883,,,,,8,ALB,2022/03/24,0,2743218,0
Albania,3/25/22,273318,3490,,,61,,9497.463340051429,,,,,8,ALB,2022/03/25,1,2743218,0
Albania,3/26/22,273387,3491,,,69,,9499.861004934324,,,,,8,ALB,2022/03/26,1,2743218,0
Albania,3/27/22,273432,3491,,,45,,9501.42469942317,,,,,8,ALB,2022/03/27,0,2764839,21621
Albania,3/29/22,273529,3492,,,97,,9504.795329765793,,,,,8,ALB,2022/03/29,1,2764839,0
Albania,3/30/22,273608,3492,,,79,,9507.540482312877,,,,,8,ALB,2022/03/30,0,2764839,0
Albania,3/31/22,273677,3492,,,69,,9509.938147195775,,,,,8,ALB,2022/03/31,0,2764839,0
Albania,4/1/22,273759,3492,,,82,,9512.787546042115,,,,,8,ALB,2022/04/01,0,,
Algeria,3/5/22,265227,6853,,,41,,604.8362407252206,,,,,12,DZA,2022/03/05,1,13461201,0
Algeria,3/6/22,265265,6855,,,38,,604.9228977290232,,,,,12,DZA,2022/03/06,2,13461201,0
Algeria,3/7/22,265297,6857,,,32,,604.9958720480149,,,,,12,DZA,2022/03/07,2,13461201,0
Algeria,3/8/22,265323,6858,,,26,,605.0551636821957,,,,,12,DZA,2022/03/08,1,13461201,0
Algeria,3/9/22,265346,6860,,,23,,605.107613973971,,,,,12,DZA,2022/03/09,2,13461201,0
Algeria,3/10/22,265366,6861,,,20,,605.1532229233408,,,,,12,DZA,2022/03/10,1,13461201,0
Algeria,3/11/22,265391,6861,,,25,,605.210234110053,,,,,12,DZA,2022/03/11,0,13461201,0
Algeria,3/12/22,265410,6862,,,19,,605.2535626119543,,,,,12,DZA,2022/03/12,1,13461201,0
Algeria,3/13/22,265432,6864,,,22,,605.3037324562611,,,,,12,DZA,2022/03/13,2,13461201,0
Algeria,3/14/22,265457,6866,,,25,,605.3607436429734,,,,,12,DZA,2022/03/14,2,13461201,0
Algeria,3/15/22,265478,6868,,,21,,605.4086330398117,,,,,12,DZA,2022/03/15,2,13461201,0
Algeria,3/16/22,265496,6869,,,18,,605.4496810942444,,,,,12,DZA,2022/03/16,1,13461201,0
Algeria,3/17/22,265511,6870,,,15,,605.4838878062718,,,,,12,DZA,2022/03/17,1,13461201,0
Algeria,3/18/22,265524,6871,,,13,,605.5135336233622,,,,,12,DZA,2022/03/18,1,13461201,0
Algeria,3/19/22,265539,6871,,,15,,605.5477403353896,,,,,12,DZA,2022/03/19,0,13461201,0
Algeria,3/20/22,265550,6871,,,11,,605.572825257543,,,,,12,DZA,2022/03/20,0,13461201,0
Algeria,3/21/22,265562,6872,,,12,,605.6001906271648,,,,,12,DZA,2022/03/21,1,13461201,0
Algeria,3/22/22,265573,6873,,,11,,605.6252755493182,,,,,12,DZA,2022/03/22,1,13461201,0
Algeria,3/23/22,265585,6873,,,12,,605.65264091894,,,,,12,DZA,2022/03/23,0,13461201,0
Algeria,3/24/22,265599,6873,,,14,,605.6845671834989,,,,,12,DZA,2022/03/24,0,13461201,0
Algeria,3/25/22,265612,6873,,,13,,605.7142130005893,,,,,12,DZA,2022/03/25,0,13461201,0
Algeria,3/26/22,265621,6873,,,9,,605.7347370278057,,,,,12,DZA,2022/03/26,0,13461201,0
Algeria,3/27/22,265629,6873,,,8,,605.7529806075536,,,,,12,DZA,2022/03/27,0,13461201,0
Algeria,3/28/22,265641,6873,,,12,,605.7803459771756,,,,,12,DZA,2022/03/28,0,13461201,0
Algeria,3/29/22,265651,6874,,,10,,605.8031504518605,,,,,12,DZA,2022/03/29,1,13461201,0
Algeria,3/30/22,265662,6874,,,11,,605.8282353740138,,,,,12,DZA,2022/03/30,0,13704895,243694
Algeria,3/31/22,265671,6874,,,9,,605.8487594012302,,,,,12,DZA,2022/03/31,0,13704895,0
Algeria,4/1/22,265679,6874,,,8,,605.8670029809781,,,,,12,DZA,2022/04/01,0,,
Andorra,3/5/22,38434,151,,,0,,49743.09195625445,,,,,20,AND,2022/03/05,0,142420,0
Andorra,3/7/22,38620,151,,,186,,49983.82191160293,,,,,20,AND,2022/03/07,0,142420,0
Andorra,3/8/22,38710,152,,,90,,50100.30414806186,,,,,20,AND,2022/03/08,1,142420,0
Andorra,3/9/22,38794,152,,,84,,50209.02090209021,,,,,20,AND,2022/03/09,0,142420,0
Andorra,3/17/22,39234,153,,,440,,50778.48961366725,,,,,20,AND,2022/03/17,1,151284,8864
Andorra,3/23/22,39713,153,,,479,,51398.43396104316,,,,,20,AND,2022/03/23,0,151284,0
Andorra,3/24/22,39713,155,,,0,,51398.43396104316,,,,,20,AND,2022/03/24,2,151284,0
Andorra,3/25/22,39713,153,,,0,,51398.43396104316,,,,,20,AND,2022/03/25,,151284,0
Andorra,3/30/22,40024,153,,,311,,51800.94480036239,,,,,20,AND,2022/03/30,0,151997,0
Andorra,4/1/22,40024,153,,,0,,51800.94480036239,,,,,20,AND,2022/04/01,0,,
Angola,3/5/22,98796,1900,,,0,,300.59999510744575,,,,,24,AGO,2022/03/05,0,15505389,0
Angola,3/6/22,98806,1900,,,10,,300.6304214400004,,,,,24,AGO,2022/03/06,0,15505389,0
Angola,3/8/22,98829,1900,,,23,,300.70040200487625,,,,,24,AGO,2022/03/08,0,15505389,0
Angola,3/9/22,98855,1900,,,26,,300.77951046951847,,,,,24,AGO,2022/03/09,0,15505389,0
Angola,3/12/22,98909,1900,,,54,,300.9438126653139,,,,,24,AGO,2022/03/12,0,15505389,0
Angola,3/13/22,98927,1900,,,18,,300.99858006391236,,,,,24,AGO,2022/03/13,0,15505389,0
Angola,3/14/22,98931,1900,,,4,,301.0107505969342,,,,,24,AGO,2022/03/14,0,15505389,0
Angola,3/15/22,98956,1900,,,25,,301.08681642832096,,,,,24,AGO,2022/03/15,0,15505389,0
Angola,3/16/22,98985,1900,,,29,,301.1750527927296,,,,,24,AGO,2022/03/16,0,15505389,0
Angola,3/17/22,99003,1900,,,18,,301.2298201913281,,,,,24,AGO,2022/03/17,0,15505389,0
Angola,3/21/22,99010,1900,,,7,,301.2511186241164,,,,,24,AGO,2022/03/21,0,15505389,0
Angola,3/22/22,99058,1900,,,48,,301.39716502037896,,,,,24,AGO,2022/03/22,0,15505389,0
Angola,3/24/22,99081,1900,,,23,,301.46714558525474,,,,,24,AGO,2022/03/24,0,15505389,0
Angola,3/25/22,99102,1900,,,21,,301.53104088361965,,,,,24,AGO,2022/03/25,0,15505389,0
Angola,3/26/22,99106,1900,,,4,,301.5432114166415,,,,,24,AGO,2022/03/26,0,15505389,0
Angola,3/27/22,99115,1900,,,9,,301.57059511594076,,,,,24,AGO,2022/03/27,0,15505389,0
Angola,3/29/22,99138,1900,,,23,,301.6405756808166,,,,,24,AGO,2022/03/29,0,15505389,0
Angola,3/31/22,99169,1900,,,31,,301.7348973117362,,,,,24,AGO,2022/03/31,0,15505389,0
Angola,4/1/22,99194,1900,,,25,,301.81096314312293,,,,,24,AGO,2022/04/01,0,,
Antarctica,3/5/22,11,0,,,0,,,,,,,10,ATA,2022/03/05,0,,
Antarctica,4/1/22,11,0,,,0,,,,,,,10,ATA,2022/04/01,0,,
Antigua and Barbuda,3/5/22,7455,135,,,6,,7612.735887590883,,,,,28,ATG,2022/03/05,0,125031,0
Antigua and Barbuda,3/9/22,7461,135,,,6,,7618.8628380034315,,,,,28,ATG,2022/03/09,0,125031,0
Antigua and Barbuda,3/11/22,7466,135,,,5,,7623.968630013887,,,,,28,ATG,2022/03/11,0,125031,0
Antigua and Barbuda,3/15/22,7470,135,,,4,,7628.053263622253,,,,,28,ATG,2022/03/15,0,125031,0
Antigua and Barbuda,3/19/22,7473,135,,,3,,7631.116738828527,,,,,28,ATG,2022/03/19,0,125386,0
Antigua and Barbuda,3/23/22,7482,135,,,9,,7640.307164447349,,,,,28,ATG,2022/03/23,0,125386,0
Antigua and Barbuda,3/27/22,7485,135,,,3,,7643.370639653623,,,,,28,ATG,2022/03/27,0,125386,0
Antigua and Barbuda,3/28/22,7491,135,,,6,,7649.497590066171,,,,,28,ATG,2022/03/28,0,125386,0
Antigua and Barbuda,4/1/22,7493,135,,,2,,7651.539906870354,,,,,28,ATG,2022/04/01,0,,
Argentina,3/5/22,8934328,126708,,,4430,,19768.059303416776,,,,,32,ARG,2022/03/05,84,94081034,143565
Argentina,3/6/22,8936602,126768,,,2274,,19773.090746951868,,,,,32,ARG,2022/03/06,60,94081034,0
Argentina,3/7/22,8942888,126842,,,6286,,19786.999126046667,,,,,32,ARG,2022/03/07,74,94213510,132476
Argentina,3/8/22,8949362,126901,,,6474,,19801.32347320857,,,,,32,ARG,2022/03/08,59,94371423,157913
Argentina,3/9/22,8955458,126955,,,6096,,19814.81145904406,,,,,32,ARG,2022/03/09,54,94493804,122381
Argentina,3/10/22,8961595,127009,,,6137,,19828.39016131972,,,,,32,ARG,2022/03/10,54,94622092,128288
Argentina,3/11/22,8967210,127051,,,5615,,19840.81388843033,,,,,32,ARG,2022/03/11,42,94770122,148030
Argentina,3/12/22,8970196,127122,,,2986,,19847.42070038977,,,,,32,ARG,2022/03/12,71,94924200,154078
Argentina,3/13/22,8971432,127187,,,1236,,19850.15546917138,,,,,32,ARG,2022/03/13,65,95012933,88733
Argentina,3/14/22,8976079,127257,,,4647,,19860.43740325562,,,,,32,ARG,2022/03/14,70,95051509,38576
Argentina,3/15/22,8981155,127295,,,5076,,19871.668541067454,,,,,32,ARG,2022/03/15,38,95164436,112927
Argentina,3/16/22,8985836,127334,,,4681,,19882.02570341915,,,,,32,ARG,2022/03/16,39,95302989,138553
Argentina,3/17/22,8990413,127363,,,4577,,19892.152755776275,,,,,32,ARG,2022/03/17,29,95424211,121222
Argentina,3/18/22,9004829,127439,,,14416,,19924.049541177264,,,,,32,ARG,2022/03/18,76,95546011,121800
Argentina,3/19/22,9006526,127483,,,1697,,19927.804316761718,,,,,32,ARG,2022/03/19,44,95546011,0
Argentina,3/20/22,9007753,127494,,,1227,,19930.51917217841,,,,,32,ARG,2022/03/20,11,95546011,0
Argentina,3/21/22,9011367,127599,,,3614,,19938.515494489675,,,,,32,ARG,2022/03/21,105,95546011,0
Argentina,3/22/22,9016057,127675,,,4690,,19948.892570206284,,,,,32,ARG,2022/03/22,76,95915973,369962
Argentina,3/23/22,9019660,127752,,,3603,,19956.86455396043,,,,,32,ARG,2022/03/23,77,95915973,0
Argentina,3/24/22,9021240,127780,,,1580,,19960.360455800994,,,,,32,ARG,2022/03/24,28,96158041,242068
Argentina,3/25/22,9023812,127846,,,2572,,19966.051252974365,,,,,32,ARG,2022/03/25,66,96196459,38418
Argentina,3/26/22,9025257,127904,,,1445,,19969.24845434121,,,,,32,ARG,2022/03/26,58,96301409,104950
Argentina,3/27/22,9026075,127909,,,818,,19971.058357952337,,,,,32,ARG,2022/03/27,5,96362115,60706
Argentina,3/28/22,9028730,127943,,,2655,,19976.932800602146,,,,,32,ARG,2022/03/28,34,96385888,23773
Argentina,3/29/22,9032162,127970,,,3432,,19984.526430422913,,,,,32,ARG,2022/03/29,27,96490416,104528
Argentina,3/30/22,9035127,127997,,,2965,,19991.086777864224,,,,,32,ARG,2022/03/30,27,96593425,103009
Argentina,3/31/22,9037911,128019,,,2784,,19997.24664541114,,,,,32,ARG,2022/03/31,22,96593425,0
Argentina,4/1/22,9039838,128052,,,1927,,20001.510318098968,,,,,32,ARG,2022/04/01,33,,
Armenia,3/5/22,421226,8528,,,218,,14215.077175815342,,,,,51,ARM,2022/03/05,12,1971565,0
Armenia,3/6/22,421341,8536,,,115,,14218.958070810473,,,,,51,ARM,2022/03/06,8,1971565,0
Armenia,3/7/22,421401,8548,,,60,,14220.98288559054,,,,,51,ARM,2022/03/07,12,1971565,0
Armenia,3/8/22,421541,8552,,,140,,14225.7074534107,,,,,51,ARM,2022/03/08,4,1971565,0
Armenia,3/9/22,421592,8560,,,51,,14227.428545973757,,,,,51,ARM,2022/03/09,8,1971565,0
Armenia,3/10/22,421714,8563,,,122,,14231.545669359895,,,,,51,ARM,2022/03/10,3,1971565,0
Armenia,3/11/22,421842,8568,,,128,,14235.865274224041,,,,,51,ARM,2022/03/11,5,1971565,0
Armenia,3/12/22,421953,8570,,,111,,14239.611181567167,,,,,51,ARM,2022/03/12,2,1971565,0
Armenia,3/13/22,422004,8572,,,51,,14241.332274130224,,,,,51,ARM,2022/03/13,2,1971565,0
Armenia,3/14/22,422021,8576,,,17,,14241.905971651244,,,,,51,ARM,2022/03/14,4,1971565,0
Armenia,3/15/22,422076,8579,,,55,,14243.762051866306,,,,,51,ARM,2022/03/15,3,1971565,0
Armenia,3/16/22,422155,8587,,,79,,14246.428057993395,,,,,51,ARM,2022/03/16,8,1971565,0
Armenia,3/17/22,422202,8589,,,47,,14248.014162904448,,,,,51,ARM,2022/03/17,2,1971565,0
Armenia,3/18/22,422254,8592,,,52,,14249.769002380508,,,,,51,ARM,2022/03/18,3,1971565,0
Armenia,3/19/22,422286,8593,,,32,,14250.848903596543,,,,,51,ARM,2022/03/19,1,1971565,0
Armenia,3/20/22,422307,8595,,,21,,14251.557588769567,,,,,51,ARM,2022/03/20,2,1971565,0
Armenia,3/21/22,422328,8598,,,21,,14252.26627394259,,,,,51,ARM,2022/03/21,3,1971565,0
Armenia,3/22/22,422354,8601,,,26,,14253.14369368062,,,,,51,ARM,2022/03/22,3,1971565,0
Armenia,3/23/22,422382,8603,,,28,,14254.088607244652,,,,,51,ARM,2022/03/23,2,1971565,0
Armenia,3/24/22,422401,8604,,,19,,14254.729798591674,,,,,51,ARM,2022/03/24,1,1971565,0
Armenia,3/25/22,422423,8607,,,22,,14255.472230677698,,,,,51,ARM,2022/03/25,3,1971565,0
Armenia,3/26/22,422444,8608,,,21,,14256.180915850722,,,,,51,ARM,2022/03/26,1,1971565,0
Armenia,3/27/22,422458,8610,,,14,,14256.653372632738,,,,,51,ARM,2022/03/27,2,1971565,0
Armenia,3/28/22,422468,8610,,,10,,14256.99084176275,,,,,51,ARM,2022/03/28,0,1971565,0
Armenia,3/29/22,422484,8611,,,16,,14257.530792370768,,,,,51,ARM,2022/03/29,1,1971565,0
Armenia,3/30/22,422498,8611,,,14,,14258.003249152784,,,,,51,ARM,2022/03/30,0,2088962,0
Armenia,3/31/22,422519,8613,,,21,,14258.711934325807,,,,,51,ARM,2022/03/31,2,2088962,0
Armenia,4/1/22,422540,8616,,,21,,14259.420619498831,,,,,51,ARM,2022/04/01,3,,
Australia,3/5/22,3362035,5416,,,17376,,13205.32056544264,,,,,36,AUS,2022/03/05,14,54557472,51889
Australia,3/6/22,3384217,5425,,,22182,,13292.446493870706,,,,,36,AUS,2022/03/06,9,54580411,22939
Australia,3/7/22,3429179,5464,,,44962,,13469.04716080708,,,,,36,AUS,2022/03/07,39,54659240,78829
Australia,3/8/22,3459870,5495,,,30691,,13589.594535677954,,,,,36,AUS,2022/03/08,31,54749767,90527
Australia,3/9/22,3496205,5520,,,36335,,13732.310278597155,,,,,36,AUS,2022/03/09,25,54841157,91390
Australia,3/10/22,3527894,5550,,,31689,,13856.777573969843,,,,,36,AUS,2022/03/10,30,54934071,92914
Australia,3/11/22,3562971,5571,,,35077,,13994.552174613213,,,,,36,AUS,2022/03/11,21,55042007,107936
Australia,3/12/22,3596466,5587,,,33495,,14126.113033539279,,,,,36,AUS,2022/03/12,16,55114521,72514
Australia,3/13/22,3622906,5590,,,26440,,14229.963432404938,,,,,36,AUS,2022/03/13,3,55149115,34594
Australia,3/14/22,3651709,5615,,,28803,,14343.09516608601,,,,,36,AUS,2022/03/14,25,55223539,74424
Australia,3/15/22,3706018,5638,,,54309,,14556.40875579838,,,,,36,AUS,2022/03/15,23,55321036,97497
Australia,3/16/22,3763166,5662,,,57148,,14780.873301727828,,,,,36,AUS,2022/03/16,24,55415201,94165
Australia,3/17/22,3812332,5691,,,49166,,14973.986339194884,,,,,36,AUS,2022/03/17,29,55508022,92821
Australia,3/18/22,3859284,5722,,,46952,,15158.40328047856,,,,,36,AUS,2022/03/18,31,55608918,100896
Australia,3/19/22,3900138,5725,,,40854,,15318.86864338543,,,,,36,AUS,2022/03/19,3,55680095,71177
Australia,3/20/22,3943368,5736,,,43230,,15488.666402196412,,,,,36,AUS,2022/03/20,11,55716641,36546
Australia,3/21/22,3996431,5763,,,53063,,15697.085982945597,,,,,36,AUS,2022/03/21,27,55804675,88034
Australia,3/22/22,4053987,5786,,,57556,,15923.153061505045,,,,,36,AUS,2022/03/22,23,55889039,84364
Australia,3/23/22,4113691,5817,,,59704,,16157.657003028315,,,,,36,AUS,2022/03/23,31,55889039,0
Australia,3/24/22,4180473,5850,,,66782,,16419.961743461234,,,,,36,AUS,2022/03/24,33,55961916,72877
Australia,3/25/22,4228461,5875,,,47988,,16608.44786073677,,,,,36,AUS,2022/03/25,25,55961916,0
Australia,3/26/22,4275210,5893,,,46749,,16792.0674634815,,,,,36,AUS,2022/03/26,18,55961916,0
Australia,3/27/22,4326181,5897,,,50971,,16992.270136725885,,,,,36,AUS,2022/03/27,4,55961916,0
Australia,3/28/22,4381919,5926,,,55738,,17211.196518419307,,,,,36,AUS,2022/03/28,29,55961916,0
Australia,3/29/22,4447442,5959,,,65523,,17468.55618880034,,,,,36,AUS,2022/03/29,33,55961916,0
Australia,3/30/22,4507681,5993,,,60239,,17705.161490512455,,,,,36,AUS,2022/03/30,34,55961916,0
Australia,3/31/22,4573066,6008,,,65385,,17961.97912779805,,,,,36,AUS,2022/03/31,15,0,
Australia,4/1/22,4628163,6365,,,55097,,18178.387805040908,,,,,36,AUS,2022/04/01,357,,
Austria,3/5/22,2839297,14986,,,31289,,31525.32643453544,,,,,40,AUT,2022/03/05,26,18058790,3978
Austria,3/6/22,2867760,15008,,,28463,,31841.357257061645,,,,,40,AUT,2022/03/06,22,18060574,1784
Austria,3/7/22,2893913,15026,,,26153,,32131.739651803164,,,,,40,AUT,2022/03/07,18,18065620,5046
Austria,3/8/22,2924852,15071,,,30939,,32475.262035885593,,,,,40,AUT,2022/03/08,45,18072356,6736
Austria,3/9/22,2972647,15113,,,47795,,33005.9402202878,,,,,40,AUT,2022/03/09,42,18077783,5427
Austria,3/10/22,3022079,15136,,,49432,,33554.794368449104,,,,,40,AUT,2022/03/10,23,18083087,5304
Austria,3/11/22,3071402,15163,,,49323,,34102.43826612187,,,,,40,AUT,2022/03/11,27,18083841,754
Austria,3/12/22,3115867,15180,,,44465,,34596.142742938355,,,,,40,AUT,2022/03/12,17,18092659,8818
Austria,3/13/22,3153927,15207,,,38060,,35018.73112453367,,,,,40,AUT,2022/03/13,27,18094057,1398
Austria,3/14/22,3188147,15221,,,34220,,35398.68315864274,,,,,40,AUT,2022/03/14,14,18095970,1913
Austria,3/15/22,3225272,15261,,,37125,,35810.89003375378,,,,,40,AUT,2022/03/15,40,18100402,4432
Austria,3/16/22,3283855,15289,,,58583,,36461.34970687511,,,,,40,AUT,2022/03/16,28,18104966,4564
Austria,3/17/22,3335900,15320,,,52045,,37039.21655711494,,,,,40,AUT,2022/03/17,31,18111082,6116
Austria,3/18/22,3387012,15344,,,51112,,37606.724107301474,,,,,40,AUT,2022/03/18,24,18116207,5125
Austria,3/19/22,3429011,15387,,,41999,,38073.048054716644,,,,,40,AUT,2022/03/19,43,18118551,2344
Austria,3/20/22,3466203,15409,,,37192,,38485.99884526559,,,,,40,AUT,2022/03/20,22,18119573,1022
Austria,3/21/22,3498075,15432,,,31872,,38839.880529401315,,,,,40,AUT,2022/03/21,23,18123152,3579
Austria,3/22/22,3532415,15487,,,34340,,39221.16494936934,,,,,40,AUT,2022/03/22,55,18126693,3541
Austria,3/23/22,3585486,15530,,,53071,,39810.42369870315,,,,,40,AUT,2022/03/23,43,18126693,0
Austria,3/24/22,3627093,15579,,,41607,,40272.395185645764,,,,,40,AUT,2022/03/24,49,18135948,9255
Austria,3/25/22,3665003,15619,,,37910,,40693.318084917395,,,,,40,AUT,2022/03/25,40,18141606,5658
Austria,3/26/22,3698511,15665,,,33508,,41065.364629596734,,,,,40,AUT,2022/03/26,46,18144664,3058
Austria,3/28/22,3747582,15706,,,49071,,41610.210516965715,,,,,40,AUT,2022/03/28,41,18148681,3168
Austria,3/29/22,3770412,15764,,,22830,,41863.69692662995,,,,,40,AUT,2022/03/29,58,18152356,3675
Austria,3/30/22,3805155,15812,,,34743,,42249.45594244093,,,,,40,AUT,2022/03/30,48,18152356,0
Austria,3/31/22,3831048,15865,,,25893,,42536.951501154734,,,,,40,AUT,2022/03/31,53,18152356,0
Austria,4/1/22,3854405,15905,,,23357,,42796.28930538284,,,,,40,AUT,2022/04/01,40,,
Azerbaijan,3/5/22,788958,9500,,,433,,7781.2839802054905,,,,,31,AZE,2022/03/05,12,12720225,0
Azerbaijan,3/6/22,789332,9518,,,374,,7784.972643237738,,,,,31,AZE,2022/03/06,18,12720225,0
Azerbaijan,3/7/22,789481,9531,,,149,,7786.44219080941,,,,,31,AZE,2022/03/07,13,12720225,0
Azerbaijan,3/8/22,789757,9547,,,276,,7789.164305774385,,,,,31,AZE,2022/03/08,16,13159756,439531
Azerbaijan,3/9/22,789883,9558,,,126,,7790.407010432308,,,,,31,AZE,2022/03/09,11,13176634,16878
Azerbaijan,3/10/22,790153,9575,,,270,,7793.069948985001,,,,,31,AZE,2022/03/10,17,13202557,25923
Azerbaijan,3/11/22,790378,9589,,,225,,7795.289064445578,,,,,31,AZE,2022/03/11,14,13224872,22315
Azerbaijan,3/12/22,790575,9599,,,197,,7797.232023315506,,,,,31,AZE,2022/03/12,10,13246942,22070
Azerbaijan,3/13/22,790767,9611,,,192,,7799.125668508533,,,,,31,AZE,2022/03/13,12,13246942,0
Azerbaijan,3/14/22,790820,9618,,,53,,7799.648393483691,,,,,31,AZE,2022/03/14,7,13263746,16804
Azerbaijan,3/15/22,790962,9627,,,142,,7801.0489019076995,,,,,31,AZE,2022/03/15,9,13263773,27
Azerbaijan,3/16/22,791077,9633,,,115,,7802.183116476439,,,,,31,AZE,2022/03/16,6,13303938,40165
Azerbaijan,3/18/22,791288,9647,,,211,,7804.264153641691,,,,,31,AZE,2022/03/18,14,13338542,18052
Azerbaijan,3/19/22,791404,9651,,,116,,7805.408230945812,,,,,31,AZE,2022/03/19,4,13338542,0
Azerbaijan,3/20/22,791482,9656,,,78,,7806.177524305478,,,,,31,AZE,2022/03/20,5,13355516,16974
Azerbaijan,3/21/22,791511,9659,,,29,,7806.463543631508,,,,,31,AZE,2022/03/21,3,13368482,12966
Azerbaijan,3/22/22,791545,9666,,,34,,7806.798876634441,,,,,31,AZE,2022/03/22,7,13368489,7
Azerbaijan,3/23/22,791583,9670,,,38,,7807.173660578893,,,,,31,AZE,2022/03/23,4,13368581,92
Azerbaijan,3/24/22,791604,9672,,,21,,7807.38077802188,,,,,31,AZE,2022/03/24,2,13375580,6999
Azerbaijan,3/25/22,791654,9675,,,50,,7807.873914790897,,,,,31,AZE,2022/03/25,3,13382494,6914
Azerbaijan,3/26/22,791695,9679,,,41,,7808.278286941491,,,,,31,AZE,2022/03/26,4,13388971,6477
Azerbaijan,3/27/22,791750,9681,,,55,,7808.820737387411,,,,,31,AZE,2022/03/27,2,13395825,6854
Azerbaijan,3/28/22,791766,9684,,,16,,7808.978541153496,,,,,31,AZE,2022/03/28,3,13406075,10250
Azerbaijan,3/29/22,791814,9687,,,48,,7809.451952451753,,,,,31,AZE,2022/03/29,3,13425032,18957
Azerbaijan,3/30/22,791876,9691,,,62,,7810.063442045334,,,,,31,AZE,2022/03/30,4,13425032,0
Azerbaijan,3/31/22,791932,9692,,,56,,7810.615755226633,,,,,31,AZE,2022/03/31,1,13425032,0
Azerbaijan,4/1/22,791979,9694,,,47,,7811.079303789509,,,,,31,AZE,2022/04/01,2,,
Bahamas,3/5/22,33169,771,,,0,,8434.626495239645,,,,,44,BHS,2022/03/05,0,327515,0
Bahamas,3/6/22,33171,771,,,2,,8435.135080152982,,,,,44,BHS,2022/03/06,0,327515,0
Bahamas,3/7/22,33176,771,,,5,,8436.406542436325,,,,,44,BHS,2022/03/07,0,327515,0
Bahamas,3/8/22,33180,771,,,4,,8437.423712263,,,,,44,BHS,2022/03/08,0,327515,0
Bahamas,3/10/22,33188,771,,,8,,8439.458051916348,,,,,44,BHS,2022/03/10,0,331157,0
Bahamas,3/11/22,33191,771,,,3,,8440.220929286354,,,,,44,BHS,2022/03/11,0,331157,0
Bahamas,3/12/22,33194,771,,,3,,8440.983806656359,,,,,44,BHS,2022/03/12,0,331157,0
Bahamas,3/14/22,33198,773,,,4,,8442.000976483034,,,,,44,BHS,2022/03/14,2,331157,0
Bahamas,3/16/22,33206,773,,,8,,8444.035316136382,,,,,44,BHS,2022/03/16,0,332549,1392
Bahamas,3/18/22,33211,777,,,5,,8445.306778419725,,,,,44,BHS,2022/03/18,4,332549,0
Bahamas,3/20/22,33221,787,,,10,,8447.84970298641,,,,,44,BHS,2022/03/20,10,332549,0
Bahamas,3/21/22,33230,787,,,9,,8450.138335096428,,,,,44,BHS,2022/03/21,0,332549,0
Bahamas,3/22/22,33235,787,,,5,,8451.40979737977,,,,,44,BHS,2022/03/22,0,332549,0
Bahamas,3/23/22,33238,787,,,3,,8452.172674749776,,,,,44,BHS,2022/03/23,0,332549,0
Bahamas,3/24/22,33242,787,,,4,,8453.189844576451,,,,,44,BHS,2022/03/24,0,332549,0
Bahamas,3/25/22,33242,788,,,0,,8453.189844576451,,,,,44,BHS,2022/03/25,1,332549,0
Bahamas,3/26/22,33249,788,,,7,,8454.969891773131,,,,,44,BHS,2022/03/26,0,334155,1606
Bahamas,3/27/22,33256,788,,,7,,8456.74993896981,,,,,44,BHS,2022/03/27,0,334155,0
Bahamas,3/28/22,33257,788,,,1,,8457.00423142648,,,,,44,BHS,2022/03/28,0,334155,0
Bahamas,3/29/22,33258,788,,,1,,8457.258523883147,,,,,44,BHS,2022/03/29,0,334155,0
Bahamas,3/31/22,33283,788,,,25,,8463.615835299861,,,,,44,BHS,2022/03/31,0,334155,0
Bahamas,4/1/22,33291,788,,,8,,8465.65017495321,,,,,44,BHS,2022/04/01,0,,
Bahrain,3/5/22,525171,1458,,,1517,,30863.67223932068,,,,,48,BHR,2022/03/05,0,3403616,0
Bahrain,3/6/22,527135,1458,,,1964,,30979.09417289665,,,,,48,BHR,2022/03/06,0,3410306,6690
Bahrain,3/7/22,528834,1459,,,1699,,31078.942373072605,,,,,48,BHR,2022/03/07,1,3410306,0
Bahrain,3/8/22,530730,1461,,,1896,,31190.368027889323,,,,,48,BHR,2022/03/08,2,3410306,0
Bahrain,3/9/22,532265,1462,,,1535,,31280.578143998853,,,,,48,BHR,2022/03/09,1,3410306,0
Bahrain,3/10/22,533748,1462,,,1483,,31367.73228223366,,,,,48,BHR,2022/03/10,0,3410306,0
Bahrain,3/11/22,535065,1462,,,1317,,31445.130798791477,,,,,48,BHR,2022/03/11,0,3410306,0
Bahrain,3/12/22,536241,1462,,,1176,,31514.24291380438,,,,,48,BHR,2022/03/12,0,3410306,0
Bahrain,3/13/22,537395,1463,,,1154,,31582.062115101056,,,,,48,BHR,2022/03/13,1,3410306,0
Bahrain,3/14/22,538794,1463,,,1399,,31664.279673692086,,,,,48,BHR,2022/03/14,0,3410306,0
Bahrain,3/15/22,539988,1464,,,1194,,31734.449627200083,,,,,48,BHR,2022/03/15,1,3410306,0
Bahrain,3/16/22,541184,1464,,,1196,,31804.737118318648,,,,,48,BHR,2022/03/16,0,3410306,0
Bahrain,3/17/22,542305,1464,,,1121,,31870.61694904098,,,,,48,BHR,2022/03/17,0,3410306,0
Bahrain,3/18/22,543089,1465,,,784,,31916.691692382916,,,,,48,BHR,2022/03/18,1,3417600,7294
Bahrain,3/19/22,543835,1465,,,746,,31960.533221124093,,,,,48,BHR,2022/03/19,0,3417600,0
Bahrain,3/20/22,544851,1465,,,1016,,32020.242327291704,,,,,48,BHR,2022/03/20,0,3417600,0
Bahrain,3/21/22,545761,1465,,,910,,32073.72194009931,,,,,48,BHR,2022/03/21,0,3417600,0
Bahrain,3/22/22,546896,1466,,,1135,,32140.424534095604,,,,,48,BHR,2022/03/22,1,3417600,0
Bahrain,3/23/22,547951,1466,,,1055,,32202.425623669253,,,,,48,BHR,2022/03/23,0,3417600,0
Bahrain,3/24/22,548866,1466,,,915,,32256.199080503273,,,,,48,BHR,2022/03/24,0,3417600,0
Bahrain,3/25/22,549718,1468,,,852,,32306.270102604456,,,,,48,BHR,2022/03/25,2,3417600,0
Bahrain,3/26/22,550362,1468,,,644,,32344.117213206762,,,,,48,BHR,2022/03/26,0,3417600,0
Bahrain,3/27/22,551342,1468,,,980,,32401.71064238418,,,,,48,BHR,2022/03/27,0,3421273,3673
Bahrain,3/28/22,552155,1469,,,813,,32449.489681079325,,,,,48,BHR,2022/03/28,1,3421273,0
Bahrain,3/29/22,552890,1470,,,735,,32492.68475296239,,,,,48,BHR,2022/03/29,1,3421273,0
Bahrain,3/30/22,553750,1470,,,860,,32543.225925505838,,,,,48,BHR,2022/03/30,0,3421273,0
Bahrain,3/31/22,554469,1471,,,719,,32585.48069650437,,,,,48,BHR,2022/03/31,1,3421273,0
Bahrain,4/1/22,555003,1471,,,534,,32616.863238525537,,,,,48,BHR,2022/04/01,0,,
Bangladesh,3/5/22,1946737,29077,,,368,,1182.0658773128077,,,,,50,BGD,2022/03/05,13,0,0
Bangladesh,3/6/22,1947266,29085,,,529,,1182.3870880614083,,,,,50,BGD,2022/03/06,8,0,0
Bangladesh,3/7/22,1947702,29089,,,436,,1182.6518288674383,,,,,50,BGD,2022/03/07,4,0,0
Bangladesh,3/8/22,1948148,29096,,,446,,1182.9226417103039,,,,,50,BGD,2022/03/08,7,0,0
Bangladesh,3/9/22,1948471,29097,,,323,,1183.118768500092,,,,,50,BGD,2022/03/09,1,0,0
Bangladesh,3/10/22,1948798,29100,,,327,,1183.3173241046145,,,,,50,BGD,2022/03/10,3,0,0
Bangladesh,3/11/22,1949055,29105,,,257,,1183.4733754512881,,,,,50,BGD,2022/03/11,5,0,0
Bangladesh,3/12/22,1949253,29108,,,198,,1183.593601780632,,,,,50,BGD,2022/03/12,3,0,0
Bangladesh,3/13/22,1949486,29111,,,233,,1183.7350802389003,,,,,50,BGD,2022/03/13,3,0,0
Bangladesh,3/14/22,1949725,29112,,,239,,1183.8802019192701,,,,,50,BGD,2022/03/14,1,0,0
Bangladesh,3/15/22,1949942,29112,,,217,,1184.0119651186014,,,,,50,BGD,2022/03/15,0,0,0
Bangladesh,3/16/22,1950124,29112,,,182,,1184.1224761890085,,,,,50,BGD,2022/03/16,0,0,0
Bangladesh,3/17/22,1950357,29112,,,233,,1184.2639546472767,,,,,50,BGD,2022/03/17,0,0,0
Bangladesh,3/18/22,1950465,29114,,,108,,1184.3295326451007,,,,,50,BGD,2022/03/18,2,0,0
Bangladesh,3/19/22,1950527,29114,,,62,,1184.3671792734813,,,,,50,BGD,2022/03/19,0,0,0
Bangladesh,3/20/22,1950609,29117,,,82,,1184.4169699755328,,,,,50,BGD,2022/03/20,3,0,0
Bangladesh,3/21/22,1950725,29117,,,116,,1184.487405602825,,,,,50,BGD,2022/03/21,0,0,0
Bangladesh,3/22/22,1950846,29117,,,121,,1184.5608772485352,,,,,50,BGD,2022/03/22,0,0,0
Bangladesh,3/23/22,1950980,29118,,,134,,1184.6422425421315,,,,,50,BGD,2022/03/23,1,0,0
Bangladesh,3/24/22,1951072,29118,,,92,,1184.6981052810186,,,,,50,BGD,2022/03/24,0,0,0
Bangladesh,3/25/22,1951174,29118,,,102,,1184.7600400567412,,,,,50,BGD,2022/03/25,0,0,0
Bangladesh,3/26/22,1951239,29118,,,65,,1184.7995082961722,,,,,50,BGD,2022/03/26,0,0,0
Bangladesh,3/27/22,1951282,29118,,,43,,1184.8256180545652,,,,,50,BGD,2022/03/27,0,0,0
Bangladesh,3/28/22,1951363,29119,,,81,,1184.8748015529331,,,,,50,BGD,2022/03/28,1,0,0
Bangladesh,3/29/22,1951432,29120,,,69,,1184.9166986070984,,,,,50,BGD,2022/03/29,1,0,0
Bangladesh,3/30/22,1951504,29122,,,72,,1184.9604172723143,,,,,50,BGD,2022/03/30,2,0,0
Bangladesh,3/31/22,1951577,29122,,,73,,1185.0047431412138,,,,,50,BGD,2022/03/31,0,0,0
Bangladesh,4/1/22,1951658,29122,,,81,,1185.053926639582,,,,,50,BGD,2022/04/01,0,,
Barbados,3/5/22,56013,319,,,150,,19491.52837273072,,,,,52,BRB,2022/03/05,3,310363,383
Barbados,3/6/22,56124,319,,,111,,19530.15439971326,,,,,52,BRB,2022/03/06,0,310363,0
Barbados,3/7/22,56220,322,,,96,,19563.560693319785,,,,,52,BRB,2022/03/07,3,310363,0
Barbados,3/8/22,56376,323,,,156,,19617.845920430384,,,,,52,BRB,2022/03/08,1,310502,139
Barbados,3/9/22,56551,323,,,175,,19678.742809817275,,,,,52,BRB,2022/03/09,0,310652,150
Barbados,3/10/22,56679,323,,,128,,19723.28453462597,,,,,52,BRB,2022/03/10,0,310772,120
Barbados,3/11/22,56805,323,,,126,,19767.130294984534,,,,,52,BRB,2022/03/11,0,310825,53
Barbados,3/12/22,56922,324,,,117,,19807.84421531748,,,,,52,BRB,2022/03/12,1,310848,23
Barbados,3/13/22,57023,325,,,101,,19842.990420049344,,,,,52,BRB,2022/03/13,1,310848,0
Barbados,3/14/22,57102,326,,,79,,19870.48101582971,,,,,52,BRB,2022/03/14,1,310966,118
Barbados,3/15/22,57230,326,,,128,,19915.022740638407,,,,,52,BRB,2022/03/15,0,310966,0
Barbados,3/16/22,57348,326,,,118,,19956.084643196424,,,,,52,BRB,2022/03/16,0,311174,208
Barbados,3/17/22,57451,326,,,103,,19991.926812378424,,,,,52,BRB,2022/03/17,0,311261,87
Barbados,3/18/22,57548,326,,,97,,20025.681088210014,,,,,52,BRB,2022/03/18,0,357585,46324
Barbados,3/19/22,57660,327,,,112,,20064.655097417624,,,,,52,BRB,2022/03/19,1,357585,0
Barbados,3/20/22,57733,329,,,73,,20090.057799847586,,,,,52,BRB,2022/03/20,2,357585,0
Barbados,3/21/22,57800,329,,,67,,20113.372608927137,,,,,52,BRB,2022/03/21,0,357585,0
Barbados,3/22/22,57903,329,,,103,,20149.214778109133,,,,,52,BRB,2022/03/22,0,357585,0
Barbados,3/23/22,58018,329,,,115,,20189.232733991947,,,,,52,BRB,2022/03/23,0,357585,0
Barbados,3/24/22,58128,329,,,110,,20227.51077874942,,,,,52,BRB,2022/03/24,0,357585,0
Barbados,3/25/22,58270,330,,,142,,20276.92425470907,,,,,52,BRB,2022/03/25,1,357585,0
Barbados,3/27/22,58532,330,,,262,,20368.09559767687,,,,,52,BRB,2022/03/27,0,359726,2141
Barbados,3/28/22,58634,331,,,102,,20403.5897846338,,,,,52,BRB,2022/03/28,1,359726,0
Barbados,3/29/22,58862,331,,,228,,20482.92973194929,,,,,52,BRB,2022/03/29,0,359726,0
Barbados,3/30/22,59080,331,,,218,,20558.789857014104,,,,,52,BRB,2022/03/30,0,359726,0
Barbados,3/31/22,59272,374,,,192,,20625.60244422715,,,,,52,BRB,2022/03/31,43,359726,0
Barbados,4/1/22,59495,375,,,223,,20703.2024804173,,,,,52,BRB,2022/04/01,1,,
Belarus,3/5/22,929340,6550,,,1876,,9834.99237670093,,,,,112,BLR,2022/03/05,15,10649534,0
Belarus,3/6/22,931002,6566,,,1662,,9852.580942059223,,,,,112,BLR,2022/03/06,16,10649534,0
Belarus,3/7/22,932207,6579,,,1205,,9865.333181082535,,,,,112,BLR,2022/03/07,13,10649534,0
Belarus,3/8/22,932949,6594,,,742,,9873.185597145022,,,,,112,BLR,2022/03/08,15,10649534,0
Belarus,3/9/22,934187,6608,,,1238,,9886.287067610467,,,,,112,BLR,2022/03/09,14,10649534,0
Belarus,3/10/22,935684,6618,,,1497,,9902.1294757581,,,,,112,BLR,2022/03/10,10,10649534,0
Belarus,3/11/22,937583,6633,,,1899,,9922.226157837162,,,,,112,BLR,2022/03/11,15,10649534,0
Belarus,3/12/22,939514,6647,,,1931,,9942.66148858738,,,,,112,BLR,2022/03/12,14,10649534,0
Belarus,3/13/22,941168,6661,,,1654,,9960.165391777886,,,,,112,BLR,2022/03/13,14,10649534,0
Belarus,3/14/22,942334,6670,,,1166,,9972.504902733222,,,,,112,BLR,2022/03/14,9,10649534,0
Belarus,3/15/22,943027,6681,,,693,,9979.838763017999,,,,,112,BLR,2022/03/15,11,10649534,0
Belarus,3/16/22,944885,6688,,,1858,,9999.50155148714,,,,,112,BLR,2022/03/16,7,10649534,0
Belarus,3/17/22,946674,6698,,,1789,,10018.434128759092,,,,,112,BLR,2022/03/17,10,11046924,397390
Belarus,3/18/22,948416,6705,,,1742,,10036.869315795284,,,,,112,BLR,2022/03/18,7,11046924,0
Belarus,3/19/22,949994,6716,,,1578,,10053.568928391785,,,,,112,BLR,2022/03/19,11,11046924,0
Belarus,3/20/22,951081,6722,,,1087,,10065.072400440202,,,,,112,BLR,2022/03/20,6,11046924,0
Belarus,3/21/22,951758,6727,,,677,,10072.236936389398,,,,,112,BLR,2022/03/21,5,11046924,0
Belarus,3/22/22,952254,6737,,,496,,10077.485990792355,,,,,112,BLR,2022/03/22,10,11046924,0
Belarus,3/23/22,953901,6747,,,1647,,10094.915814586042,,,,,112,BLR,2022/03/23,10,11046924,0
Belarus,3/24/22,955600,6759,,,1699,,10112.895942470364,,,,,112,BLR,2022/03/24,12,11046924,0
Belarus,3/25/22,957088,6767,,,1488,,10128.643105679233,,,,,112,BLR,2022/03/25,8,11046924,0
Belarus,3/26/22,958492,6778,,,1404,,10143.501316126312,,,,,112,BLR,2022/03/26,11,11046924,0
Belarus,3/27/22,959276,6785,,,784,,10151.798208569695,,,,,112,BLR,2022/03/27,7,11634483,587559
Belarus,3/28/22,959802,6791,,,526,,10157.364746101863,,,,,112,BLR,2022/03/28,6,11634483,0
Belarus,3/29/22,960245,6799,,,443,,10162.052913643212,,,,,112,BLR,2022/03/29,8,11634483,0
Belarus,3/30/22,961389,6810,,,1144,,10174.159603637128,,,,,112,BLR,2022/03/30,11,11634483,0
Belarus,3/31/22,962707,6819,,,1318,,10188.107695780469,,,,,112,BLR,2022/03/31,9,11634483,0
Belarus,4/1/22,963756,6829,,,1049,,10199.209022531884,,,,,112,BLR,2022/04/01,10,,
Belgium,3/5/22,3586292,30259,,,0,,30944.01056946149,,,,,56,BEL,2022/03/05,0,25063243,22446
Belgium,3/7/22,3601627,30296,,,15335,,31076.327291603106,,,,,56,BEL,2022/03/07,37,25090382,27139
Belgium,3/8/22,3609122,30313,,,7495,,31140.997251332574,,,,,56,BEL,2022/03/08,17,25095416,5034
Belgium,3/10/22,3629671,30380,,,20549,,31318.302521843692,,,,,56,BEL,2022/03/10,67,25106723,5787
Belgium,3/11/22,3640052,30408,,,10381,,31407.874083144772,,,,,56,BEL,2022/03/11,28,25127401,20678
Belgium,3/14/22,3658084,30445,,,18032,,31563.461636692708,,,,,56,BEL,2022/03/14,37,25153368,25967
Belgium,3/16/22,3683784,30492,,,25700,,31785.211865518235,,,,,56,BEL,2022/03/16,47,25159369,0
Belgium,3/17/22,3696059,30510,,,12275,,31891.12564212654,,,,,56,BEL,2022/03/17,18,25163382,4013
Belgium,3/19/22,3707561,30529,,,11502,,31990.369655042927,,,,,56,BEL,2022/03/19,19,25178307,0
Belgium,3/21/22,3728945,30575,,,21384,,32174.879650887484,,,,,56,BEL,2022/03/21,46,25199371,21064
Belgium,3/22/22,3741614,30605,,,12669,,32284.19302244354,,,,,56,BEL,2022/03/22,30,25199371,0
Belgium,3/23/22,3757776,30635,,,16162,,32423.645442610006,,,,,56,BEL,2022/03/23,30,25204526,5155
Belgium,3/24/22,3771233,30662,,,13457,,32539.75800406157,,,,,56,BEL,2022/03/24,27,25207403,2877
Belgium,3/25/22,3782085,30686,,,10852,,32633.39354815552,,,,,56,BEL,2022/03/25,24,25216760,9357
Belgium,3/28/22,3807447,30747,,,25362,,32852.22737319338,,,,,56,BEL,2022/03/28,61,25235826,19066
Belgium,3/31/22,3851048,30826,,,43601,,33228.43483338878,,,,,56,BEL,2022/03/31,79,25244612,8786
Belgium,4/1/22,3851048,30826,,,0,,33228.43483338878,,,,,56,BEL,2022/04/01,0,,
Belize,3/5/22,56876,651,,,0,,14304.073477004484,,,,,84,BLZ,2022/03/05,0,453359,0
Belize,3/8/22,56952,652,,,76,,14323.187155607979,,,,,84,BLZ,2022/03/08,1,453359,0
Belize,3/9/22,56976,652,,,24,,14329.223054114345,,,,,84,BLZ,2022/03/09,0,453359,0
Belize,3/10/22,57003,652,,,27,,14336.013439934008,,,,,84,BLZ,2022/03/10,0,453359,0
Belize,3/11/22,57034,652,,,31,,14343.809808838065,,,,,84,BLZ,2022/03/11,0,453359,0
Belize,3/14/22,57071,652,,,37,,14353.115152368713,,,,,84,BLZ,2022/03/14,0,453359,0
Belize,3/15/22,57096,652,,,25,,14359.402546646179,,,,,84,BLZ,2022/03/15,0,453359,0
Belize,3/16/22,57113,652,,,17,,14363.677974754855,,,,,84,BLZ,2022/03/16,0,453359,0
Belize,3/17/22,57131,652,,,18,,14368.204898634629,,,,,84,BLZ,2022/03/17,0,453359,0
Belize,3/18/22,57143,654,,,12,,14371.222847887813,,,,,84,BLZ,2022/03/18,2,453359,0
Belize,3/21/22,57168,654,,,25,,14377.510242165277,,,,,84,BLZ,2022/03/21,0,453359,0
Belize,3/22/22,57191,654,,,23,,14383.294644900547,,,,,84,BLZ,2022/03/22,0,453359,0
Belize,3/23/22,57203,654,,,12,,14386.31259415373,,,,,84,BLZ,2022/03/23,0,453359,0
Belize,3/24/22,57212,654,,,9,,14388.576056093616,,,,,84,BLZ,2022/03/24,0,453359,0
Belize,3/25/22,57231,654,,,19,,14393.35447574449,,,,,84,BLZ,2022/03/25,0,453359,0
Belize,3/28/22,57253,654,,,22,,14398.887382708659,,,,,84,BLZ,2022/03/28,0,453359,0
Belize,3/30/22,57277,654,,,24,,14404.923281215026,,,,,84,BLZ,2022/03/30,0,453359,0
Belize,3/31/22,57280,654,,,3,,14405.677768528321,,,,,84,BLZ,2022/03/31,0,453359,0
Belize,4/1/22,57289,656,,,9,,14407.94123046821,,,,,84,BLZ,2022/04/01,2,,
Benin,3/5/22,26575,163,,,0,,219.20783608417514,,,,,204,BEN,2022/03/05,0,2788620,0
Benin,3/16/22,26952,163,,,377,,222.31757659983776,,,,,204,BEN,2022/03/16,0,3060435,0
Benin,4/1/22,26952,163,,,0,,222.31757659983776,,,,,204,BEN,2022/04/01,0,,
Bhutan,3/5/22,14451,7,,,331,,1872.8324598373276,,,,,64,BTN,2022/03/05,1,1435774,0
Bhutan,3/6/22,14798,7,,,347,,1917.803248264672,,,,,64,BTN,2022/03/06,0,1435774,0
Bhutan,3/7/22,15119,7,,,321,,1959.4044675303132,,,,,64,BTN,2022/03/07,0,1435774,0
Bhutan,3/8/22,15560,7,,,441,,2016.557544465353,,,,,64,BTN,2022/03/08,0,1435774,0
Bhutan,3/9/22,15946,7,,,386,,2066.582686635252,,,,,64,BTN,2022/03/09,0,1435774,0
Bhutan,3/10/22,16277,7,,,331,,2109.4798940400096,,,,,64,BTN,2022/03/10,0,1435774,0
Bhutan,3/11/22,16666,7,,,389,,2159.8938326516436,,,,,64,BTN,2022/03/11,0,1435774,0
Bhutan,3/12/22,17150,7,,,484,,2222.6196585848847,,,,,64,BTN,2022/03/12,0,1435774,0
Bhutan,3/13/22,17620,7,,,470,,2283.5311011233625,,,,,64,BTN,2022/03/13,0,1435774,0
Bhutan,3/14/22,18652,7,,,1032,,2417.2770770801903,,,,,64,BTN,2022/03/14,0,1435774,0
Bhutan,3/15/22,19435,7,,,783,,2518.7529483730164,,,,,64,BTN,2022/03/15,0,1435774,0
Bhutan,3/16/22,20116,7,,,681,,2607.0097406468535,,,,,64,BTN,2022/03/16,0,1435774,0
Bhutan,3/17/22,20722,9,,,606,,2685.5466218773167,,,,,64,BTN,2022/03/17,2,1435774,0
Bhutan,3/18/22,21310,9,,,588,,2761.75072445737,,,,,64,BTN,2022/03/18,0,1435774,0
Bhutan,3/19/22,21660,9,,,350,,2807.110309326449,,,,,64,BTN,2022/03/19,0,1435774,0
Bhutan,3/20/22,22004,9,,,344,,2851.6923013120586,,,,,64,BTN,2022/03/20,0,1435774,0
Bhutan,3/21/22,22385,9,,,381,,2901.069449412399,,,,,64,BTN,2022/03/21,0,1435774,0
Bhutan,3/22/22,22625,9,,,240,,2932.173164751196,,,,,64,BTN,2022/03/22,0,1435774,0
Bhutan,3/23/22,23155,9,,,530,,3000.8605361243735,,,,,64,BTN,2022/03/23,0,1435774,0
Bhutan,3/24/22,23814,9,,,659,,3086.266154492154,,,,,64,BTN,2022/03/24,0,1435774,0
Bhutan,3/25/22,24316,9,,,502,,3151.324759075805,,,,,64,BTN,2022/03/25,0,1435774,0
Bhutan,3/26/22,24761,9,,,445,,3208.9962312664916,,,,,64,BTN,2022/03/26,0,1435774,0
Bhutan,3/27/22,25080,9,,,319,,3250.3382529043092,,,,,64,BTN,2022/03/27,0,1435774,0
Bhutan,3/29/22,25876,10,,,796,,3353.498908777987,,,,,64,BTN,2022/03/29,1,1435774,0
Bhutan,3/30/22,26963,10,,,1087,,3494.3728194999558,,,,,64,BTN,2022/03/30,0,1435774,0
Bhutan,3/31/22,28101,10,,,1138,,3641.8562697314196,,,,,64,BTN,2022/03/31,0,1435774,0
Bhutan,4/1/22,29139,11,,,1038,,3776.3798385717173,,,,,64,BTN,2022/04/01,1,,
Bolivia,3/5/22,894551,21455,,,351,,7663.40081910188,,,,,68,BOL,2022/03/05,2,12687474,61575
Bolivia,3/6/22,895098,21463,,,547,,7668.086835045128,,,,,68,BOL,2022/03/06,8,12700090,12616
Bolivia,3/8/22,895424,21469,,,326,,7670.879597746223,,,,,68,BOL,2022/03/08,6,12720136,20046
Bolivia,3/9/22,896315,21470,,,891,,7678.5125780121,,,,,68,BOL,2022/03/09,1,12736142,16006
Bolivia,3/10/22,896744,21472,,,429,,7682.187716658633,,,,,68,BOL,2022/03/10,2,12736142,0
Bolivia,3/11/22,897098,21473,,,354,,7685.220348548779,,,,,68,BOL,2022/03/11,1,12736142,0
Bolivia,3/12/22,897351,21473,,,253,,7687.387738006991,,,,,68,BOL,2022/03/12,0,12736142,0
Bolivia,3/13/22,897489,21473,,,138,,7688.569950438742,,,,,68,BOL,2022/03/13,0,12736142,0
Bolivia,3/15/22,897970,21475,,,481,,7692.69056043637,,,,,68,BOL,2022/03/15,2,12813437,77295
Bolivia,3/16/22,898464,21476,,,494,,7696.922538271771,,,,,68,BOL,2022/03/16,1,12813437,0
Bolivia,3/17/22,898941,21477,,,477,,7701.008881242392,,,,,68,BOL,2022/03/17,1,12813437,0
Bolivia,3/18/22,899524,21482,,,583,,7706.003300428706,,,,,68,BOL,2022/03/18,5,12813437,0
Bolivia,3/20/22,899697,21482,,,173,,7707.485349346772,,,,,68,BOL,2022/03/20,0,12813437,0
Bolivia,3/21/22,899999,21483,,,302,,7710.072509885823,,,,,68,BOL,2022/03/21,1,12813437,0
Bolivia,3/23/22,900260,21483,,,261,,7712.30843339805,,,,,68,BOL,2022/03/23,0,12813437,0
Bolivia,3/24/22,900557,21484,,,297,,7714.8527601533415,,,,,68,BOL,2022/03/24,1,12972825,159388
Bolivia,3/25/22,900845,21487,,,288,,7717.3199860978675,,,,,68,BOL,2022/03/25,3,12972825,0
Bolivia,3/26/22,901108,21487,,,263,,7719.573043123597,,,,,68,BOL,2022/03/26,0,12972825,0
Bolivia,3/27/22,901367,21487,,,259,,7721.79183312232,,,,,68,BOL,2022/03/27,0,13034118,61293
Bolivia,3/28/22,901587,21489,,,220,,7723.676519607721,,,,,68,BOL,2022/03/28,2,13034118,0
Bolivia,3/29/22,901752,21894,,,165,,7725.090034471773,,,,,68,BOL,2022/03/29,405,13034118,0
Bolivia,3/30/22,901943,21894,,,191,,7726.726285011371,,,,,68,BOL,2022/03/30,0,13034118,0
Bolivia,4/1/22,902316,21895,,,373,,7729.921685279802,,,,,68,BOL,2022/04/01,1,,
Bosnia and Herzegovina,3/5/22,372139,15519,,,0,,11342.882789794608,,,,,70,BIH,2022/03/05,0,1924950,0
Bosnia and Herzegovina,3/7/22,372478,15575,,,339,,11353.215588199882,,,,,70,BIH,2022/03/07,56,1924950,0
Bosnia and Herzegovina,3/8/22,372645,15590,,,167,,11358.30578682431,,,,,70,BIH,2022/03/08,15,1924950,0
Bosnia and Herzegovina,3/9/22,372817,15599,,,172,,11363.548386605158,,,,,70,BIH,2022/03/09,9,1924950,0
Bosnia and Herzegovina,3/10/22,372962,15610,,,145,,11367.968020141338,,,,,70,BIH,2022/03/10,11,1924950,0
Bosnia and Herzegovina,3/11/22,373105,15614,,,143,,11372.326693214947,,,,,70,BIH,2022/03/11,4,1924950,0
Bosnia and Herzegovina,3/14/22,373359,15635,,,254,,11380.068671961082,,,,,70,BIH,2022/03/14,21,1924950,0
Bosnia and Herzegovina,3/15/22,373506,15641,,,147,,11384.54926595983,,,,,70,BIH,2022/03/15,6,1924950,0
Bosnia and Herzegovina,3/16/22,373670,15651,,,164,,11389.548023890406,,,,,70,BIH,2022/03/16,10,1924950,0
Bosnia and Herzegovina,3/17/22,373799,15661,,,129,,11393.47997372604,,,,,70,BIH,2022/03/17,10,1924950,0
Bosnia and Herzegovina,3/18/22,373985,15664,,,186,,11399.149296744863,,,,,70,BIH,2022/03/18,3,1924950,0
Bosnia and Herzegovina,3/21/22,374276,15677,,,291,,11408.019044048506,,,,,70,BIH,2022/03/21,13,1924950,0
Bosnia and Herzegovina,3/22/22,374426,15685,,,150,,11412.591078741105,,,,,70,BIH,2022/03/22,8,1924950,0
Bosnia and Herzegovina,3/23/22,374573,15691,,,147,,11417.071672739852,,,,,70,BIH,2022/03/23,6,1924950,0
Bosnia and Herzegovina,3/24/22,374696,15695,,,123,,11420.820741187785,,,,,70,BIH,2022/03/24,4,1924950,0
Bosnia and Herzegovina,3/25/22,374810,15702,,,114,,11424.29548755416,,,,,70,BIH,2022/03/25,7,1924950,0
Bosnia and Herzegovina,3/28/22,375054,15706,,,244,,11431.732663987454,,,,,70,BIH,2022/03/28,4,1924950,0
Bosnia and Herzegovina,3/29/22,375222,15708,,,168,,11436.853342843166,,,,,70,BIH,2022/03/29,2,1924950,0
Bosnia and Herzegovina,3/30/22,375332,15710,,,110,,11440.206168284405,,,,,70,BIH,2022/03/30,2,1924950,0
Bosnia and Herzegovina,3/31/22,375440,15713,,,108,,11443.498033263077,,,,,70,BIH,2022/03/31,3,1924950,0
Bosnia and Herzegovina,4/1/22,375554,15718,,,114,,11446.972779629452,,,,,70,BIH,2022/04/01,5,,
Botswana,3/5/22,263950,2619,,,0,,11224.153510870143,,,,,72,BWA,2022/03/05,0,1376754,0
Botswana,3/30/22,305526,2686,,,41576,,12992.12246850582,,,,,72,BWA,2022/03/30,67,1376754,0
Botswana,4/1/22,305526,2686,,,0,,12992.12246850582,,,,,72,BWA,2022/04/01,0,,
Brazil,3/5/22,29040800,652216,,,62748,,13662.439191294514,,,,,76,BRA,2022/03/05,694,395464826,1353030
Brazil,3/6/22,29056525,652438,,,15725,,13669.837123041681,,,,,76,BRA,2022/03/06,222,395658972,194146
Brazil,3/7/22,29077831,652648,,,21306,,13679.860673681116,,,,,76,BRA,2022/03/07,210,395658972,0
Brazil,3/8/22,29152318,653134,,,74487,,13714.903582555595,,,,,76,BRA,2022/03/08,486,396537303,878331
Brazil,3/9/22,29198101,653767,,,45783,,13736.442502058331,,,,,76,BRA,2022/03/09,633,398449118,1911815
Brazil,3/10/22,29259206,654380,,,61105,,13765.189759254552,,,,,76,BRA,2022/03/10,613,400536072,2086954
Brazil,3/11/22,29313228,654843,,,54022,,13790.604771581766,,,,,76,BRA,2022/03/11,463,401272006,735934
Brazil,3/12/22,29361024,655234,,,47796,,13813.090720439479,,,,,76,BRA,2022/03/12,391,402357624,1085618
Brazil,3/13/22,29374833,655359,,,13809,,13819.587257132429,,,,,76,BRA,2022/03/13,125,402357624,0
Brazil,3/14/22,29391345,655557,,,16512,,13827.355438309485,,,,,76,BRA,2022/03/14,198,402573315,215691
Brazil,3/15/22,29441039,655878,,,49694,,13850.734314000656,,,,,76,BRA,2022/03/15,321,403286505,713190
Brazil,3/16/22,29488777,656231,,,47738,,13873.192976369255,,,,,76,BRA,2022/03/16,353,404885141,1598636
Brazil,3/17/22,29532810,656693,,,44033,,13893.908596631449,,,,,76,BRA,2022/03/17,462,405634648,749507
Brazil,3/18/22,29584800,657098,,,51990,,13918.367640926213,,,,,76,BRA,2022/03/18,405,406685448,1050800
Brazil,3/19/22,29624435,657389,,,39635,,13937.014192582743,,,,,76,BRA,2022/03/19,291,406685448,0
Brazil,3/20/22,29637814,657495,,,13379,,13943.308432890872,,,,,76,BRA,2022/03/20,106,407274462,589014
Brazil,3/21/22,29650082,657595,,,12268,,13949.079995795435,,,,,76,BRA,2022/03/21,100,407435784,161322
Brazil,3/22/22,29691641,658005,,,41559,,13968.631706159853,,,,,76,BRA,2022/03/22,410,408348030,912246
Brazil,3/23/22,29738362,658286,,,46721,,13990.61191405552,,,,,76,BRA,2022/03/23,281,408961974,613944
Brazil,3/24/22,29775568,658600,,,37206,,14008.115726366175,,,,,76,BRA,2022/03/24,314,409606978,645004
Brazil,3/25/22,29809769,658855,,,34201,,14024.205816266642,,,,,76,BRA,2022/03/25,255,410175836,568858
Brazil,3/26/22,29839103,659046,,,29334,,14038.006193364981,,,,,76,BRA,2022/03/26,191,410860641,684805
Brazil,3/27/22,29849740,659159,,,10637,,14043.010441377357,,,,,76,BRA,2022/03/27,113,411116197,255556
Brazil,3/28/22,29857641,659227,,,7901,,14046.727519834232,,,,,76,BRA,2022/03/28,68,412177025,1060828
Brazil,3/29/22,29887191,659508,,,29550,,14060.629515581688,,,,,76,BRA,2022/03/29,281,413559595,1382570
Brazil,3/30/22,29920604,659769,,,33413,,14076.348885595557,,,,,76,BRA,2022/03/30,261,413559595,0
Brazil,3/31/22,29951670,660022,,,31066,,14090.964093713677,,,,,76,BRA,2022/03/31,253,413559595,0
Brazil,4/1/22,29978513,660265,,,26843,,14103.592563150192,,,,,76,BRA,2022/04/01,243,,
Brunei,3/5/22,84844,140,,,4095,,19393.667868237168,,,,,96,BRN,2022/03/05,5,979285,0
Brunei,3/6/22,88849,143,,,4005,,20309.132011986752,,,,,96,BRN,2022/03/06,3,979285,0
Brunei,3/7/22,93034,147,,,4185,,21265.740611635196,,,,,96,BRN,2022/03/07,4,979285,0
Brunei,3/8/22,97018,151,,,3984,,22176.404568863247,,,,,96,BRN,2022/03/08,4,979285,0
Brunei,3/9/22,100173,155,,,3155,,22897.575448646003,,,,,96,BRN,2022/03/09,4,979285,0
Brunei,3/10/22,104022,156,,,3849,,23777.381063949913,,,,,96,BRN,2022/03/10,1,979285,0
Brunei,3/11/22,106936,158,,,2914,,24443.464088890312,,,,,96,BRN,2022/03/11,2,979285,0
Brunei,3/12/22,109538,163,,,2602,,25038.230056939356,,,,,96,BRN,2022/03/12,5,979285,0
Brunei,3/13/22,112093,166,,,2555,,25622.25275039259,,,,,96,BRN,2022/03/13,3,979285,0
Brunei,3/14/22,114371,170,,,2278,,26142.958697823688,,,,,96,BRN,2022/03/14,4,979285,0
Brunei,3/15/22,116924,171,,,2553,,26726.52423065582,,,,,96,BRN,2022/03/15,1,979285,0
Brunei,3/16/22,118892,176,,,1968,,27176.370281816664,,,,,96,BRN,2022/03/16,5,979285,0
Brunei,3/17/22,120600,177,,,1708,,27566.785452234715,,,,,96,BRN,2022/03/17,1,979285,0
Brunei,3/18/22,121957,178,,,1357,,27876.968933649994,,,,,96,BRN,2022/03/18,1,979285,0
Brunei,3/19/22,123422,180,,,1465,,28211.839088604585,,,,,96,BRN,2022/03/19,2,979285,0
Brunei,3/20/22,124716,189,,,1294,,28507.622010455263,,,,,96,BRN,2022/03/20,9,979285,0
Brunei,3/21/22,126109,193,,,1393,,28826.03438305031,,,,,96,BRN,2022/03/21,4,979285,0
Brunei,3/22/22,127300,196,,,1191,,29098.273532914423,,,,,96,BRN,2022/03/22,3,979285,0
Brunei,3/23/22,128306,199,,,1006,,29328.225325326926,,,,,96,BRN,2022/03/23,3,979285,0
Brunei,3/24/22,129081,200,,,775,,29505.375066002565,,,,,96,BRN,2022/03/24,1,979285,0
Brunei,3/25/22,129837,200,,,756,,29678.181780777766,,,,,96,BRN,2022/03/25,0,979285,0
Brunei,3/26/22,130611,202,,,774,,29855.102941142857,,,,,96,BRN,2022/03/26,2,979285,0
Brunei,3/27/22,131403,202,,,792,,30036.13854709783,,,,,96,BRN,2022/03/27,0,979285,0
Brunei,3/28/22,132194,203,,,791,,30216.945572742254,,,,,96,BRN,2022/03/28,1,979285,0
Brunei,3/29/22,132981,206,,,787,,30396.838277144485,,,,,96,BRN,2022/03/29,3,979285,0
Brunei,3/30/22,133726,208,,,745,,30567.130608503645,,,,,96,BRN,2022/03/30,2,979285,0
Brunei,3/31/22,134412,208,,,686,,30723.936701540402,,,,,96,BRN,2022/03/31,0,979285,0
Brunei,4/1/22,134915,210,,,503,,30838.912597746654,,,,,96,BRN,2022/04/01,2,,
Bulgaria,3/5/22,1100811,35811,,,1388,,15842.551822745952,,,,,100,BGR,2022/03/05,21,4310149,849
Bulgaria,3/6/22,1101326,35832,,,515,,15849.96355299639,,,,,100,BGR,2022/03/06,21,4310499,350
Bulgaria,3/7/22,1103788,35923,,,2462,,15885.395941106248,,,,,100,BGR,2022/03/07,91,4312603,2104
Bulgaria,3/8/22,1105968,35964,,,2180,,15916.769867214894,,,,,100,BGR,2022/03/08,41,4314508,1905
Bulgaria,3/9/22,1107888,35995,,,1920,,15944.401948925262,,,,,100,BGR,2022/03/09,31,4317192,2684
Bulgaria,3/10/22,1109581,36028,,,1693,,15968.76711264175,,,,,100,BGR,2022/03/10,33,4319928,2736
Bulgaria,3/11/22,1111216,36069,,,1635,,15992.297557223235,,,,,100,BGR,2022/03/11,41,4322396,2468
Bulgaria,3/12/22,1112176,36084,,,960,,16006.113598078418,,,,,100,BGR,2022/03/12,15,4323100,704
Bulgaria,3/13/22,1112699,36098,,,523,,16013.64046200265,,,,,100,BGR,2022/03/13,14,4323390,290
Bulgaria,3/14/22,1115132,36162,,,2433,,16048.655490545007,,,,,100,BGR,2022/03/14,64,4325241,1851
Bulgaria,3/15/22,1117525,36196,,,2393,,16083.094850718398,,,,,100,BGR,2022/03/15,34,4327565,2324
Bulgaria,3/16/22,1119474,36222,,,1949,,16111.144291996266,,,,,100,BGR,2022/03/16,26,4329904,2339
Bulgaria,3/17/22,1121194,36248,,,1720,,16135.898031861805,,,,,100,BGR,2022/03/17,26,4332347,2443
Bulgaria,3/18/22,1122795,36266,,,1601,,16158.93915832967,,,,,100,BGR,2022/03/18,18,4334468,2121
Bulgaria,3/19/22,1123714,36272,,,919,,16172.165139106663,,,,,100,BGR,2022/03/19,6,4334991,523
Bulgaria,3/20/22,1124186,36282,,,472,,16178.958025860462,,,,,100,BGR,2022/03/20,10,4335284,293
Bulgaria,3/21/22,1126146,36330,,,1960,,16207.165775939797,,,,,100,BGR,2022/03/21,48,4336850,1566
Bulgaria,3/22/22,1128089,36350,,,1943,,16235.12886696232,,,,,100,BGR,2022/03/22,20,4338642,1792
Bulgaria,3/23/22,1129641,36375,,,1552,,16257.4647996782,,,,,100,BGR,2022/03/23,25,4338642,0
Bulgaria,3/24/22,1131065,36396,,,1424,,16277.958593613392,,,,,100,BGR,2022/03/24,21,4342510,3868
Bulgaria,3/25/22,1132398,36425,,,1333,,16297.142742009184,,,,,100,BGR,2022/03/25,29,4344451,1941
Bulgaria,3/26/22,1133102,36429,,,704,,16307.274505302985,,,,,100,BGR,2022/03/26,4,4344963,512
Bulgaria,3/27/22,1133464,36437,,,362,,16312.484304042127,,,,,100,BGR,2022/03/27,8,4345164,201
Bulgaria,3/28/22,1134906,36480,,,1442,,16333.237148743352,,,,,100,BGR,2022/03/28,43,4346559,1395
Bulgaria,3/29/22,1136604,36498,,,1698,,16357.674271005959,,,,,100,BGR,2022/03/29,18,4348404,1845
Bulgaria,3/30/22,1137780,36512,,,1176,,16374.598921053559,,,,,100,BGR,2022/03/30,14,4348404,0
Bulgaria,3/31/22,1138923,36529,,,1143,,16391.048644696762,,,,,100,BGR,2022/03/31,17,4348404,0
Bulgaria,4/1/22,1139956,36554,,,1033,,16405.91528032531,,,,,100,BGR,2022/04/01,25,,
Burkina Faso,3/5/22,20751,375,,,0,,99.27151138687435,,,,,854,BFA,2022/03/05,0,1259250,0
Burkina Faso,3/17/22,20806,379,,,55,,99.53462801384548,,,,,854,BFA,2022/03/17,4,1259250,0
Burkina Faso,3/18/22,20813,379,,,7,,99.5681155845509,,,,,854,BFA,2022/03/18,0,1259250,0
Burkina Faso,3/25/22,20822,381,,,9,,99.61117103260072,,,,,854,BFA,2022/03/25,2,1259250,0
Burkina Faso,3/27/22,20853,382,,,31,,99.75947313143901,,,,,854,BFA,2022/03/27,1,1259250,0
Burkina Faso,4/1/22,20858,382,,,5,,99.78339282480002,,,,,854,BFA,2022/04/01,0,,
Burma,3/5/22,597417,19386,,,1596,,1097.9953351780748,,,,,104,MMR,2022/03/05,3,44685868,0
Burma,3/6/22,598446,19389,,,1029,,1099.8865388095385,,,,,104,MMR,2022/03/06,3,45202278,516410
Burma,3/7/22,599619,19391,,,1173,,1102.0424006751432,,,,,104,MMR,2022/03/07,2,45202278,0
Burma,3/8/22,601020,19394,,,1401,,1104.617304744804,,,,,104,MMR,2022/03/08,3,45341326,139048
Burma,3/9/22,602321,19398,,,1301,,1107.0084183740892,,,,,104,MMR,2022/03/09,4,45341326,0
Burma,3/10/22,603263,19401,,,942,,1108.7397243224261,,,,,104,MMR,2022/03/10,3,45658400,317074
Burma,3/11/22,604219,19403,,,956,,1110.496760932416,,,,,104,MMR,2022/03/11,2,45658400,0
Burma,3/12/22,604860,19406,,,641,,1111.674857655223,,,,,104,MMR,2022/03/12,3,45658400,0
Burma,3/13/22,605347,19409,,,487,,1112.5699170998516,,,,,104,MMR,2022/03/13,3,45658400,0
Burma,3/14/22,606227,19411,,,880,,1114.187272975156,,,,,104,MMR,2022/03/14,2,46247597,589197
Burma,3/15/22,606910,19414,,,683,,1115.4425616829205,,,,,104,MMR,2022/03/15,3,46247597,0
Burma,3/16/22,607399,19417,,,489,,1116.3412969363567,,,,,104,MMR,2022/03/16,3,46697342,449745
Burma,3/17/22,607844,19418,,,445,,1117.1591643960276,,,,,104,MMR,2022/03/17,1,47150926,453584
Burma,3/18/22,608384,19420,,,540,,1118.1516327740553,,,,,104,MMR,2022/03/18,2,47150926,0
Burma,3/19/22,608763,19423,,,379,,1118.8481985430785,,,,,104,MMR,2022/03/19,3,47150926,0
Burma,3/20/22,608990,19425,,,227,,1119.265402842731,,,,,104,MMR,2022/03/20,2,47150926,0
Burma,3/21/22,609288,19425,,,298,,1119.8130983550498,,,,,104,MMR,2022/03/21,0,48265243,1114317
Burma,3/22/22,609648,19427,,,360,,1120.4747439404016,,,,,104,MMR,2022/03/22,2,48265243,0
Burma,3/23/22,609915,19428,,,267,,1120.9654644162042,,,,,104,MMR,2022/03/23,1,48708905,443662
Burma,3/24/22,610176,19428,,,261,,1121.4451574655843,,,,,104,MMR,2022/03/24,0,48708905,0
Burma,3/25/22,610493,19428,,,317,,1122.0277731615745,,,,,104,MMR,2022/03/25,0,48708905,0
Burma,3/26/22,610728,19429,,,235,,1122.4596806964569,,,,,104,MMR,2022/03/26,1,48708905,0
Burma,3/27/22,610858,19430,,,130,,1122.698608268945,,,,,104,MMR,2022/03/27,1,48708905,0
Burma,3/28/22,611021,19430,,,163,,1122.9981866867572,,,,,104,MMR,2022/03/28,0,49316486,607581
Burma,3/29/22,611275,19430,,,254,,1123.465014405311,,,,,104,MMR,2022/03/29,0,49316486,0
Burma,3/30/22,611448,19430,,,173,,1123.7829718671605,,,,,104,MMR,2022/03/30,0,49316486,0
Burma,3/31/22,611587,19430,,,139,,1124.0384405792825,,,,,104,MMR,2022/03/31,0,49316486,0
Burma,4/1/22,611674,19431,,,87,,1124.1983382624092,,,,,104,MMR,2022/04/01,1,,
Burundi,3/5/22,38150,38,,,0,,320.8367894421737,,,,,108,BDI,2022/03/05,0,11101,0
Burundi,3/7/22,38178,38,,,28,,321.0722659848836,,,,,108,BDI,2022/03/07,0,11502,0
Burundi,3/9/22,38209,38,,,31,,321.3329721571695,,,,,108,BDI,2022/03/09,0,11502,0
Burundi,3/10/22,38238,38,,,29,,321.5768585764047,,,,,108,BDI,2022/03/10,0,11502,0
Burundi,3/11/22,38248,38,,,10,,321.6609573416582,,,,,108,BDI,2022/03/11,0,11502,0
Burundi,3/14/22,38274,38,,,26,,321.87961413131734,,,,,108,BDI,2022/03/14,0,11860,0
Burundi,3/15/22,38279,38,,,5,,321.9216635139441,,,,,108,BDI,2022/03/15,0,11860,0
Burundi,3/16/22,38296,38,,,17,,322.0646314148751,,,,,108,BDI,2022/03/16,0,11860,0
Burundi,3/18/22,38308,38,,,12,,322.1655499331793,,,,,108,BDI,2022/03/18,0,12166,0
Burundi,3/21/22,38372,38,,,64,,322.70378203080185,,,,,108,BDI,2022/03/21,0,12166,0
Burundi,3/23/22,38406,38,,,34,,322.9897178326638,,,,,108,BDI,2022/03/23,0,12166,0
Burundi,3/25/22,38440,38,,,34,,323.2756536345258,,,,,108,BDI,2022/03/25,0,12166,0
Burundi,3/28/22,38463,38,,,23,,323.4690807946089,,,,,108,BDI,2022/03/28,0,12166,0
Burundi,3/29/22,38482,38,,,19,,323.62886844859054,,,,,108,BDI,2022/03/29,0,12166,0
Burundi,3/30/22,38490,38,,,8,,323.6961474607934,,,,,108,BDI,2022/03/30,0,12166,0
Burundi,3/31/22,38509,38,,,19,,323.85593511477504,,,,,108,BDI,2022/03/31,0,12166,0
Burundi,4/1/22,38519,38,,,10,,323.9400338800286,,,,,108,BDI,2022/04/01,0,,
Cabo Verde,3/5/22,55892,401,,,2,,10052.734951114053,,,,,132,CPV,2022/03/05,0,704843,0
Cabo Verde,3/6/22,55895,401,,,3,,10053.274531104988,,,,,132,CPV,2022/03/06,0,711323,0
Cabo Verde,3/7/22,55898,401,,,3,,10053.814111095922,,,,,132,CPV,2022/03/07,0,711323,0
Cabo Verde,3/8/22,55903,401,,,5,,10054.713411080815,,,,,132,CPV,2022/03/08,0,711323,0
Cabo Verde,3/9/22,55904,401,,,1,,10054.893271077794,,,,,132,CPV,2022/03/09,0,711323,0
Cabo Verde,3/10/22,55906,401,,,2,,10055.25299107175,,,,,132,CPV,2022/03/10,0,711323,0
Cabo Verde,3/14/22,55907,401,,,1,,10055.432851068728,,,,,132,CPV,2022/03/14,0,719120,0
Cabo Verde,3/15/22,55911,401,,,4,,10056.152291056642,,,,,132,CPV,2022/03/15,0,719120,0
Cabo Verde,3/16/22,55914,401,,,3,,10056.691871047577,,,,,132,CPV,2022/03/16,0,719120,0
Cabo Verde,3/17/22,55917,401,,,3,,10057.231451038511,,,,,132,CPV,2022/03/17,0,719120,0
Cabo Verde,3/18/22,55921,401,,,4,,10057.950891026425,,,,,132,CPV,2022/03/18,0,724784,0
Cabo Verde,3/19/22,55925,401,,,4,,10058.670331014338,,,,,132,CPV,2022/03/19,0,724784,0
Cabo Verde,3/21/22,55927,401,,,2,,10059.030051008294,,,,,132,CPV,2022/03/21,0,724784,0
Cabo Verde,3/22/22,55931,401,,,4,,10059.749490996208,,,,,132,CPV,2022/03/22,0,724784,0
Cabo Verde,3/23/22,55934,401,,,3,,10060.289070987144,,,,,132,CPV,2022/03/23,0,724784,0
Cabo Verde,3/24/22,55941,401,,,7,,10061.548090965993,,,,,132,CPV,2022/03/24,0,724784,0
Cabo Verde,3/25/22,55945,401,,,4,,10062.267530953906,,,,,132,CPV,2022/03/25,0,724784,0
Cabo Verde,3/26/22,55947,401,,,2,,10062.627250947862,,,,,132,CPV,2022/03/26,0,724784,0
Cabo Verde,3/27/22,55948,401,,,1,,10062.807110944841,,,,,132,CPV,2022/03/27,0,728077,0
Cabo Verde,3/28/22,55949,401,,,1,,10062.986970941818,,,,,132,CPV,2022/03/28,0,728077,0
Cabo Verde,3/29/22,55950,401,,,1,,10063.166830938797,,,,,132,CPV,2022/03/29,0,728077,0
Cabo Verde,3/31/22,55952,401,,,2,,10063.526550932755,,,,,132,CPV,2022/03/31,0,728077,0
Cabo Verde,4/1/22,55957,401,,,5,,10064.425850917645,,,,,132,CPV,2022/04/01,0,,
Cambodia,3/5/22,132072,3040,,,334,,789.9529223419312,,,,,116,KHM,2022/03/05,2,35670692,0
Cambodia,3/6/22,132402,3041,,,330,,791.9267280265035,,,,,116,KHM,2022/03/06,1,35962180,291488
Cambodia,3/7/22,132708,3042,,,306,,793.7569842067434,,,,,116,KHM,2022/03/07,1,35962180,0
Cambodia,3/8/22,133065,3043,,,357,,795.8922830836898,,,,,116,KHM,2022/03/08,1,35962180,0
Cambodia,3/9/22,133263,3043,,,198,,797.0765664944332,,,,,116,KHM,2022/03/09,0,36072945,110765
Cambodia,3/10/22,133501,3044,,,238,,798.5000990790642,,,,,116,KHM,2022/03/10,1,36072945,0
Cambodia,3/11/22,133738,3045,,,237,,799.9176504343479,,,,,116,KHM,2022/03/11,1,36072945,0
Cambodia,3/12/22,133943,3046,,,205,,801.1438024505217,,,,,116,KHM,2022/03/12,1,36285390,212445
Cambodia,3/13/22,134068,3047,,,125,,801.8914561189202,,,,,116,KHM,2022/03/13,1,36285390,0
Cambodia,3/14/22,134213,3047,,,145,,802.7587343742626,,,,,116,KHM,2022/03/14,0,36352339,66949
Cambodia,3/15/22,134352,3048,,,139,,803.5901252535219,,,,,116,KHM,2022/03/15,1,36352339,0
Cambodia,3/16/22,134492,3049,,,140,,804.4274973621283,,,,,116,KHM,2022/03/16,1,36352339,0
Cambodia,3/17/22,134624,3049,,,132,,805.2170196359573,,,,,116,KHM,2022/03/17,0,36457313,104974
Cambodia,3/18/22,134772,3049,,,148,,806.1022415793412,,,,,116,KHM,2022/03/18,0,36457313,0
Cambodia,3/19/22,134889,3050,,,117,,806.8020454129623,,,,,116,KHM,2022/03/19,1,36457313,0
Cambodia,3/20/22,134986,3051,,,97,,807.3822246596396,,,,,116,KHM,2022/03/20,1,36457313,0
Cambodia,3/21/22,135085,3052,,,99,,807.9743663650113,,,,,116,KHM,2022/03/21,1,36457313,0
Cambodia,3/22/22,135158,3052,,,73,,808.4109961073561,,,,,116,KHM,2022/03/22,0,36567354,110041
Cambodia,3/23/22,135222,3052,,,64,,808.7937947855762,,,,,116,KHM,2022/03/23,0,36567354,0
Cambodia,3/24/22,135285,3054,,,63,,809.1706122344491,,,,,116,KHM,2022/03/24,2,36567354,0
Cambodia,3/25/22,135344,3054,,,59,,809.5235047659332,,,,,116,KHM,2022/03/25,0,36639260,71906
Cambodia,3/26/22,135402,3054,,,58,,809.8704160680702,,,,,116,KHM,2022/03/26,0,36639260,0
Cambodia,3/27/22,135461,3054,,,59,,810.2233085995543,,,,,116,KHM,2022/03/27,0,36639260,0
Cambodia,3/28/22,135513,3054,,,52,,810.5343325256082,,,,,116,KHM,2022/03/28,0,36819740,180480
Cambodia,3/29/22,135552,3054,,,39,,810.7676004701485,,,,,116,KHM,2022/03/29,0,36819740,0
Cambodia,3/30/22,135585,3054,,,33,,810.9649810386057,,,,,116,KHM,2022/03/30,0,36819740,0
Cambodia,3/31/22,135625,3054,,,40,,811.2042302124934,,,,,116,KHM,2022/03/31,0,36819740,0
Cambodia,4/1/22,135682,3054,,,57,,811.5451602852831,,,,,116,KHM,2022/04/01,0,,
Cameroon,3/5/22,119322,1926,,,0,,449.49375164432394,,,,,120,CMR,2022/03/05,0,1267525,0
Cameroon,3/16/22,119414,1926,,,92,,449.84032164106617,,,,,120,CMR,2022/03/16,0,1273072,0
Cameroon,3/20/22,119544,1927,,,130,,450.3300401147237,,,,,120,CMR,2022/03/20,1,1273072,0
Cameroon,4/1/22,119544,1927,,,0,,450.3300401147237,,,,,120,CMR,2022/04/01,0,,
Canada,3/5/22,3334478,36998,,,3197,,8808.390345000074,,,,,124,CAN,2022/03/05,41,81358416,0
Canada,3/6/22,3337091,37027,,,2613,,8815.292871863794,,,,,124,CAN,2022/03/06,29,81358416,0
Canada,3/7/22,3345546,37082,,,8455,,8837.627684199331,,,,,124,CAN,2022/03/07,55,81452488,94072
Canada,3/8/22,3349699,37148,,,4153,,8848.59829042399,,,,,124,CAN,2022/03/08,66,81517941,65453
Canada,3/9/22,3356440,37207,,,6741,,8866.405383263002,,,,,124,CAN,2022/03/09,59,81548320,30379
Canada,3/10/22,3362047,37261,,,5607,,8881.216890390779,,,,,124,CAN,2022/03/10,54,81563025,14705
Canada,3/11/22,3370105,37264,,,8058,,8902.502983566386,,,,,124,CAN,2022/03/11,3,81581032,18007
Canada,3/12/22,3371929,37278,,,1824,,8907.32128016012,,,,,124,CAN,2022/03/12,14,81581032,0
Canada,3/13/22,3373322,37283,,,1393,,8911.001042854787,,,,,124,CAN,2022/03/13,5,81666740,85708
Canada,3/14/22,3377844,37327,,,4522,,8922.946403160084,,,,,124,CAN,2022/03/14,44,81706844,40104
Canada,3/15/22,3386875,37040,,,9031,,8946.80278284101,,,,,124,CAN,2022/03/15,,81734416,27572
Canada,3/16/22,3392164,37080,,,5289,,8960.774257996853,,,,,124,CAN,2022/03/16,40,81757868,23452
Canada,3/17/22,3396364,37120,,,4200,,8971.869019890319,,,,,124,CAN,2022/03/17,40,81792572,34704
Canada,3/18/22,3399704,37183,,,3340,,8980.691997205598,,,,,124,CAN,2022/03/18,63,81792572,0
Canada,3/19/22,3402711,37204,,,3007,,8988.635318399325,,,,,124,CAN,2022/03/19,21,81792572,0
Canada,3/20/22,3404964,37215,,,2253,,8994.586865672178,,,,,124,CAN,2022/03/20,11,81867127,74555
Canada,3/21/22,3413117,37254,,,8153,,9016.123911795376,,,,,124,CAN,2022/03/21,39,81894769,27642
Canada,3/22/22,3422583,37289,,,9466,,9041.129391815268,,,,,124,CAN,2022/03/22,35,81916479,21710
Canada,3/23/22,3429407,37331,,,6824,,9059.155738282176,,,,,124,CAN,2022/03/23,42,81916479,0
Canada,3/24/22,3436460,37406,,,7053,,9077.787013433273,,,,,124,CAN,2022/03/24,75,81967208,50729
Canada,3/25/22,3445404,37449,,,8944,,9101.413573046406,,,,,124,CAN,2022/03/25,43,81967208,0
Canada,3/26/22,3449778,37476,,,4374,,9112.967975075459,,,,,124,CAN,2022/03/26,27,81967208,0
Canada,3/27/22,3453432,37485,,,3654,,9122.620417922773,,,,,124,CAN,2022/03/27,9,82052104,84896
Canada,3/28/22,3459582,37508,,,6150,,9138.866319266777,,,,,124,CAN,2022/03/28,23,82076782,24678
Canada,3/29/22,3470143,37542,,,10561,,9166.764362208894,,,,,124,CAN,2022/03/29,34,82094112,17330
Canada,3/30/22,3481119,37601,,,10976,,9195.758673290486,,,,,124,CAN,2022/03/30,59,82094112,0
Canada,3/31/22,3489910,37653,,,8791,,9218.9810665775,,,,,124,CAN,2022/03/31,52,82094112,0
Canada,4/1/22,3502925,37713,,,13015,,9253.36162039737,,,,,124,CAN,2022/04/01,60,,
Central African Republic,3/5/22,14320,113,,,0,,296.4948183803598,,,,,140,CAF,2022/03/05,0,855735,0
Central African Republic,3/15/22,14649,113,,,329,,303.30674542275773,,,,,140,CAF,2022/03/15,0,946264,0
Central African Republic,4/1/22,14649,113,,,0,,303.30674542275773,,,,,140,CAF,2022/04/01,0,,
Chad,3/5/22,7257,190,,,0,,44.18033784412736,,,,,148,TCD,2022/03/05,0,403992,0
Chad,3/7/22,7258,190,,,1,,44.18642580579804,,,,,148,TCD,2022/03/07,0,403992,0
Chad,3/9/22,7260,190,,,2,,44.198601729139405,,,,,148,TCD,2022/03/09,0,403992,0
Chad,3/14/22,7267,190,,,7,,44.241217460834164,,,,,148,TCD,2022/03/14,0,412309,0
Chad,3/15/22,7269,190,,,2,,44.253393384175524,,,,,148,TCD,2022/03/15,0,412309,0
Chad,3/21/22,7286,190,,,17,,44.35688873257709,,,,,148,TCD,2022/03/21,0,418052,0
Chad,3/22/22,7288,190,,,2,,44.36906465591845,,,,,148,TCD,2022/03/22,0,418052,0
Chad,3/28/22,7308,191,,,20,,44.490823889332056,,,,,148,TCD,2022/03/28,1,419469,0
Chad,3/29/22,7310,191,,,2,,44.50299981267342,,,,,148,TCD,2022/03/29,0,419469,0
Chad,4/1/22,7310,191,,,0,,44.50299981267342,,,,,148,TCD,2022/04/01,0,,
Chile,3/5/22,3168335,42955,,,20901,,16574.07595826139,,,,,152,CHL,2022/03/05,146,49060956,0
Chile,3/6/22,3188448,43077,,,20113,,16679.290334187077,,,,,152,CHL,2022/03/06,122,49060956,0
Chile,3/7/22,3202562,43226,,,14114,,16753.122964914226,,,,,152,CHL,2022/03/07,149,49207742,146786
Chile,3/8/22,3214326,43260,,,11764,,16814.662363233212,,,,,152,CHL,2022/03/08,34,49287361,79619
Chile,3/9/22,3230793,43283,,,16467,,16900.803919856702,,,,,152,CHL,2022/03/09,23,49401767,114406
Chile,3/10/22,3249890,43527,,,19097,,17000.703434451883,,,,,152,CHL,2022/03/10,244,49498599,96832
Chile,3/11/22,3269062,43659,,,19172,,17100.99528625158,,,,,152,CHL,2022/03/11,132,49590579,91980
Chile,3/12/22,3286476,43785,,,17414,,17192.090753977423,,,,,152,CHL,2022/03/12,126,49590579,0
Chile,3/13/22,3301747,43879,,,15271,,17271.97583997957,,,,,152,CHL,2022/03/13,94,49590579,0
Chile,3/14/22,3313242,44005,,,11495,,17332.108055525026,,,,,152,CHL,2022/03/14,126,49732602,142023
Chile,3/15/22,3323324,44039,,,10082,,17384.848638137406,,,,,152,CHL,2022/03/15,34,49793482,60880
Chile,3/16/22,3336614,44062,,,13290,,17454.370790777608,,,,,152,CHL,2022/03/16,23,49884910,91428
Chile,3/17/22,3353259,44246,,,16645,,17541.443494366482,,,,,152,CHL,2022/03/17,184,49963383,78473
Chile,3/18/22,3368704,44339,,,15445,,17622.238802683107,,,,,152,CHL,2022/03/18,93,50037680,74297
Chile,3/19/22,3381681,44440,,,12977,,17690.123601389794,,,,,152,CHL,2022/03/19,101,50037680,0
Chile,3/20/22,3392978,44518,,,11297,,17749.22004671533,,,,,152,CHL,2022/03/20,78,50037680,0
Chile,3/21/22,3401145,55965,,,8167,,17791.942952705736,,,,,152,CHL,2022/03/21,11447,50165750,128070
Chile,3/22/22,3406540,55976,,,5395,,17820.165075617242,,,,,152,CHL,2022/03/22,11,50165750,0
Chile,3/23/22,3415989,55992,,,9449,,17869.594332223507,,,,,152,CHL,2022/03/23,16,50165750,0
Chile,3/24/22,3426147,56147,,,10158,,17922.73248320313,,,,,152,CHL,2022/03/24,155,50302179,136429
Chile,3/25/22,3434908,56222,,,8761,,17968.5626998533,,,,,152,CHL,2022/03/25,75,50302179,0
Chile,3/26/22,3443018,56298,,,8110,,18010.98742956828,,,,,152,CHL,2022/03/26,76,50302179,0
Chile,3/27/22,3450094,56381,,,7076,,18048.003137023665,,,,,152,CHL,2022/03/27,83,50302179,0
Chile,3/28/22,3455060,56446,,,4966,,18073.981091125337,,,,,152,CHL,2022/03/28,65,50565994,263815
Chile,3/29/22,3458499,56464,,,3439,,18091.971059743068,,,,,152,CHL,2022/03/29,18,50608487,42493
Chile,3/30/22,3464425,56467,,,5926,,18122.970930062544,,,,,152,CHL,2022/03/30,3,50672753,64266
Chile,3/31/22,3470936,56580,,,6511,,18157.031030577244,,,,,152,CHL,2022/03/31,113,50672753,0
Chile,4/1/22,3476914,56637,,,5978,,18188.302921358518,,,,,152,CHL,2022/04/01,57,,
China,3/5/22,752035,6410,,,68103,,53.53795632051406,,,,,156,CHN,2022/03/05,220,3156899000,9892000
China,3/6/22,792586,6643,,,40551,,56.42481353693772,,,,,156,CHN,2022/03/06,233,3160685000,3786000
China,3/7/22,829730,6923,,,37144,,59.06912377458514,,,,,156,CHN,2022/03/07,280,3160685000,0
China,3/8/22,869191,7214,,,39461,,61.878383043586986,,,,,156,CHN,2022/03/08,291,3165486000,4801000
China,3/9/22,900504,7505,,,31313,,64.10757985791645,,,,,156,CHN,2022/03/09,291,3174984000,9498000
China,3/10/22,933469,7786,,,32965,,66.4543838365953,,,,,156,CHN,2022/03/10,281,3180060000,5076000
China,3/11/22,964448,8080,,,30979,,68.65980293125605,,,,,156,CHN,2022/03/11,294,3185239000,5179000
China,3/12/22,993865,8365,,,29417,,70.75402203153804,,,,,156,CHN,2022/03/12,285,3189426000,4187000
China,3/13/22,1029245,8629,,,35380,,73.27275173776154,,,,,156,CHN,2022/03/13,264,3189426000,0
China,3/14/22,1059248,8915,,,30003,,75.40868863362992,,,,,156,CHN,2022/03/14,286,3193236000,3810000
China,3/15/22,1091665,9204,,,32417,,77.71648006626552,,,,,156,CHN,2022/03/15,289,3198272000,5036000
China,3/16/22,1125158,9483,,,33493,,80.10087277543859,,,,,156,CHN,2022/03/16,279,3209041000,10769000
China,3/17/22,1149302,9772,,,24144,,81.8197029062204,,,,,156,CHN,2022/03/17,289,3209041000,0
China,3/18/22,1173353,10037,,,24051,,83.53191229469924,,,,,156,CHN,2022/03/18,265,3218716000,9675000
China,3/19/22,1195788,10288,,,22435,,85.12907738681693,,,,,156,CHN,2022/03/19,251,3218716000,0
China,3/20/22,1212837,10534,,,17049,,86.34280895158246,,,,,156,CHN,2022/03/20,246,3222868000,4152000
China,3/21/22,1231237,10757,,,18400,,87.65271925668456,,,,,156,CHN,2022/03/21,223,3226334000,3466000
China,3/22/22,1252312,11002,,,21075,,89.15306489146863,,,,,156,CHN,2022/03/22,245,3226334000,0
China,3/23/22,1269366,11207,,,17054,,90.3671524101214,,,,,156,CHN,2022/03/23,205,3234601000,8267000
China,3/24/22,1287278,11408,,,17912,,91.64232161582733,,,,,156,CHN,2022/03/24,201,3239170000,4569000
China,3/25/22,1303376,11600,,,16098,,92.78835075123676,,,,,156,CHN,2022/03/25,192,3243599000,4429000
China,3/26/22,1317780,11739,,,14404,,93.81378270964386,,,,,156,CHN,2022/03/26,139,3247624000,4025000
China,3/27/22,1331994,11890,,,14214,,94.82568842033524,,,,,156,CHN,2022/03/27,151,3247624000,0
China,3/28/22,1346658,12058,,,14664,,95.86962998087965,,,,,156,CHN,2022/03/28,168,3254984000,7360000
China,3/29/22,1362987,12209,,,16329,,97.03210418588031,,,,,156,CHN,2022/03/29,151,3263129000,8145000
China,3/30/22,1378452,12344,,,15465,,98.13306955916315,,,,,156,CHN,2022/03/30,135,3263129000,0
China,3/31/22,1385495,12463,,,7043,,98.63446620475194,,,,,156,CHN,2022/03/31,119,3263129000,0
China,4/1/22,1400358,12583,,,14863,,99.69257473000916,,,,,156,CHN,2022/04/01,120,,
Colombia,3/5/22,6070616,139037,,,1191,,11930.565885377095,,,,,170,COL,2022/03/05,53,77983480,169012
Colombia,3/6/22,6071704,139091,,,1088,,11932.704128956213,,,,,170,COL,2022/03/06,54,78139554,156074
Colombia,3/7/22,6072656,139120,,,952,,11934.57509208794,,,,,170,COL,2022/03/07,29,78256058,116504
Colombia,3/8/22,6073416,139154,,,760,,11936.06871811747,,,,,170,COL,2022/03/08,34,78298936,42878
Colombia,3/9/22,6074155,139189,,,739,,11937.521072901449,,,,,170,COL,2022/03/09,35,78423261,124325
Colombia,3/10/22,6074874,139220,,,719,,11938.934121737282,,,,,170,COL,2022/03/10,31,78548341,125080
Colombia,3/11/22,6075656,139255,,,782,,11940.470984309773,,,,,170,COL,2022/03/11,35,78682668,134327
Colombia,3/12/22,6076333,139283,,,677,,11941.8014906545,,,,,170,COL,2022/03/12,28,78826650,143982
Colombia,3/13/22,6076819,139297,,,486,,11942.756625194437,,,,,170,COL,2022/03/13,14,78954496,127846
Colombia,3/14/22,6077288,139315,,,469,,11943.67834967845,,,,,170,COL,2022/03/14,18,79051362,96866
Colombia,3/15/22,6077861,139335,,,573,,11944.80446509282,,,,,170,COL,2022/03/15,20,79106844,55482
Colombia,3/16/22,6078487,139361,,,626,,11946.034741269776,,,,,170,COL,2022/03/16,26,79222616,115772
Colombia,3/17/22,6079231,139386,,,744,,11947.49692254079,,,,,170,COL,2022/03/17,25,79329323,106707
Colombia,3/18/22,6079896,139415,,,665,,11948.80384531663,,,,,170,COL,2022/03/18,29,79449268,119945
Colombia,3/19/22,6080589,139434,,,693,,11950.165796419873,,,,,170,COL,2022/03/19,19,79557334,108066
Colombia,3/20/22,6081131,139452,,,542,,11951.230987614617,,,,,170,COL,2022/03/20,18,79665183,107849
Colombia,3/21/22,6081639,139471,,,508,,11952.229358697514,,,,,170,COL,2022/03/21,19,79751465,86282
Colombia,3/22/22,6081933,139489,,,294,,11952.807156135254,,,,,170,COL,2022/03/22,18,79783514,32049
Colombia,3/23/22,6082226,139508,,,293,,11953.382988275585,,,,,170,COL,2022/03/23,19,79809930,26416
Colombia,3/24/22,6082577,139531,,,351,,11954.07280766554,,,,,170,COL,2022/03/24,23,79932662,122732
Colombia,3/25/22,6082943,139544,,,366,,11954.792106516605,,,,,170,COL,2022/03/25,13,80224223,291561
Colombia,3/26/22,6083291,139558,,,348,,11955.476030014337,,,,,170,COL,2022/03/26,14,80224223,0
Colombia,3/27/22,6083643,139573,,,352,,11956.167814701697,,,,,170,COL,2022/03/27,15,80439798,215575
Colombia,3/28/22,6083939,139585,,,296,,11956.749542734253,,,,,170,COL,2022/03/28,12,80531597,91799
Colombia,3/29/22,6084240,139595,,,301,,11957.341097253842,,,,,170,COL,2022/03/29,10,80573164,41567
Colombia,3/30/22,6084551,139595,,,311,,11957.952304747507,,,,,170,COL,2022/03/30,0,80649211,76047
Colombia,3/31/22,6084916,139621,,,365,,11958.669638301162,,,,,170,COL,2022/03/31,26,80744778,95567
Colombia,4/1/22,6085270,139636,,,354,,11959.365353583338,,,,,170,COL,2022/04/01,15,,
Comoros,3/5/22,8047,160,,,0,,925.3733059642707,,,,,174,COM,2022/03/05,0,637961,0
Comoros,3/7/22,8048,160,,,1,,925.4883020256556,,,,,174,COM,2022/03/07,0,637961,0
Comoros,3/8/22,8051,160,,,3,,925.8332902098103,,,,,174,COM,2022/03/08,0,637961,0
Comoros,3/10/22,8057,160,,,6,,926.5232665781197,,,,,174,COM,2022/03/10,0,637961,0
Comoros,3/11/22,8060,160,,,3,,926.8682547622744,,,,,174,COM,2022/03/11,0,637961,0
Comoros,3/13/22,8063,160,,,3,,927.2132429464291,,,,,174,COM,2022/03/13,0,637961,0
Comoros,3/14/22,8069,160,,,6,,927.9032193147385,,,,,174,COM,2022/03/14,0,637961,0
Comoros,3/16/22,8074,160,,,5,,928.478199621663,,,,,174,COM,2022/03/16,0,637961,0
Comoros,3/18/22,8076,160,,,2,,928.7081917444327,,,,,174,COM,2022/03/18,0,637961,0
Comoros,3/21/22,8077,160,,,1,,928.8231878058176,,,,,174,COM,2022/03/21,0,637961,0
Comoros,3/22/22,8078,160,,,1,,928.9381838672025,,,,,174,COM,2022/03/22,0,637961,0
Comoros,3/24/22,8081,160,,,3,,929.2831720513573,,,,,174,COM,2022/03/24,0,637961,0
Comoros,3/28/22,8083,160,,,2,,929.513164174127,,,,,174,COM,2022/03/28,0,637961,0
Comoros,3/29/22,8085,160,,,2,,929.7431562968968,,,,,174,COM,2022/03/29,0,637961,0
Comoros,3/30/22,8086,160,,,1,,929.8581523582817,,,,,174,COM,2022/03/30,0,637961,0
Comoros,4/1/22,8088,160,,,2,,930.0881444810515,,,,,174,COM,2022/04/01,0,,
Congo (Brazzaville),3/5/22,24020,378,,,0,,435.2953883335037,,,,,178,COG,2022/03/05,0,812761,0
Congo (Brazzaville),3/9/22,24041,378,,,21,,435.6759546596903,,,,,178,COG,2022/03/09,0,812761,0
Congo (Brazzaville),3/11/22,24049,378,,,8,,435.82093230776144,,,,,178,COG,2022/03/11,0,812761,0
Congo (Brazzaville),3/18/22,24059,383,,,10,,436.0021543678503,,,,,178,COG,2022/03/18,5,817927,0
Congo (Brazzaville),3/21/22,24062,384,,,3,,436.056520985877,,,,,178,COG,2022/03/21,1,817927,0
Congo (Brazzaville),3/28/22,24069,384,,,7,,436.1833764279392,,,,,178,COG,2022/03/28,0,818931,0
Congo (Brazzaville),3/31/22,24071,385,,,2,,436.219620839957,,,,,178,COG,2022/03/31,1,818931,0
Congo (Brazzaville),4/1/22,24071,385,,,0,,436.219620839957,,,,,178,COG,2022/04/01,0,,
Congo (Kinshasa),3/5/22,86154,1335,,,0,,96.19545490823256,,,,,180,COD,2022/03/05,0,795810,0
Congo (Kinshasa),3/9/22,86271,1335,,,117,,96.32609153827022,,,,,180,COD,2022/03/09,0,850731,0
Congo (Kinshasa),3/10/22,86290,1335,,,19,,96.3473060337464,,,,,180,COD,2022/03/10,0,850731,0
Congo (Kinshasa),3/11/22,86315,1335,,,25,,96.37521984358351,,,,,180,COD,2022/03/11,0,850731,0
Congo (Kinshasa),3/14/22,86344,1335,,,29,,96.40759986299456,,,,,180,COD,2022/03/14,0,850731,0
Congo (Kinshasa),3/15/22,86375,1335,,,31,,96.44221298719256,,,,,180,COD,2022/03/15,0,850731,0
Congo (Kinshasa),3/16/22,86426,1335,,,51,,96.49915715926025,,,,,180,COD,2022/03/16,0,850731,0
Congo (Kinshasa),3/17/22,86461,1335,,,35,,96.5382364930322,,,,,180,COD,2022/03/17,0,850731,0
Congo (Kinshasa),3/22/22,86509,1335,,,48,,96.59183100791944,,,,,180,COD,2022/03/22,0,850731,0
Congo (Kinshasa),3/23/22,86585,1335,,,76,,96.67668898982423,,,,,180,COD,2022/03/23,0,850731,0
Congo (Kinshasa),3/24/22,86598,1335,,,13,,96.69120417093953,,,,,180,COD,2022/03/24,0,850731,0
Congo (Kinshasa),3/25/22,86611,1335,,,13,,96.70571935205481,,,,,180,COD,2022/03/25,0,850731,0
Congo (Kinshasa),3/28/22,86628,1335,,,17,,96.72470074274405,,,,,180,COD,2022/03/28,0,964948,0
Congo (Kinshasa),3/29/22,86715,1337,,,87,,96.82184080097717,,,,,180,COD,2022/03/29,2,964948,0
Congo (Kinshasa),3/30/22,86748,1337,,,33,,96.85868702996214,,,,,180,COD,2022/03/30,0,964948,0
Congo (Kinshasa),4/1/22,86748,1337,,,0,,96.85868702996214,,,,,180,COD,2022/04/01,0,,
Costa Rica,3/5/22,814583,8082,,,0,,15990.670801634986,,,,,188,CRI,2022/03/05,0,9349535,0
Costa Rica,3/7/22,817538,8121,,,2955,,16048.678926305929,,,,,188,CRI,2022/03/07,39,9349535,0
Costa Rica,3/8/22,818996,8136,,,1458,,16077.30019391007,,,,,188,CRI,2022/03/08,15,9582303,232768
Costa Rica,3/9/22,820445,8142,,,1449,,16105.744787022826,,,,,188,CRI,2022/03/09,6,9582303,0
Costa Rica,3/10/22,821813,8149,,,1368,,16132.599309713132,,,,,188,CRI,2022/03/10,7,9582303,0
Costa Rica,3/11/22,822935,8160,,,1122,,16154.624729638952,,,,,188,CRI,2022/03/11,11,9582303,0
Costa Rica,3/14/22,825158,8186,,,2223,,16198.263329010697,,,,,188,CRI,2022/03/14,26,9582303,0
Costa Rica,3/15/22,826251,8192,,,1093,,16219.719464464282,,,,,188,CRI,2022/03/15,6,9790312,208009
Costa Rica,3/16/22,827346,8202,,,1095,,16241.21486091595,,,,,188,CRI,2022/03/16,10,9790312,0
Costa Rica,3/17/22,828442,8215,,,1096,,16262.729887866662,,,,,188,CRI,2022/03/17,13,9790312,0
Costa Rica,3/18/22,829400,8226,,,958,,16281.535905949493,,,,,188,CRI,2022/03/18,11,9790312,0
Costa Rica,3/21/22,831152,8244,,,1752,,16315.928540272165,,,,,188,CRI,2022/03/21,18,9790312,0
Costa Rica,3/22/22,832054,8256,,,902,,16333.635250408608,,,,,188,CRI,2022/03/22,12,10018261,227949
Costa Rica,3/23/22,832966,8261,,,912,,16351.538265535479,,,,,188,CRI,2022/03/23,5,10018261,0
Costa Rica,3/24/22,833909,8263,,,943,,16370.04982613267,,,,,188,CRI,2022/03/24,2,10018261,0
Costa Rica,3/25/22,834726,8266,,,817,,16386.087943850493,,,,,188,CRI,2022/03/25,3,10018261,0
Costa Rica,3/30/22,837828,8298,,,3102,,16446.9817518807,,,,,188,CRI,2022/03/30,32,10166273,0
Costa Rica,3/31/22,838537,8300,,,709,,16460.899775701917,,,,,188,CRI,2022/03/31,2,10166273,0
Costa Rica,4/1/22,839368,8308,,,831,,16477.212720406336,,,,,188,CRI,2022/04/01,8,,
Cote d'Ivoire,3/5/22,81546,795,,,12,,309.14076072070674,,,,,384,CIV,2022/03/05,0,9558981,0
Cote d'Ivoire,3/6/22,81556,795,,,10,,309.1786707053437,,,,,384,CIV,2022/03/06,0,9970869,411888
Cote d'Ivoire,3/8/22,81559,795,,,3,,309.1900437007348,,,,,384,CIV,2022/03/08,0,9970869,0
Cote d'Ivoire,3/9/22,81571,795,,,12,,309.23553568229914,,,,,384,CIV,2022/03/09,0,9970869,0
Cote d'Ivoire,3/11/22,81577,795,,,6,,309.25828167308134,,,,,384,CIV,2022/03/11,0,9970869,0
Cote d'Ivoire,3/12/22,81594,796,,,17,,309.3227286469642,,,,,384,CIV,2022/03/12,1,9970869,0
Cote d'Ivoire,3/13/22,81597,796,,,3,,309.33410164235534,,,,,384,CIV,2022/03/13,0,10108543,137674
Cote d'Ivoire,3/14/22,81598,796,,,1,,309.337892640819,,,,,384,CIV,2022/03/14,0,10108543,0
Cote d'Ivoire,3/15/22,81616,796,,,18,,309.40613061316554,,,,,384,CIV,2022/03/15,0,10108543,0
Cote d'Ivoire,3/16/22,81626,796,,,10,,309.44404059780254,,,,,384,CIV,2022/03/16,0,10108543,0
Cote d'Ivoire,3/17/22,81637,796,,,11,,309.4857415809032,,,,,384,CIV,2022/03/17,0,10108543,0
Cote d'Ivoire,3/18/22,81643,796,,,6,,309.5084875716854,,,,,384,CIV,2022/03/18,0,10154915,46372
Cote d'Ivoire,3/19/22,81655,796,,,12,,309.5539795532498,,,,,384,CIV,2022/03/19,0,10154915,0
Cote d'Ivoire,3/21/22,81667,796,,,12,,309.59947153481414,,,,,384,CIV,2022/03/21,0,10154915,0
Cote d'Ivoire,3/22/22,81671,796,,,4,,309.61463552866894,,,,,384,CIV,2022/03/22,0,10154915,0
Cote d'Ivoire,3/23/22,81675,796,,,4,,309.62979952252374,,,,,384,CIV,2022/03/23,0,10154915,0
Cote d'Ivoire,3/24/22,81680,796,,,5,,309.6487545148422,,,,,384,CIV,2022/03/24,0,10154915,0
Cote d'Ivoire,3/25/22,81690,796,,,10,,309.6866644994792,,,,,384,CIV,2022/03/25,0,10154915,0
Cote d'Ivoire,3/26/22,81697,796,,,7,,309.7132014887251,,,,,384,CIV,2022/03/26,0,10154915,0
Cote d'Ivoire,3/28/22,81714,796,,,17,,309.77764846260794,,,,,384,CIV,2022/03/28,0,10364488,0
Cote d'Ivoire,3/29/22,81719,796,,,5,,309.79660345492647,,,,,384,CIV,2022/03/29,0,10364488,0
Cote d'Ivoire,3/30/22,81722,796,,,3,,309.80797645031754,,,,,384,CIV,2022/03/30,0,10364488,0
Cote d'Ivoire,3/31/22,81741,796,,,19,,309.8800054211278,,,,,384,CIV,2022/03/31,0,10364488,0
Cote d'Ivoire,4/1/22,81741,796,,,0,,309.8800054211278,,,,,384,CIV,2022/04/01,0,,
Croatia,3/5/22,1062953,15194,,,1524,,25892.41433202412,,,,,191,HRV,2022/03/05,22,5201481,2752
Croatia,3/6/22,1063828,15214,,,875,,25913.728409448544,,,,,191,HRV,2022/03/06,20,5202184,703
Croatia,3/7/22,1063985,15234,,,157,,25917.552763912125,,,,,191,HRV,2022/03/07,20,5202184,0
Croatia,3/8/22,1065001,15250,,,1016,,25942.301452670083,,,,,191,HRV,2022/03/08,16,5202211,27
Croatia,3/9/22,1067589,15276,,,2588,,26005.342403955114,,,,,191,HRV,2022/03/09,26,5204094,1883
Croatia,3/10/22,1069317,15294,,,1728,,26047.43466200014,,,,,191,HRV,2022/03/10,18,5206046,1952
Croatia,3/11/22,1070855,15308,,,1538,,26084.89872037587,,,,,191,HRV,2022/03/11,14,5207259,1213
Croatia,3/12/22,1072430,15321,,,1575,,26123.264059739828,,,,,191,HRV,2022/03/12,13,5208696,1437
Croatia,3/13/22,1073386,15336,,,956,,26146.55121176011,,,,,191,HRV,2022/03/13,15,5208696,0
Croatia,3/14/22,1073527,15354,,,141,,26149.985823093644,,,,,191,HRV,2022/03/14,18,5209274,578
Croatia,3/15/22,1074706,15373,,,1179,,26178.70501998895,,,,,191,HRV,2022/03/15,19,5209291,17
Croatia,3/16/22,1077365,15383,,,2659,,26243.475456413566,,,,,191,HRV,2022/03/16,10,5211223,1932
Croatia,3/17/22,1079397,15392,,,2032,,26292.972833929478,,,,,191,HRV,2022/03/17,9,5213058,1835
Croatia,3/18/22,1081336,15410,,,1939,,26340.204829501996,,,,,191,HRV,2022/03/18,18,5214150,1092
Croatia,3/19/22,1083111,15425,,,1775,,26383.441957991537,,,,,191,HRV,2022/03/19,15,5214150,0
Croatia,3/20/22,1084012,15435,,,901,,26405.389368002285,,,,,191,HRV,2022/03/20,10,5215491,1341
Croatia,3/21/22,1084304,15451,,,292,,26412.502180125633,,,,,191,HRV,2022/03/21,16,5216350,859
Croatia,3/22/22,1085558,15463,,,1254,,26443.048297943034,,,,,191,HRV,2022/03/22,12,5216368,18
Croatia,3/23/22,1087635,15476,,,2077,,26493.6418280122,,,,,191,HRV,2022/03/23,13,5217248,880
Croatia,3/24/22,1089696,15485,,,2061,,26543.845614951326,,,,,191,HRV,2022/03/24,9,5218366,1118
Croatia,3/25/22,1091511,15495,,,1815,,26588.057101265982,,,,,191,HRV,2022/03/25,10,5220005,1639
Croatia,3/26/22,1093098,15509,,,1587,,26626.714747977476,,,,,191,HRV,2022/03/26,14,5222208,2203
Croatia,3/27/22,1094059,15520,,,961,,26650.1236947259,,,,,191,HRV,2022/03/27,11,5222208,0
Croatia,3/28/22,1094202,15534,,,143,,26653.607023950688,,,,,191,HRV,2022/03/28,14,5222632,424
Croatia,3/29/22,1095115,15548,,,913,,26675.84674130897,,,,,191,HRV,2022/03/29,14,5224151,1519
Croatia,3/30/22,1097409,15563,,,2294,,26731.726162579398,,,,,191,HRV,2022/03/30,15,5224151,0
Croatia,3/31/22,1099176,15563,,,1767,,26774.768419503915,,,,,191,HRV,2022/03/31,0,5224151,0
Croatia,4/1/22,1100618,15584,,,1442,,26809.894019099364,,,,,191,HRV,2022/04/01,21,,
Cuba,3/5/22,1072474,8499,,,510,,9468.61798793214,,,,,192,CUB,2022/03/05,1,35031576,0
Cuba,3/6/22,1072956,8500,,,482,,9472.87345134681,,,,,192,CUB,2022/03/06,1,35063358,0
Cuba,3/7/22,1073504,8501,,,548,,9477.711613071371,,,,,192,CUB,2022/03/07,1,35063358,0
Cuba,3/8/22,1073951,8501,,,447,,9481.658069806552,,,,,192,CUB,2022/03/08,0,35077956,0
Cuba,3/9/22,1074469,8502,,,518,,9486.231368662979,,,,,192,CUB,2022/03/09,1,35086108,0
Cuba,3/10/22,1075030,8502,,,561,,9491.184304297065,,,,,192,CUB,2022/03/10,0,35100904,0
Cuba,3/11/22,1075616,8503,,,586,,9496.357958987926,,,,,192,CUB,2022/03/11,1,35113686,0
Cuba,3/12/22,1076229,8503,,,613,,9501.769990260109,,,,,192,CUB,2022/03/12,0,35131556,0
Cuba,3/13/22,1076785,8503,,,556,,9506.67878208284,,,,,192,CUB,2022/03/13,0,35131556,0
Cuba,3/14/22,1077405,8503,,,620,,9512.15261469092,,,,,192,CUB,2022/03/14,0,35152122,0
Cuba,3/15/22,1077966,8503,,,561,,9517.105550325005,,,,,192,CUB,2022/03/15,0,35167920,0
Cuba,3/16/22,1078525,8503,,,559,,9522.040828434547,,,,,192,CUB,2022/03/16,0,35178483,0
Cuba,3/17/22,1079111,8503,,,586,,9527.21448312541,,,,,192,CUB,2022/03/17,0,35190391,0
Cuba,3/18/22,1079853,8504,,,742,,9533.765424730564,,,,,192,CUB,2022/03/18,1,35203502,0
Cuba,3/19/22,1080686,8506,,,833,,9541.119783702386,,,,,192,CUB,2022/03/19,2,35203502,0
Cuba,3/20/22,1081472,8506,,,786,,9548.059190847469,,,,,192,CUB,2022/03/20,0,35218760,0
Cuba,3/21/22,1082201,8507,,,729,,9554.4953585431,,,,,192,CUB,2022/03/21,1,35233331,0
Cuba,3/22/22,1082880,8508,,,679,,9560.490088125174,,,,,192,CUB,2022/03/22,1,35248586,0
Cuba,3/23/22,1083691,8508,,,811,,9567.650214327034,,,,,192,CUB,2022/03/23,0,35253792,0
Cuba,3/24/22,1084568,8508,,,877,,9575.393038838785,,,,,192,CUB,2022/03/24,0,35253792,0
Cuba,3/25/22,1085404,8508,,,836,,9582.773884097422,,,,,192,CUB,2022/03/25,0,35269751,0
Cuba,3/26/22,1086361,8509,,,957,,9591.223009590862,,,,,192,CUB,2022/03/26,1,35286060,0
Cuba,3/27/22,1087183,8509,,,822,,9598.480252177702,,,,,192,CUB,2022/03/27,0,35300895,0
Cuba,3/28/22,1088017,8510,,,834,,9605.843439911798,,,,,192,CUB,2022/03/28,1,35335766,0
Cuba,3/29/22,1088638,8510,,,621,,9611.326101282148,,,,,192,CUB,2022/03/29,0,35342367,0
Cuba,3/30/22,1089452,8510,,,814,,9618.51271377082,,,,,192,CUB,2022/03/30,0,35342367,0
Cuba,3/31/22,1090285,8510,,,833,,9625.867072742645,,,,,192,CUB,2022/03/31,0,35342367,0
Cuba,4/1/22,1091063,8510,,,778,,9632.735849789558,,,,,192,CUB,2022/04/01,0,,
Cyprus,3/5/22,331508,875,,,1834,,27457.239384078166,,,,,196,CYP,2022/03/05,2,1773485,0
Cyprus,3/6/22,333238,877,,,1730,,27600.527100014,,,,,196,CYP,2022/03/06,2,1773485,0
Cyprus,3/7/22,334822,878,,,1584,,27731.722326628074,,,,,196,CYP,2022/03/07,1,1773485,0
Cyprus,3/8/22,338517,883,,,3695,,28037.761696791596,,,,,196,CYP,2022/03/08,5,1773485,0
Cyprus,3/9/22,341383,886,,,2866,,28275.13891868298,,,,,196,CYP,2022/03/09,3,1773485,0
Cyprus,3/10/22,344856,889,,,3473,,28562.791079055893,,,,,196,CYP,2022/03/10,3,1773485,0
Cyprus,3/11/22,347876,895,,,3020,,28812.92339242364,,,,,196,CYP,2022/03/11,6,1773485,0
Cyprus,3/12/22,350688,899,,,2812,,29045.82804977136,,,,,196,CYP,2022/03/12,4,1773485,0
Cyprus,3/13/22,353002,902,,,2314,,29237.4857229942,,,,,196,CYP,2022/03/13,3,1773485,0
Cyprus,3/14/22,356784,902,,,3782,,29550.730891589177,,,,,196,CYP,2022/03/14,0,1773485,0
Cyprus,3/15/22,360078,904,,,3294,,29823.557328752544,,,,,196,CYP,2022/03/15,2,1773485,0
Cyprus,3/16/22,363792,904,,,3714,,30131.17037903328,,,,,196,CYP,2022/03/16,0,1773485,0
Cyprus,3/17/22,367743,905,,,3951,,30458.413018144533,,,,,196,CYP,2022/03/17,1,1773485,0
Cyprus,3/18/22,370311,915,,,2568,,30671.108309776446,,,,,196,CYP,2022/03/18,10,1773485,0
Cyprus,3/19/22,373658,916,,,3347,,30948.324486214147,,,,,196,CYP,2022/03/19,1,1773485,0
Cyprus,3/20/22,377356,919,,,3698,,31254.61233218565,,,,,196,CYP,2022/03/20,3,1773485,0
Cyprus,3/21/22,382642,920,,,5286,,31692.426705848542,,,,,196,CYP,2022/03/21,1,1773485,0
Cyprus,3/22/22,387315,923,,,4673,,32079.469189413936,,,,,196,CYP,2022/03/22,3,1773485,0
Cyprus,3/23/22,392019,927,,,4704,,32469.07925632847,,,,,196,CYP,2022/03/23,4,1773485,0
Cyprus,3/24/22,397205,927,,,5186,,32898.611103058654,,,,,196,CYP,2022/03/24,0,1773485,0
Cyprus,3/25/22,400534,930,,,3329,,33174.33642464847,,,,,196,CYP,2022/03/25,3,1773485,0
Cyprus,3/26/22,405706,932,,,5172,,33602.708717608075,,,,,196,CYP,2022/03/26,2,1773485,0
Cyprus,3/27/22,410020,932,,,4314,,33960.01692948505,,,,,196,CYP,2022/03/27,0,1773485,0
Cyprus,3/28/22,416514,935,,,6494,,34497.88422849504,,,,,196,CYP,2022/03/28,3,1773485,0
Cyprus,3/29/22,421603,937,,,5089,,34919.382024100494,,,,,196,CYP,2022/03/29,2,1773485,0
Cyprus,3/30/22,426377,938,,,4774,,35314.789859867924,,,,,196,CYP,2022/03/30,1,1773485,0
Cyprus,3/31/22,430726,940,,,4349,,35674.99695617135,,,,,196,CYP,2022/03/31,2,1773485,0
Cyprus,4/1/22,433217,942,,,2491,,35881.31470206508,,,,,196,CYP,2022/04/01,2,,
Czechia,3/5/22,3624937,38892,,,8297,,33849.50128779748,,,,,203,CZE,2022/03/05,55,17413948,936
Czechia,3/6/22,3629515,38915,,,4578,,33892.25044920236,,,,,203,CZE,2022/03/06,23,17414176,228
Czechia,3/7/22,3632095,38940,,,2580,,33916.34237502687,,,,,203,CZE,2022/03/07,25,17417977,3801
Czechia,3/8/22,3642514,38986,,,10419,,34013.634535943755,,,,,203,CZE,2022/03/08,46,17421305,3328
Czechia,3/9/22,3653041,39032,,,10527,,34111.9351960812,,,,,203,CZE,2022/03/09,46,17425558,4253
Czechia,3/10/22,3662117,39068,,,9076,,34196.68648243129,,,,,203,CZE,2022/03/10,36,17429682,4124
Czechia,3/11/22,3670380,39100,,,8263,,34273.84601075994,,,,,203,CZE,2022/03/11,32,17437236,7554
Czechia,3/12/22,3678771,39126,,,8391,,34352.20079742407,,,,,203,CZE,2022/03/12,26,17438347,1111
Czechia,3/13/22,3685973,39155,,,7202,,34419.45275470628,,,,,203,CZE,2022/03/13,29,17438648,301
Czechia,3/15/22,3696837,39216,,,10864,,34520.9003059301,,,,,203,CZE,2022/03/15,61,17445371,3420
Czechia,3/16/22,3707588,39248,,,10751,,34621.29266815464,,,,,203,CZE,2022/03/16,32,17449173,3802
Czechia,3/17/22,3716181,39271,,,8593,,34701.533721879445,,,,,203,CZE,2022/03/17,23,17452994,3821
Czechia,3/18/22,3724368,39318,,,8187,,34777.983565571405,,,,,203,CZE,2022/03/18,47,17460745,7751
Czechia,3/19/22,3733099,39352,,,8731,,34859.51325718915,,,,,203,CZE,2022/03/19,34,17461493,748
Czechia,3/20/22,3737891,39359,,,4792,,34904.26074112367,,,,,203,CZE,2022/03/20,7,17461737,244
Czechia,3/21/22,3740174,39374,,,2283,,34925.57929409163,,,,,203,CZE,2022/03/21,15,17464713,2976
Czechia,3/22/22,3750636,39418,,,10462,,35023.27298710559,,,,,203,CZE,2022/03/22,44,17467515,2802
Czechia,3/23/22,3761164,39441,,,10528,,35121.58298519878,,,,,203,CZE,2022/03/23,23,17467515,0
Czechia,3/24/22,3776874,39495,,,15710,,35268.2822699674,,,,,203,CZE,2022/03/24,54,17474992,7477
Czechia,3/25/22,3784532,39527,,,7658,,35339.79233506976,,,,,203,CZE,2022/03/25,32,17482504,7512
Czechia,3/27/22,3790322,39563,,,5790,,35393.859098838715,,,,,203,CZE,2022/03/27,36,17483251,182
Czechia,3/28/22,3799158,39610,,,8836,,35476.36927580978,,,,,203,CZE,2022/03/28,47,17486135,2884
Czechia,3/29/22,3808101,39640,,,8943,,35559.878614045665,,,,,203,CZE,2022/03/29,30,17489006,2871
Czechia,3/30/22,3815526,39673,,,7425,,35629.212935459225,,,,,203,CZE,2022/03/30,33,17492496,3490
Czechia,3/31/22,3822035,39692,,,6509,,35689.99368940951,,,,,203,CZE,2022/03/31,19,17492496,0
Czechia,4/1/22,3828021,39706,,,5986,,35745.89069250467,,,,,203,CZE,2022/04/01,14,,
Denmark,3/5/22,2899700,4878,,,15735,,50062.12662090745,,,,,208,DNK,2022/03/05,58,13165075,0
Denmark,3/6/22,2910527,4916,,,10827,,50249.050318160465,,,,,208,DNK,2022/03/06,38,13165075,0
Denmark,3/7/22,2922756,4953,,,12229,,50460.17896817497,,,,,208,DNK,2022/03/07,37,13165075,0
Denmark,3/8/22,2938246,4996,,,15490,,50727.60744055414,,,,,208,DNK,2022/03/08,43,13165075,0
Denmark,3/9/22,2955211,5056,,,16965,,51020.50118063887,,,,,208,DNK,2022/03/09,60,13165075,0
Denmark,3/10/22,2969537,5097,,,14326,,51267.83367226597,,,,,208,DNK,2022/03/10,41,13165075,0
Denmark,3/11/22,2983370,5124,,,13833,,51506.65472187353,,,,,208,DNK,2022/03/11,27,13165075,0
Denmark,3/12/22,2990461,5176,,,7091,,51629.077917331284,,,,,208,DNK,2022/03/12,52,13160370,
Denmark,3/13/22,2997119,5223,,,6658,,51744.025546065976,,,,,208,DNK,2022/03/13,47,13160370,0
Denmark,3/14/22,3005034,5244,,,7915,,51880.6747622623,,,,,208,DNK,2022/03/14,21,13160370,0
Denmark,3/15/22,3014997,5280,,,9963,,52052.68185524575,,,,,208,DNK,2022/03/15,36,13160370,0
Denmark,3/16/22,3024588,5305,,,9591,,52218.26652139091,,,,,208,DNK,2022/03/16,25,13160370,0
Denmark,3/17/22,3032928,5348,,,8340,,52362.253187604096,,,,,208,DNK,2022/03/17,43,13178651,18281
Denmark,3/18/22,3040155,5386,,,7227,,52487.02436706724,,,,,208,DNK,2022/03/18,38,13178651,0
Denmark,3/19/22,3046507,5423,,,6352,,52596.68903178981,,,,,208,DNK,2022/03/19,37,13178651,0
Denmark,3/20/22,3051491,5450,,,4984,,52682.735739752214,,,,,208,DNK,2022/03/20,27,13178651,0
Denmark,3/21/22,3056722,5478,,,5231,,52773.04680101854,,,,,208,DNK,2022/03/21,28,13178651,0
Denmark,3/22/22,3064138,5509,,,7416,,52901.08098766566,,,,,208,DNK,2022/03/22,31,13178651,0
Denmark,3/23/22,3070430,5535,,,6292,,53009.709777091724,,,,,208,DNK,2022/03/23,26,13178651,0
Denmark,3/24/22,3075839,5567,,,5409,,53103.09393507099,,,,,208,DNK,2022/03/24,32,13178651,0
Denmark,3/25/22,3081511,5591,,,5672,,53201.018679766574,,,,,208,DNK,2022/03/25,24,13178651,0
Denmark,3/26/22,3085833,5632,,,4322,,53275.63623029096,,,,,208,DNK,2022/03/26,41,13178651,0
Denmark,3/27/22,3089192,5634,,,3359,,53333.627982306556,,,,,208,DNK,2022/03/27,2,13187998,9347
Denmark,3/28/22,3092564,5634,,,3372,,53391.84417396973,,,,,208,DNK,2022/03/28,0,13187998,0
Denmark,3/29/22,3097060,5634,,,4496,,53469.46576285396,,,,,208,DNK,2022/03/29,0,13211743,23745
Denmark,3/30/22,3101471,5717,,,4411,,53545.61986173482,,,,,208,DNK,2022/03/30,83,13211743,0
Denmark,3/31/22,3105402,5747,,,3931,,53613.486958243695,,,,,208,DNK,2022/03/31,30,13211743,0
Denmark,4/1/22,3108402,5772,,,3000,,53665.28072306858,,,,,208,DNK,2022/04/01,25,,
Diamond Princess,3/5/22,712,13,,,0,,,,,,,9999,,2022/03/05,0,,
Diamond Princess,4/1/22,712,13,,,0,,,,,,,9999,,2022/04/01,0,,
Djibouti,3/5/22,15550,189,,,0,,1573.8834536772192,,,,,262,DJI,2022/03/05,0,158306,0
Djibouti,3/9/22,15564,189,,,14,,1575.3004548573788,,,,,262,DJI,2022/03/09,0,160742,0
Djibouti,3/13/22,15565,189,,,1,,1575.4016692273901,,,,,262,DJI,2022/03/13,0,160742,0
Djibouti,3/14/22,15568,189,,,3,,1575.7053123374244,,,,,262,DJI,2022/03/14,0,160742,0
Djibouti,3/16/22,15572,189,,,4,,1576.11016981747,,,,,262,DJI,2022/03/16,0,160742,0
Djibouti,3/18/22,15573,189,,,1,,1576.2113841874814,,,,,262,DJI,2022/03/18,0,164197,0
Djibouti,3/22/22,15574,189,,,1,,1576.3125985574927,,,,,262,DJI,2022/03/22,0,164197,0
Djibouti,3/23/22,15578,189,,,4,,1576.7174560375383,,,,,262,DJI,2022/03/23,0,164197,0
Djibouti,3/24/22,15580,189,,,2,,1576.9198847775613,,,,,262,DJI,2022/03/24,0,164197,0
Djibouti,3/28/22,15585,189,,,5,,1577.4259566276182,,,,,262,DJI,2022/03/28,0,165554,0
Djibouti,3/31/22,15587,189,,,2,,1577.628385367641,,,,,262,DJI,2022/03/31,0,165554,0
Djibouti,4/1/22,15587,189,,,0,,1577.628385367641,,,,,262,DJI,2022/04/01,0,,
Dominica,3/5/22,11248,61,,,0,,15624.175244127739,,,,,212,DMA,2022/03/05,0,61758,45
Dominica,3/9/22,11462,62,,,214,,15921.434623772417,,,,,212,DMA,2022/03/09,1,61814,56
Dominica,3/10/22,11502,62,,,40,,15976.99712464058,,,,,212,DMA,2022/03/10,0,61814,0
Dominica,3/14/22,11529,62,,,27,,16014.50181272659,,,,,212,DMA,2022/03/14,0,62015,0
Dominica,3/16/22,11643,62,,,114,,16172.85494020086,,,,,212,DMA,2022/03/16,0,62030,15
Dominica,3/18/22,11674,62,,,31,,16215.915878373686,,,,,212,DMA,2022/03/18,0,62110,80
Dominica,3/19/22,11724,62,,,50,,16285.369004458891,,,,,212,DMA,2022/03/19,0,62110,0
Dominica,3/21/22,11745,62,,,21,,16314.539317414677,,,,,212,DMA,2022/03/21,0,62110,0
Dominica,3/22/22,11777,63,,,32,,16358.989318109208,,,,,212,DMA,2022/03/22,1,62110,0
Dominica,3/24/22,11787,63,,,10,,16372.879943326248,,,,,212,DMA,2022/03/24,0,62333,223
Dominica,3/28/22,11805,63,,,18,,16397.883068716925,,,,,212,DMA,2022/03/28,0,62334,0
Dominica,3/29/22,11816,63,,,11,,16413.16275645567,,,,,212,DMA,2022/03/29,0,62334,0
Dominica,3/30/22,11839,63,,,23,,16445.11119445486,,,,,212,DMA,2022/03/30,0,62334,0
Dominica,3/31/22,11859,63,,,20,,16472.892444888945,,,,,212,DMA,2022/03/31,0,62334,0
Dominica,4/1/22,11891,63,,,32,,16517.342445583476,,,,,212,DMA,2022/04/01,0,,
Dominican Republic,3/5/22,575883,4371,,,291,,5308.702953123479,,,,,214,DOM,2022/03/05,1,15285668,0
Dominican Republic,3/6/22,575949,4371,,,66,,5309.311365587306,,,,,214,DOM,2022/03/06,0,15285668,0
Dominican Republic,3/7/22,576003,4371,,,54,,5309.809157603165,,,,,214,DOM,2022/03/07,0,15301734,16066
Dominican Republic,3/8/22,576129,4371,,,126,,5310.970672306835,,,,,214,DOM,2022/03/08,0,15311504,9770
Dominican Republic,3/9/22,576220,4372,,,91,,5311.809544037263,,,,,214,DOM,2022/03/09,1,15321540,10036
Dominican Republic,3/11/22,576367,4374,,,147,,5313.164644524878,,,,,214,DOM,2022/03/11,2,15342887,10936
Dominican Republic,3/13/22,576641,4374,,,274,,5315.690478086827,,,,,214,DOM,2022/03/13,0,15354971,3331
Dominican Republic,3/15/22,576788,4374,,,147,,5317.045578574442,,,,,214,DOM,2022/03/15,0,15366965,0
Dominican Republic,3/16/22,576904,4375,,,116,,5318.114909571471,,,,,214,DOM,2022/03/16,1,15378904,11939
Dominican Republic,3/17/22,577070,4375,,,166,,5319.645159101703,,,,,214,DOM,2022/03/17,0,15392788,13884
Dominican Republic,3/18/22,577241,4375,,,171,,5321.221500485255,,,,,214,DOM,2022/03/18,0,15407509,14721
Dominican Republic,3/19/22,577317,4375,,,76,,5321.922096655722,,,,,214,DOM,2022/03/19,0,15419005,11496
Dominican Republic,3/21/22,577354,4375,,,37,,5322.263176370292,,,,,214,DOM,2022/03/21,0,15423820,1353
Dominican Republic,3/22/22,577476,4375,,,122,,5323.387817591306,,,,,214,DOM,2022/03/22,0,15434138,10318
Dominican Republic,3/24/22,577673,4375,,,197,,5325.203836612123,,,,,214,DOM,2022/03/24,0,15456312,10854
Dominican Republic,3/26/22,577841,4375,,,168,,5326.752522883683,,,,,214,DOM,2022/03/26,0,15474538,7122
Dominican Republic,3/28/22,577910,4375,,,69,,5327.388590459503,,,,,214,DOM,2022/03/28,0,15478425,1329
Dominican Republic,3/30/22,578020,4375,,,110,,5328.402611232548,,,,,214,DOM,2022/03/30,0,15493964,9086
Dominican Republic,4/1/22,578130,4375,,,110,,5329.416632005593,,,,,214,DOM,2022/04/01,0,,
Ecuador,3/5/22,836216,35264,,,0,,4739.631333793571,,,,,218,ECU,2022/03/05,0,31996832,0
Ecuador,3/7/22,841575,35309,,,5359,,4770.005883333163,,,,,218,ECU,2022/03/07,45,32244231,247399
Ecuador,3/9/22,843760,35316,,,2185,,4782.390356321409,,,,,218,ECU,2022/03/09,7,32337184,0
Ecuador,3/14/22,849386,35347,,,5626,,4814.278248784508,,,,,218,ECU,2022/03/14,31,32658435,256285
Ecuador,3/15/22,849699,35348,,,313,,4816.052317455135,,,,,218,ECU,2022/03/15,1,32658435,0
Ecuador,3/20/22,853850,35410,,,4151,,4839.57998215729,,,,,218,ECU,2022/03/20,62,32938768,125645
Ecuador,3/21/22,854252,35410,,,402,,4841.858498469086,,,,,218,ECU,2022/03/21,0,32938768,0
Ecuador,3/24/22,855314,35413,,,1062,,4847.877862456966,,,,,218,ECU,2022/03/24,3,33040342,74682
Ecuador,3/25/22,857299,35418,,,1985,,4859.1287452403385,,,,,218,ECU,2022/03/25,5,33080633,40291
Ecuador,3/29/22,859207,35421,,,1908,,4869.943195794834,,,,,218,ECU,2022/03/29,3,33165706,85073
Ecuador,3/30/22,859890,35421,,,683,,4873.814406344478,,,,,218,ECU,2022/03/30,0,33206162,40456
Ecuador,4/1/22,859890,35421,,,0,,4873.814406344478,,,,,218,ECU,2022/04/01,0,,
Egypt,3/5/22,489876,24172,,,1113,,478.70118517230225,,,,,818,EGY,2022/03/05,10,67724897,0
Egypt,3/6/22,490969,24197,,,1093,,479.7692521839405,,,,,818,EGY,2022/03/06,25,67724897,0
Egypt,3/7/22,491892,24222,,,923,,480.6711971535125,,,,,818,EGY,2022/03/07,25,67724897,0
Egypt,3/8/22,492774,24244,,,882,,481.53307739529197,,,,,818,EGY,2022/03/08,22,67724897,0
Egypt,3/9/22,493658,24257,,,884,,482.39691201403696,,,,,818,EGY,2022/03/09,13,67724897,0
Egypt,3/10/22,494519,24269,,,861,,483.23827129767886,,,,,818,EGY,2022/03/10,12,67724897,0
Egypt,3/11/22,495373,24277,,,854,,484.0727902619415,,,,,818,EGY,2022/03/11,8,67724897,0
Egypt,3/21/22,500889,24361,,,5516,,489.46296193275293,,,,,818,EGY,2022/03/21,84,67724897,0
Egypt,3/28/22,505264,24417,,,4375,,493.7381615447544,,,,,818,EGY,2022/03/28,56,67724897,0
Egypt,4/1/22,505264,24417,,,0,,493.7381615447544,,,,,818,EGY,2022/04/01,0,,
El Salvador,3/5/22,156364,4086,,,0,,2410.7177683824475,,,,,222,SLV,2022/03/05,3,10234262,0
El Salvador,3/6/22,156364,4088,,,0,,2410.7177683824475,,,,,222,SLV,2022/03/06,2,10234262,0
El Salvador,3/7/22,156364,4091,,,0,,2410.7177683824475,,,,,222,SLV,2022/03/07,3,10234262,0
El Salvador,3/8/22,156364,4092,,,0,,2410.7177683824475,,,,,222,SLV,2022/03/08,1,10234262,0
El Salvador,3/9/22,156364,4093,,,0,,2410.7177683824475,,,,,222,SLV,2022/03/09,1,10234262,0
El Salvador,3/10/22,156364,4094,,,0,,2410.7177683824475,,,,,222,SLV,2022/03/10,1,10234262,0
El Salvador,3/11/22,156364,4095,,,0,,2410.7177683824475,,,,,222,SLV,2022/03/11,1,10234262,0
El Salvador,3/13/22,156364,4100,,,0,,2410.7177683824475,,,,,222,SLV,2022/03/13,5,10234262,0
El Salvador,3/14/22,156364,4101,,,0,,2410.7177683824475,,,,,222,SLV,2022/03/14,1,10288175,53913
El Salvador,3/15/22,156364,4102,,,0,,2410.7177683824475,,,,,222,SLV,2022/03/15,1,10288175,0
El Salvador,3/16/22,156364,4104,,,0,,2410.7177683824475,,,,,222,SLV,2022/03/16,2,10288175,0
El Salvador,3/17/22,160305,4105,,,3941,,2471.4775259046087,,,,,222,SLV,2022/03/17,1,10307278,19103
El Salvador,3/18/22,160942,4107,,,637,,2481.298374811388,,,,,222,SLV,2022/03/18,2,10307278,0
El Salvador,3/19/22,161052,4109,,,110,,2482.9942827858713,,,,,222,SLV,2022/03/19,2,10307278,0
El Salvador,3/21/22,161052,4113,,,0,,2482.9942827858713,,,,,222,SLV,2022/03/21,4,10314830,0
El Salvador,3/23/22,161052,4114,,,0,,2482.9942827858713,,,,,222,SLV,2022/03/23,1,10314830,0
El Salvador,3/24/22,161052,4115,,,0,,2482.9942827858713,,,,,222,SLV,2022/03/24,1,10418549,103719
El Salvador,3/26/22,161052,4116,,,0,,2482.9942827858713,,,,,222,SLV,2022/03/26,1,10418549,0
El Salvador,3/28/22,161052,4117,,,0,,2482.9942827858713,,,,,222,SLV,2022/03/28,1,10418549,0
El Salvador,3/29/22,161052,4118,,,0,,2482.9942827858713,,,,,222,SLV,2022/03/29,1,10418549,0
El Salvador,3/31/22,161052,4119,,,0,,2482.9942827858713,,,,,222,SLV,2022/03/31,1,10418549,0
El Salvador,4/1/22,161052,4119,,,0,,2482.9942827858713,,,,,222,SLV,2022/04/01,0,,
Equatorial Guinea,3/5/22,15889,183,,,4,,1132.5138900273346,,,,,226,GNQ,2022/03/05,0,463549,0
Equatorial Guinea,3/7/22,15894,183,,,5,,1132.8702730250145,,,,,226,GNQ,2022/03/07,0,463549,0
Equatorial Guinea,3/12/22,15895,183,,,1,,1132.9415496245506,,,,,226,GNQ,2022/03/12,0,467504,0
Equatorial Guinea,3/14/22,15898,183,,,3,,1133.1553794231586,,,,,226,GNQ,2022/03/14,0,467504,0
Equatorial Guinea,3/17/22,15899,183,,,1,,1133.2266560226944,,,,,226,GNQ,2022/03/17,0,467504,0
Equatorial Guinea,3/22/22,15902,183,,,3,,1133.4404858213024,,,,,226,GNQ,2022/03/22,0,467504,0
Equatorial Guinea,3/23/22,15999,183,,,97,,1140.3543159762935,,,,,226,GNQ,2022/03/23,0,467504,0
Equatorial Guinea,3/28/22,16000,183,,,1,,1140.4255925758293,,,,,226,GNQ,2022/03/28,0,467504,0
Equatorial Guinea,4/1/22,16000,183,,,0,,1140.4255925758293,,,,,226,GNQ,2022/04/01,0,,
Eritrea,3/5/22,9715,103,,,7,,273.937684322841,,,,,232,ERI,2022/03/05,0,,
Eritrea,3/7/22,9716,103,,,1,,273.965881717007,,,,,232,ERI,2022/03/07,0,,
Eritrea,3/9/22,9718,103,,,2,,274.02227650533905,,,,,232,ERI,2022/03/09,0,,
Eritrea,3/10/22,9719,103,,,1,,274.05047389950505,,,,,232,ERI,2022/03/10,0,,
Eritrea,3/11/22,9720,103,,,1,,274.07867129367105,,,,,232,ERI,2022/03/11,0,,
Eritrea,3/12/22,9721,103,,,1,,274.1068686878371,,,,,232,ERI,2022/03/12,0,,
Eritrea,3/14/22,9722,103,,,1,,274.1350660820031,,,,,232,ERI,2022/03/14,0,,
Eritrea,3/18/22,9723,103,,,1,,274.1632634761691,,,,,232,ERI,2022/03/18,0,,
Eritrea,3/25/22,9724,103,,,1,,274.1914608703351,,,,,232,ERI,2022/03/25,0,,
Eritrea,3/30/22,9727,103,,,3,,274.27605305283316,,,,,232,ERI,2022/03/30,0,,
Eritrea,3/31/22,9728,103,,,1,,274.30425044699916,,,,,232,ERI,2022/03/31,0,,
Eritrea,4/1/22,9728,103,,,0,,274.30425044699916,,,,,232,ERI,2022/04/01,0,,
Estonia,3/5/22,514067,2290,,,3045,,38752.49804189699,,,,,233,EST,2022/03/05,15,1916163,385
Estonia,3/6/22,515708,2290,,,1641,,38876.20341354457,,,,,233,EST,2022/03/06,0,1916375,212
Estonia,3/7/22,517102,2299,,,1394,,38981.28890292709,,,,,233,EST,2022/03/07,9,1917068,693
Estonia,3/8/22,520407,2308,,,3305,,39230.43348141291,,,,,233,EST,2022/03/08,9,1917795,727
Estonia,3/9/22,523279,2320,,,2872,,39446.93672783084,,,,,233,EST,2022/03/09,12,1918514,719
Estonia,3/10/22,525748,2327,,,2469,,39633.06016634264,,,,,233,EST,2022/03/10,7,1919382,868
Estonia,3/11/22,527913,2337,,,2165,,39796.26682668206,,,,,233,EST,2022/03/11,10,1919382,0
Estonia,3/12/22,529793,2346,,,1880,,39937.98900748489,,,,,233,EST,2022/03/12,9,1920293,911
Estonia,3/13/22,531164,2353,,,1371,,40041.34066167674,,,,,233,EST,2022/03/13,7,1920688,395
Estonia,3/14/22,532089,2359,,,925,,40111.07098999728,,,,,233,EST,2022/03/14,6,1920827,139
Estonia,3/15/22,534788,2367,,,2699,,40314.5327804158,,,,,233,EST,2022/03/15,8,1921342,515
Estonia,3/16/22,536924,2371,,,2136,,40475.55330073221,,,,,233,EST,2022/03/16,4,1921974,632
Estonia,3/17/22,538673,2376,,,1749,,40607.40015936207,,,,,233,EST,2022/03/17,5,1922517,543
Estonia,3/18/22,540184,2385,,,1511,,40721.305592975405,,,,,233,EST,2022/03/18,9,1922970,453
Estonia,3/19/22,541551,2385,,,1367,,40824.355710612355,,,,,233,EST,2022/03/19,0,1923693,723
Estonia,3/20/22,542386,2392,,,835,,40887.30146644765,,,,,233,EST,2022/03/20,7,1923895,202
Estonia,3/21/22,543053,2397,,,667,,40937.58268697716,,,,,233,EST,2022/03/21,5,1924029,134
Estonia,3/22/22,545057,2399,,,2004,,41088.65250098188,,,,,233,EST,2022/03/22,2,1924494,465
Estonia,3/23/22,546885,2418,,,1828,,41226.45470657101,,,,,233,EST,2022/03/23,19,1925029,535
Estonia,3/24/22,548333,2423,,,1448,,41335.610939444676,,,,,233,EST,2022/03/24,5,1926189,1160
Estonia,3/25/22,549793,2429,,,1460,,41445.67178198304,,,,,233,EST,2022/03/25,6,1926869,680
Estonia,3/26/22,551067,2436,,,1274,,41541.71117471857,,,,,233,EST,2022/03/26,7,1927103,234
Estonia,3/27/22,551714,2439,,,647,,41590.48471247359,,,,,233,EST,2022/03/27,3,1927241,138
Estonia,3/28/22,552287,2444,,,573,,41633.67982396296,,,,,233,EST,2022/03/28,5,1927703,462
Estonia,3/29/22,553736,2448,,,1449,,41742.91144097535,,,,,233,EST,2022/03/29,4,1928226,523
Estonia,3/30/22,555140,2451,,,1404,,41848.75077174512,,,,,233,EST,2022/03/30,3,1928226,0
Estonia,3/31/22,556304,2459,,,1164,,41936.49790922091,,,,,233,EST,2022/03/31,8,1928226,0
Estonia,4/1/22,557314,2463,,,1010,,42012.63588933307,,,,,233,EST,2022/04/01,4,,
Eswatini,3/5/22,69297,1391,,,7,,5973.034846797522,,,,,748,SWZ,2022/03/05,0,490899,0
Eswatini,3/6/22,69298,1391,,,1,,5973.121041507925,,,,,748,SWZ,2022/03/06,0,490899,0
Eswatini,3/7/22,69307,1391,,,9,,5973.896793901552,,,,,748,SWZ,2022/03/07,0,490899,0
Eswatini,3/8/22,69331,1391,,,24,,5975.965466951224,,,,,748,SWZ,2022/03/08,0,490899,0
Eswatini,3/9/22,69351,1391,,,20,,5977.689361159284,,,,,748,SWZ,2022/03/09,0,490899,0
Eswatini,3/10/22,69379,1392,,,28,,5980.102813050568,,,,,748,SWZ,2022/03/10,1,490899,0
Eswatini,3/11/22,69408,1392,,,29,,5982.602459652256,,,,,748,SWZ,2022/03/11,0,490899,0
Eswatini,3/12/22,69429,1392,,,21,,5984.412548570719,,,,,748,SWZ,2022/03/12,0,490899,0
Eswatini,3/13/22,69435,1392,,,6,,5984.929716833138,,,,,748,SWZ,2022/03/13,0,503477,0
Eswatini,3/14/22,69459,1392,,,24,,5986.9983898828095,,,,,748,SWZ,2022/03/14,0,503477,0
Eswatini,3/15/22,69478,1392,,,19,,5988.636089380467,,,,,748,SWZ,2022/03/15,0,503477,0
Eswatini,3/16/22,69507,1392,,,29,,5991.135735982154,,,,,748,SWZ,2022/03/16,0,503477,0
Eswatini,3/17/22,69527,1392,,,20,,5992.859630190214,,,,,748,SWZ,2022/03/17,0,503477,0
Eswatini,3/18/22,69541,1392,,,14,,5994.066356135857,,,,,748,SWZ,2022/03/18,0,506539,0
Eswatini,3/19/22,69548,1392,,,7,,5994.669719108678,,,,,748,SWZ,2022/03/19,0,506539,0
Eswatini,3/20/22,69552,1392,,,4,,5995.01449795029,,,,,748,SWZ,2022/03/20,0,506539,0
Eswatini,3/21/22,69563,1392,,,11,,5995.962639764723,,,,,748,SWZ,2022/03/21,0,506539,0
Eswatini,3/22/22,69597,1392,,,34,,5998.893259918425,,,,,748,SWZ,2022/03/22,0,506539,0
Eswatini,3/23/22,69610,1393,,,13,,6000.013791153665,,,,,748,SWZ,2022/03/23,1,506539,0
Eswatini,3/24/22,69633,1393,,,23,,6001.996269492934,,,,,748,SWZ,2022/03/24,0,506539,0
Eswatini,3/25/22,69658,1393,,,25,,6004.151137253009,,,,,748,SWZ,2022/03/25,0,506539,0
Eswatini,3/26/22,69663,1393,,,5,,6004.582110805024,,,,,748,SWZ,2022/03/26,0,506539,0
Eswatini,3/27/22,69664,1393,,,1,,6004.668305515427,,,,,748,SWZ,2022/03/27,0,509424,0
Eswatini,3/28/22,69672,1394,,,8,,6005.357863198651,,,,,748,SWZ,2022/03/28,1,509424,0
Eswatini,3/29/22,69695,1394,,,23,,6007.340341537921,,,,,748,SWZ,2022/03/29,0,509424,0
Eswatini,3/30/22,69723,1394,,,28,,6009.753793429205,,,,,748,SWZ,2022/03/30,0,509424,0
Eswatini,3/31/22,69771,1394,,,48,,6013.8911395285495,,,,,748,SWZ,2022/03/31,0,509424,0
Eswatini,4/1/22,69832,1394,,,61,,6019.1490168631335,,,,,748,SWZ,2022/04/01,0,,
Ethiopia,3/5/22,468930,7476,,,35,,407.89438512889774,,,,,231,ETH,2022/03/05,0,24450750,0
Ethiopia,3/6/22,468966,7476,,,36,,407.92569939299824,,,,,231,ETH,2022/03/06,0,26178996,0
Ethiopia,3/7/22,469007,7476,,,41,,407.961362860446,,,,,231,ETH,2022/03/07,0,26178996,0
Ethiopia,3/8/22,469047,7477,,,40,,407.9961564872243,,,,,231,ETH,2022/03/08,1,26178996,0
Ethiopia,3/9/22,469095,7482,,,48,,408.0379088393583,,,,,231,ETH,2022/03/09,5,27259495,0
Ethiopia,3/10/22,469134,7484,,,39,,408.07183262546715,,,,,231,ETH,2022/03/10,2,27259495,0
Ethiopia,3/11/22,469153,7484,,,19,,408.08835959818686,,,,,231,ETH,2022/03/11,0,27259495,0
Ethiopia,3/12/22,469170,7485,,,17,,408.10314688956765,,,,,231,ETH,2022/03/12,1,27259495,0
Ethiopia,3/13/22,469184,7486,,,14,,408.11532465894004,,,,,231,ETH,2022/03/13,1,28705008,0
Ethiopia,3/14/22,469222,7486,,,38,,408.14837860437945,,,,,231,ETH,2022/03/14,0,28705008,0
Ethiopia,3/15/22,469291,7486,,,69,,408.20839761057204,,,,,231,ETH,2022/03/15,0,28705008,0
Ethiopia,3/16/22,469329,7488,,,38,,408.24145155601144,,,,,231,ETH,2022/03/16,2,28705008,0
Ethiopia,3/17/22,469393,7488,,,64,,408.29712135885677,,,,,231,ETH,2022/03/17,0,28705008,0
Ethiopia,3/18/22,469419,7488,,,26,,408.31973721626264,,,,,231,ETH,2022/03/18,0,29168929,0
Ethiopia,3/19/22,469441,7489,,,22,,408.3388737109907,,,,,231,ETH,2022/03/19,1,29168929,0
Ethiopia,3/20/22,469455,7489,,,14,,408.35105148036314,,,,,231,ETH,2022/03/20,0,29168929,0
Ethiopia,3/21/22,469469,7489,,,14,,408.3632292497355,,,,,231,ETH,2022/03/21,0,29168929,0
Ethiopia,3/22/22,469494,7489,,,25,,408.384975266472,,,,,231,ETH,2022/03/22,0,29168929,0
Ethiopia,3/23/22,469523,7491,,,29,,408.4102006458863,,,,,231,ETH,2022/03/23,2,29168929,0
Ethiopia,3/24/22,469544,7491,,,21,,408.4284672999449,,,,,231,ETH,2022/03/24,0,29168929,0
Ethiopia,3/25/22,469604,7491,,,60,,408.48065774011235,,,,,231,ETH,2022/03/25,0,29168929,0
Ethiopia,3/26/22,469611,7492,,,7,,408.48674662479857,,,,,231,ETH,2022/03/26,1,29168929,0
Ethiopia,3/27/22,469621,7492,,,10,,408.49544503149315,,,,,231,ETH,2022/03/27,0,29373478,0
Ethiopia,3/28/22,469656,7492,,,35,,408.5258894549242,,,,,231,ETH,2022/03/28,0,29373478,0
Ethiopia,3/29/22,469679,7492,,,23,,408.5458957903217,,,,,231,ETH,2022/03/29,0,29373478,0
Ethiopia,3/30/22,469704,7492,,,25,,408.5676418070582,,,,,231,ETH,2022/03/30,0,29373478,0
Ethiopia,3/31/22,469758,7497,,,54,,408.6146132032089,,,,,231,ETH,2022/03/31,5,29373478,0
Ethiopia,4/1/22,469784,7500,,,26,,408.6372290606148,,,,,231,ETH,2022/04/01,3,,
Fiji,3/5/22,64019,834,,,0,,7141.438840574537,,,,,242,FJI,2022/03/05,0,1287727,0
Fiji,3/7/22,64034,834,,,15,,7143.112118548398,,,,,242,FJI,2022/03/07,0,1287727,0
Fiji,3/9/22,64060,834,,,26,,7146.012467036424,,,,,242,FJI,2022/03/09,0,1287727,0
Fiji,3/11/22,64067,834,,,7,,7146.793330090893,,,,,242,FJI,2022/03/11,0,1287727,0
Fiji,3/14/22,64081,834,,,14,,7148.35505619983,,,,,242,FJI,2022/03/14,0,1287727,0
Fiji,3/16/22,64154,834,,,73,,7156.498342339287,,,,,242,FJI,2022/03/16,0,1287727,0
Fiji,3/18/22,64221,834,,,67,,7163.972317289201,,,,,242,FJI,2022/03/18,0,1287727,0
Fiji,3/21/22,64327,834,,,106,,7175.796814971152,,,,,242,FJI,2022/03/21,0,1287727,0
Fiji,3/23/22,64335,834,,,8,,7176.689229890545,,,,,242,FJI,2022/03/23,0,1287727,0
Fiji,3/25/22,64376,834,,,41,,7181.262856352432,,,,,242,FJI,2022/03/25,0,1287727,0
Fiji,3/28/22,64394,834,,,18,,7183.270789921066,,,,,242,FJI,2022/03/28,0,1287727,0
Fiji,3/30/22,64404,834,,,10,,7184.386308570307,,,,,242,FJI,2022/03/30,0,1287727,0
Fiji,4/1/22,64417,834,,,13,,7185.836482814319,,,,,242,FJI,2022/04/01,0,,
Finland,3/5/22,671773,2387,,,0,,12124.295082334094,,,,,246,FIN,2022/03/05,0,11461524,0
Finland,3/7/22,694142,2571,,,22369,,12528.015322201923,,,,,246,FIN,2022/03/07,184,11481480,1737
Finland,3/9/22,703052,2573,,,8910,,12688.824805738173,,,,,246,FIN,2022/03/09,2,11488408,5922
Finland,3/10/22,713103,2573,,,10051,,12870.22728823232,,,,,246,FIN,2022/03/10,0,11488408,0
Finland,3/11/22,734262,2653,,,21159,,13252.109203175472,,,,,246,FIN,2022/03/11,80,11488408,0
Finland,3/14/22,761110,2717,,,26848,,13736.667341669438,,,,,246,FIN,2022/03/14,64,11488408,0
Finland,3/15/22,767220,2719,,,6110,,13846.941858437842,,,,,246,FIN,2022/03/15,2,11488408,0
Finland,3/16/22,778617,2763,,,11397,,14052.637221385387,,,,,246,FIN,2022/03/16,44,11615848,127440
Finland,3/17/22,782912,2783,,,4295,,14130.154250766778,,,,,246,FIN,2022/03/17,20,11615848,0
Finland,3/18/22,786312,2783,,,3400,,14191.518138984875,,,,,246,FIN,2022/03/18,0,11615848,0
Finland,3/21/22,812017,2881,,,25705,,14655.447182116108,,,,,246,FIN,2022/03/21,98,11615848,0
Finland,3/22/22,812224,2881,,,207,,14659.183160016446,,,,,246,FIN,2022/03/22,0,11615848,0
Finland,3/23/22,821536,2948,,,9312,,14827.248020924364,,,,,246,FIN,2022/03/23,67,11615848,0
Finland,3/24/22,834038,2951,,,12502,,15052.886647542791,,,,,246,FIN,2022/03/24,3,11658258,42410
Finland,3/25/22,844713,2985,,,10675,,15245.5512083452,,,,,246,FIN,2022/03/25,34,11658258,0
Finland,3/28/22,859477,3054,,,14764,,15512.01486883108,,,,,246,FIN,2022/03/28,69,11672091,0
Finland,3/29/22,864815,3055,,,5338,,15608.356173333492,,,,,246,FIN,2022/03/29,1,11679339,7248
Finland,3/30/22,874135,3105,,,9320,,15776.565419860748,,,,,246,FIN,2022/03/30,50,11679339,0
Finland,3/31/22,883676,3144,,,9541,,15948.76331912218,,,,,246,FIN,2022/03/31,39,11679339,0
Finland,4/1/22,889626,3178,,,5950,,16056.150123503849,,,,,246,FIN,2022/04/01,34,,
France,3/5/22,23191580,140264,,,53678,,35529.84861608182,,,,,250,FRA,2022/03/05,120,153013512,0
France,3/6/22,23236908,140296,,,45328,,35599.291792358286,,,,,250,FRA,2022/03/06,32,153013512,0
France,3/7/22,23253235,140473,,,16327,,35624.30500139168,,,,,250,FRA,2022/03/07,177,153013512,0
France,3/8/22,23346927,140642,,,93692,,35767.84255150849,,,,,250,FRA,2022/03/08,169,153013512,0
France,3/9/22,23417253,140797,,,70326,,35875.58303895154,,,,,250,FRA,2022/03/09,155,153013512,0
France,3/10/22,23492815,140904,,,75562,,35991.345156975774,,,,,250,FRA,2022/03/10,107,153013512,0
France,3/11/22,23565274,141054,,,72459,,36102.3534324306,,,,,250,FRA,2022/03/11,150,153013512,0
France,3/12/22,23635798,141104,,,70524,,36210.39725884521,,,,,250,FRA,2022/03/12,50,153013512,0
France,3/13/22,23694834,141132,,,59036,,36300.84129684948,,,,,250,FRA,2022/03/13,28,153013512,0
France,3/14/22,23717460,141321,,,22626,,36335.504668417416,,,,,250,FRA,2022/03/14,189,153013512,0
France,3/15/22,23834842,141467,,,117382,,36515.33565407052,,,,,250,FRA,2022/03/15,146,153013512,0
France,3/16/22,23943801,141640,,,108959,,36682.26247731239,,,,,250,FRA,2022/03/16,173,153013512,0
France,3/17/22,24046195,141757,,,102394,,36839.13162202763,,,,,250,FRA,2022/03/17,117,153822238,808726
France,3/18/22,24143852,141869,,,97657,,36988.74361165062,,,,,250,FRA,2022/03/18,112,153822238,0
France,3/19/22,24241956,141931,,,98104,,37139.040411982125,,,,,250,FRA,2022/03/19,62,153822238,0
France,3/20/22,24323239,141961,,,81283,,37263.56718786634,,,,,250,FRA,2022/03/20,30,153822238,0
France,3/21/22,24347772,142114,,,24533,,37301.152112054275,,,,,250,FRA,2022/03/21,153,153822238,0
France,3/22/22,24528957,142248,,,181185,,37578.730251254136,,,,,250,FRA,2022/03/22,134,153822238,0
France,3/23/22,24683075,142362,,,154118,,37814.84134023614,,,,,250,FRA,2022/03/23,114,153822238,0
France,3/24/22,24823603,142476,,,140528,,38030.13234526128,,,,,250,FRA,2022/03/24,114,153822238,0
France,3/25/22,24967222,142597,,,143619,,38250.15880867572,,,,,250,FRA,2022/03/25,121,153822238,0
France,3/26/22,25106739,142664,,,139517,,38463.900946527894,,,,,250,FRA,2022/03/26,67,153822238,0
France,3/27/22,25216913,142705,,,110174,,38632.68916800432,,,,,250,FRA,2022/03/27,41,154105693,283455
France,3/28/22,25246720,142855,,,29807,,38678.353939343724,,,,,250,FRA,2022/03/28,150,154105693,0
France,3/29/22,25464389,143019,,,217669,,39011.82611409051,,,,,250,FRA,2022/03/29,164,154105693,0
France,3/30/22,25633476,143168,,,169087,,39270.869935725226,,,,,250,FRA,2022/03/30,149,154105693,0
France,3/31/22,25803173,143307,,,169697,,39530.84828651475,,,,,250,FRA,2022/03/31,139,154105693,0
France,4/1/22,25952226,143441,,,149053,,39759.19971948193,,,,,250,FRA,2022/04/01,134,,
Gabon,3/5/22,47559,303,,,16,,2136.7840095465394,,,,,266,GAB,2022/03/05,0,545642,0
Gabon,3/8/22,47562,303,,,3,,2136.9187969060013,,,,,266,GAB,2022/03/08,0,545642,0
Gabon,3/9/22,47564,303,,,2,,2137.008655145642,,,,,266,GAB,2022/03/09,0,545642,0
Gabon,3/14/22,47570,303,,,6,,2137.2782298645657,,,,,266,GAB,2022/03/14,0,545642,0
Gabon,3/21/22,47581,303,,,11,,2137.772450182592,,,,,266,GAB,2022/03/21,0,545642,0
Gabon,3/24/22,47584,303,,,3,,2137.9072375420537,,,,,266,GAB,2022/03/24,0,545642,0
Gabon,4/1/22,47586,303,,,2,,2137.997095781695,,,,,266,GAB,2022/04/01,0,,
Gambia,3/5/22,11948,365,,,0,,494.40054554542957,,,,,270,GMB,2022/03/05,0,362079,0
Gambia,3/8/22,11963,365,,,15,,495.02123588550165,,,,,270,GMB,2022/03/08,0,362079,0
Gambia,3/14/22,11973,365,,,10,,495.43502944554973,,,,,270,GMB,2022/03/14,0,362079,0
Gambia,3/18/22,11978,365,,,5,,495.64192622557374,,,,,270,GMB,2022/03/18,0,363353,1274
Gambia,3/25/22,11986,365,,,8,,495.9729610736122,,,,,270,GMB,2022/03/25,0,363353,0
Gambia,3/29/22,11988,365,,,2,,496.0557197856218,,,,,270,GMB,2022/03/29,0,363353,0
Gambia,4/1/22,11988,365,,,0,,496.0557197856218,,,,,270,GMB,2022/04/01,0,,
Georgia,3/5/22,1623672,16338,,,3033,,40701.94965124368,,,,,268,GEO,2022/03/05,32,2825833,0
Georgia,3/6/22,1625372,16366,,,1700,,40744.56497897435,,,,,268,GEO,2022/03/06,28,2826144,0
Georgia,3/7/22,1626282,16398,,,910,,40767.37671323018,,,,,268,GEO,2022/03/07,32,2826144,0
Georgia,3/8/22,1629065,16430,,,2783,,40837.14051150927,,,,,268,GEO,2022/03/08,32,2827683,0
Georgia,3/9/22,1629930,16456,,,865,,40858.82419297223,,,,,268,GEO,2022/03/09,26,2829114,0
Georgia,3/10/22,1631900,16485,,,1970,,40908.207837460126,,,,,268,GEO,2022/03/10,29,2830741,0
Georgia,3/11/22,1633443,16505,,,1543,,40946.88751433567,,,,,268,GEO,2022/03/11,20,2832291,0
Georgia,3/12/22,1634686,16530,,,1243,,40978.04683925874,,,,,268,GEO,2022/03/12,25,2832994,0
Georgia,3/13/22,1635509,16554,,,823,,40998.67767144836,,,,,268,GEO,2022/03/13,24,2832994,0
Georgia,3/14/22,1635975,16569,,,466,,41010.35928481453,,,,,268,GEO,2022/03/14,15,2833144,0
Georgia,3/15/22,1637691,16585,,,1716,,41053.375697982665,,,,,268,GEO,2022/03/15,16,2834936,0
Georgia,3/16/22,1638790,16595,,,1099,,41080.925253968555,,,,,268,GEO,2022/03/16,10,2836778,0
Georgia,3/17/22,1639678,16612,,,888,,41103.185495747864,,,,,268,GEO,2022/03/17,17,2839891,0
Georgia,3/18/22,1640550,16630,,,872,,41125.04465208972,,,,,268,GEO,2022/03/18,18,2841572,0
Georgia,3/19/22,1641399,16643,,,849,,41146.32724811521,,,,,268,GEO,2022/03/19,13,2841572,0
Georgia,3/20/22,1641874,16663,,,475,,41158.234472039956,,,,,268,GEO,2022/03/20,20,2842355,0
Georgia,3/21/22,1642242,16671,,,368,,41167.45943710166,,,,,268,GEO,2022/03/21,8,2842541,0
Georgia,3/22/22,1643295,16678,,,1053,,41193.85587245483,,,,,268,GEO,2022/03/22,7,2844372,0
Georgia,3/23/22,1644112,16681,,,817,,41214.3362976054,,,,,268,GEO,2022/03/23,3,2846431,0
Georgia,3/24/22,1644711,16688,,,599,,41229.35193367049,,,,,268,GEO,2022/03/24,7,2848368,0
Georgia,3/25/22,1645301,16698,,,590,,41244.141959177025,,,,,268,GEO,2022/03/25,10,2850298,0
Georgia,3/26/22,1645959,16704,,,658,,41260.63659779278,,,,,268,GEO,2022/03/26,6,2851946,0
Georgia,3/27/22,1646316,16708,,,357,,41269.585816616214,,,,,268,GEO,2022/03/27,4,2853040,0
Georgia,3/28/22,1646545,16720,,,229,,41275.32635193994,,,,,268,GEO,2022/03/28,12,2853264,0
Georgia,3/29/22,1647243,16730,,,698,,41292.823704149356,,,,,268,GEO,2022/03/29,10,2857215,0
Georgia,3/30/22,1647796,16739,,,553,,41306.686219581745,,,,,268,GEO,2022/03/30,9,2857215,0
Georgia,3/31/22,1648264,16745,,,468,,41318.4179686276,,,,,268,GEO,2022/03/31,6,2857215,0
Georgia,4/1/22,1648653,16748,,,389,,41328.16935832597,,,,,268,GEO,2022/04/01,3,,
Germany,3/5/22,15674100,124051,,,192210,,18707.760776840958,,,,,276,DEU,2022/03/05,255,170426609,0
Germany,3/6/22,15790989,124102,,,116889,,18847.273185811435,,,,,276,DEU,2022/03/06,51,170487423,60814
Germany,3/7/22,15869417,124126,,,78428,,18940.880618595842,,,,,276,DEU,2022/03/07,24,170563324,75901
Germany,3/8/22,16026216,124450,,,156799,,19128.0274520375,,,,,276,DEU,2022/03/08,324,170667578,104254
Germany,3/9/22,16242070,124764,,,215854,,19385.659149852636,,,,,276,DEU,2022/03/09,314,170769631,102053
Germany,3/10/22,16504822,125023,,,262752,,19699.26577221925,,,,,276,DEU,2022/03/10,259,170878454,108823
Germany,3/11/22,16757658,125272,,,252836,,20001.03719155263,,,,,276,DEU,2022/03/11,249,170977292,98838
Germany,3/12/22,16994744,125521,,,237086,,20284.0102599609,,,,,276,DEU,2022/03/12,249,170977292,0
Germany,3/13/22,17141351,125571,,,146607,,20458.99247164836,,,,,276,DEU,2022/03/13,50,171023885,46593
Germany,3/14/22,17233729,125590,,,92378,,20569.249872395005,,,,,276,DEU,2022/03/14,19,171082913,59028
Germany,3/15/22,17432617,125873,,,198888,,20806.631867239004,,,,,276,DEU,2022/03/15,283,171173137,90224
Germany,3/16/22,17695210,126142,,,262593,,21120.04871577723,,,,,276,DEU,2022/03/16,269,171266006,92869
Germany,3/17/22,17990141,126420,,,294931,,21472.062457789496,,,,,276,DEU,2022/03/17,278,171361767,95761
Germany,3/18/22,18287986,126646,,,297845,,21827.55419310943,,,,,276,DEU,2022/03/18,226,171431970,70203
Germany,3/19/22,18548225,126867,,,260239,,22138.16143415066,,,,,276,DEU,2022/03/19,221,171431970,0
Germany,3/20/22,18680017,126916,,,131792,,22295.461260507607,,,,,276,DEU,2022/03/20,49,171472356,40386
Germany,3/21/22,18772331,126929,,,92314,,22405.642274304464,,,,,276,DEU,2022/03/21,13,171525773,53417
Germany,3/22/22,18994411,127193,,,222080,,22670.704990078946,,,,,276,DEU,2022/03/22,264,171600903,75130
Germany,3/23/22,19278143,127522,,,283732,,23009.352209423894,,,,,276,DEU,2022/03/23,329,171600903,0
Germany,3/24/22,19596530,127822,,,318387,,23389.36176853453,,,,,276,DEU,2022/03/24,300,171737552,136649
Germany,3/25/22,19893028,128110,,,296498,,23743.245797270585,,,,,276,DEU,2022/03/25,288,171794481,56929
Germany,3/26/22,20145054,128388,,,252026,,24044.050444270677,,,,,276,DEU,2022/03/26,278,171794481,0
Germany,3/27/22,20256278,128437,,,111224,,24176.80141463857,,,,,276,DEU,2022/03/27,49,171828850,34369
Germany,3/28/22,20323779,128457,,,67501,,24257.366969292267,,,,,276,DEU,2022/03/28,20,171876955,48105
Germany,3/29/22,20561131,128764,,,237352,,24540.65752096061,,,,,276,DEU,2022/03/29,307,171940027,63072
Germany,3/30/22,20829608,129112,,,268477,,24861.097194695238,,,,,276,DEU,2022/03/30,348,171940027,0
Germany,3/31/22,21394747,129708,,,565139,,25535.616638724758,,,,,276,DEU,2022/03/31,596,171940027,0
Germany,4/1/22,21394691,129695,,,,,25535.54980014369,,,,,276,DEU,2022/04/01,,,
Ghana,3/5/22,160028,1442,,,0,,515.0075089438739,,,,,288,GHA,2022/03/05,0,12043575,0
Ghana,3/8/22,160640,1442,,,612,,516.9770679927506,,,,,288,GHA,2022/03/08,0,12043575,0
Ghana,3/9/22,160667,1444,,,27,,517.0639603037305,,,,,288,GHA,2022/03/09,2,12043575,0
Ghana,3/10/22,160681,1445,,,14,,517.1090155760904,,,,,288,GHA,2022/03/10,1,12043575,0
Ghana,3/11/22,160693,1445,,,12,,517.1476343809703,,,,,288,GHA,2022/03/11,0,12043575,0
Ghana,3/13/22,160716,1445,,,23,,517.2216537569902,,,,,288,GHA,2022/03/13,0,12043575,0
Ghana,3/15/22,160761,1445,,,45,,517.36647427529,,,,,288,GHA,2022/03/15,0,12043575,0
Ghana,3/17/22,160775,1445,,,14,,517.4115295476499,,,,,288,GHA,2022/03/17,0,12043575,0
Ghana,3/18/22,160791,1445,,,16,,517.4630212874898,,,,,288,GHA,2022/03/18,0,12043575,0
Ghana,3/20/22,160819,1445,,,28,,517.5531318322097,,,,,288,GHA,2022/03/20,0,12043575,0
Ghana,3/21/22,160863,1445,,,44,,517.6947341167694,,,,,288,GHA,2022/03/21,0,12043575,0
Ghana,3/22/22,160870,1445,,,7,,517.7172617529494,,,,,288,GHA,2022/03/22,0,12043575,0
Ghana,3/24/22,160894,1445,,,24,,517.7944993627093,,,,,288,GHA,2022/03/24,0,12043575,0
Ghana,3/26/22,160925,1445,,,31,,517.8942646086491,,,,,288,GHA,2022/03/26,0,12043575,0
Ghana,3/31/22,160971,1445,,,46,,518.0423033606888,,,,,288,GHA,2022/03/31,0,12043575,0
Ghana,4/1/22,160971,1445,,,0,,518.0423033606888,,,,,288,GHA,2022/04/01,0,,
Greece,3/5/22,2499259,26143,,,12997,,23978.178760624523,,,,,300,GRC,2022/03/05,51,20229483,17716
Greece,3/6/22,2508472,26194,,,9213,,24066.569343962077,,,,,300,GRC,2022/03/06,51,20233125,3642
Greece,3/7/22,2517111,26246,,,8639,,24149.452905174836,,,,,300,GRC,2022/03/07,52,20233243,118
Greece,3/8/22,2538168,26303,,,21057,,24351.47618894113,,,,,300,GRC,2022/03/08,57,20245734,12491
Greece,3/9/22,2561503,26366,,,23335,,24575.354867133017,,,,,300,GRC,2022/03/09,63,20263362,17628
Greece,3/10/22,2583366,26424,,,21863,,24785.11100775051,,,,,300,GRC,2022/03/10,58,20280234,16872
Greece,3/11/22,2604626,26473,,,21260,,24989.081896902404,,,,,300,GRC,2022/03/11,49,20293254,13020
Greece,3/12/22,2623628,26513,,,19002,,25171.389273932713,,,,,300,GRC,2022/03/12,40,20311201,17947
Greece,3/13/22,2635614,26562,,,11986,,25286.384338719854,,,,,300,GRC,2022/03/13,49,20314595,3394
Greece,3/14/22,2658296,26635,,,22682,,25503.998059686142,,,,,300,GRC,2022/03/14,73,20324765,10170
Greece,3/15/22,2684916,26686,,,26620,,25759.39340631001,,,,,300,GRC,2022/03/15,51,20339677,14912
Greece,3/16/22,2708610,26730,,,23694,,25986.716371858696,,,,,300,GRC,2022/03/16,44,20352306,12629
Greece,3/17/22,2732866,26792,,,24256,,26219.431230149774,,,,,300,GRC,2022/03/17,62,20366298,13992
Greece,3/18/22,2756487,26847,,,23621,,26446.05382528886,,,,,300,GRC,2022/03/18,55,20379512,13214
Greece,3/19/22,2776192,26893,,,19705,,26635.105865304762,,,,,300,GRC,2022/03/19,46,20396984,17472
Greece,3/20/22,2788654,26937,,,12462,,26754.667728927103,,,,,300,GRC,2022/03/20,44,20400742,3758
Greece,3/21/22,2812182,26995,,,23528,,26980.398071352585,,,,,300,GRC,2022/03/21,58,20411638,10896
Greece,3/22/22,2838891,27029,,,26709,,27236.647294229253,,,,,300,GRC,2022/03/22,34,20426618,14980
Greece,3/23/22,2861993,27083,,,23102,,27458.29054357954,,,,,300,GRC,2022/03/23,54,20426618,0
Greece,3/24/22,2884100,27125,,,22107,,27670.387648305834,,,,,300,GRC,2022/03/24,42,20453871,27253
Greece,3/25/22,2900334,27160,,,16234,,27826.138514462553,,,,,300,GRC,2022/03/25,35,20457789,3918
Greece,3/26/22,2916892,27216,,,16558,,27984.99787394407,,,,,300,GRC,2022/03/26,56,20469746,11957
Greece,3/27/22,2930321,27268,,,13429,,28113.837246964806,,,,,300,GRC,2022/03/27,52,20473051,3305
Greece,3/28/22,2957810,27341,,,27489,,28377.569879697472,,,,,300,GRC,2022/03/28,73,20488988,15937
Greece,3/29/22,2986882,27392,,,29072,,28656.489996791726,,,,,300,GRC,2022/03/29,51,20503242,14254
Greece,3/30/22,3009333,27454,,,22451,,28871.887477146818,,,,,300,GRC,2022/03/30,62,20518119,14877
Greece,3/31/22,3030429,27510,,,21096,,29074.284931405913,,,,,300,GRC,2022/03/31,56,20518119,0
Greece,4/1/22,3051531,27571,,,21102,,29276.739950356212,,,,,300,GRC,2022/04/01,61,,
Grenada,3/5/22,13690,216,,,0,,12166.834045805597,,,,,308,GRD,2022/03/05,0,85113,0
Grenada,3/16/22,13921,217,,,231,,12372.132706476239,,,,,308,GRD,2022/03/16,1,85113,0
Grenada,3/18/22,13936,217,,,15,,12385.46378833797,,,,,308,GRD,2022/03/18,0,85113,0
Grenada,3/22/22,13954,218,,,18,,12401.461086572046,,,,,308,GRD,2022/03/22,1,85113,0
Grenada,3/24/22,13967,218,,,13,,12413.014690852211,,,,,308,GRD,2022/03/24,0,85113,0
Grenada,3/26/22,13982,218,,,15,,12426.345772713941,,,,,308,GRD,2022/03/26,0,85113,0
Grenada,3/30/22,13998,218,,,16,,12440.565593366453,,,,,308,GRD,2022/03/30,0,85113,0
Grenada,3/31/22,14012,218,,,14,,12453.007936437401,,,,,308,GRD,2022/03/31,0,85113,0
Grenada,4/1/22,14012,218,,,0,,12453.007936437401,,,,,308,GRD,2022/04/01,0,,
Guatemala,3/5/22,791944,17073,,,2590,,4420.423869364558,,,,,320,GTM,2022/03/05,28,14944937,0
Guatemala,3/6/22,792503,17077,,,559,,4423.5440608717545,,,,,320,GTM,2022/03/06,4,15002348,57411
Guatemala,3/7/22,792961,17083,,,458,,4426.100496847239,,,,,320,GTM,2022/03/07,6,15014107,11759
Guatemala,3/8/22,795808,17106,,,2847,,4441.991704755981,,,,,320,GTM,2022/03/08,23,15057672,43565
Guatemala,3/9/22,798400,17116,,,2592,,4456.4595694906,,,,,320,GTM,2022/03/09,10,15057672,0
Guatemala,3/10/22,800403,17127,,,2003,,4467.63979057989,,,,,320,GTM,2022/03/10,11,15141507,83835
Guatemala,3/11/22,802744,17139,,,2341,,4480.706639092137,,,,,320,GTM,2022/03/11,12,15141507,0
Guatemala,3/12/22,804709,17144,,,1965,,4491.674754139794,,,,,320,GTM,2022/03/12,5,15190808,49301
Guatemala,3/13/22,805030,17153,,,321,,4493.4664920178075,,,,,320,GTM,2022/03/13,9,15209784,18976
Guatemala,3/14/22,805393,17159,,,363,,4495.492662889207,,,,,320,GTM,2022/03/14,6,15225125,15341
Guatemala,3/15/22,807453,17170,,,2060,,4506.991043040949,,,,,320,GTM,2022/03/15,11,15268039,42914
Guatemala,3/16/22,809586,17178,,,2133,,4518.896890062146,,,,,320,GTM,2022/03/16,8,15324518,56479
Guatemala,3/17/22,812125,17191,,,2539,,4533.068922686064,,,,,320,GTM,2022/03/17,13,15383061,58543
Guatemala,3/18/22,814111,17206,,,1986,,4544.154254230413,,,,,320,GTM,2022/03/18,15,15485491,102430
Guatemala,3/19/22,815776,17231,,,1665,,4553.4478478967485,,,,,320,GTM,2022/03/19,25,15561860,76369
Guatemala,3/20/22,816136,17238,,,360,,4555.457273554334,,,,,320,GTM,2022/03/20,7,15594708,32848
Guatemala,3/21/22,816653,17241,,,517,,4558.343032068145,,,,,320,GTM,2022/03/21,3,15620338,25630
Guatemala,3/22/22,818454,17253,,,1801,,4568.395742094012,,,,,320,GTM,2022/03/22,12,15691165,70827
Guatemala,3/23/22,820477,17258,,,2023,,4579.687597942057,,,,,320,GTM,2022/03/23,5,15691165,0
Guatemala,3/24/22,821834,17267,,,1357,,4587.26201632357,,,,,320,GTM,2022/03/24,9,15845925,154760
Guatemala,3/25/22,823145,17274,,,1311,,4594.579674759945,,,,,320,GTM,2022/03/25,7,15923269,77344
Guatemala,3/26/22,824159,17278,,,1014,,4600.239557028812,,,,,320,GTM,2022/03/26,4,15996387,73118
Guatemala,3/27/22,824502,17285,,,343,,4602.1540931414565,,,,,320,GTM,2022/03/27,7,15996387,0
Guatemala,3/28/22,824644,17289,,,142,,4602.946699928615,,,,,320,GTM,2022/03/28,4,16049794,53407
Guatemala,3/29/22,826061,17295,,,1417,,4610.856022586391,,,,,320,GTM,2022/03/29,6,16120084,70290
Guatemala,3/30/22,827596,17300,,,1535,,4619.42399032082,,,,,320,GTM,2022/03/30,5,16188982,68898
Guatemala,3/31/22,828874,17312,,,1278,,4626.55745140525,,,,,320,GTM,2022/03/31,12,16188982,0
Guatemala,4/1/22,829881,17318,,,1007,,4632.178261508553,,,,,320,GTM,2022/04/01,6,,
Guinea,3/5/22,36397,440,,,0,,277.1459412438726,,,,,324,GIN,2022/03/05,0,4964952,0
Guinea,3/7/22,36427,440,,,30,,277.3743770555416,,,,,324,GIN,2022/03/07,0,5159979,0
Guinea,3/14/22,36435,440,,,8,,277.43529327198667,,,,,324,GIN,2022/03/14,0,5835471,0
Guinea,3/21/22,36459,440,,,24,,277.61804192132183,,,,,324,GIN,2022/03/21,0,5894935,0
Guinea,4/1/22,36459,440,,,0,,277.61804192132183,,,,,324,GIN,2022/04/01,0,,
Guinea-Bissau,3/5/22,8027,167,,,0,,407.8764307687305,,,,,624,GNB,2022/03/05,0,556675,0
Guinea-Bissau,3/6/22,8033,167,,,6,,408.18130912734665,,,,,624,GNB,2022/03/06,0,558351,0
Guinea-Bissau,3/8/22,8038,168,,,5,,408.4353744261935,,,,,624,GNB,2022/03/08,1,558351,0
Guinea-Bissau,3/9/22,8039,168,,,1,,408.4861874859629,,,,,624,GNB,2022/03/09,0,558351,0
Guinea-Bissau,3/10/22,8050,168,,,11,,409.045131143426,,,,,624,GNB,2022/03/10,0,558351,0
Guinea-Bissau,3/13/22,8068,168,,,18,,409.9597662192746,,,,,624,GNB,2022/03/13,0,562296,0
Guinea-Bissau,3/15/22,8071,169,,,3,,410.1122053985827,,,,,624,GNB,2022/03/15,1,562296,0
Guinea-Bissau,3/17/22,8096,169,,,25,,411.382531892817,,,,,624,GNB,2022/03/17,0,562296,0
Guinea-Bissau,3/19/22,8113,169,,,17,,412.24635390889625,,,,,624,GNB,2022/03/19,0,562296,0
Guinea-Bissau,3/22/22,8124,169,,,11,,412.80529756635934,,,,,624,GNB,2022/03/22,0,562296,0
Guinea-Bissau,3/24/22,8125,169,,,1,,412.85611062612867,,,,,624,GNB,2022/03/24,0,562296,0
Guinea-Bissau,3/25/22,8126,169,,,1,,412.90692368589805,,,,,624,GNB,2022/03/25,0,562296,0
Guinea-Bissau,3/26/22,8131,169,,,5,,413.1609889847449,,,,,624,GNB,2022/03/26,0,562296,0
Guinea-Bissau,3/28/22,8140,170,,,9,,413.61830652266923,,,,,624,GNB,2022/03/28,1,562620,0
Guinea-Bissau,3/30/22,8149,170,,,9,,414.07562406059355,,,,,624,GNB,2022/03/30,0,562620,0
Guinea-Bissau,4/1/22,8149,170,,,0,,414.07562406059355,,,,,624,GNB,2022/04/01,0,,
Guyana,3/5/22,63040,1223,,,16,,8014.656243206167,,,,,328,GUY,2022/03/05,0,863110,0
Guyana,3/6/22,63055,1223,,,15,,8016.563283873174,,,,,328,GUY,2022/03/06,0,863110,0
Guyana,3/7/22,63062,1223,,,7,,8017.453236184444,,,,,328,GUY,2022/03/07,0,863110,0
Guyana,3/8/22,63076,1223,,,14,,8019.233140806983,,,,,328,GUY,2022/03/08,0,863110,0
Guyana,3/9/22,63090,1224,,,14,,8021.013045429523,,,,,328,GUY,2022/03/09,1,863110,0
Guyana,3/10/22,63107,1224,,,17,,8023.1743581854635,,,,,328,GUY,2022/03/10,0,863110,0
Guyana,3/12/22,63127,1224,,,20,,8025.717079074806,,,,,328,GUY,2022/03/12,0,863110,0
Guyana,3/13/22,63144,1224,,,17,,8027.878391830746,,,,,328,GUY,2022/03/13,0,863110,0
Guyana,3/14/22,63147,1225,,,3,,8028.2597999641475,,,,,328,GUY,2022/03/14,1,863110,0
Guyana,3/15/22,63157,1225,,,10,,8029.531160408818,,,,,328,GUY,2022/03/15,0,878430,15320
Guyana,3/16/22,63169,1226,,,12,,8031.056792942424,,,,,328,GUY,2022/03/16,1,884246,5816
Guyana,3/17/22,63175,1226,,,6,,8031.819609209227,,,,,328,GUY,2022/03/17,0,884246,0
Guyana,3/19/22,63183,1226,,,8,,8032.836697564963,,,,,328,GUY,2022/03/19,0,886069,0
Guyana,3/20/22,63194,1226,,,11,,8034.235194054101,,,,,328,GUY,2022/03/20,0,886069,0
Guyana,3/21/22,63195,1226,,,1,,8034.362330098568,,,,,328,GUY,2022/03/21,0,886069,0
Guyana,3/22/22,63202,1226,,,7,,8035.252282409839,,,,,328,GUY,2022/03/22,0,886069,0
Guyana,3/23/22,63208,1226,,,6,,8036.015098676641,,,,,328,GUY,2022/03/23,0,886069,0
Guyana,3/25/22,63223,1226,,,15,,8037.922139343647,,,,,328,GUY,2022/03/25,0,888928,0
Guyana,3/26/22,63232,1226,,,9,,8039.066363743851,,,,,328,GUY,2022/03/26,0,889522,594
Guyana,3/27/22,63234,1226,,,2,,8039.320635832785,,,,,328,GUY,2022/03/27,0,889522,0
Guyana,3/28/22,63235,1226,,,1,,8039.447771877252,,,,,328,GUY,2022/03/28,0,889522,0
Guyana,3/29/22,63239,1226,,,4,,8039.9563160551215,,,,,328,GUY,2022/03/29,0,889522,0
Guyana,3/30/22,63246,1226,,,7,,8040.846268366391,,,,,328,GUY,2022/03/30,0,889522,0
Guyana,3/31/22,63253,1226,,,7,,8041.736220677661,,,,,328,GUY,2022/03/31,0,889522,0
Guyana,4/1/22,63258,1226,,,5,,8042.371900899996,,,,,328,GUY,2022/04/01,0,,
Haiti,3/5/22,30385,823,,,3,,266.4758786490686,,,,,332,HTI,2022/03/05,3,234119,0
Haiti,3/8/22,30400,825,,,15,,266.60742836701286,,,,,332,HTI,2022/03/08,2,239355,0
Haiti,3/9/22,30430,827,,,30,,266.87052780290134,,,,,332,HTI,2022/03/09,2,239355,0
Haiti,3/10/22,30433,827,,,3,,266.8968377464902,,,,,332,HTI,2022/03/10,0,241800,0
Haiti,3/11/22,30438,827,,,5,,266.9406876524716,,,,,332,HTI,2022/03/11,0,241800,0
Haiti,3/12/22,30446,827,,,8,,267.0108475020419,,,,,332,HTI,2022/03/12,0,241800,0
Haiti,3/13/22,30461,827,,,15,,267.1423972199861,,,,,332,HTI,2022/03/13,0,241800,0
Haiti,3/15/22,30473,827,,,12,,267.2476369943415,,,,,332,HTI,2022/03/15,0,241800,0
Haiti,3/16/22,30478,827,,,5,,267.2914869003229,,,,,332,HTI,2022/03/16,0,241800,0
Haiti,3/21/22,30509,827,,,31,,267.56335631740774,,,,,332,HTI,2022/03/21,0,243969,0
Haiti,3/22/22,30511,827,,,2,,267.5808962798003,,,,,332,HTI,2022/03/22,0,243969,0
Haiti,3/28/22,30529,833,,,18,,267.7387559413334,,,,,332,HTI,2022/03/28,6,249801,0
Haiti,3/30/22,30545,833,,,16,,267.8790756404739,,,,,332,HTI,2022/03/30,0,249801,0
Haiti,3/31/22,30547,833,,,2,,267.89661560286646,,,,,332,HTI,2022/03/31,0,249801,0
Haiti,4/1/22,30547,833,,,0,,267.89661560286646,,,,,332,HTI,2022/04/01,0,,
Holy See,3/5/22,29,0,,,0,,3584.672435105068,,,,,336,VAT,2022/03/05,0,,
Holy See,4/1/22,29,0,,,0,,3584.672435105068,,,,,336,VAT,2022/04/01,0,,
Honduras,3/5/22,413699,10785,,,0,,4176.833651569047,,,,,340,HND,2022/03/05,0,11561083,0
Honduras,3/8/22,414714,10812,,,1015,,4187.081406957246,,,,,340,HND,2022/03/08,27,11561083,0
Honduras,3/12/22,416729,10834,,,2015,,4207.425473072735,,,,,340,HND,2022/03/12,22,11794913,0
Honduras,3/15/22,417201,10842,,,472,,4212.190931736016,,,,,340,HND,2022/03/15,8,11794913,0
Honduras,3/18/22,418300,10857,,,1099,,4223.286777225308,,,,,340,HND,2022/03/18,15,12001264,206351
Honduras,3/22/22,418460,10863,,,160,,4224.902186941674,,,,,340,HND,2022/03/22,6,12001264,0
Honduras,3/23/22,418492,10869,,,32,,4225.225268884948,,,,,340,HND,2022/03/23,6,12001264,0
Honduras,3/24/22,418792,10869,,,300,,4228.254162103134,,,,,340,HND,2022/03/24,0,12001264,0
Honduras,3/25/22,420621,10871,,,1829,,4246.720314423347,,,,,340,HND,2022/03/25,2,12001264,0
Honduras,3/28/22,420621,10971,,,0,,4246.720314423347,,,,,340,HND,2022/03/28,100,11995048,
Honduras,3/29/22,420978,10878,,,357,,4250.3246973529895,,,,,340,HND,2022/03/29,,11995048,0
Honduras,3/30/22,421013,10880,,,35,,4250.678068228445,,,,,340,HND,2022/03/30,2,11995048,0
Honduras,3/31/22,421062,10880,,,49,,4251.172787454082,,,,,340,HND,2022/03/31,0,11995048,0
Honduras,4/1/22,421062,10880,,,0,,4251.172787454082,,,,,340,HND,2022/04/01,0,,
Hungary,3/5/22,1800046,44286,,,0,,18633.341442080255,,,,,348,HUN,2022/03/05,0,16143987,0
Hungary,3/7/22,1805898,44436,,,5852,,18693.918957387672,,,,,348,HUN,2022/03/07,150,16143987,0
Hungary,3/8/22,1807285,44495,,,1387,,18708.276615236507,,,,,348,HUN,2022/03/08,59,16143987,0
Hungary,3/9/22,1809917,44549,,,2632,,18735.522004896302,,,,,348,HUN,2022/03/09,54,16163897,19910
Hungary,3/10/22,1812294,44603,,,2377,,18760.12773864301,,,,,348,HUN,2022/03/10,54,16163897,0
Hungary,3/11/22,1814362,44653,,,2068,,18781.53483051856,,,,,348,HUN,2022/03/11,50,16163897,0
Hungary,3/16/22,1819264,44831,,,4902,,18832.27833360075,,,,,348,HUN,2022/03/16,178,16171785,7888
Hungary,3/17/22,1820767,44895,,,1503,,18847.836776100245,,,,,348,HUN,2022/03/17,64,16171785,0
Hungary,3/18/22,1824089,44961,,,3322,,18882.2247641131,,,,,348,HUN,2022/03/18,66,16171785,0
Hungary,3/21/22,1829928,45095,,,5839,,18942.66770872691,,,,,348,HUN,2022/03/21,134,16171785,0
Hungary,3/22/22,1831423,45143,,,1495,,18958.14333849188,,,,,348,HUN,2022/03/22,48,16171785,0
Hungary,3/23/22,1834268,45185,,,2845,,18987.593617208488,,,,,348,HUN,2022/03/23,42,16429829,258044
Hungary,3/24/22,1836919,45220,,,2651,,19015.035687112784,,,,,348,HUN,2022/03/24,35,16429829,0
Hungary,3/25/22,1839358,45258,,,2439,,19040.283219552086,,,,,348,HUN,2022/03/25,38,16429829,0
Hungary,3/28/22,1844581,45342,,,5223,,19094.349583607218,,,,,348,HUN,2022/03/28,84,16429829,0
Hungary,3/29/22,1846311,45390,,,1730,,19112.257837448953,,,,,348,HUN,2022/03/29,48,16429829,0
Hungary,3/30/22,1849217,45430,,,2906,,19142.33956326634,,,,,348,HUN,2022/03/30,40,16429829,0
Hungary,3/31/22,1851871,45470,,,2654,,19169.81268794609,,,,,348,HUN,2022/03/31,40,16429829,0
Hungary,4/1/22,1854198,45510,,,2327,,19193.900842101993,,,,,348,HUN,2022/04/01,40,,
Iceland,3/5/22,140929,68,,,0,,41297.87545787546,,,,,352,ISL,2022/03/05,0,803609,0
Iceland,3/7/22,147151,71,,,6222,,43121.17216117216,,,,,352,ISL,2022/03/07,3,803609,0
Iceland,3/8/22,150467,73,,,3316,,44092.893772893774,,,,,352,ISL,2022/03/08,2,804106,497
Iceland,3/9/22,153244,76,,,2777,,44906.666666666664,,,,,352,ISL,2022/03/09,3,804106,0
Iceland,3/10/22,155877,77,,,2633,,45678.241758241755,,,,,352,ISL,2022/03/10,1,804106,0
Iceland,3/11/22,158533,79,,,2656,,46456.556776556776,,,,,352,ISL,2022/03/11,2,804106,0
Iceland,3/14/22,162938,81,,,4405,,47747.39926739927,,,,,352,ISL,2022/03/14,2,804106,0
Iceland,3/15/22,165299,83,,,2361,,48439.2673992674,,,,,352,ISL,2022/03/15,2,804593,487
Iceland,3/16/22,167379,87,,,2080,,49048.79120879121,,,,,352,ISL,2022/03/16,4,804593,0
Iceland,3/17/22,169258,91,,,1879,,49599.41391941392,,,,,352,ISL,2022/03/17,4,804593,0
Iceland,3/18/22,170806,91,,,1548,,50053.04029304029,,,,,352,ISL,2022/03/18,0,804593,0
Iceland,3/21/22,173796,91,,,2990,,50929.230769230766,,,,,352,ISL,2022/03/21,0,804593,0
Iceland,3/22/22,175329,93,,,1533,,51378.46153846154,,,,,352,ISL,2022/03/22,2,805039,446
Iceland,3/23/22,176179,93,,,850,,51627.54578754579,,,,,352,ISL,2022/03/23,0,805039,0
Iceland,3/24/22,177015,95,,,836,,51872.52747252747,,,,,352,ISL,2022/03/24,2,805039,0
Iceland,3/25/22,178385,97,,,1370,,52273.992673992674,,,,,352,ISL,2022/03/25,2,805039,0
Iceland,3/28/22,179813,97,,,1428,,52692.45421245421,,,,,352,ISL,2022/03/28,0,805039,0
Iceland,3/30/22,180950,98,,,1137,,53025.64102564102,,,,,352,ISL,2022/03/30,1,805469,0
Iceland,3/31/22,181391,101,,,441,,53154.8717948718,,,,,352,ISL,2022/03/31,3,805469,0
Iceland,4/1/22,181830,101,,,439,,53283.51648351648,,,,,352,ISL,2022/04/01,0,,
India,3/5/22,42962953,515036,,,5476,,3113.2475713111594,,,,,356,IND,2022/03/05,158,1787975439,1126091
India,3/6/22,42967315,515102,,,4362,,3113.5636572633066,,,,,356,IND,2022/03/06,66,1789850493,1875054
India,3/7/22,42971308,515210,,,3993,,3113.8530041699833,,,,,356,IND,2022/03/07,108,1792026230,2175737
India,3/8/22,42975883,515355,,,4575,,3114.1845248556947,,,,,356,IND,2022/03/08,145,1793996046,1969816
India,3/9/22,42980067,515459,,,4184,,3114.4877122981025,,,,,356,IND,2022/03/09,104,1795876578,1880532
India,3/10/22,42984261,515714,,,4194,,3114.791624375889,,,,,356,IND,2022/03/10,255,1797805442,1928864
India,3/11/22,42987875,515803,,,3614,,3115.053507601717,,,,,356,IND,2022/03/11,89,1799905208,2099766
India,3/12/22,42990991,515850,,,3116,,3115.2793039856897,,,,,356,IND,2022/03/12,47,1800839040,933832
India,3/13/22,42993494,515877,,,2503,,3115.4606802209546,,,,,356,IND,2022/03/13,27,1802515613,1676573
India,3/14/22,42996062,515974,,,2568,,3115.64676658618,,,,,356,IND,2022/03/14,97,1804655693,2140080
India,3/15/22,42998938,516072,,,2876,,3115.8551717210667,,,,,356,IND,2022/03/15,98,1806403756,1748063
India,3/16/22,43001477,516132,,,2539,,3116.0391566436942,,,,,356,IND,2022/03/16,60,1808411944,2008188
India,3/17/22,43004005,516281,,,2528,,3116.2223444674055,,,,,356,IND,2022/03/17,149,1809365918,953974
India,3/18/22,43006080,516352,,,2075,,3116.3727063084657,,,,,356,IND,2022/03/18,71,1810810379,1444461
India,3/19/22,43007841,516479,,,1761,,3116.500314598638,,,,,356,IND,2022/03/19,127,1811457201,646822
India,3/20/22,43009390,516510,,,1549,,3116.612560618784,,,,,356,IND,2022/03/20,31,1813883509,2426308
India,3/21/22,43010971,516543,,,1581,,3116.7271254721413,,,,,356,IND,2022/03/21,33,1817222036,3338527
India,3/22/22,43012749,516605,,,1778,,3116.855965642457,,,,,356,IND,2022/03/22,62,1820574288,3352252
India,3/23/22,43014687,516672,,,1938,,3116.9963999788306,,,,,356,IND,2022/03/23,67,1821070215,495927
India,3/24/22,43016372,516755,,,1685,,3117.1185010401255,,,,,356,IND,2022/03/24,83,1826265830,5195615
India,3/25/22,43018032,520855,,,1660,,3117.2387905129735,,,,,356,IND,2022/03/25,4100,1829554402,3288572
India,3/26/22,43019453,521004,,,1421,,3117.341761200273,,,,,356,IND,2022/03/26,149,1831347741,1793339
India,3/27/22,43020723,521035,,,1270,,3117.433789893356,,,,,356,IND,2022/03/27,31,1833040014,1692273
India,3/28/22,43021982,521070,,,1259,,3117.5250214875223,,,,,356,IND,2022/03/28,35,1835934701,2894687
India,3/29/22,43023215,521101,,,1233,,3117.614369029704,,,,,356,IND,2022/03/29,31,1838519822,2585121
India,3/30/22,43024440,521129,,,1225,,3117.703136863583,,,,,356,IND,2022/03/30,28,1839769549,1249727
India,3/31/22,43025775,521181,,,1335,,3117.799875686627,,,,,356,IND,2022/03/31,52,1839769549,0
India,4/1/22,43027035,521264,,,1260,,3117.891179744331,,,,,356,IND,2022/04/01,83,,
Indonesia,3/5/22,5723858,149918,,,30156,,2092.637549573826,,,,,360,IDN,2022/03/05,322,352266904,1208004
Indonesia,3/6/22,5748725,150172,,,24867,,2101.7289033329957,,,,,360,IDN,2022/03/06,254,352577230,310326
Indonesia,3/7/22,5770105,150430,,,21380,,2109.545412898727,,,,,360,IDN,2022/03/07,258,353698734,1121504
Indonesia,3/8/22,5800253,150831,,,30148,,2120.5674957045117,,,,,360,IDN,2022/03/08,401,354566415,867681
Indonesia,3/9/22,5826589,151135,,,26336,,2130.1959145970795,,,,,360,IDN,2022/03/09,304,356256648,1690233
Indonesia,3/10/22,5847900,151413,,,21311,,2137.9871978223046,,,,,360,IDN,2022/03/10,278,357308080,1051432
Indonesia,3/11/22,5864010,151703,,,16110,,2143.8769999319366,,,,,360,IDN,2022/03/11,290,358354805,1046725
Indonesia,3/12/22,5878910,151951,,,14900,,2149.324427084855,,,,,360,IDN,2022/03/12,248,359380001,1025196
Indonesia,3/13/22,5890495,152166,,,11585,,2153.5598930960336,,,,,360,IDN,2022/03/13,215,359589226,209225
Indonesia,3/14/22,5900124,152437,,,9629,,2157.080247193715,,,,,360,IDN,2022/03/14,271,360250837,661611
Indonesia,3/15/22,5914532,152745,,,14408,,2162.347799570846,,,,,360,IDN,2022/03/15,308,361531110,1280273
Indonesia,3/16/22,5927550,152975,,,13018,,2167.1071691464626,,,,,360,IDN,2022/03/16,230,362340334,809224
Indonesia,3/17/22,5939082,153212,,,11532,,2171.323258403339,,,,,360,IDN,2022/03/17,237,363890835,1550501
Indonesia,3/18/22,5948610,153411,,,9528,,2174.806686988105,,,,,360,IDN,2022/03/18,199,364305498,414663
Indonesia,3/19/22,5956561,153599,,,7951,,2177.7135657325916,,,,,360,IDN,2022/03/19,188,364931091,625593
Indonesia,3/20/22,5962483,153738,,,5922,,2179.8786438265233,,,,,360,IDN,2022/03/20,139,365473877,542786
Indonesia,3/21/22,5967182,153892,,,4699,,2181.5965941749505,,,,,360,IDN,2022/03/21,154,367864028,2390151
Indonesia,3/22/22,5974646,154062,,,7464,,2184.325426139339,,,,,360,IDN,2022/03/22,170,369439976,1575948
Indonesia,3/23/22,5981022,154221,,,6376,,2186.6564862418227,,,,,360,IDN,2022/03/23,159,369679413,239437
Indonesia,3/24/22,5986830,154343,,,5808,,2188.7798860340476,,,,,360,IDN,2022/03/24,122,370563628,884215
Indonesia,3/27/22,5995876,154570,,,9046,,2192.0870958344035,,,,,360,IDN,2022/03/27,227,374067191,373377
Indonesia,3/28/22,6001751,154774,,,5875,,2194.2349907688595,,,,,360,IDN,2022/03/28,204,375911010,1843819
Indonesia,3/29/22,6005646,154882,,,3895,,2195.6589994105116,,,,,360,IDN,2022/03/29,108,377108938,1197928
Indonesia,3/30/22,6009486,155000,,,3840,,2197.062900099586,,,,,360,IDN,2022/03/30,118,377629902,520964
Indonesia,3/31/22,6012818,155089,,,3332,,2198.2810764266683,,,,,360,IDN,2022/03/31,89,377629902,0
Indonesia,4/1/22,6015748,155164,,,2930,,2199.352281900363,,,,,360,IDN,2022/04/01,75,,
Iran,3/5/22,7084306,137747,,,4089,,8434.4052053986,,,,,364,IRN,2022/03/05,154,142537180,522077
Iran,3/6/22,7089892,137948,,,5586,,8441.055763332908,,,,,364,IRN,2022/03/06,201,142884337,347157
Iran,3/7/22,7096318,138116,,,6426,,8448.70640516711,,,,,364,IRN,2022/03/07,168,142884337,0
Iran,3/8/22,7102159,138260,,,5841,,8455.660559999598,,,,,364,IRN,2022/03/08,144,143232107,347770
Iran,3/9/22,7107167,138433,,,5008,,8461.622964964692,,,,,364,IRN,2022/03/09,173,143791282,559175
Iran,3/10/22,7113591,138572,,,6424,,8469.271225646751,,,,,364,IRN,2022/03/10,139,144079994,288712
Iran,3/11/22,7117544,138711,,,3953,,8473.977572856618,,,,,364,IRN,2022/03/11,139,144079994,0
Iran,3/12/22,7119763,138831,,,2219,,8476.619461158843,,,,,364,IRN,2022/03/12,120,144547815,467821
Iran,3/13/22,7123093,138949,,,3330,,8480.584079476286,,,,,364,IRN,2022/03/13,118,144547815,0
Iran,3/14/22,7126906,139063,,,3813,,8485.12374603617,,,,,364,IRN,2022/03/14,114,144547815,0
Iran,3/15/22,7130129,139180,,,3223,,8488.960972713985,,,,,364,IRN,2022/03/15,117,145041265,493450
Iran,3/16/22,7133139,139289,,,3010,,8492.54460668861,,,,,364,IRN,2022/03/16,109,145041265,0
Iran,3/17/22,7135719,139387,,,2580,,8495.616292952576,,,,,364,IRN,2022/03/17,98,145726159,684894
Iran,3/18/22,7137894,139478,,,2175,,8498.205795907665,,,,,364,IRN,2022/03/18,91,145726159,0
Iran,3/19/22,7139217,139550,,,1323,,8499.78092805,,,,,364,IRN,2022/03/19,72,145726159,0
Iran,3/20/22,7141033,139610,,,1816,,8501.943014195489,,,,,364,IRN,2022/03/20,60,145935239,209080
Iran,3/21/22,7142287,139662,,,1254,,8503.435996588903,,,,,364,IRN,2022/03/21,52,146046396,111157
Iran,3/22/22,7143409,139735,,,1122,,8504.771822940907,,,,,364,IRN,2022/03/22,73,146046396,0
Iran,3/23/22,7144532,139802,,,1123,,8506.108839868983,,,,,364,IRN,2022/03/23,67,146109352,62956
Iran,3/24/22,7145877,139865,,,1345,,8507.710164684888,,,,,364,IRN,2022/03/24,63,146109352,0
Iran,3/25/22,7147407,139917,,,1530,,8509.531746073983,,,,,364,IRN,2022/03/25,52,146109352,0
Iran,3/26/22,7148789,139971,,,1382,,8511.177122204526,,,,,364,IRN,2022/03/26,54,146178539,69187
Iran,3/27/22,7151088,140021,,,2299,,8513.914256592454,,,,,364,IRN,2022/03/27,50,146178539,0
Iran,3/28/22,7154003,140063,,,2915,,8517.384785840308,,,,,364,IRN,2022/03/28,42,146655682,477143
Iran,3/29/22,7156746,140109,,,2743,,8520.650536003895,,,,,364,IRN,2022/03/29,46,146792557,136875
Iran,3/30/22,7159733,140158,,,2987,,8524.206786728882,,,,,364,IRN,2022/03/30,49,146792557,0
Iran,3/31/22,7162220,140204,,,2487,,8527.167749418217,,,,,364,IRN,2022/03/31,46,146792557,0
Iran,4/1/22,7164484,140240,,,2264,,8529.86321364365,,,,,364,IRN,2022/04/01,36,,
Iraq,3/5/22,2307555,25041,,,397,,5736.975145480131,,,,,368,IRQ,2022/03/05,7,16785945,0
Iraq,3/6/22,2308191,25050,,,636,,5738.556349911889,,,,,368,IRQ,2022/03/06,9,17014009,0
Iraq,3/7/22,2308928,25068,,,737,,5740.388657563156,,,,,368,IRQ,2022/03/07,18,17014009,0
Iraq,3/8/22,2309816,25076,,,888,,5742.5963769584405,,,,,368,IRQ,2022/03/08,8,17014009,0
Iraq,3/9/22,2310539,25082,,,723,,5744.393878222844,,,,,368,IRQ,2022/03/09,6,17014009,0
Iraq,3/10/22,2311238,25090,,,699,,5746.131711395485,,,,,368,IRQ,2022/03/10,8,17014009,0
Iraq,3/11/22,2311926,25094,,,688,,5747.842196692732,,,,,368,IRQ,2022/03/11,4,17014009,0
Iraq,3/12/22,2312292,25097,,,366,,5748.75213509214,,,,,368,IRQ,2022/03/12,3,17014009,0
Iraq,3/13/22,2312713,25099,,,421,,5749.798812868508,,,,,368,IRQ,2022/03/13,2,17014009,0
Iraq,3/14/22,2313370,25105,,,657,,5751.43222688056,,,,,368,IRQ,2022/03/14,6,17014009,0
Iraq,3/15/22,2313943,25109,,,573,,5752.856802571436,,,,,368,IRQ,2022/03/15,4,17014009,0
Iraq,3/16/22,2314575,25116,,,632,,5754.4280623212335,,,,,368,IRQ,2022/03/16,7,17014009,0
Iraq,3/17/22,2315134,25119,,,559,,5755.817831625247,,,,,368,IRQ,2022/03/17,3,17014009,0
Iraq,3/18/22,2315573,25124,,,439,,5756.909260470438,,,,,368,IRQ,2022/03/18,5,17372433,0
Iraq,3/19/22,2315791,25127,,,218,,5757.4512456372995,,,,,368,IRQ,2022/03/19,3,17372433,0
Iraq,3/20/22,2316044,25129,,,253,,5758.080246771316,,,,,368,IRQ,2022/03/20,2,17372433,0
Iraq,3/21/22,2316306,25131,,,262,,5758.731623439745,,,,,368,IRQ,2022/03/21,2,17372433,0
Iraq,3/22/22,2316493,25132,,,187,,5759.19653732141,,,,,368,IRQ,2022/03/22,1,17372433,0
Iraq,3/23/22,2316758,25134,,,265,,5759.855372501309,,,,,368,IRQ,2022/03/23,2,17372433,0
Iraq,3/24/22,2317128,25138,,,370,,5760.775255582677,,,,,368,IRQ,2022/03/24,4,17372433,0
Iraq,3/25/22,2317498,25145,,,370,,5761.695138664046,,,,,368,IRQ,2022/03/25,7,17372433,0
Iraq,3/26/22,2317747,25149,,,249,,5762.314195116102,,,,,368,IRQ,2022/03/26,4,17372433,0
Iraq,3/27/22,2317977,25150,,,230,,5762.886014328845,,,,,368,IRQ,2022/03/27,1,17536902,0
Iraq,3/28/22,2318450,25156,,,473,,5764.061972970702,,,,,368,IRQ,2022/03/28,6,17536902,0
Iraq,3/29/22,2318865,25160,,,415,,5765.093733724129,,,,,368,IRQ,2022/03/29,4,17536902,0
Iraq,3/30/22,2319209,25163,,,344,,5765.948976372753,,,,,368,IRQ,2022/03/30,3,17536902,0
Iraq,3/31/22,2319550,25164,,,341,,5766.796760509907,,,,,368,IRQ,2022/03/31,1,17536902,0
Iraq,4/1/22,2319908,25167,,,358,,5767.686809545393,,,,,368,IRQ,2022/04/01,3,,
Ireland,3/5/22,1315100,6531,,,0,,26633.340056980887,,,,,372,IRL,2022/03/05,0,10620191,0
Ireland,3/7/22,1322591,6570,,,7491,,26785.04741791682,,,,,372,IRL,2022/03/07,39,10620191,0
Ireland,3/8/22,1326946,6571,,,4355,,26873.244662193414,,,,,372,IRL,2022/03/08,1,10642767,22576
Ireland,3/9/22,1328644,6578,,,1698,,26907.63247408358,,,,,372,IRL,2022/03/09,7,10648877,6110
Ireland,3/10/22,1332701,6590,,,4057,,26989.7946371215,,,,,372,IRL,2022/03/10,12,10653137,4260
Ireland,3/11/22,1341826,6611,,,9125,,27174.593685117812,,,,,372,IRL,2022/03/11,21,10659090,5953
Ireland,3/14/22,1353733,6624,,,11907,,27415.733659308728,,,,,372,IRL,2022/03/14,13,10659090,0
Ireland,3/15/22,1360015,6636,,,6282,,27542.95641213205,,,,,372,IRL,2022/03/15,12,10678769,19679
Ireland,3/16/22,1365467,6638,,,5452,,27653.370046069136,,,,,372,IRL,2022/03/16,2,10686860,8091
Ireland,3/21/22,1390177,6664,,,24710,,28153.79574206792,,,,,372,IRL,2022/03/21,26,10706034,19174
Ireland,3/22/22,1397885,6680,,,7708,,28309.89777625483,,,,,372,IRL,2022/03/22,16,10706034,0
Ireland,3/23/22,1404929,6685,,,7044,,28452.55251533275,,,,,372,IRL,2022/03/23,5,10712132,6098
Ireland,3/24/22,1413798,6693,,,8869,,28632.167064009936,,,,,372,IRL,2022/03/24,8,10712132,0
Ireland,3/25/22,1422945,6710,,,9147,,28817.411654916486,,,,,372,IRL,2022/03/25,17,10716514,4382
Ireland,3/28/22,1442877,6721,,,19932,,29221.07353159183,,,,,372,IRL,2022/03/28,11,10739809,16959
Ireland,3/29/22,1448812,6730,,,5935,,29341.268857603674,,,,,372,IRL,2022/03/29,9,10741777,1968
Ireland,3/30/22,1454182,6740,,,5370,,29450.0218316026,,,,,372,IRL,2022/03/30,10,10741777,0
Ireland,3/31/22,1459425,6753,,,5243,,29556.202807892427,,,,,372,IRL,2022/03/31,13,10741777,0
Ireland,4/1/22,1465150,6786,,,5725,,29672.145224306554,,,,,372,IRL,2022/04/01,33,,
Israel,3/5/22,3669112,10274,,,7048,,42390.325457415085,,,,,376,ISR,2022/03/05,10,18002410,0
Israel,3/6/22,3673103,10282,,,3991,,42436.43464920332,,,,,376,ISR,2022/03/06,8,18002410,0
Israel,3/7/22,3680632,10317,,,7529,,42523.41939111605,,,,,376,ISR,2022/03/07,35,18002410,0
Israel,3/8/22,3688096,10322,,,7464,,42609.653168993136,,,,,376,ISR,2022/03/08,5,18002410,0
Israel,3/9/22,3690974,10322,,,2878,,42642.90354583266,,,,,376,ISR,2022/03/09,0,18002410,0
Israel,3/10/22,3704109,10358,,,13135,,42794.65604749605,,,,,376,ISR,2022/03/10,36,18002410,0
Israel,3/11/22,3707470,10359,,,3361,,42833.48666478502,,,,,376,ISR,2022/03/11,1,18002410,0
Israel,3/12/22,3712880,10367,,,5410,,42895.989979135906,,,,,376,ISR,2022/03/12,8,18002410,0
Israel,3/13/22,3719437,10379,,,6557,,42971.744920392615,,,,,376,ISR,2022/03/13,12,18002410,0
Israel,3/14/22,3725407,10392,,,5970,,43040.71807874285,,,,,376,ISR,2022/03/14,13,18002410,0
Israel,3/15/22,3732579,10399,,,7172,,43123.57829510599,,,,,376,ISR,2022/03/15,7,18002410,0
Israel,3/16/22,3737345,10405,,,4766,,43178.64128885762,,,,,376,ISR,2022/03/16,6,18002410,0
Israel,3/17/22,3745401,10417,,,8056,,43271.714616105455,,,,,376,ISR,2022/03/17,12,18002410,0
Israel,3/18/22,3751042,10417,,,5641,,43336.88674110607,,,,,376,ISR,2022/03/18,0,18002410,0
Israel,3/19/22,3758948,10419,,,7906,,43428.22707442551,,,,,376,ISR,2022/03/19,2,18002410,0
Israel,3/20/22,3772751,10431,,,13803,,43587.69717571669,,,,,376,ISR,2022/03/20,12,18002410,0
Israel,3/21/22,3785806,10431,,,13055,,43738.5254139516,,,,,376,ISR,2022/03/21,0,18002410,0
Israel,3/22/22,3801627,10449,,,15821,,43921.31006022616,,,,,376,ISR,2022/03/22,18,18002410,0
Israel,3/23/22,3814628,10455,,,13001,,44071.51442064685,,,,,376,ISR,2022/03/23,6,18002410,0
Israel,3/24/22,3818058,10455,,,3430,,44111.14221514288,,,,,376,ISR,2022/03/24,0,18045319,42909
Israel,3/25/22,3835693,10460,,,17635,,44314.8845346582,,,,,376,ISR,2022/03/25,5,18049295,3976
Israel,3/26/22,3848014,10460,,,12321,,44457.232655936816,,,,,376,ISR,2022/03/26,0,18050051,756
Israel,3/27/22,3864148,10485,,,16134,,44643.6334828753,,,,,376,ISR,2022/03/27,25,18050419,368
Israel,3/28/22,3876115,10485,,,11967,,44781.8917384829,,,,,376,ISR,2022/03/28,0,18056822,6403
Israel,3/29/22,3894134,10485,,,18019,,44990.070522454924,,,,,376,ISR,2022/03/29,0,18062854,6032
Israel,3/30/22,3904298,10485,,,10164,,45107.498191043174,,,,,376,ISR,2022/03/30,0,18062854,0
Israel,3/31/22,3918225,10485,,,13927,,45268.4009006485,,,,,376,ISR,2022/03/31,0,18062854,0
Israel,4/1/22,3926812,10496,,,8587,,45367.60902640285,,,,,376,ISR,2022/04/01,11,,
Italy,3/5/22,12990223,155782,,,41364,,21484.998766494457,,,,,380,ITA,2022/03/05,173,134564100,88931
Italy,3/6/22,13026112,155887,,,35889,,21544.35687918665,,,,,380,ITA,2022/03/06,105,134593644,29544
Italy,3/7/22,13048774,156017,,,22662,,21581.838379084402,,,,,380,ITA,2022/03/07,130,134669393,75749
Italy,3/8/22,13109527,156201,,,60753,,21682.319958966506,,,,,380,ITA,2022/03/08,184,134740702,71309
Italy,3/9/22,13159342,156357,,,49815,,21764.710785787025,,,,,380,ITA,2022/03/09,156,134808529,67827
Italy,3/10/22,13214498,156493,,,55156,,21855.93528531754,,,,,380,ITA,2022/03/10,136,134883035,74506
Italy,3/11/22,13268459,156649,,,53961,,21945.183331208576,,,,,380,ITA,2022/03/11,156,134963113,80078
Italy,3/12/22,13323179,156782,,,54720,,22035.6867145995,,,,,380,ITA,2022/03/12,133,135041216,78103
Italy,3/13/22,13373207,156868,,,50028,,22118.429829809313,,,,,380,ITA,2022/03/13,86,135065770,24554
Italy,3/14/22,13402905,156997,,,29698,,22167.548424106528,,,,,380,ITA,2022/03/14,129,135129857,64087
Italy,3/15/22,13489319,157177,,,86414,,22310.471658250226,,,,,380,ITA,2022/03/15,180,135196411,66554
Italy,3/16/22,13563466,157314,,,74147,,22433.106058255467,,,,,380,ITA,2022/03/16,137,135252801,56390
Italy,3/17/22,13645834,157442,,,82368,,22569.337466938643,,,,,380,ITA,2022/03/17,128,135311245,58444
Italy,3/18/22,13724411,157607,,,78577,,22699.298803866797,,,,,380,ITA,2022/03/18,165,135376872,65627
Italy,3/19/22,13800179,157692,,,75768,,22824.614234290104,,,,,380,ITA,2022/03/19,85,135436829,59957
Italy,3/20/22,13861743,157785,,,61564,,22926.437156349293,,,,,380,ITA,2022/03/20,93,135452421,15592
Italy,3/21/22,13895188,157904,,,33445,,22981.753049213134,,,,,380,ITA,2022/03/21,119,135503440,51019
Italy,3/22/22,13992092,158101,,,96904,,23142.026073045625,,,,,380,ITA,2022/03/22,197,135552314,48874
Italy,3/23/22,14070450,158254,,,78358,,23271.625197967882,,,,,380,ITA,2022/03/23,153,135552314,0
Italy,3/24/22,14153098,158436,,,82648,,23408.319708759052,,,,,380,ITA,2022/03/24,182,135594966,42652
Italy,3/25/22,14229495,158582,,,76397,,23534.67546498925,,,,,380,ITA,2022/03/25,146,135594966,0
Italy,3/26/22,14304111,158700,,,74616,,23658.08556102538,,,,,380,ITA,2022/03/26,118,135594966,0
Italy,3/27/22,14364723,158782,,,60612,,23758.333935917384,,,,,380,ITA,2022/03/27,82,135594966,0
Italy,3/28/22,14396283,158877,,,31560,,23810.532159232764,,,,,380,ITA,2022/03/28,95,135594966,0
Italy,3/29/22,14496579,159054,,,100296,,23976.41533431639,,,,,380,ITA,2022/03/29,177,135594966,0
Italy,3/30/22,14567990,159224,,,71411,,24094.52456515208,,,,,380,ITA,2022/03/30,170,135890337,295371
Italy,3/31/22,14642354,159383,,,74364,,24217.51786929102,,,,,380,ITA,2022/03/31,159,135890337,0
Italy,4/1/22,14719394,159537,,,77040,,24344.9371064335,,,,,380,ITA,2022/04/01,154,,
Jamaica,3/5/22,128166,2825,,,24,,4328.2347700783575,,,,,388,JAM,2022/03/05,0,1367785,4058
Jamaica,3/6/22,128179,2827,,,13,,4328.67378707203,,,,,388,JAM,2022/03/06,2,1368631,846
Jamaica,3/7/22,128213,2830,,,34,,4329.821985363174,,,,,388,JAM,2022/03/07,3,1368631,0
Jamaica,3/8/22,128228,2831,,,15,,4330.328543432795,,,,,388,JAM,2022/03/08,1,1368995,364
Jamaica,3/9/22,128246,2835,,,18,,4330.936413116342,,,,,388,JAM,2022/03/09,4,1372538,3543
Jamaica,3/10/22,128273,2837,,,27,,4331.848217641662,,,,,388,JAM,2022/03/10,2,1372538,0
Jamaica,3/11/22,128318,2839,,,45,,4333.3678918505275,,,,,388,JAM,2022/03/11,2,1375825,3287
Jamaica,3/12/22,128354,2844,,,36,,4334.583631217621,,,,,388,JAM,2022/03/12,5,1377536,1711
Jamaica,3/13/22,128379,2845,,,25,,4335.42789466699,,,,,388,JAM,2022/03/13,1,1377536,0
Jamaica,3/14/22,128400,2850,,,21,,4336.1370759644615,,,,,388,JAM,2022/03/14,5,1378039,503
Jamaica,3/15/22,128418,2851,,,18,,4336.744945648008,,,,,388,JAM,2022/03/15,1,1378789,750
Jamaica,3/16/22,128426,2855,,,8,,4337.015109951806,,,,,388,JAM,2022/03/16,4,1381889,3100
Jamaica,3/17/22,128456,2857,,,30,,4338.02822609105,,,,,388,JAM,2022/03/17,2,1383240,1351
Jamaica,3/18/22,128477,2858,,,21,,4338.737407388521,,,,,388,JAM,2022/03/18,1,1384647,1407
Jamaica,3/19/22,128500,2863,,,23,,4339.514129761941,,,,,388,JAM,2022/03/19,5,1384647,0
Jamaica,3/20/22,128539,2867,,,39,,4340.831180742958,,,,,388,JAM,2022/03/20,4,1384647,0
Jamaica,3/21/22,128565,2869,,,26,,4341.709214730304,,,,,388,JAM,2022/03/21,2,1384647,0
Jamaica,3/23/22,128594,2872,,,29,,4342.688560331572,,,,,388,JAM,2022/03/23,3,1387646,949
Jamaica,3/24/22,128607,2874,,,13,,4343.1275773252455,,,,,388,JAM,2022/03/24,2,1388975,1329
Jamaica,3/25/22,128628,2875,,,21,,4343.836758622716,,,,,388,JAM,2022/03/25,1,1389872,897
Jamaica,3/27/22,128679,2879,,,51,,4345.559056059431,,,,,388,JAM,2022/03/27,4,1391958,947
Jamaica,3/28/22,128704,2881,,,25,,4346.4033195088,,,,,388,JAM,2022/03/28,2,1392820,862
Jamaica,3/29/22,128727,2882,,,23,,4347.180041882221,,,,,388,JAM,2022/03/29,1,1393819,999
Jamaica,3/30/22,128735,2884,,,8,,4347.450206186019,,,,,388,JAM,2022/03/30,2,1393819,0
Jamaica,3/31/22,128757,2888,,,22,,4348.193158021465,,,,,388,JAM,2022/03/31,4,1393819,0
Jamaica,4/1/22,128786,2889,,,29,,4349.172503622734,,,,,388,JAM,2022/04/01,1,,
Japan,3/5/22,5341246,24816,,,63591,,4223.114787101327,,,,,392,JPN,2022/03/05,184,231122195,0
Japan,3/6/22,5395143,24948,,,53897,,4265.729041842712,,,,,392,JPN,2022/03/06,132,233632708,2510513
Japan,3/7/22,5432145,25068,,,37002,,4294.985079357614,,,,,392,JPN,2022/03/07,120,233632708,0
Japan,3/8/22,5486083,25317,,,53938,,4337.631751199105,,,,,392,JPN,2022/03/08,249,236103982,2471274
Japan,3/9/22,5549755,25530,,,63672,,4387.974717002274,,,,,392,JPN,2022/03/09,213,237089041,985059
Japan,3/10/22,5610818,25718,,,61063,,4436.254848313351,,,,,392,JPN,2022/03/10,188,238050214,961173
Japan,3/11/22,5666630,25927,,,55812,,4480.383218827966,,,,,392,JPN,2022/03/11,209,238050214,0
Japan,3/12/22,5721856,26068,,,55226,,4524.048262009362,,,,,392,JPN,2022/03/12,141,238050214,0
Japan,3/13/22,5772715,26158,,,50859,,4564.260488699011,,,,,392,JPN,2022/03/13,90,238050214,0
Japan,3/14/22,5805074,26274,,,32359,,4589.845487292188,,,,,392,JPN,2022/03/14,116,240441450,2391236
Japan,3/15/22,5855769,26462,,,50695,,4629.928045581416,,,,,392,JPN,2022/03/15,188,240441450,0
Japan,3/16/22,5913591,26625,,,57822,,4675.645644662187,,,,,392,JPN,2022/03/16,163,243836391,3394941
Japan,3/17/22,5967069,26796,,,53478,,4717.92861245371,,,,,392,JPN,2022/03/17,171,244711875,875484
Japan,3/18/22,6016178,26952,,,49109,,4756.757182431532,,,,,392,JPN,2022/03/18,156,244711875,0
Japan,3/19/22,6060771,27056,,,44593,,4792.015127431858,,,,,392,JPN,2022/03/19,104,244711875,0
Japan,3/20/22,6100331,27122,,,39560,,4823.293675728964,,,,,392,JPN,2022/03/20,66,244711875,0
Japan,3/21/22,6127897,27180,,,27566,,4845.0890362536875,,,,,392,JPN,2022/03/21,58,247132594,2420719
Japan,3/22/22,6148049,27251,,,20152,,4861.022436286127,,,,,392,JPN,2022/03/22,71,247132594,0
Japan,3/23/22,6188977,27373,,,40928,,4893.382608801395,,,,,392,JPN,2022/03/23,122,248489469,1356875
Japan,3/24/22,6238527,27499,,,49550,,4932.559860270597,,,,,392,JPN,2022/03/24,126,250187988,1698519
Japan,3/25/22,6285894,27614,,,47367,,4970.011098824415,,,,,392,JPN,2022/03/25,115,250187988,0
Japan,3/26/22,6333118,27715,,,47224,,5007.349272858352,,,,,392,JPN,2022/03/26,101,250187988,0
Japan,3/27/22,6376338,27776,,,43220,,5041.521640335627,,,,,392,JPN,2022/03/27,61,252334857,2146869
Japan,3/28/22,6406058,27841,,,29720,,5065.020084607366,,,,,392,JPN,2022/03/28,65,252334857,0
Japan,3/29/22,6450423,27922,,,44365,,5100.097758904665,,,,,392,JPN,2022/03/29,81,254345587,2010730
Japan,3/30/22,6504032,28018,,,53609,,5142.484303284331,,,,,392,JPN,2022/03/30,96,254345587,0
Japan,3/31/22,6555585,28120,,,51553,,5183.245248692844,,,,,392,JPN,2022/03/31,102,254345587,0
Japan,4/1/22,6604726,28198,,,49141,,5222.099119821967,,,,,392,JPN,2022/04/01,78,,
Jordan,3/5/22,1638228,13849,,,0,,16056.116058389869,,,,,400,JOR,2022/03/05,0,9491363,0
Jordan,3/7/22,1654677,13882,,,16449,,16217.331135317167,,,,,400,JOR,2022/03/07,33,9649298,0
Jordan,3/14/22,1680179,13959,,,25502,,16467.273800026265,,,,,400,JOR,2022/03/14,77,9649298,0
Jordan,3/21/22,1689314,14003,,,9135,,16556.805061971118,,,,,400,JOR,2022/03/21,44,9727982,0
Jordan,3/28/22,1692485,14031,,,3171,,16587.883729910594,,,,,400,JOR,2022/03/28,28,9727982,0
Jordan,4/1/22,1692485,14031,,,0,,16587.883729910594,,,,,400,JOR,2022/04/01,0,,
Kazakhstan,3/5/22,1391984,18967,,,171,,7413.355281093751,,,,,398,KAZ,2022/03/05,0,18437993,10437
Kazakhstan,3/6/22,1392011,18967,,,27,,7413.499076275728,,,,,398,KAZ,2022/03/06,0,18445101,7108
Kazakhstan,3/7/22,1392169,18979,,,158,,7414.34054437767,,,,,398,KAZ,2022/03/07,12,18449084,3983
Kazakhstan,3/8/22,1392338,18980,,,169,,7415.240595701898,,,,,398,KAZ,2022/03/08,1,18453123,4039
Kazakhstan,3/9/22,1392427,18983,,,89,,7415.714587227675,,,,,398,KAZ,2022/03/09,3,18456476,3353
Kazakhstan,3/10/22,1392590,18988,,,163,,7416.58268406702,,,,,398,KAZ,2022/03/10,5,18468758,12282
Kazakhstan,3/11/22,1392590,18989,,,0,,7416.58268406702,,,,,398,KAZ,2022/03/11,1,18481239,12481
Kazakhstan,3/12/22,1392812,18989,,,222,,7417.765000007722,,,,,398,KAZ,2022/03/12,0,18493804,12565
Kazakhstan,3/14/22,1392982,18995,,,170,,7418.670377079431,,,,,398,KAZ,2022/03/14,6,18504712,4507
Kazakhstan,3/16/22,1393206,18997,,,224,,7419.863344515095,,,,,398,KAZ,2022/03/16,2,18516663,760
Kazakhstan,3/17/22,1393286,18999,,,80,,7420.289404313547,,,,,398,KAZ,2022/03/17,2,18540073,23410
Kazakhstan,3/18/22,1393337,19001,,,51,,7420.5610174350595,,,,,398,KAZ,2022/03/18,2,18548817,8744
Kazakhstan,3/19/22,1393369,19001,,,32,,7420.73144135444,,,,,398,KAZ,2022/03/19,0,18560014,11197
Kazakhstan,3/20/22,1393427,19001,,,58,,7421.0403347083175,,,,,398,KAZ,2022/03/20,0,18564153,4139
Kazakhstan,3/21/22,1393456,19004,,,29,,7421.194781385256,,,,,398,KAZ,2022/03/21,3,18563301,
Kazakhstan,3/22/22,1393492,19005,,,36,,7421.386508294559,,,,,398,KAZ,2022/03/22,1,18569666,6365
Kazakhstan,3/23/22,1393522,19006,,,30,,7421.546280718978,,,,,398,KAZ,2022/03/23,1,18569666,0
Kazakhstan,3/24/22,1393546,19006,,,24,,7421.674098658514,,,,,398,KAZ,2022/03/24,0,18576652,6986
Kazakhstan,3/25/22,1393546,19008,,,0,,7421.674098658514,,,,,398,KAZ,2022/03/25,2,18584746,8094
Kazakhstan,3/26/22,1393598,19008,,,52,,7421.951037527507,,,,,398,KAZ,2022/03/26,0,18595900,11154
Kazakhstan,3/27/22,1393643,19008,,,45,,7422.190696164135,,,,,398,KAZ,2022/03/27,0,18599164,3264
Kazakhstan,3/28/22,1393689,19010,,,46,,7422.435680548245,,,,,398,KAZ,2022/03/28,2,18601638,2474
Kazakhstan,3/29/22,1393689,19011,,,0,,7422.435680548245,,,,,398,KAZ,2022/03/29,1,18609842,8204
Kazakhstan,3/30/22,1393786,19011,,,97,,7422.952278053867,,,,,398,KAZ,2022/03/30,0,18617031,7189
Kazakhstan,3/31/22,1393802,19011,,,16,,7423.0374900135575,,,,,398,KAZ,2022/03/31,0,18617031,0
Kazakhstan,4/1/22,1393820,19012,,,18,,7423.133353468209,,,,,398,KAZ,2022/04/01,1,,
Kenya,3/5/22,323071,5640,,,14,,600.8242315138373,,,,,404,KEN,2022/03/05,0,16865915,0
Kenya,3/6/22,323075,5641,,,4,,600.8316704264171,,,,,404,KEN,2022/03/06,1,16876436,10521
Kenya,3/7/22,323094,5641,,,19,,600.8670052611709,,,,,404,KEN,2022/03/07,0,16918288,41852
Kenya,3/8/22,323115,5641,,,21,,600.9060595522146,,,,,404,KEN,2022/03/08,0,16918288,0
Kenya,3/9/22,323129,5641,,,14,,600.9320957462438,,,,,404,KEN,2022/03/09,0,17004424,86136
Kenya,3/10/22,323140,5644,,,11,,600.9525527558382,,,,,404,KEN,2022/03/10,3,17054582,50158
Kenya,3/11/22,323160,5644,,,20,,600.9897473187369,,,,,404,KEN,2022/03/11,0,17054582,0
Kenya,3/12/22,323171,5644,,,11,,601.0102043283313,,,,,404,KEN,2022/03/12,0,17105662,51080
Kenya,3/13/22,323183,5645,,,12,,601.0325210660706,,,,,404,KEN,2022/03/13,1,17105662,0
Kenya,3/14/22,323195,5646,,,12,,601.0548378038098,,,,,404,KEN,2022/03/14,1,17129923,24261
Kenya,3/15/22,323204,5647,,,9,,601.0715753571143,,,,,404,KEN,2022/03/15,1,17172651,42728
Kenya,3/16/22,323219,5647,,,15,,601.0994712792884,,,,,404,KEN,2022/03/16,0,17172651,0
Kenya,3/17/22,323237,5647,,,18,,601.1329463858973,,,,,404,KEN,2022/03/17,0,17172651,0
Kenya,3/18/22,323255,5647,,,18,,601.1664214925062,,,,,404,KEN,2022/03/18,0,17278552,105901
Kenya,3/19/22,323272,5647,,,17,,601.1980368709702,,,,,404,KEN,2022/03/19,0,17278552,0
Kenya,3/20/22,323281,5647,,,9,,601.2147744242747,,,,,404,KEN,2022/03/20,0,17278552,0
Kenya,3/21/22,323289,5647,,,8,,601.2296522494341,,,,,404,KEN,2022/03/21,0,17327143,48591
Kenya,3/22/22,323306,5647,,,17,,601.2612676278982,,,,,404,KEN,2022/03/22,0,17327143,0
Kenya,3/23/22,323319,5647,,,13,,601.2854440937824,,,,,404,KEN,2022/03/23,0,17327143,0
Kenya,3/24/22,323333,5647,,,14,,601.3114802878115,,,,,404,KEN,2022/03/24,0,17439527,112384
Kenya,3/25/22,323350,5647,,,17,,601.3430956662755,,,,,404,KEN,2022/03/25,0,17470720,31193
Kenya,3/26/22,323365,5647,,,15,,601.3709915884496,,,,,404,KEN,2022/03/26,0,17470720,0
Kenya,3/27/22,323374,5647,,,9,,601.3877291417541,,,,,404,KEN,2022/03/27,0,17470720,0
Kenya,3/28/22,323383,5647,,,9,,601.4044666950585,,,,,404,KEN,2022/03/28,0,17565944,95224
Kenya,3/29/22,323395,5648,,,12,,601.4267834327978,,,,,404,KEN,2022/03/29,1,17595442,29498
Kenya,3/30/22,323402,5648,,,7,,601.4398015298124,,,,,404,KEN,2022/03/30,0,17595442,0
Kenya,3/31/22,323423,5648,,,21,,601.4788558208561,,,,,404,KEN,2022/03/31,0,17595442,0
Kenya,4/1/22,323436,5648,,,13,,601.5030322867403,,,,,404,KEN,2022/04/01,0,,
Kiribati,3/5/22,2985,11,,,11,,2538.1358093974795,,,,,296,KIR,2022/03/05,0,127916,0
Kiribati,3/6/22,2986,11,,,1,,2538.986106151047,,,,,296,KIR,2022/03/06,0,127916,0
Kiribati,3/7/22,2991,12,,,5,,2543.237589918882,,,,,296,KIR,2022/03/07,1,127916,0
Kiribati,3/8/22,3000,13,,,9,,2550.8902607009845,,,,,296,KIR,2022/03/08,1,127916,0
Kiribati,3/9/22,3006,13,,,6,,2555.9920412223864,,,,,296,KIR,2022/03/09,0,127916,0
Kiribati,3/10/22,3010,13,,,4,,2559.3932282366545,,,,,296,KIR,2022/03/10,0,127916,0
Kiribati,3/11/22,3019,13,,,9,,2567.0458990187576,,,,,296,KIR,2022/03/11,0,127916,0
Kiribati,3/12/22,3022,13,,,3,,2569.5967892794583,,,,,296,KIR,2022/03/12,0,127916,0
Kiribati,3/13/22,3027,13,,,5,,2573.8482730472933,,,,,296,KIR,2022/03/13,0,127916,0
Kiribati,3/14/22,3033,13,,,6,,2578.9500535686957,,,,,296,KIR,2022/03/14,0,127916,0
Kiribati,3/15/22,3038,13,,,5,,2583.2015373365302,,,,,296,KIR,2022/03/15,0,127916,0
Kiribati,3/16/22,3041,13,,,3,,2585.7524275972314,,,,,296,KIR,2022/03/16,0,127916,0
Kiribati,3/18/22,3042,13,,,1,,2586.6027243507983,,,,,296,KIR,2022/03/18,0,136758,0
Kiribati,3/19/22,3049,13,,,7,,2592.5548016257676,,,,,296,KIR,2022/03/19,0,136758,0
Kiribati,3/21/22,3061,13,,,12,,2602.7583626685714,,,,,296,KIR,2022/03/21,0,136758,0
Kiribati,3/22/22,3057,13,,,,,2599.3571756543033,,,,,296,KIR,2022/03/22,0,136758,0
Kiribati,3/23/22,3060,13,,,3,,2601.9080659150045,,,,,296,KIR,2022/03/23,0,136758,0
Kiribati,3/24/22,3061,13,,,1,,2602.7583626685714,,,,,296,KIR,2022/03/24,0,136758,0
Kiribati,3/25/22,3062,13,,,1,,2603.6086594221383,,,,,296,KIR,2022/03/25,0,136758,0
Kiribati,3/26/22,3065,13,,,3,,2606.1595496828395,,,,,296,KIR,2022/03/26,0,136758,0
Kiribati,3/31/22,3066,13,,,1,,2607.0098464364064,,,,,296,KIR,2022/03/31,0,136758,0
Kiribati,4/1/22,3066,13,,,0,,2607.0098464364064,,,,,296,KIR,2022/04/01,0,,
"Korea, South",3/5/22,4456264,8957,,,243612,,8691.895870468621,,,,,410,KOR,2022/03/05,161,118927988,0
"Korea, South",3/6/22,4666977,9096,,,210713,,9102.88935167935,,,,,410,KOR,2022/03/06,139,118927988,0
"Korea, South",3/7/22,4869691,9282,,,202714,,9498.280867865595,,,,,410,KOR,2022/03/07,186,118927988,0
"Korea, South",3/8/22,5212118,9440,,,342427,,10166.181115076477,,,,,410,KOR,2022/03/08,158,118927988,0
"Korea, South",3/9/22,5539650,9646,,,327532,,10805.028822089871,,,,,410,KOR,2022/03/09,206,118927988,0
"Korea, South",3/10/22,5822626,9875,,,282976,,11356.970521648453,,,,,410,KOR,2022/03/10,229,118927988,0
"Korea, South",3/11/22,6206277,10144,,,383651,,12105.277745502595,,,,,410,KOR,2022/03/11,269,118927988,0
"Korea, South",3/12/22,6556453,10395,,,350176,,12788.292335378155,,,,,410,KOR,2022/03/12,251,121443873,0
"Korea, South",3/13/22,6866222,10595,,,309769,,13392.493498482314,,,,,410,KOR,2022/03/13,200,121444753,0
"Korea, South",3/14/22,7228550,10888,,,362328,,14099.210436023526,,,,,410,KOR,2022/03/14,293,121502523,0
"Korea, South",3/15/22,7629275,11052,,,400725,,14880.820316563266,,,,,410,KOR,2022/03/15,164,121543850,0
"Korea, South",3/16/22,8250592,11481,,,621317,,16092.692563483994,,,,,410,KOR,2022/03/16,429,121581724,0
"Korea, South",3/17/22,8657609,11782,,,407017,,16886.574923575434,,,,,410,KOR,2022/03/17,301,121632001,0
"Korea, South",3/18/22,9038938,12101,,,381329,,17630.353110951663,,,,,410,KOR,2022/03/18,319,121719508,0
"Korea, South",3/19/22,9373646,12428,,,334708,,18283.197530181045,,,,,410,KOR,2022/03/19,327,121756570,0
"Korea, South",3/20/22,9582815,12757,,,209169,,18691.179455697587,,,,,410,KOR,2022/03/20,329,121757169,0
"Korea, South",3/21/22,9936540,13141,,,353725,,19381.116332593014,,,,,410,KOR,2022/03/21,384,121812513,0
"Korea, South",3/22/22,10427247,13432,,,490707,,20338.235153854508,,,,,410,KOR,2022/03/22,291,121846902,0
"Korea, South",3/23/22,10822836,13902,,,395589,,21109.827320634307,,,,,410,KOR,2022/03/23,470,121846902,0
"Korea, South",3/24/22,11162232,14294,,,339396,,21771.81563435485,,,,,410,KOR,2022/03/24,392,121930667,0
"Korea, South",3/25/22,11497711,14617,,,335479,,22426.16388094189,,,,,410,KOR,2022/03/25,323,122006432,0
"Korea, South",3/26/22,11815841,14899,,,318130,,23046.67308624754,,,,,410,KOR,2022/03/26,282,122045656,0
"Korea, South",3/27/22,12003054,15186,,,187213,,23411.830065636113,,,,,410,KOR,2022/03/27,287,122046254,0
"Korea, South",3/28/22,12350428,15423,,,347374,,24089.379384102922,,,,,410,KOR,2022/03/28,237,122092333,0
"Korea, South",3/29/22,12774956,15855,,,424528,,24917.41676476491,,,,,410,KOR,2022/03/29,432,122120134,0
"Korea, South",3/30/22,13095631,16230,,,320675,,25542.889965693426,,,,,410,KOR,2022/03/30,375,122120134,0
"Korea, South",3/31/22,13375818,16590,,,280187,,26089.391750205967,,,,,410,KOR,2022/03/31,360,122120134,0
"Korea, South",4/1/22,13639915,16929,,,264097,,26604.510159641122,,,,,410,KOR,2022/04/01,339,,
Kosovo,3/5/22,226579,3117,,,66,,12515.646007492407,,,,,383,XKS,2022/03/05,0,1815751,0
Kosovo,3/6/22,226625,3118,,,46,,12518.186930156664,,,,,383,XKS,2022/03/06,1,1815864,0
Kosovo,3/7/22,226648,3119,,,23,,12519.457391488793,,,,,383,XKS,2022/03/07,1,1815864,0
Kosovo,3/8/22,226680,3120,,,32,,12521.224989863927,,,,,383,XKS,2022/03/08,1,1816329,0
Kosovo,3/9/22,226729,3122,,,49,,12523.931624875853,,,,,383,XKS,2022/03/09,2,1816890,0
Kosovo,3/10/22,226766,3123,,,37,,12525.975410497103,,,,,383,XKS,2022/03/10,1,1817274,0
Kosovo,3/11/22,226813,3124,,,47,,12528.571570610584,,,,,383,XKS,2022/03/11,1,1817563,0
Kosovo,3/12/22,226845,3124,,,32,,12530.339168985718,,,,,383,XKS,2022/03/12,0,1817705,0
Kosovo,3/13/22,226877,3126,,,32,,12532.106767360854,,,,,383,XKS,2022/03/13,2,1817705,0
Kosovo,3/14/22,226895,3126,,,18,,12533.101041446867,,,,,383,XKS,2022/03/14,0,1817836,0
Kosovo,3/15/22,226917,3126,,,22,,12534.316265329773,,,,,383,XKS,2022/03/15,0,1818153,0
Kosovo,3/16/22,226968,3127,,,51,,12537.133375240144,,,,,383,XKS,2022/03/16,1,1818750,0
Kosovo,3/17/22,227001,3127,,,33,,12538.956211064504,,,,,383,XKS,2022/03/17,0,1819097,0
Kosovo,3/18/22,227057,3127,,,56,,12542.049508220989,,,,,383,XKS,2022/03/18,0,1819481,0
Kosovo,3/19/22,227093,3127,,,36,,12544.038056393018,,,,,383,XKS,2022/03/19,0,1819481,0
Kosovo,3/20/22,227124,3127,,,31,,12545.750417318928,,,,,383,XKS,2022/03/20,0,1819600,0
Kosovo,3/21/22,227150,3127,,,26,,12547.186590998726,,,,,383,XKS,2022/03/21,0,1819736,0
Kosovo,3/22/22,227191,3130,,,41,,12549.451326416869,,,,,383,XKS,2022/03/22,3,1820094,0
Kosovo,3/23/22,227231,3130,,,40,,12551.660824385786,,,,,383,XKS,2022/03/23,0,1820441,0
Kosovo,3/24/22,227265,3130,,,34,,12553.538897659368,,,,,383,XKS,2022/03/24,0,1820441,0
Kosovo,3/25/22,227296,3130,,,31,,12555.25125858528,,,,,383,XKS,2022/03/25,0,1820975,0
Kosovo,3/26/22,227324,3130,,,28,,12556.797907163524,,,,,383,XKS,2022/03/26,0,1821176,0
Kosovo,3/27/22,227361,3130,,,37,,12558.841692784774,,,,,383,XKS,2022/03/27,0,1821249,0
Kosovo,3/28/22,227377,3132,,,16,,12559.725491972342,,,,,383,XKS,2022/03/28,2,1821541,0
Kosovo,3/29/22,227409,3132,,,32,,12561.493090347476,,,,,383,XKS,2022/03/29,0,1821917,0
Kosovo,3/30/22,227439,3132,,,30,,12563.150213824167,,,,,383,XKS,2022/03/30,0,1821917,0
Kosovo,3/31/22,227471,3134,,,32,,12564.9178121993,,,,,383,XKS,2022/03/31,2,1821917,0
Kosovo,4/1/22,227497,3135,,,26,,12566.3539858791,,,,,383,XKS,2022/04/01,1,,
Kuwait,3/5/22,622489,2544,,,524,,14576.274837767292,,,,,414,KWT,2022/03/05,1,7567520,0
Kuwait,3/6/22,623159,2545,,,670,,14591.963635707985,,,,,414,KWT,2022/03/06,1,7592265,24745
Kuwait,3/7/22,623769,2546,,,610,,14606.247466668914,,,,,414,KWT,2022/03/07,1,7592265,0
Kuwait,3/8/22,624205,2548,,,436,,14616.45689338853,,,,,414,KWT,2022/03/08,2,7592265,0
Kuwait,3/9/22,624573,2549,,,368,,14625.074024197746,,,,,414,KWT,2022/03/09,1,7592265,0
Kuwait,3/10/22,624922,2549,,,349,,14633.246248796704,,,,,414,KWT,2022/03/10,0,7592265,0
Kuwait,3/11/22,625202,2549,,,280,,14639.802761368934,,,,,414,KWT,2022/03/11,0,7592265,0
Kuwait,3/12/22,625461,2550,,,259,,14645.867535498246,,,,,414,KWT,2022/03/12,1,7592265,0
Kuwait,3/14/22,626114,2552,,,653,,14661.158259461341,,,,,414,KWT,2022/03/14,2,7592265,0
Kuwait,3/15/22,626384,2552,,,270,,14667.480610870276,,,,,414,KWT,2022/03/15,0,7592265,0
Kuwait,3/16/22,626609,2552,,,225,,14672.749237044389,,,,,414,KWT,2022/03/16,0,7592265,0
Kuwait,3/18/22,626993,2553,,,384,,14681.741025714877,,,,,414,KWT,2022/03/18,1,7752791,160526
Kuwait,3/19/22,627143,2553,,,150,,14685.253443164285,,,,,414,KWT,2022/03/19,0,7752791,0
Kuwait,3/20/22,627342,2553,,,199,,14689.913250313835,,,,,414,KWT,2022/03/20,0,7752791,0
Kuwait,3/21/22,627584,2553,,,242,,14695.579950465548,,,,,414,KWT,2022/03/21,0,7752791,0
Kuwait,3/22/22,627753,2553,,,169,,14699.537274125214,,,,,414,KWT,2022/03/22,0,7752791,0
Kuwait,3/24/22,628130,2553,,,377,,14708.365149981395,,,,,414,KWT,2022/03/24,0,7752791,0
Kuwait,3/28/22,628460,2553,,,330,,14716.092468370096,,,,,414,KWT,2022/03/28,0,7814545,0
Kuwait,3/29/22,628978,2554,,,518,,14728.22201662872,,,,,414,KWT,2022/03/29,1,7814545,0
Kuwait,4/1/22,628978,2554,,,0,,14728.22201662872,,,,,414,KWT,2022/04/01,0,,
Kyrgyzstan,3/5/22,200615,2963,,,16,,3074.9406324860815,,,,,417,KGZ,2022/03/05,1,2776676,0
Kyrgyzstan,3/6/22,200641,2966,,,26,,3075.339149329013,,,,,417,KGZ,2022/03/06,3,2781699,0
Kyrgyzstan,3/8/22,200658,2968,,,17,,3075.599718034006,,,,,417,KGZ,2022/03/08,2,2782907,0
Kyrgyzstan,3/9/22,200671,2969,,,13,,3075.798976455472,,,,,417,KGZ,2022/03/09,1,2796955,0
Kyrgyzstan,3/10/22,200707,2971,,,36,,3076.3507690072224,,,,,417,KGZ,2022/03/10,2,2805969,0
Kyrgyzstan,3/12/22,200720,2972,,,13,,3076.5500274286883,,,,,417,KGZ,2022/03/12,1,2813620,0
Kyrgyzstan,3/13/22,200742,2973,,,22,,3076.8872339880913,,,,,417,KGZ,2022/03/13,1,2813620,0
Kyrgyzstan,3/14/22,200758,2974,,,16,,3077.132475122203,,,,,417,KGZ,2022/03/14,1,2813620,0
Kyrgyzstan,3/16/22,200763,2975,,,5,,3077.2091129766127,,,,,417,KGZ,2022/03/16,1,2840706,0
Kyrgyzstan,3/17/22,200776,2976,,,13,,3077.4083713980785,,,,,417,KGZ,2022/03/17,1,2848474,0
Kyrgyzstan,3/18/22,200787,2977,,,11,,3077.57697467778,,,,,417,KGZ,2022/03/18,1,2854706,0
Kyrgyzstan,3/19/22,200809,2979,,,22,,3077.914181237183,,,,,417,KGZ,2022/03/19,2,2854706,0
Kyrgyzstan,3/20/22,200818,2980,,,9,,3078.052129375121,,,,,417,KGZ,2022/03/20,1,2855677,0
Kyrgyzstan,3/22/22,200826,2981,,,8,,3078.1747499421767,,,,,417,KGZ,2022/03/22,1,2861172,0
Kyrgyzstan,3/23/22,200836,2982,,,10,,3078.3280256509966,,,,,417,KGZ,2022/03/23,1,2868392,0
Kyrgyzstan,3/24/22,200847,2982,,,11,,3078.496628930698,,,,,417,KGZ,2022/03/24,0,2875357,0
Kyrgyzstan,3/25/22,200857,2983,,,10,,3078.649904639518,,,,,417,KGZ,2022/03/25,1,2881701,0
Kyrgyzstan,3/26/22,200868,2984,,,11,,3078.8185079192194,,,,,417,KGZ,2022/03/26,1,2886409,0
Kyrgyzstan,3/27/22,200879,2984,,,11,,3078.987111198921,,,,,417,KGZ,2022/03/27,0,2886982,0
Kyrgyzstan,3/28/22,200892,2985,,,13,,3079.186369620387,,,,,417,KGZ,2022/03/28,1,2894397,0
Kyrgyzstan,3/29/22,200909,2986,,,17,,3079.44693832538,,,,,417,KGZ,2022/03/29,1,2902889,0
Kyrgyzstan,3/30/22,200923,2988,,,14,,3079.6615243177275,,,,,417,KGZ,2022/03/30,2,2902889,0
Kyrgyzstan,3/31/22,200935,2988,,,12,,3079.845455168311,,,,,417,KGZ,2022/03/31,0,2902889,0
Kyrgyzstan,4/1/22,200946,2989,,,11,,3080.0140584480127,,,,,417,KGZ,2022/04/01,1,,
Laos,3/5/22,143969,628,,,259,,1978.8040941475813,,,,,418,LAO,2022/03/05,0,9292290,0
Laos,3/6/22,144155,628,,,186,,1981.3605997947097,,,,,418,LAO,2022/03/06,0,9292290,0
Laos,3/7/22,144320,632,,,165,,1983.6284677074852,,,,,418,LAO,2022/03/07,4,9292290,0
Laos,3/8/22,144551,633,,,231,,1986.8034827853705,,,,,418,LAO,2022/03/08,1,9454997,162707
Laos,3/9/22,144759,634,,,208,,1989.6623708208692,,,,,418,LAO,2022/03/09,1,9454997,0
Laos,3/10/22,145094,637,,,335,,1994.2668299165039,,,,,418,LAO,2022/03/10,3,9531259,76262
Laos,3/11/22,145507,640,,,413,,1999.9433720254508,,,,,418,LAO,2022/03/11,3,9580326,49067
Laos,3/12/22,145934,641,,,427,,2005.812339290633,,,,,418,LAO,2022/03/12,1,9580326,0
Laos,3/13/22,146328,641,,,394,,2011.2277329732601,,,,,418,LAO,2022/03/13,0,9580326,0
Laos,3/14/22,146687,641,,,359,,2016.1620637652984,,,,,418,LAO,2022/03/14,0,9679522,99196
Laos,3/15/22,147409,643,,,722,,2026.0857039654427,,,,,418,LAO,2022/03/15,2,9679522,0
Laos,3/16/22,148257,643,,,848,,2037.741170571706,,,,,418,LAO,2022/03/16,0,9766766,87244
Laos,3/17/22,149131,643,,,874,,2049.753998182407,,,,,418,LAO,2022/03/17,0,9766766,0
Laos,3/18/22,150639,645,,,1508,,2070.4809364397715,,,,,418,LAO,2022/03/18,2,9859123,92357
Laos,3/19/22,151956,645,,,1317,,2088.582645779924,,,,,418,LAO,2022/03/19,0,9859123,0
Laos,3/20/22,152957,645,,,1001,,2102.341044450761,,,,,418,LAO,2022/03/20,0,9859123,0
Laos,3/21/22,154094,649,,,1137,,2117.9687160678855,,,,,418,LAO,2022/03/21,4,9859123,0
Laos,3/22/22,156422,651,,,2328,,2149.966270619043,,,,,418,LAO,2022/03/22,2,9859123,0
Laos,3/23/22,159047,653,,,2625,,2186.0459874131957,,,,,418,LAO,2022/03/23,2,9950722,91599
Laos,3/24/22,161866,652,,,2819,,2224.7921670866117,,,,,418,LAO,2022/03/24,,9988048,37326
Laos,3/25/22,164078,654,,,2212,,2255.1953417718178,,,,,418,LAO,2022/03/25,2,9988048,0
Laos,3/27/22,167993,660,,,3915,,2309.0056622476686,,,,,418,LAO,2022/03/27,6,10023472,0
Laos,3/28/22,169256,661,,,1263,,2326.365160270913,,,,,418,LAO,2022/03/28,1,10048983,25511
Laos,3/29/22,171439,663,,,2183,,2356.369739989631,,,,,418,LAO,2022/03/29,2,10048983,0
Laos,3/30/22,174136,664,,,2697,,2393.439071872995,,,,,418,LAO,2022/03/30,1,10048983,0
Laos,3/31/22,176898,665,,,2762,,2431.4018062674522,,,,,418,LAO,2022/03/31,1,10048983,0
Laos,4/1/22,179563,669,,,2665,,2468.031309222278,,,,,418,LAO,2022/04/01,4,,
Latvia,3/5/22,697548,5348,,,7754,,36981.6170272325,,,,,428,LVA,2022/03/05,25,2858242,2691
Latvia,3/6/22,701540,5351,,,3992,,37193.259258552374,,,,,428,LVA,2022/03/06,3,2858242,0
Latvia,3/7/22,704134,5360,,,2594,,37330.78429563747,,,,,428,LVA,2022/03/07,9,2858242,0
Latvia,3/8/22,712271,5369,,,8137,,37762.18029670205,,,,,428,LVA,2022/03/08,9,2859927,1685
Latvia,3/9/22,719813,5384,,,7542,,38162.03142611449,,,,,428,LVA,2022/03/09,15,2861862,1935
Latvia,3/10/22,726868,5397,,,7055,,38536.06347570409,,,,,428,LVA,2022/03/10,13,2861862,0
Latvia,3/11/22,733084,5411,,,6216,,38865.614605434625,,,,,428,LVA,2022/03/11,14,2864173,2311
Latvia,3/12/22,739609,5434,,,6525,,39211.54786178787,,,,,428,LVA,2022/03/12,23,2864173,0
Latvia,3/13/22,742336,5436,,,2727,,39356.12410547757,,,,,428,LVA,2022/03/13,2,2864173,0
Latvia,3/14/22,744433,5444,,,2097,,39467.29989682971,,,,,428,LVA,2022/03/14,8,2864173,0
Latvia,3/15/22,750683,5450,,,6250,,39798.653590654656,,,,,428,LVA,2022/03/15,6,2865341,1168
Latvia,3/16/22,755821,5470,,,5138,,40071.05283527427,,,,,428,LVA,2022/03/16,20,2867250,1909
Latvia,3/17/22,761074,5484,,,5253,,40349.54898786026,,,,,428,LVA,2022/03/17,14,2867250,0
Latvia,3/18/22,765297,5494,,,4223,,40573.4380517039,,,,,428,LVA,2022/03/18,10,2869287,2037
Latvia,3/19/22,769131,5507,,,3834,,40776.70366164388,,,,,428,LVA,2022/03/19,13,2869287,0
Latvia,3/20/22,771038,5511,,,1907,,40877.80630070374,,,,,428,LVA,2022/03/20,4,2869287,0
Latvia,3/21/22,772390,5514,,,1352,,40949.48473175195,,,,,428,LVA,2022/03/21,3,2869287,0
Latvia,3/22/22,777201,5525,,,4811,,41204.54755111064,,,,,428,LVA,2022/03/22,11,2870346,1059
Latvia,3/23/22,780831,5538,,,3630,,41396.997776484175,,,,,428,LVA,2022/03/23,13,2870346,0
Latvia,3/24/22,784155,5559,,,3324,,41573.224925008035,,,,,428,LVA,2022/03/24,21,2872050,1704
Latvia,3/25/22,786974,5569,,,2819,,41722.678695070834,,,,,428,LVA,2022/03/25,10,2872050,0
Latvia,3/26/22,789483,5572,,,2509,,41855.69732191992,,,,,428,LVA,2022/03/26,3,2873621,1571
Latvia,3/27/22,790620,5575,,,1137,,41915.977185900556,,,,,428,LVA,2022/03/27,3,2873621,0
Latvia,3/28/22,791550,5577,,,930,,41965.282615541706,,,,,428,LVA,2022/03/28,2,2874324,703
Latvia,3/29/22,794447,5596,,,2897,,42118.87167970344,,,,,428,LVA,2022/03/29,19,2874324,0
Latvia,3/30/22,796890,5608,,,2443,,42248.39121154574,,,,,428,LVA,2022/03/30,12,2874324,0
Latvia,3/31/22,798895,5616,,,2005,,42354.689476524785,,,,,428,LVA,2022/03/31,8,2874324,0
Latvia,4/1/22,800687,5632,,,1792,,42449.69520761827,,,,,428,LVA,2022/04/01,16,,
Lebanon,3/5/22,1077242,10142,,,1268,,15782.743447237555,,,,,422,LBN,2022/03/05,8,5230447,531
Lebanon,3/6/22,1078249,10152,,,1007,,15797.497070519388,,,,,422,LBN,2022/03/06,10,5234818,4371
Lebanon,3/7/22,1079375,10161,,,1126,,15813.99417063393,,,,,422,LBN,2022/03/07,9,5240748,5930
Lebanon,3/8/22,1080381,10169,,,1006,,15828.733142849944,,,,,422,LBN,2022/03/08,8,5246017,5269
Lebanon,3/9/22,1081463,10176,,,1082,,15844.585596068357,,,,,422,LBN,2022/03/09,7,5251112,5095
Lebanon,3/10/22,1082419,10185,,,956,,15858.592014993315,,,,,422,LBN,2022/03/10,9,5255855,4743
Lebanon,3/11/22,1083351,10193,,,932,,15872.246808338567,,,,,422,LBN,2022/03/11,8,5257965,2110
Lebanon,3/12/22,1084114,10200,,,763,,15883.425571560054,,,,,422,LBN,2022/03/12,7,5258344,379
Lebanon,3/13/22,1084600,10206,,,486,,15890.545989549102,,,,,422,LBN,2022/03/13,6,5258961,617
Lebanon,3/14/22,1085232,10211,,,632,,15899.805463148028,,,,,422,LBN,2022/03/14,5,5261243,2282
Lebanon,3/15/22,1085846,10219,,,614,,15908.801217562173,,,,,422,LBN,2022/03/15,8,5261243,0
Lebanon,3/16/22,1086382,10226,,,536,,15916.654188842276,,,,,422,LBN,2022/03/16,7,5274482,13239
Lebanon,3/17/22,1086890,10232,,,508,,15924.096930279387,,,,,422,LBN,2022/03/17,6,5279069,4587
Lebanon,3/18/22,1087387,10237,,,497,,15931.378509992466,,,,,422,LBN,2022/03/18,5,5281375,2306
Lebanon,3/19/22,1087835,10243,,,448,,15937.942187480312,,,,,422,LBN,2022/03/19,6,5281766,391
Lebanon,3/20/22,1088196,10248,,,361,,15943.231222241724,,,,,422,LBN,2022/03/20,5,5283991,2225
Lebanon,3/21/22,1088595,10252,,,399,,15949.076997504337,,,,,422,LBN,2022/03/21,4,5287493,3502
Lebanon,3/22/22,1089005,10258,,,410,,15955.083934490982,,,,,422,LBN,2022/03/22,6,5290431,2938
Lebanon,3/23/22,1089419,10263,,,414,,15961.149475740911,,,,,422,LBN,2022/03/23,5,5291468,1037
Lebanon,3/24/22,1089830,10267,,,411,,15967.171063793377,,,,,422,LBN,2022/03/24,4,5295144,3676
Lebanon,3/25/22,1090208,10272,,,378,,15972.709166673749,,,,,422,LBN,2022/03/25,5,5296680,1536
Lebanon,3/26/22,1090498,10278,,,290,,15976.957975761863,,,,,422,LBN,2022/03/26,6,5297350,670
Lebanon,3/27/22,1090782,10283,,,284,,15981.11887845505,,,,,422,LBN,2022/03/27,5,5300116,2766
Lebanon,3/28/22,1091084,10288,,,302,,15985.543500333019,,,,,422,LBN,2022/03/28,5,5303331,3215
Lebanon,3/29/22,1091413,10292,,,329,,15990.363700988155,,,,,422,LBN,2022/03/29,4,5307003,3672
Lebanon,3/30/22,1091777,10297,,,364,,15995.696688947031,,,,,422,LBN,2022/03/30,5,5307805,802
Lebanon,3/31/22,1092157,10303,,,380,,16001.264093959044,,,,,422,LBN,2022/03/31,6,5307805,0
Lebanon,4/1/22,1092509,10307,,,352,,16006.421269128065,,,,,422,LBN,2022/04/01,4,,
Lesotho,3/5/22,32707,697,,,0,,1526.7578230759034,,,,,426,LSO,2022/03/05,0,857925,0
Lesotho,3/8/22,32716,697,,,9,,1527.1779417174077,,,,,426,LSO,2022/03/08,0,926760,0
Lesotho,3/14/22,32775,697,,,59,,1529.9320528117141,,,,,426,LSO,2022/03/14,0,926760,0
Lesotho,3/22/22,32880,697,,,105,,1534.8334369625982,,,,,426,LSO,2022/03/22,0,926760,0
Lesotho,3/30/22,32899,697,,,19,,1535.720354094663,,,,,426,LSO,2022/03/30,0,905438,0
Lesotho,3/31/22,32910,697,,,11,,1536.2338324342795,,,,,426,LSO,2022/03/31,0,905438,0
Lesotho,4/1/22,32910,697,,,0,,1536.2338324342795,,,,,426,LSO,2022/04/01,0,,
Liberia,3/5/22,7384,294,,,0,,145.9958791358167,,,,,430,LBR,2022/03/05,0,1200630,0
Liberia,3/9/22,7387,294,,,3,,146.05519490469638,,,,,430,LBR,2022/03/09,0,1200630,0
Liberia,3/10/22,7392,294,,,5,,146.15405451949582,,,,,430,LBR,2022/03/10,0,1200630,0
Liberia,3/14/22,7397,294,,,5,,146.25291413429525,,,,,430,LBR,2022/03/14,0,1200630,0
Liberia,3/28/22,7400,294,,,3,,146.3122299031749,,,,,430,LBR,2022/03/28,0,1200630,0
Liberia,4/1/22,7400,294,,,0,,146.3122299031749,,,,,430,LBR,2022/04/01,0,,
Libya,3/5/22,497279,6288,,,0,,7237.057628359869,,,,,434,LBY,2022/03/05,0,3198389,0
Libya,3/6/22,497958,6299,,,679,,7246.939328833158,,,,,434,LBY,2022/03/06,11,3198389,0
Libya,3/7/22,498453,6308,,,495,,7254.143219458014,,,,,434,LBY,2022/03/07,9,3198389,0
Libya,3/8/22,498839,6314,,,386,,7259.760798813963,,,,,434,LBY,2022/03/08,6,3198389,0
Libya,3/9/22,499132,6321,,,293,,7264.024919931303,,,,,434,LBY,2022/03/09,7,3198389,0
Libya,3/10/22,499465,6326,,,333,,7268.871173624388,,,,,434,LBY,2022/03/10,5,3198389,0
Libya,3/11/22,499767,6336,,,302,,7273.2662745712705,,,,,434,LBY,2022/03/11,10,3198389,0
Libya,3/13/22,500000,6344,,,233,,7276.657196824991,,,,,434,LBY,2022/03/13,8,3198389,0
Libya,3/14/22,500304,6350,,,304,,7281.08140440066,,,,,434,LBY,2022/03/14,6,3198389,0
Libya,3/15/22,500497,6354,,,193,,7283.8901940786345,,,,,434,LBY,2022/03/15,4,3198389,0
Libya,3/16/22,500626,6361,,,129,,7285.767571635416,,,,,434,LBY,2022/03/16,7,3198389,0
Libya,3/17/22,500760,6365,,,134,,7287.7177157641645,,,,,434,LBY,2022/03/17,4,3198389,0
Libya,3/18/22,500864,6368,,,104,,7289.231260461104,,,,,434,LBY,2022/03/18,3,3198389,0
Libya,3/20/22,501015,6374,,,151,,7291.428810934545,,,,,434,LBY,2022/03/20,6,3198389,0
Libya,3/21/22,501135,6377,,,120,,7293.1752086617835,,,,,434,LBY,2022/03/21,3,3198389,0
Libya,3/22/22,501211,6382,,,76,,7294.281260555701,,,,,434,LBY,2022/03/22,5,3198389,0
Libya,3/23/22,501296,6389,,,85,,7295.518292279161,,,,,434,LBY,2022/03/23,7,3198389,0
Libya,3/24/22,501379,6392,,,83,,7296.726217373834,,,,,434,LBY,2022/03/24,3,3198389,0
Libya,3/25/22,501420,6397,,,41,,7297.322903263974,,,,,434,LBY,2022/03/25,5,3198389,0
Libya,3/27/22,501495,6404,,,75,,7298.414401843497,,,,,434,LBY,2022/03/27,7,3198389,0
Libya,3/28/22,501559,6408,,,64,,7299.345813964691,,,,,434,LBY,2022/03/28,4,3198389,0
Libya,3/29/22,501610,6411,,,51,,7300.088032998768,,,,,434,LBY,2022/03/29,3,3198389,0
Libya,3/30/22,501657,6413,,,47,,7300.772038775269,,,,,434,LBY,2022/03/30,2,3198389,0
Libya,3/31/22,501705,6415,,,48,,7301.470597866164,,,,,434,LBY,2022/03/31,2,3198389,0
Libya,4/1/22,501738,6419,,,33,,7301.950857241154,,,,,434,LBY,2022/04/01,4,,
Liechtenstein,3/5/22,12833,78,,,152,,33649.73647638776,,,,,438,LIE,2022/03/05,0,70228,0
Liechtenstein,3/6/22,12932,78,,,99,,33909.32690038545,,,,,438,LIE,2022/03/06,0,70228,0
Liechtenstein,3/7/22,13195,78,,,263,,34598.94590555104,,,,,438,LIE,2022/03/07,0,70228,0
Liechtenstein,3/8/22,13222,79,,,27,,34669.74329391405,,,,,438,LIE,2022/03/08,1,70232,4
Liechtenstein,3/9/22,13471,79,,,249,,35322.65254215067,,,,,438,LIE,2022/03/09,0,70232,0
Liechtenstein,3/10/22,13590,79,,,119,,35634.685476046885,,,,,438,LIE,2022/03/10,0,70232,0
Liechtenstein,3/11/22,13789,79,,,199,,36156.488449537195,,,,,438,LIE,2022/03/11,0,70232,0
Liechtenstein,3/12/22,14025,79,,,236,,36775.31006633978,,,,,438,LIE,2022/03/12,0,70232,0
Liechtenstein,3/13/22,14234,79,,,209,,37323.33429477935,,,,,438,LIE,2022/03/13,0,70232,0
Liechtenstein,3/14/22,14235,79,,,1,,37325.95642027428,,,,,438,LIE,2022/03/14,0,70336,104
Liechtenstein,3/15/22,14424,79,,,189,,37821.538138815326,,,,,438,LIE,2022/03/15,0,70336,0
Liechtenstein,3/16/22,14642,81,,,218,,38393.16149670923,,,,,438,LIE,2022/03/16,2,70336,0
Liechtenstein,3/17/22,14926,81,,,284,,39137.84513726827,,,,,438,LIE,2022/03/17,0,70336,0
Liechtenstein,3/18/22,15043,81,,,117,,39444.63382017463,,,,,438,LIE,2022/03/18,0,70336,0
Liechtenstein,3/19/22,15243,81,,,200,,39969.05891915987,,,,,438,LIE,2022/03/19,0,70336,0
Liechtenstein,3/20/22,15312,81,,,69,,40149.98557830978,,,,,438,LIE,2022/03/20,0,70336,0
Liechtenstein,3/21/22,15458,83,,,146,,40532.815900569,,,,,438,LIE,2022/03/21,2,70336,0
Liechtenstein,3/22/22,15497,83,,,39,,40635.07879487112,,,,,438,LIE,2022/03/22,0,70336,0
Liechtenstein,3/23/22,15649,83,,,152,,41033.641870099906,,,,,438,LIE,2022/03/23,0,70336,0
Liechtenstein,3/24/22,15761,83,,,112,,41327.319925531636,,,,,438,LIE,2022/03/24,0,70336,0
Liechtenstein,3/25/22,15889,83,,,128,,41662.95198888219,,,,,438,LIE,2022/03/25,0,70434,98
Liechtenstein,3/26/22,16017,83,,,128,,41998.58405223274,,,,,438,LIE,2022/03/26,0,70434,0
Liechtenstein,3/27/22,16098,83,,,81,,42210.97621732176,,,,,438,LIE,2022/03/27,0,70434,0
Liechtenstein,3/28/22,16139,83,,,41,,42318.48336261373,,,,,438,LIE,2022/03/28,0,70434,0
Liechtenstein,3/29/22,16176,84,,,37,,42415.502005926006,,,,,438,LIE,2022/03/29,1,70434,0
Liechtenstein,3/30/22,16286,84,,,110,,42703.93581036788,,,,,438,LIE,2022/03/30,0,70434,0
Liechtenstein,3/31/22,16378,84,,,92,,42945.1713559011,,,,,438,LIE,2022/03/31,0,70434,0
Liechtenstein,4/1/22,16429,84,,,51,,43078.89975614233,,,,,438,LIE,2022/04/01,0,,
Lithuania,3/5/22,928612,8503,,,4802,,34111.415715660085,,,,,440,LTU,2022/03/05,22,4453871,1118
Lithuania,3/6/22,931824,8512,,,3212,,34229.404571370214,,,,,440,LTU,2022/03/06,9,4453871,0
Lithuania,3/7/22,934228,8528,,,2404,,34317.712544323884,,,,,440,LTU,2022/03/07,16,4454057,186
Lithuania,3/8/22,938968,8548,,,4740,,34491.83059415764,,,,,440,LTU,2022/03/08,20,4454744,687
Lithuania,3/9/22,944968,8562,,,6000,,34712.23318888392,,,,,440,LTU,2022/03/09,14,4456108,1364
Lithuania,3/10/22,950602,8599,,,5634,,34919.1912253319,,,,,440,LTU,2022/03/10,37,4456108,0
Lithuania,3/11/22,956180,8607,,,5578,,35124.09217089576,,,,,440,LTU,2022/03/11,8,4457101,993
Lithuania,3/12/22,959305,8624,,,3125,,35238.88518898237,,,,,440,LTU,2022/03/12,17,4457172,71
Lithuania,3/13/22,961941,8634,,,2636,,35335.71539559878,,,,,440,LTU,2022/03/13,10,4457268,96
Lithuania,3/14/22,964128,8642,,,2187,,35416.05214137651,,,,,440,LTU,2022/03/14,8,4458042,774
Lithuania,3/15/22,968723,8659,,,4595,,35584.84379517105,,,,,440,LTU,2022/03/15,17,4458042,0
Lithuania,3/17/22,980331,8692,,,11608,,36011.24934843483,,,,,440,LTU,2022/03/17,33,4460124,645
Lithuania,3/18/22,984980,8704,,,4649,,36182.02462558191,,,,,440,LTU,2022/03/18,12,4461091,967
Lithuania,3/19/22,989430,8716,,,4450,,36345.489883337235,,,,,440,LTU,2022/03/19,12,4461161,70
Lithuania,3/20/22,992101,8728,,,2671,,36443.605771756214,,,,,440,LTU,2022/03/20,12,4461230,69
Lithuania,3/21/22,993953,8736,,,1852,,36511.636705995064,,,,,440,LTU,2022/03/21,8,4461755,525
Lithuania,3/22/22,997690,8751,,,3737,,36648.91078874374,,,,,440,LTU,2022/03/22,15,4462289,534
Lithuania,3/23/22,1002365,8769,,,4675,,36820.64114380131,,,,,440,LTU,2022/03/23,18,4462289,0
Lithuania,3/24/22,1006330,8788,,,3965,,36966.29052514959,,,,,440,LTU,2022/03/24,19,4463542,1253
Lithuania,3/25/22,1009756,8804,,,3426,,37092.1404067383,,,,,440,LTU,2022/03/25,16,4464427,885
Lithuania,3/26/22,1013008,8817,,,3252,,37211.598613079936,,,,,440,LTU,2022/03/26,13,4464492,65
Lithuania,3/27/22,1015010,8818,,,2002,,37285.13961218694,,,,,440,LTU,2022/03/27,1,4464562,70
Lithuania,3/28/22,1016117,8841,,,1107,,37325.80389091394,,,,,440,LTU,2022/03/28,23,4465144,582
Lithuania,3/29/22,1018758,8858,,,2641,,37422.817766359294,,,,,440,LTU,2022/03/29,17,4465769,625
Lithuania,3/30/22,1021961,8866,,,3203,,37540.47601817734,,,,,440,LTU,2022/03/30,8,4465769,0
Lithuania,3/31/22,1024839,8876,,,2878,,37646.19579611438,,,,,440,LTU,2022/03/31,10,4465769,0
Lithuania,4/1/22,1027432,8888,,,2593,,37741.446450801915,,,,,440,LTU,2022/04/01,12,,
Luxembourg,3/5/22,186360,996,,,0,,29771.109435505514,,,,,442,LUX,2022/03/05,0,1264033,0
Luxembourg,3/7/22,187971,999,,,1611,,30028.4675450816,,,,,442,LUX,2022/03/07,3,1264033,0
Luxembourg,3/8/22,188748,999,,,777,,30152.59370966299,,,,,442,LUX,2022/03/08,0,1264033,0
Luxembourg,3/9/22,189830,1000,,,1082,,30325.443786982247,,,,,442,LUX,2022/03/09,1,1264033,0
Luxembourg,3/10/22,191006,1004,,,1176,,30513.310414456784,,,,,442,LUX,2022/03/10,4,1264033,0
Luxembourg,3/11/22,191964,1004,,,958,,30666.35142561376,,,,,442,LUX,2022/03/11,0,1264033,0
Luxembourg,3/14/22,193939,1006,,,1975,,30981.858729408155,,,,,442,LUX,2022/03/14,2,1276044,2849
Luxembourg,3/15/22,194846,1007,,,907,,31126.752463353227,,,,,442,LUX,2022/03/15,1,1276044,0
Luxembourg,3/16/22,196296,1008,,,1450,,31358.39073702506,,,,,442,LUX,2022/03/16,1,1276044,0
Luxembourg,3/17/22,197701,1010,,,1405,,31582.840236686392,,,,,442,LUX,2022/03/17,2,1276044,0
Luxembourg,3/18/22,199202,1010,,,1501,,31822.62578757013,,,,,442,LUX,2022/03/18,0,1276044,0
Luxembourg,3/21/22,201718,1015,,,2516,,32224.558130024154,,,,,442,LUX,2022/03/21,5,1278357,2313
Luxembourg,3/22/22,202577,1019,,,859,,32361.78383835802,,,,,442,LUX,2022/03/22,4,1278357,0
Luxembourg,3/23/22,203861,1019,,,1284,,32566.903523457768,,,,,442,LUX,2022/03/23,0,1278357,0
Luxembourg,3/24/22,206044,1023,,,2183,,32915.63893823406,,,,,442,LUX,2022/03/24,4,1278357,0
Luxembourg,3/25/22,208223,1025,,,2179,,33263.73535087607,,,,,442,LUX,2022/03/25,2,1278357,0
Luxembourg,3/28/22,211280,1032,,,3057,,33752.092731989724,,,,,442,LUX,2022/03/28,7,1280144,1787
Luxembourg,3/29/22,212390,1035,,,1110,,33929.415824248856,,,,,442,LUX,2022/03/29,3,1280144,0
Luxembourg,3/30/22,214099,1035,,,1709,,34202.42948611448,,,,,442,LUX,2022/03/30,0,1280144,0
Luxembourg,3/31/22,215831,1036,,,1732,,34479.11741025215,,,,,442,LUX,2022/03/31,1,1280144,0
Luxembourg,4/1/22,216979,1037,,,1148,,34662.51102278681,,,,,442,LUX,2022/04/01,1,,
MS Zaandam,3/5/22,9,2,,,0,,,,,,,8888,,2022/03/05,0,,
MS Zaandam,4/1/22,9,2,,,0,,,,,,,8888,,2022/04/01,0,,
Madagascar,3/5/22,63791,1373,,,132,,230.3671092782826,,,,,450,MDG,2022/03/05,7,1185489,0
Madagascar,3/12/22,63870,1377,,,79,,230.65240033239658,,,,,450,MDG,2022/03/12,4,1228391,0
Madagascar,3/19/22,63928,1380,,,58,,230.86185452402455,,,,,450,MDG,2022/03/19,3,1279175,0
Madagascar,3/26/22,64009,1384,,,81,,231.15436813647054,,,,,450,MDG,2022/03/26,4,1279175,0
Madagascar,4/1/22,64009,1384,,,0,,231.15436813647054,,,,,450,MDG,2022/04/01,0,,
Malawi,3/5/22,85411,2618,,,15,,446.4777883690788,,,,,454,MWI,2022/03/05,1,1938721,0
Malawi,3/6/22,85429,2619,,,18,,446.57188163798605,,,,,454,MWI,2022/03/06,1,1948988,10267
Malawi,3/7/22,85440,2619,,,11,,446.6293830800961,,,,,454,MWI,2022/03/07,0,1948988,0
Malawi,3/8/22,85452,2619,,,12,,446.69211192603433,,,,,454,MWI,2022/03/08,0,1948988,0
Malawi,3/9/22,85461,2620,,,9,,446.73915856048797,,,,,454,MWI,2022/03/09,1,1955495,6507
Malawi,3/10/22,85476,2620,,,15,,446.81756961791075,,,,,454,MWI,2022/03/10,0,1934835,
Malawi,3/11/22,85486,2620,,,10,,446.8698436561926,,,,,454,MWI,2022/03/11,0,1934835,0
Malawi,3/12/22,85495,2620,,,9,,446.9168902906463,,,,,454,MWI,2022/03/12,0,1934835,0
Malawi,3/13/22,85499,2623,,,4,,446.937799905959,,,,,454,MWI,2022/03/13,3,1934835,0
Malawi,3/15/22,85515,2624,,,16,,447.02143836720995,,,,,454,MWI,2022/03/15,1,1934835,0
Malawi,3/16/22,85526,2624,,,11,,447.07893980932,,,,,454,MWI,2022/03/16,0,1934835,0
Malawi,3/17/22,85539,2624,,,13,,447.1468960590864,,,,,454,MWI,2022/03/17,0,1934835,0
Malawi,3/18/22,85544,2624,,,5,,447.1730330782273,,,,,454,MWI,2022/03/18,0,1993981,59146
Malawi,3/19/22,85556,2626,,,12,,447.2357619241655,,,,,454,MWI,2022/03/19,2,1993981,0
Malawi,3/20/22,85561,2626,,,5,,447.26189894330645,,,,,454,MWI,2022/03/20,0,1993981,0
Malawi,3/21/22,85563,2626,,,2,,447.27235375096285,,,,,454,MWI,2022/03/21,0,1993981,0
Malawi,3/22/22,85566,2626,,,3,,447.2880359624474,,,,,454,MWI,2022/03/22,0,1993981,0
Malawi,3/23/22,85574,2626,,,8,,447.32985519307283,,,,,454,MWI,2022/03/23,0,1993981,0
Malawi,3/24/22,85586,2626,,,12,,447.39258403901107,,,,,454,MWI,2022/03/24,0,1993981,0
Malawi,3/25/22,85596,2626,,,10,,447.4448580772929,,,,,454,MWI,2022/03/25,0,1993981,0
Malawi,3/26/22,85608,2626,,,12,,447.50758692323114,,,,,454,MWI,2022/03/26,0,1993981,0
Malawi,3/27/22,85610,2626,,,2,,447.5180417308875,,,,,454,MWI,2022/03/27,0,1993981,0
Malawi,3/28/22,85620,2626,,,10,,447.5703157691693,,,,,454,MWI,2022/03/28,0,1993981,0
Malawi,3/29/22,85625,2626,,,5,,447.5964527883103,,,,,454,MWI,2022/03/29,0,1993981,0
Malawi,3/30/22,85631,2626,,,6,,447.62781721127936,,,,,454,MWI,2022/03/30,0,1993981,0
Malawi,3/31/22,85640,2626,,,9,,447.67486384573306,,,,,454,MWI,2022/03/31,0,1993981,0
Malawi,4/1/22,85650,2626,,,10,,447.7271378840149,,,,,454,MWI,2022/04/01,0,,
Malaysia,3/5/22,3595172,33173,,,33406,,11107.866965820118,,,,,458,MYS,2022/03/05,67,67672349,71613
Malaysia,3/6/22,3622607,33228,,,27435,,11192.631847780502,,,,,458,MYS,2022/03/06,55,67731132,58783
Malaysia,3/7/22,3649463,33305,,,26856,,11275.607815337566,,,,,458,MYS,2022/03/07,77,67797494,66362
Malaysia,3/8/22,3680953,33384,,,31490,,11372.901277445546,,,,,458,MYS,2022/03/08,79,67869343,71849
Malaysia,3/9/22,3711199,33497,,,30246,,11466.351199799246,,,,,458,MYS,2022/03/09,113,67869343,0
Malaysia,3/10/22,3741986,33567,,,30787,,11561.472629393353,,,,,458,MYS,2022/03/10,70,67935466,66123
Malaysia,3/11/22,3774786,33643,,,32800,,11662.81354895962,,,,,458,MYS,2022/03/11,76,68064755,129289
Malaysia,3/12/22,3801036,33720,,,26250,,11743.917181234454,,,,,458,MYS,2022/03/12,77,68113082,48327
Malaysia,3/13/22,3823571,33807,,,22535,,11813.542718503535,,,,,458,MYS,2022/03/13,87,68159756,46674
Malaysia,3/14/22,3845601,33899,,,22030,,11881.607976370758,,,,,458,MYS,2022/03/14,92,68214783,55027
Malaysia,3/15/22,3872135,33994,,,26534,,11963.58907270525,,,,,458,MYS,2022/03/15,95,68275177,60394
Malaysia,3/16/22,3900433,34099,,,28298,,12051.020333128612,,,,,458,MYS,2022/03/16,105,68328203,53026
Malaysia,3/17/22,3927437,34185,,,27004,,12134.453570688598,,,,,458,MYS,2022/03/17,86,68376641,48438
Malaysia,3/18/22,3951678,34244,,,24241,,12209.350071639998,,,,,458,MYS,2022/03/18,59,68418688,42047
Malaysia,3/19/22,3974019,34329,,,22341,,12278.37621444579,,,,,458,MYS,2022/03/19,85,68455223,36535
Malaysia,3/20/22,3993124,34400,,,19105,,12337.40421043096,,,,,458,MYS,2022/03/20,71,68484635,29412
Malaysia,3/21/22,4010952,34463,,,17828,,12392.486707809845,,,,,458,MYS,2022/03/21,63,68515709,31074
Malaysia,3/22/22,4032435,34535,,,21483,,12458.861920463569,,,,,458,MYS,2022/03/22,72,68546897,31188
Malaysia,3/23/22,4054926,34600,,,22491,,12528.351512596646,,,,,458,MYS,2022/03/23,65,68546897,0
Malaysia,3/24/22,4079242,34664,,,24316,,12603.479738211687,,,,,458,MYS,2022/03/24,64,68607824,60927
Malaysia,3/25/22,4101081,34717,,,21839,,12670.954870602167,,,,,458,MYS,2022/03/25,53,68607824,0
Malaysia,3/26/22,4122004,34751,,,20923,,12735.599872434028,,,,,458,MYS,2022/03/26,34,68675263,67439
Malaysia,3/27/22,4137736,34758,,,15732,,12784.206437879653,,,,,458,MYS,2022/03/27,7,68701958,26695
Malaysia,3/28/22,4152203,34842,,,14467,,12828.904580665177,,,,,458,MYS,2022/03/28,84,68745333,43375
Malaysia,3/29/22,4167418,34906,,,15215,,12875.913790762763,,,,,458,MYS,2022/03/29,64,68795057,49724
Malaysia,3/30/22,4183359,34939,,,15941,,12925.166095604405,,,,,458,MYS,2022/03/30,33,68795057,0
Malaysia,3/31/22,4201919,34983,,,18560,,12982.51022570044,,,,,458,MYS,2022/03/31,44,68909031,113974
Malaysia,4/1/22,4219395,35013,,,17476,,13036.505161991297,,,,,458,MYS,2022/04/01,30,,
Maldives,3/5/22,172270,297,,,323,,31869.86395136733,,,,,462,MDV,2022/03/05,0,903380,0
Maldives,3/6/22,172576,297,,,306,,31926.473798520743,,,,,462,MDV,2022/03/06,0,906588,3208
Maldives,3/7/22,173064,297,,,488,,32016.7535547654,,,,,462,MDV,2022/03/07,0,906588,0
Maldives,3/8/22,173337,297,,,273,,32067.25841840227,,,,,462,MDV,2022/03/08,0,906588,0
Maldives,3/9/22,173666,297,,,329,,32128.123254067214,,,,,462,MDV,2022/03/09,0,909494,2906
Maldives,3/10/22,173991,297,,,325,,32188.24809173015,,,,,462,MDV,2022/03/10,0,910281,787
Maldives,3/11/22,174163,297,,,172,,32220.068005816385,,,,,462,MDV,2022/03/11,0,910281,0
Maldives,3/12/22,174367,297,,,204,,32257.80790391866,,,,,462,MDV,2022/03/12,0,911964,1683
Maldives,3/13/22,174658,297,,,291,,32311.64275856455,,,,,462,MDV,2022/03/13,0,911964,0
Maldives,3/28/22,177000,298,,,2342,,32744.91158873871,,,,,462,MDV,2022/03/28,1,927010,0
Maldives,4/1/22,177000,298,,,0,,32744.91158873871,,,,,462,MDV,2022/04/01,0,,
Mali,3/5/22,30398,724,,,2,,150.1073980459274,,,,,466,MLI,2022/03/05,0,1634711,0
Mali,3/6/22,30398,725,,,0,,150.1073980459274,,,,,466,MLI,2022/03/06,1,1735358,0
Mali,3/8/22,30401,725,,,3,,150.12221225061646,,,,,466,MLI,2022/03/08,0,1735358,0
Mali,3/9/22,30402,725,,,1,,150.12715031884613,,,,,466,MLI,2022/03/09,0,1735358,0
Mali,3/10/22,30407,726,,,5,,150.15184065999455,,,,,466,MLI,2022/03/10,1,1735358,0
Mali,3/11/22,30409,726,,,2,,150.1617167964539,,,,,466,MLI,2022/03/11,0,1735358,0
Mali,3/12/22,30414,726,,,5,,150.18640713760234,,,,,466,MLI,2022/03/12,0,1735358,0
Mali,3/13/22,30420,726,,,6,,150.21603554698044,,,,,466,MLI,2022/03/13,0,1769121,0
Mali,3/14/22,30423,726,,,3,,150.2308497516695,,,,,466,MLI,2022/03/14,0,1769121,0
Mali,3/15/22,30428,726,,,5,,150.2555400928179,,,,,466,MLI,2022/03/15,0,1769121,0
Mali,3/16/22,30433,727,,,5,,150.28023043396632,,,,,466,MLI,2022/03/16,1,1769121,0
Mali,3/17/22,30439,727,,,6,,150.30985884334441,,,,,466,MLI,2022/03/17,0,1769121,0
Mali,3/18/22,30444,727,,,5,,150.33454918449286,,,,,466,MLI,2022/03/18,0,1814171,0
Mali,3/19/22,30448,727,,,4,,150.3543014574116,,,,,466,MLI,2022/03/19,0,1814171,0
Mali,3/20/22,30453,727,,,5,,150.37899179856,,,,,466,MLI,2022/03/20,0,1814171,0
Mali,3/21/22,30454,727,,,1,,150.38392986678969,,,,,466,MLI,2022/03/21,0,1814171,0
Mali,3/22/22,30458,727,,,4,,150.40368213970842,,,,,466,MLI,2022/03/22,0,1814171,0
Mali,3/23/22,30463,727,,,5,,150.42837248085684,,,,,466,MLI,2022/03/23,0,1814171,0
Mali,3/24/22,30466,727,,,3,,150.4431866855459,,,,,466,MLI,2022/03/24,0,1814171,0
Mali,3/25/22,30468,727,,,2,,150.45306282200525,,,,,466,MLI,2022/03/25,0,1814171,0
Mali,3/26/22,30470,727,,,2,,150.46293895846463,,,,,466,MLI,2022/03/26,0,1814171,0
Mali,3/27/22,30472,727,,,2,,150.472815094924,,,,,466,MLI,2022/03/27,0,1873615,0
Mali,3/28/22,30473,727,,,1,,150.47775316315366,,,,,466,MLI,2022/03/28,0,1873615,0
Mali,3/29/22,30476,727,,,3,,150.49256736784272,,,,,466,MLI,2022/03/29,0,1873615,0
Mali,3/30/22,30480,727,,,4,,150.51231964076146,,,,,466,MLI,2022/03/30,0,1873615,0
Mali,3/31/22,30484,727,,,4,,150.5320719136802,,,,,466,MLI,2022/03/31,0,1873615,0
Mali,4/1/22,30489,728,,,5,,150.5567622548286,,,,,466,MLI,2022/04/01,1,,
Malta,3/5/22,71800,608,,,121,,16261.304210953052,,,,,470,MLT,2022/03/05,1,1245089,620
Malta,3/6/22,71899,608,,,99,,16283.725786397124,,,,,470,MLT,2022/03/06,0,1245686,597
Malta,3/7/22,71971,609,,,72,,16300.032386720086,,,,,470,MLT,2022/03/07,1,1246081,395
Malta,3/8/22,72130,610,,,159,,16336.042795766625,,,,,470,MLT,2022/03/08,1,1246808,727
Malta,3/9/22,72268,612,,,138,,16367.297113052302,,,,,470,MLT,2022/03/09,2,1247286,478
Malta,3/10/22,72421,613,,,153,,16401.948638738595,,,,,470,MLT,2022/03/10,1,1247840,554
Malta,3/11/22,72560,613,,,139,,16433.429436584312,,,,,470,MLT,2022/03/11,0,1248306,466
Malta,3/12/22,72687,614,,,127,,16462.192467709534,,,,,470,MLT,2022/03/12,1,1248861,555
Malta,3/13/22,72858,614,,,171,,16500.920643476566,,,,,470,MLT,2022/03/13,0,1249336,475
Malta,3/14/22,73001,615,,,143,,16533.30736356245,,,,,470,MLT,2022/03/14,1,1249640,304
Malta,3/15/22,73195,617,,,194,,16577.244592210427,,,,,470,MLT,2022/03/15,2,1250293,653
Malta,3/16/22,73424,618,,,229,,16629.108640459846,,,,,470,MLT,2022/03/16,1,1250797,504
Malta,3/17/22,73728,619,,,304,,16697.95873071235,,,,,470,MLT,2022/03/17,1,1251260,463
Malta,3/18/22,74029,621,,,301,,16766.12937928473,,,,,470,MLT,2022/03/18,2,1251633,373
Malta,3/19/22,74315,621,,,286,,16830.902819456493,,,,,470,MLT,2022/03/19,0,1252092,459
Malta,3/20/22,74518,622,,,203,,16876.878373144842,,,,,470,MLT,2022/03/20,1,1252615,523
Malta,3/21/22,74769,624,,,251,,16933.724993715165,,,,,470,MLT,2022/03/21,2,1252837,222
Malta,3/22/22,75102,624,,,333,,17009.14302020886,,,,,470,MLT,2022/03/22,0,1253224,387
Malta,3/23/22,75477,626,,,375,,17094.073230224283,,,,,470,MLT,2022/03/23,2,1253673,449
Malta,3/24/22,75892,626,,,415,,17188.06266264135,,,,,470,MLT,2022/03/24,0,1254115,442
Malta,3/25/22,76357,627,,,465,,17293.376123060476,,,,,470,MLT,2022/03/25,1,1254627,512
Malta,3/26/22,76749,630,,,392,,17382.1565025966,,,,,470,MLT,2022/03/26,3,1255212,585
Malta,3/27/22,77102,631,,,353,,17462.104140291118,,,,,470,MLT,2022/03/27,1,1255212,0
Malta,3/30/22,78779,638,,,1677,,17841.912039480092,,,,,470,MLT,2022/03/30,7,1256198,347
Malta,3/31/22,79539,638,,,760,,18014.03726511135,,,,,470,MLT,2022/03/31,0,1256198,0
Malta,4/1/22,80198,638,,,659,,18163.287954178453,,,,,470,MLT,2022/04/01,0,,
Marshall Islands,3/5/22,7,0,,,0,,11.983633780151678,,,,,584,MHL,2022/03/05,0,55911,0
Marshall Islands,4/1/22,7,0,,,0,,11.983633780151678,,,,,584,MHL,2022/04/01,0,,
Mauritania,3/5/22,58646,980,,,1,,1261.2965249071974,,,,,478,MRT,2022/03/05,0,2544768,0
Mauritania,3/6/22,58649,980,,,3,,1261.361045753883,,,,,478,MRT,2022/03/06,0,2544768,0
Mauritania,3/7/22,58652,980,,,3,,1261.4255666005686,,,,,478,MRT,2022/03/07,0,2544768,0
Mauritania,3/8/22,58654,980,,,2,,1261.468580498359,,,,,478,MRT,2022/03/08,0,2544768,0
Mauritania,3/9/22,58656,981,,,2,,1261.5115943961493,,,,,478,MRT,2022/03/09,1,2544768,0
Mauritania,3/10/22,58657,981,,,1,,1261.5331013450445,,,,,478,MRT,2022/03/10,0,2544768,0
Mauritania,3/13/22,58658,981,,,1,,1261.5546082939397,,,,,478,MRT,2022/03/13,0,2544768,0
Mauritania,3/14/22,58659,981,,,1,,1261.576115242835,,,,,478,MRT,2022/03/14,0,2544768,0
Mauritania,3/15/22,58660,981,,,1,,1261.5976221917301,,,,,478,MRT,2022/03/15,0,2544768,0
Mauritania,3/18/22,58661,981,,,1,,1261.6191291406253,,,,,478,MRT,2022/03/18,0,2544768,0
Mauritania,3/19/22,58662,981,,,1,,1261.6406360895205,,,,,478,MRT,2022/03/19,0,2544768,0
Mauritania,3/21/22,58665,981,,,3,,1261.705156936206,,,,,478,MRT,2022/03/21,0,2544768,0
Mauritania,3/26/22,58666,982,,,1,,1261.7266638851013,,,,,478,MRT,2022/03/26,1,2544768,0
Mauritania,3/28/22,58668,982,,,2,,1261.7696777828917,,,,,478,MRT,2022/03/28,0,2544768,0
Mauritania,3/31/22,58669,982,,,1,,1261.7911847317869,,,,,478,MRT,2022/03/31,0,2544768,0
Mauritania,4/1/22,58670,982,,,1,,1261.812691680682,,,,,478,MRT,2022/04/01,0,,
Mauritius,3/5/22,169796,904,,,0,,13351.187756876849,,,,,480,MUS,2022/03/05,0,2036896,0
Mauritius,3/10/22,181362,934,,,11566,,14260.631074717303,,,,,480,MUS,2022/03/10,30,2036896,0
Mauritius,3/18/22,192558,934,,,11196,,15140.981013031475,,,,,480,MUS,2022/03/18,0,2036896,0
Mauritius,3/24/22,204200,968,,,11642,,16056.400268288138,,,,,480,MUS,2022/03/24,34,2036896,0
Mauritius,3/30/22,210343,968,,,6143,,16539.42899917988,,,,,480,MUS,2022/03/30,0,2036896,0
Mauritius,4/1/22,210343,968,,,0,,16539.42899917988,,,,,480,MUS,2022/04/01,0,,
Mexico,3/5/22,5554392,319604,,,9748,,4346.42197417143,,,,,484,MEX,2022/03/05,308,183043385,0
Mexico,3/6/22,5564985,319859,,,10593,,4354.711206903365,,,,,484,MEX,2022/03/06,255,183509755,466370
Mexico,3/7/22,5566669,319901,,,1684,,4356.028970324547,,,,,484,MEX,2022/03/07,42,183509755,0
Mexico,3/8/22,5575608,320166,,,8939,,4363.023915230689,,,,,484,MEX,2022/03/08,265,183907915,398160
Mexico,3/9/22,5583993,320408,,,8385,,4369.585344141978,,,,,484,MEX,2022/03/09,242,184272842,364927
Mexico,3/10/22,5591871,320607,,,7878,,4375.750035491187,,,,,484,MEX,2022/03/10,199,184812990,540148
Mexico,3/12/22,5605636,321054,,,13765,,4386.52142117561,,,,,484,MEX,2022/03/12,447,186141053,662692
Mexico,3/13/22,5606827,321103,,,1191,,4387.4534023125625,,,,,484,MEX,2022/03/13,49,186402474,261421
Mexico,3/14/22,5607845,321115,,,1018,,4388.250007516103,,,,,484,MEX,2022/03/14,12,186532017,129543
Mexico,3/16/22,5613870,321375,,,6025,,4392.964689590106,,,,,484,MEX,2022/03/16,260,187180552,384512
Mexico,3/17/22,5624954,321806,,,11084,,4401.638139566578,,,,,484,MEX,2022/03/17,431,187650994,470442
Mexico,3/19/22,5629814,321931,,,4860,,4405.4411860196315,,,,,484,MEX,2022/03/19,125,188160158,0
Mexico,3/20/22,5633928,322072,,,4114,,4408.66047266734,,,,,484,MEX,2022/03/20,141,188160158,0
Mexico,3/21/22,5634829,322092,,,901,,4409.365523048864,,,,,484,MEX,2022/03/21,20,188763277,603119
Mexico,3/22/22,5636054,322119,,,1225,,4410.32410986059,,,,,484,MEX,2022/03/22,27,188885665,122388
Mexico,3/24/22,5640305,322277,,,4251,,4413.650601727243,,,,,484,MEX,2022/03/24,158,189401299,515634
Mexico,3/25/22,5647041,322634,,,6736,,4418.92165541197,,,,,484,MEX,2022/03/25,357,189401299,0
Mexico,3/27/22,5650896,322750,,,3855,,4421.938269419486,,,,,484,MEX,2022/03/27,116,190197035,392537
Mexico,3/28/22,5651553,322761,,,657,,4422.45238495851,,,,,484,MEX,2022/03/28,11,190441475,244440
Mexico,3/29/22,5654311,322845,,,2758,,4424.610574694626,,,,,484,MEX,2022/03/29,84,191907868,1466393
Mexico,3/31/22,5659535,323016,,,5224,,4428.698458371736,,,,,484,MEX,2022/03/31,171,191907868,0
Mexico,4/1/22,5659535,323016,,,0,,4428.698458371736,,,,,484,MEX,2022/04/01,0,,
Micronesia,3/5/22,1,0,,,0,,0.8786188112287484,,,,,583,FSM,2022/03/05,0,106843,0
Micronesia,4/1/22,1,0,,,0,,0.8786188112287484,,,,,583,FSM,2022/04/01,0,,
Moldova,3/5/22,504875,11285,,,568,,12515.608100520505,,,,,498,MDA,2022/03/05,16,2082297,3851
Moldova,3/6/22,505393,11292,,,518,,12528.449071049983,,,,,498,MDA,2022/03/06,7,2083850,1553
Moldova,3/7/22,505644,11293,,,251,,12534.671240167547,,,,,498,MDA,2022/03/07,1,2083850,0
Moldova,3/8/22,505996,11298,,,352,,12543.397150643177,,,,,498,MDA,2022/03/08,5,2086634,2784
Moldova,3/9/22,506222,11304,,,226,,12548.999581800825,,,,,498,MDA,2022/03/09,6,2090321,3687
Moldova,3/10/22,506681,11319,,,459,,12560.377970744898,,,,,498,MDA,2022/03/10,15,2094214,3893
Moldova,3/11/22,507028,11333,,,347,,12568.979933628543,,,,,498,MDA,2022/03/11,14,2094214,0
Moldova,3/12/22,507599,11339,,,571,,12583.134748633043,,,,,498,MDA,2022/03/12,6,2094214,0
Moldova,3/13/22,507994,11346,,,395,,12592.92660839973,,,,,498,MDA,2022/03/13,7,2094214,0
Moldova,3/14/22,508235,11350,,,241,,12598.900882333328,,,,,498,MDA,2022/03/14,4,2099809,5595
Moldova,3/15/22,508578,11357,,,343,,12607.403687143387,,,,,498,MDA,2022/03/15,7,2103369,3560
Moldova,3/16/22,508917,11368,,,339,,12615.80733387986,,,,,498,MDA,2022/03/16,11,2107217,3848
Moldova,3/17/22,509367,11373,,,450,,12626.962617158362,,,,,498,MDA,2022/03/17,5,2110481,3264
Moldova,3/18/22,509834,11378,,,467,,12638.53932224961,,,,,498,MDA,2022/03/18,5,2111987,1506
Moldova,3/19/22,510206,11381,,,372,,12647.761023093171,,,,,498,MDA,2022/03/19,3,2111987,0
Moldova,3/20/22,510460,11389,,,254,,12654.057560765927,,,,,498,MDA,2022/03/20,8,2112400,413
Moldova,3/21/22,510700,11389,,,240,,12660.007045181128,,,,,498,MDA,2022/03/21,0,2112563,163
Moldova,3/22/22,510973,11392,,,273,,12666.77458370342,,,,,498,MDA,2022/03/22,3,2113955,1392
Moldova,3/23/22,511231,11401,,,258,,12673.170279449761,,,,,498,MDA,2022/03/23,9,2115629,1674
Moldova,3/24/22,511662,11408,,,431,,12683.854561878728,,,,,498,MDA,2022/03/24,7,2117174,1545
Moldova,3/25/22,512047,11409,,,385,,12693.398526461448,,,,,498,MDA,2022/03/25,1,2118777,1603
Moldova,3/26/22,512386,11415,,,339,,12701.80217319792,,,,,498,MDA,2022/03/26,6,2120425,1648
Moldova,3/27/22,512602,11417,,,216,,12707.1567091716,,,,,498,MDA,2022/03/27,2,2125665,5240
Moldova,3/28/22,512638,11421,,,36,,12708.04913183388,,,,,498,MDA,2022/03/28,4,2125665,0
Moldova,3/29/22,512942,11423,,,304,,12715.58514542647,,,,,498,MDA,2022/03/29,2,2125665,0
Moldova,3/30/22,513146,11428,,,204,,12720.642207179391,,,,,498,MDA,2022/03/30,5,2125665,0
Moldova,3/31/22,513442,11431,,,296,,12727.979904624806,,,,,498,MDA,2022/03/31,3,2125665,0
Moldova,4/1/22,513757,11435,,,315,,12735.78860291976,,,,,498,MDA,2022/04/01,4,,
Monaco,3/5/22,9537,51,,,92,,24301.804097441647,,,,,492,MCO,2022/03/05,0,49980,0
Monaco,3/6/22,9539,51,,,2,,24306.900417898276,,,,,492,MCO,2022/03/06,0,49980,0
Monaco,3/8/22,9605,51,,,66,,24475.07899296708,,,,,492,MCO,2022/03/08,0,49980,0
Monaco,3/9/22,9654,51,,,49,,24599.93884415452,,,,,492,MCO,2022/03/09,0,49980,0
Monaco,3/11/22,9736,51,,,82,,24808.887982876364,,,,,492,MCO,2022/03/11,0,49980,0
Monaco,3/12/22,9777,51,,,41,,24913.362552237286,,,,,492,MCO,2022/03/12,0,49980,0
Monaco,3/13/22,9777,52,,,0,,24913.362552237286,,,,,492,MCO,2022/03/13,1,49980,0
Monaco,3/14/22,9827,52,,,50,,25040.77056365304,,,,,492,MCO,2022/03/14,0,49980,0
Monaco,3/15/22,9901,52,,,74,,25229.334420548363,,,,,492,MCO,2022/03/15,0,49980,0
Monaco,3/16/22,9964,53,,,63,,25389.86851493222,,,,,492,MCO,2022/03/16,1,49980,0
Monaco,3/17/22,10015,54,,,51,,25519.824686576292,,,,,492,MCO,2022/03/17,1,49980,0
Monaco,3/18/22,10063,54,,,48,,25642.13637753542,,,,,492,MCO,2022/03/18,0,49980,0
Monaco,3/19/22,10124,54,,,61,,25797.574151462642,,,,,492,MCO,2022/03/19,0,49980,0
Monaco,3/20/22,10127,54,,,3,,25805.21863214759,,,,,492,MCO,2022/03/20,0,49980,0
Monaco,3/21/22,10175,54,,,48,,25927.530323106716,,,,,492,MCO,2022/03/21,0,49980,0
Monaco,3/22/22,10272,54,,,97,,26174.701865253286,,,,,492,MCO,2022/03/22,0,49980,0
Monaco,3/23/22,10369,54,,,97,,26421.873407399857,,,,,492,MCO,2022/03/23,0,49980,0
Monaco,3/24/22,10431,54,,,62,,26579.8593415554,,,,,492,MCO,2022/03/24,0,49980,0
Monaco,3/25/22,10490,54,,,59,,26730.20079502599,,,,,492,MCO,2022/03/25,0,49980,0
Monaco,3/26/22,10530,54,,,40,,26832.127204158598,,,,,492,MCO,2022/03/26,0,49980,0
Monaco,3/29/22,10670,54,,,140,,27188.86963612272,,,,,492,MCO,2022/03/29,0,49980,0
Monaco,3/30/22,10721,54,,,51,,27318.825807766792,,,,,492,MCO,2022/03/30,0,49980,0
Monaco,3/31/22,10758,54,,,37,,27413.107736214453,,,,,492,MCO,2022/03/31,0,49980,0
Monaco,4/1/22,10758,54,,,0,,27413.107736214453,,,,,492,MCO,2022/04/01,0,,
Mongolia,3/5/22,911183,2174,,,0,,27794.442959931574,,,,,496,MNG,2022/03/05,1,5556224,0
Mongolia,3/6/22,911183,2176,,,0,,27794.442959931574,,,,,496,MNG,2022/03/06,2,5568712,12488
Mongolia,3/7/22,913255,2176,,,2072,,27857.64660378026,,,,,496,MNG,2022/03/07,0,5568712,0
Mongolia,3/8/22,913444,2176,,,189,,27863.411801023216,,,,,496,MNG,2022/03/08,0,5568712,0
Mongolia,3/9/22,914016,2177,,,572,,27880.859911197662,,,,,496,MNG,2022/03/09,1,5568712,0
Mongolia,3/10/22,914536,2177,,,520,,27896.721829538063,,,,,496,MNG,2022/03/10,0,5568712,0
Mongolia,3/14/22,915811,2177,,,1275,,27935.61403316117,,,,,496,MNG,2022/03/14,0,5568712,0
Mongolia,3/15/22,915908,2177,,,97,,27938.57289100544,,,,,496,MNG,2022/03/15,0,5568712,0
Mongolia,3/16/22,916126,2177,,,218,,27945.222695232762,,,,,496,MNG,2022/03/16,0,5568712,0
Mongolia,3/17/22,916445,2177,,,319,,27954.953372060816,,,,,496,MNG,2022/03/17,0,5568712,0
Mongolia,3/18/22,916723,2177,,,278,,27963.43339763511,,,,,496,MNG,2022/03/18,0,5580780,12068
Mongolia,3/21/22,917213,2177,,,490,,27978.38020530203,,,,,496,MNG,2022/03/21,0,5580780,0
Mongolia,3/23/22,917406,2177,,,193,,27984.26741730145,,,,,496,MNG,2022/03/23,0,5580780,0
Mongolia,3/24/22,917579,2177,,,173,,27989.544555518543,,,,,496,MNG,2022/03/24,0,5580780,0
Mongolia,3/25/22,917732,2177,,,153,,27994.211619953316,,,,,496,MNG,2022/03/25,0,5580780,0
Mongolia,3/28/22,918867,2177,,,1135,,28028.83330710016,,,,,496,MNG,2022/03/28,0,5586654,0
Mongolia,4/1/22,918867,2177,,,0,,28028.83330710016,,,,,496,MNG,2022/04/01,0,,
Montenegro,3/5/22,230887,2685,,,128,,36761.816508561256,,,,,499,MNE,2022/03/05,1,662356,0
Montenegro,3/6/22,230958,2685,,,71,,36773.12112498448,,,,,499,MNE,2022/03/06,0,662356,0
Montenegro,3/7/22,231011,2686,,,53,,36781.559782314485,,,,,499,MNE,2022/03/07,1,662356,0
Montenegro,3/8/22,231115,2689,,,104,,36798.118657075254,,,,,499,MNE,2022/03/08,3,662356,0
Montenegro,3/9/22,231227,2690,,,112,,36815.95129143301,,,,,499,MNE,2022/03/09,1,662356,0
Montenegro,3/10/22,231313,2692,,,86,,36829.64420710057,,,,,499,MNE,2022/03/10,2,662356,0
Montenegro,3/11/22,231391,2692,,,78,,36842.06336317115,,,,,499,MNE,2022/03/11,0,662356,0
Montenegro,3/12/22,231488,2692,,,97,,36857.507698284564,,,,,499,MNE,2022/03/12,0,662356,0
Montenegro,3/13/22,231557,2693,,,69,,36868.49387480854,,,,,499,MNE,2022/03/13,1,662356,0
Montenegro,3/14/22,231613,2693,,,56,,36877.410191987416,,,,,499,MNE,2022/03/14,0,662356,0
Montenegro,3/15/22,231719,2695,,,106,,36894.28750664743,,,,,499,MNE,2022/03/15,2,662356,0
Montenegro,3/16/22,231816,2695,,,97,,36909.73184176085,,,,,499,MNE,2022/03/16,0,662356,0
Montenegro,3/17/22,231927,2696,,,111,,36927.405256168975,,,,,499,MNE,2022/03/17,1,662356,0
Montenegro,3/18/22,232038,2696,,,111,,36945.07867057711,,,,,499,MNE,2022/03/18,0,662356,0
Montenegro,3/19/22,232117,2696,,,79,,36957.65704659731,,,,,499,MNE,2022/03/19,0,662356,0
Montenegro,3/20/22,232193,2696,,,76,,36969.75776276864,,,,,499,MNE,2022/03/20,0,662356,0
Montenegro,3/21/22,232249,2696,,,56,,36978.67407994752,,,,,499,MNE,2022/03/21,0,662356,0
Montenegro,3/22/22,232376,2696,,,127,,36998.89501354962,,,,,499,MNE,2022/03/22,0,662356,0
Montenegro,3/23/22,232462,2696,,,86,,37012.58792921718,,,,,499,MNE,2022/03/23,0,662356,0
Montenegro,3/24/22,232561,2698,,,99,,37028.35070422984,,,,,499,MNE,2022/03/24,2,667673,5317
Montenegro,3/25/22,232626,2698,,,65,,37038.70000095532,,,,,499,MNE,2022/03/25,0,667880,207
Montenegro,3/26/22,232727,2698,,,101,,37054.781215867224,,,,,499,MNE,2022/03/26,0,668009,129
Montenegro,3/27/22,232777,2698,,,50,,37062.74221334836,,,,,499,MNE,2022/03/27,0,668025,16
Montenegro,3/28/22,232832,2699,,,55,,37071.499310577616,,,,,499,MNE,2022/03/28,1,668206,181
Montenegro,3/29/22,232924,2700,,,92,,37086.14754594291,,,,,499,MNE,2022/03/29,1,668404,198
Montenegro,3/30/22,233010,2702,,,86,,37099.840461610474,,,,,499,MNE,2022/03/30,2,668536,132
Montenegro,3/31/22,233102,2702,,,92,,37114.48869697578,,,,,499,MNE,2022/03/31,0,668536,0
Montenegro,4/1/22,233179,2704,,,77,,37126.74863309673,,,,,499,MNE,2022/04/01,2,,
Morocco,3/5/22,1161586,16015,,,80,,3147.0290966611774,,,,,504,MAR,2022/03/05,6,53027113,0
Morocco,3/6/22,1161646,16017,,,60,,3147.1916517761665,,,,,504,MAR,2022/03/06,2,53027113,0
Morocco,3/7/22,1161698,16022,,,52,,3147.3325328758237,,,,,504,MAR,2022/03/07,5,53027113,0
Morocco,3/8/22,1161776,16029,,,78,,3147.5438545253096,,,,,504,MAR,2022/03/08,7,53027113,0
Morocco,3/9/22,1161848,16029,,,72,,3147.7389206632965,,,,,504,MAR,2022/03/09,0,53027113,0
Morocco,3/10/22,1161925,16033,,,77,,3147.9475330608657,,,,,504,MAR,2022/03/10,4,53027113,0
Morocco,3/11/22,1161980,16034,,,55,,3148.096541916272,,,,,504,MAR,2022/03/11,1,53027113,0
Morocco,3/12/22,1162040,16036,,,60,,3148.2590970312613,,,,,504,MAR,2022/03/12,2,53027113,0
Morocco,3/13/22,1162096,16039,,,56,,3148.4108151385844,,,,,504,MAR,2022/03/13,3,53027113,0
Morocco,3/14/22,1162125,16043,,,29,,3148.4893834441623,,,,,504,MAR,2022/03/14,4,53027113,0
Morocco,3/15/22,1162236,16046,,,111,,3148.7901104068924,,,,,504,MAR,2022/03/15,3,53027113,0
Morocco,3/16/22,1162288,16048,,,52,,3148.9309915065496,,,,,504,MAR,2022/03/16,2,53027113,0
Morocco,3/17/22,1162322,16050,,,34,,3149.0231060717097,,,,,504,MAR,2022/03/17,2,53027113,0
Morocco,3/18/22,1162374,16050,,,52,,3149.163987171367,,,,,504,MAR,2022/03/18,0,53027113,0
Morocco,3/19/22,1162444,16051,,,70,,3149.353634805521,,,,,504,MAR,2022/03/19,1,53027113,0
Morocco,3/20/22,1162497,16052,,,53,,3149.497225157095,,,,,504,MAR,2022/03/20,1,53027113,0
Morocco,3/21/22,1162539,16052,,,42,,3149.6110137375867,,,,,504,MAR,2022/03/21,0,53027113,0
Morocco,3/22/22,1162626,16053,,,87,,3149.846718654321,,,,,504,MAR,2022/03/22,1,53027113,0
Morocco,3/23/22,1162686,16055,,,60,,3150.0092737693103,,,,,504,MAR,2022/03/23,2,53027113,0
Morocco,3/24/22,1162764,16056,,,78,,3150.2205954187957,,,,,504,MAR,2022/03/24,1,53027113,0
Morocco,3/25/22,1162841,16056,,,77,,3150.4292078163653,,,,,504,MAR,2022/03/25,0,53027113,0
Morocco,3/26/22,1162923,16057,,,82,,3150.6513664735166,,,,,504,MAR,2022/03/26,1,53027113,0
Morocco,3/27/22,1162974,16057,,,51,,3150.7895383212576,,,,,504,MAR,2022/03/27,0,53027113,0
Morocco,3/28/22,1163012,16058,,,38,,3150.892489894084,,,,,504,MAR,2022/03/28,1,53027113,0
Morocco,3/29/22,1163109,16059,,,97,,3151.155287329983,,,,,504,MAR,2022/03/29,1,53027113,0
Morocco,3/30/22,1163214,16060,,,105,,3151.4397587812136,,,,,504,MAR,2022/03/30,1,54201634,1174521
Morocco,3/31/22,1163274,16060,,,60,,3151.6023138962028,,,,,504,MAR,2022/03/31,0,54201634,0
Morocco,4/1/22,1163359,16060,,,85,,3151.832600309104,,,,,504,MAR,2022/04/01,0,,
Mozambique,3/5/22,225135,2196,,,14,,720.3067242545177,,,,,508,MOZ,2022/03/05,1,19788759,0
Mozambique,3/6/22,225140,2196,,,5,,720.3227214722815,,,,,508,MOZ,2022/03/06,0,19788759,0
Mozambique,3/8/22,225150,2197,,,10,,720.3547159078094,,,,,508,MOZ,2022/03/08,1,19788759,0
Mozambique,3/9/22,225159,2198,,,9,,720.3835108997843,,,,,508,MOZ,2022/03/09,1,19788759,0
Mozambique,3/10/22,225162,2198,,,3,,720.3931092304426,,,,,508,MOZ,2022/03/10,0,19788759,0
Mozambique,3/11/22,225165,2198,,,3,,720.402707561101,,,,,508,MOZ,2022/03/11,0,19788759,0
Mozambique,3/12/22,225173,2198,,,8,,720.4283031095232,,,,,508,MOZ,2022/03/12,0,19788759,0
Mozambique,3/13/22,225179,2198,,,6,,720.4474997708398,,,,,508,MOZ,2022/03/13,0,19788759,0
Mozambique,3/15/22,225188,2198,,,9,,720.4762947628149,,,,,508,MOZ,2022/03/15,0,19788759,0
Mozambique,3/16/22,225194,2198,,,6,,720.4954914241315,,,,,508,MOZ,2022/03/16,0,19788759,0
Mozambique,3/17/22,225200,2199,,,6,,720.5146880854481,,,,,508,MOZ,2022/03/17,1,19788759,0
Mozambique,3/18/22,225201,2199,,,1,,720.517887529001,,,,,508,MOZ,2022/03/18,0,19788759,0
Mozambique,3/19/22,225206,2199,,,5,,720.5338847467649,,,,,508,MOZ,2022/03/19,0,19788759,0
Mozambique,3/20/22,225210,2200,,,4,,720.546682520976,,,,,508,MOZ,2022/03/20,1,19788759,0
Mozambique,3/21/22,225211,2200,,,1,,720.5498819645287,,,,,508,MOZ,2022/03/21,0,19788759,0
Mozambique,3/22/22,225215,2200,,,4,,720.5626797387398,,,,,508,MOZ,2022/03/22,0,19788759,0
Mozambique,3/23/22,225220,2200,,,5,,720.5786769565037,,,,,508,MOZ,2022/03/23,0,19788759,0
Mozambique,3/24/22,225223,2200,,,3,,720.5882752871621,,,,,508,MOZ,2022/03/24,0,19788759,0
Mozambique,3/25/22,225231,2200,,,8,,720.6138708355843,,,,,508,MOZ,2022/03/25,0,19788759,0
Mozambique,3/26/22,225237,2200,,,6,,720.6330674969009,,,,,508,MOZ,2022/03/26,0,19788759,0
Mozambique,3/27/22,225239,2200,,,2,,720.6394663840065,,,,,508,MOZ,2022/03/27,0,19788759,0
Mozambique,3/29/22,225244,2200,,,5,,720.6554636017704,,,,,508,MOZ,2022/03/29,0,19788759,0
Mozambique,3/30/22,225249,2200,,,5,,720.6714608195342,,,,,508,MOZ,2022/03/30,0,26215793,6427034
Mozambique,3/31/22,225256,2200,,,7,,720.6938569244037,,,,,508,MOZ,2022/03/31,0,26215793,0
Mozambique,4/1/22,225261,2200,,,5,,720.7098541421676,,,,,508,MOZ,2022/04/01,0,,
Namibia,3/5/22,157324,4013,,,13,,6191.625382342431,,,,,516,NAM,2022/03/05,0,814463,0
Namibia,3/6/22,157338,4013,,,14,,6192.176364744053,,,,,516,NAM,2022/03/06,0,814463,0
Namibia,3/7/22,157350,4014,,,12,,6192.648635374015,,,,,516,NAM,2022/03/07,1,814463,0
Namibia,3/8/22,157358,4014,,,8,,6192.9634824606555,,,,,516,NAM,2022/03/08,0,814463,0
Namibia,3/9/22,157366,4014,,,8,,6193.278329547297,,,,,516,NAM,2022/03/09,0,814463,0
Namibia,3/11/22,157383,4014,,,17,,6193.947379606409,,,,,516,NAM,2022/03/11,0,814463,0
Namibia,3/13/22,157438,4014,,,55,,6196.111953327068,,,,,516,NAM,2022/03/13,0,814463,0
Namibia,3/15/22,157458,4014,,,20,,6196.899071043671,,,,,516,NAM,2022/03/15,0,814463,0
Namibia,3/16/22,157471,4014,,,13,,6197.410697559463,,,,,516,NAM,2022/03/16,0,814463,0
Namibia,3/17/22,157489,4014,,,18,,6198.119103504406,,,,,516,NAM,2022/03/17,0,814463,0
Namibia,3/18/22,157503,4014,,,14,,6198.670085906027,,,,,516,NAM,2022/03/18,0,827417,12954
Namibia,3/19/22,157516,4015,,,13,,6199.18171242182,,,,,516,NAM,2022/03/19,1,827417,0
Namibia,3/20/22,157523,4016,,,7,,6199.457203622631,,,,,516,NAM,2022/03/20,1,827417,0
Namibia,3/22/22,157545,4016,,,22,,6200.323033110893,,,,,516,NAM,2022/03/22,0,827417,0
Namibia,3/23/22,157552,4016,,,7,,6200.598524311705,,,,,516,NAM,2022/03/23,0,827417,0
Namibia,3/24/22,157566,4017,,,14,,6201.149506713327,,,,,516,NAM,2022/03/24,1,827417,0
Namibia,3/25/22,157576,4018,,,10,,6201.543065571628,,,,,516,NAM,2022/03/25,1,827417,0
Namibia,3/27/22,157611,4019,,,35,,6202.920521575684,,,,,516,NAM,2022/03/27,1,834756,7339
Namibia,3/28/22,157615,4019,,,4,,6203.077945119005,,,,,516,NAM,2022/03/28,0,834756,0
Namibia,3/29/22,157622,4019,,,7,,6203.353436319815,,,,,516,NAM,2022/03/29,0,834756,0
Namibia,3/31/22,157646,4019,,,24,,6204.297977579739,,,,,516,NAM,2022/03/31,0,834756,0
Namibia,4/1/22,157646,4019,,,0,,6204.297977579739,,,,,516,NAM,2022/04/01,0,,
Nepal,3/5/22,977447,11945,,,67,,3354.6811304793578,,,,,524,NPL,2022/03/05,0,37682900,288452
Nepal,3/6/22,977501,11947,,,54,,3354.8664630662356,,,,,524,NPL,2022/03/06,2,37721886,38986
Nepal,3/7/22,977567,11948,,,66,,3355.09298067242,,,,,524,NPL,2022/03/07,1,37721886,0
Nepal,3/8/22,977641,11949,,,74,,3355.346954958141,,,,,524,NPL,2022/03/08,1,37986668,264782
Nepal,3/9/22,977709,11949,,,68,,3355.580336734209,,,,,524,NPL,2022/03/09,0,38292519,305851
Nepal,3/10/22,977786,11949,,,77,,3355.844607274757,,,,,524,NPL,2022/03/10,0,38292519,0
Nepal,3/11/22,977848,11950,,,62,,3356.0573965411722,,,,,524,NPL,2022/03/11,1,38292519,0
Nepal,3/12/22,977878,11950,,,30,,3356.160359089438,,,,,524,NPL,2022/03/12,0,38292519,0
Nepal,3/13/22,977937,11950,,,59,,3356.3628521010264,,,,,524,NPL,2022/03/13,0,38699896,407377
Nepal,3/14/22,977987,11950,,,50,,3356.5344563481353,,,,,524,NPL,2022/03/14,0,38869051,169155
Nepal,3/15/22,978044,11950,,,57,,3356.7300851898394,,,,,524,NPL,2022/03/15,0,38883962,14911
Nepal,3/16/22,978085,11950,,,41,,3356.870800672469,,,,,524,NPL,2022/03/16,0,38883962,0
Nepal,3/17/22,978107,11950,,,22,,3356.946306541197,,,,,524,NPL,2022/03/17,0,39101413,217451
Nepal,3/18/22,978119,11950,,,12,,3356.9874915605033,,,,,524,NPL,2022/03/18,0,39101413,0
Nepal,3/19/22,978127,11950,,,8,,3357.0149482400407,,,,,524,NPL,2022/03/19,0,39101413,0
Nepal,3/20/22,978155,11950,,,28,,3357.111046618422,,,,,524,NPL,2022/03/20,0,39101413,0
Nepal,3/21/22,978196,11950,,,41,,3357.251762101051,,,,,524,NPL,2022/03/21,0,39101413,0
Nepal,3/22/22,978231,11951,,,35,,3357.3718850740274,,,,,524,NPL,2022/03/22,1,39374392,272979
Nepal,3/23/22,978265,11951,,,34,,3357.4885759620615,,,,,524,NPL,2022/03/23,0,39374392,0
Nepal,3/24/22,978297,11951,,,32,,3357.598402680211,,,,,524,NPL,2022/03/24,0,39551107,176715
Nepal,3/25/22,978309,11951,,,12,,3357.6395876995175,,,,,524,NPL,2022/03/25,0,39551107,0
Nepal,3/26/22,978317,11951,,,8,,3357.667044379055,,,,,524,NPL,2022/03/26,0,39551107,0
Nepal,3/27/22,978332,11951,,,15,,3357.7185256531875,,,,,524,NPL,2022/03/27,0,39701499,150392
Nepal,3/28/22,978347,11951,,,15,,3357.77000692732,,,,,524,NPL,2022/03/28,0,39777115,75616
Nepal,3/29/22,978377,11951,,,30,,3357.8729694755857,,,,,524,NPL,2022/03/29,0,39788348,11233
Nepal,3/30/22,978402,11951,,,25,,3357.95877159914,,,,,524,NPL,2022/03/30,0,39884435,96087
Nepal,3/31/22,978426,11951,,,24,,3358.0411416377524,,,,,524,NPL,2022/03/31,0,39884435,0
Nepal,4/1/22,978442,11951,,,16,,3358.096054996827,,,,,524,NPL,2022/04/01,0,,
Netherlands,3/5/22,6814578,22221,,,67207,,39770.22765211041,,,,,528,NLD,2022/03/05,9,33942499,21187
Netherlands,3/6/22,6881377,22225,,,66799,,40160.070051292474,,,,,528,NLD,2022/03/06,4,33942499,0
Netherlands,3/7/22,6945837,22225,,,64460,,40536.26192618994,,,,,528,NLD,2022/03/07,0,33942499,0
Netherlands,3/8/22,7012134,22237,,,66297,,40923.17462755633,,,,,528,NLD,2022/03/08,12,33942499,0
Netherlands,3/9/22,7086380,22247,,,74246,,41356.478101705216,,,,,528,NLD,2022/03/09,10,33943469,970
Netherlands,3/10/22,7160898,22288,,,74518,,41791.368981841886,,,,,528,NLD,2022/03/10,41,33943469,0
Netherlands,3/11/22,7230422,22302,,,69524,,42197.11462115885,,,,,528,NLD,2022/03/11,14,33943469,0
Netherlands,3/12/22,7290470,22313,,,60048,,42547.55783716634,,,,,528,NLD,2022/03/12,11,33943469,0
Netherlands,3/13/22,7342812,22321,,,52342,,42853.02844088777,,,,,528,NLD,2022/03/13,8,33943469,0
Netherlands,3/14/22,7388732,22327,,,45920,,43121.01992235367,,,,,528,NLD,2022/03/14,6,33943469,0
Netherlands,3/15/22,7441715,22339,,,52983,,43430.23143503894,,,,,528,NLD,2022/03/15,12,33943469,0
Netherlands,3/16/22,7502102,22350,,,60387,,43782.653072479734,,,,,528,NLD,2022/03/16,11,34001359,57890
Netherlands,3/17/22,7555797,22369,,,53695,,44096.01985378007,,,,,528,NLD,2022/03/17,19,34001359,0
Netherlands,3/18/22,7610310,22388,,,54513,,44414.16052514658,,,,,528,NLD,2022/03/18,19,34001426,67
Netherlands,3/19/22,7651770,22399,,,41460,,44656.12321725408,,,,,528,NLD,2022/03/19,11,34001426,0
Netherlands,3/20/22,7686593,22407,,,34823,,44859.352036049524,,,,,528,NLD,2022/03/20,8,34017698,16272
Netherlands,3/21/22,7718814,22410,,,32221,,45047.39544903542,,,,,528,NLD,2022/03/21,3,34017698,0
Netherlands,3/22/22,7759372,22435,,,40558,,45284.09402275698,,,,,528,NLD,2022/03/22,25,34017698,0
Netherlands,3/23/22,7802160,22451,,,42788,,45533.80699115774,,,,,528,NLD,2022/03/23,16,34017698,0
Netherlands,3/24/22,7841258,22466,,,39098,,45761.98492979784,,,,,528,NLD,2022/03/24,15,34017698,0
Netherlands,3/25/22,7876702,22488,,,35444,,45968.837936528624,,,,,528,NLD,2022/03/25,22,34038677,20979
Netherlands,3/26/22,7904943,22508,,,28241,,46133.65386484043,,,,,528,NLD,2022/03/26,20,34038677,0
Netherlands,3/27/22,7929975,22515,,,25032,,46279.74190412733,,,,,528,NLD,2022/03/27,7,34038677,0
Netherlands,3/28/22,7951531,22525,,,21556,,46405.543828658665,,,,,528,NLD,2022/03/28,10,34038677,0
Netherlands,3/29/22,7982514,22541,,,30983,,46586.36220997961,,,,,528,NLD,2022/03/29,16,34038677,0
Netherlands,3/30/22,8010503,22578,,,27989,,46749.70745333216,,,,,528,NLD,2022/03/30,37,34038677,0
Netherlands,3/31/22,8035972,22604,,,25469,,46898.34584709207,,,,,528,NLD,2022/03/31,26,34038677,0
Netherlands,4/1/22,8058168,22612,,,22196,,47027.882844535816,,,,,528,NLD,2022/04/01,8,,
New Zealand,3/5/22,222851,65,,,15205,,4621.323772617375,,,,,554,NZL,2022/03/05,2,10728523,37178
New Zealand,3/6/22,240403,65,,,17552,,4985.304525932281,,,,,554,NZL,2022/03/06,0,10735471,6948
New Zealand,3/7/22,264387,65,,,23984,,5482.667469614181,,,,,554,NZL,2022/03/07,0,10735471,0
New Zealand,3/8/22,286891,65,,,22504,,5949.339237651934,,,,,554,NZL,2022/03/08,0,10746387,10916
New Zealand,3/9/22,286924,65,,,33,,5950.023567919676,,,,,554,NZL,2022/03/09,0,10769249,22862
New Zealand,3/10/22,308009,81,,,21085,,6387.269134444561,,,,,554,NZL,2022/03/10,16,10779301,10052
New Zealand,3/11/22,347823,93,,,39814,,7212.9032338337865,,,,,554,NZL,2022/03/11,12,10790074,10773
New Zealand,3/12/22,362356,101,,,14533,,7514.278136290802,,,,,554,NZL,2022/03/12,8,10800332,10258
New Zealand,3/13/22,377932,102,,,15576,,7837.282022664604,,,,,554,NZL,2022/03/13,1,10800332,0
New Zealand,3/14/22,399680,102,,,21748,,8288.276406386834,,,,,554,NZL,2022/03/14,0,10804735,4403
New Zealand,3/15/22,399721,102,,,41,,8289.1266349013,,,,,554,NZL,2022/03/15,0,10815447,10712
New Zealand,3/16/22,439013,135,,,39292,,9103.935873691711,,,,,554,NZL,2022/03/16,33,10837701,22254
New Zealand,3/17/22,453274,138,,,14261,,9399.670235760072,,,,,554,NZL,2022/03/17,3,10848621,10920
New Zealand,3/18/22,471901,144,,,18627,,9785.943565978665,,,,,554,NZL,2022/03/18,6,10861105,12484
New Zealand,3/19/22,483965,151,,,12064,,10036.118122040141,,,,,554,NZL,2022/03/19,7,10861105,0
New Zealand,3/20/22,498474,163,,,14509,,10336.995329756983,,,,,554,NZL,2022/03/20,12,10875067,13962
New Zealand,3/21/22,519520,177,,,21046,,10773.432142329082,,,,,554,NZL,2022/03/21,14,10880968,5901
New Zealand,3/22/22,539787,184,,,20267,,11193.714613126325,,,,,554,NZL,2022/03/22,7,10889228,8260
New Zealand,3/23/22,558278,192,,,18491,,11577.167673150592,,,,,554,NZL,2022/03/23,8,10898132,8904
New Zealand,3/24/22,574304,201,,,16026,,11909.503335902682,,,,,554,NZL,2022/03/24,9,10906923,8791
New Zealand,3/25/22,588724,217,,,14420,,12208.534925624705,,,,,554,NZL,2022/03/25,16,10914646,7723
New Zealand,3/26/22,599002,223,,,10278,,12421.6726981048,,,,,554,NZL,2022/03/26,6,10924044,9398
New Zealand,3/27/22,612082,231,,,13080,,12692.916331500364,,,,,554,NZL,2022/03/27,8,10934758,10714
New Zealand,3/28/22,629474,266,,,17392,,13053.57911988077,,,,,554,NZL,2022/03/28,35,10944416,9658
New Zealand,3/29/22,645620,278,,,16146,,13388.403256333735,,,,,554,NZL,2022/03/29,12,10950139,5723
New Zealand,3/30/22,661058,299,,,15438,,13708.54539795153,,,,,554,NZL,2022/03/30,21,10950139,0
New Zealand,3/31/22,674698,314,,,13640,,13991.401908617854,,,,,554,NZL,2022/03/31,15,10950139,0
New Zealand,4/1/22,686492,330,,,11794,,14235.977398852358,,,,,554,NZL,2022/04/01,16,,
Nicaragua,3/5/22,18105,225,,,0,,273.30141772563104,,,,,558,NIC,2022/03/05,0,9477305,0
Nicaragua,3/8/22,18203,225,,,98,,274.7807625992633,,,,,558,NIC,2022/03/08,0,9477305,0
Nicaragua,3/9/22,18203,226,,,0,,274.7807625992633,,,,,558,NIC,2022/03/09,1,9611936,0
Nicaragua,3/15/22,18290,226,,,87,,276.09405855850827,,,,,558,NIC,2022/03/15,0,9611936,0
Nicaragua,3/16/22,18290,228,,,0,,276.09405855850827,,,,,558,NIC,2022/03/16,2,9611936,0
Nicaragua,3/22/22,18365,228,,,75,,277.2262102475125,,,,,558,NIC,2022/03/22,0,9611936,0
Nicaragua,3/25/22,18365,229,,,0,,277.2262102475125,,,,,558,NIC,2022/03/25,1,9611936,0
Nicaragua,3/29/22,18434,229,,,69,,278.2677898013964,,,,,558,NIC,2022/03/29,0,9611936,0
Nicaragua,3/30/22,18434,230,,,0,,278.2677898013964,,,,,558,NIC,2022/03/30,1,9611936,0
Nicaragua,4/1/22,18434,230,,,0,,278.2677898013964,,,,,558,NIC,2022/04/01,0,,
Niger,3/5/22,8760,307,,,0,,36.18842370331838,,,,,562,NER,2022/03/05,0,1840055,0
Niger,3/6/22,8766,307,,,6,,36.213210294895994,,,,,562,NER,2022/03/06,0,1840055,0
Niger,3/7/22,8767,307,,,1,,36.21734139349226,,,,,562,NER,2022/03/07,0,1840055,0
Niger,3/8/22,8769,307,,,2,,36.225603590684806,,,,,562,NER,2022/03/08,0,1840055,0
Niger,3/9/22,8774,307,,,5,,36.246259083666146,,,,,562,NER,2022/03/09,0,1840055,0
Niger,3/11/22,8780,308,,,6,,36.27104567524376,,,,,562,NER,2022/03/11,1,1840055,0
Niger,3/12/22,8781,308,,,1,,36.27517677384003,,,,,562,NER,2022/03/12,0,1840055,0
Niger,3/16/22,8786,308,,,5,,36.29583226682138,,,,,562,NER,2022/03/16,0,2674381,0
Niger,3/17/22,8788,308,,,2,,36.304094464013914,,,,,562,NER,2022/03/17,0,2674381,0
Niger,3/21/22,8794,308,,,6,,36.32888105559153,,,,,562,NER,2022/03/21,0,2674381,0
Niger,3/22/22,8797,308,,,3,,36.34127435138034,,,,,562,NER,2022/03/22,0,2674381,0
Niger,3/23/22,8799,308,,,2,,36.34953654857288,,,,,562,NER,2022/03/23,0,2674381,0
Niger,3/26/22,8801,308,,,2,,36.357798745765415,,,,,562,NER,2022/03/26,0,2674381,0
Niger,4/1/22,8801,308,,,0,,36.357798745765415,,,,,562,NER,2022/04/01,0,,
Nigeria,3/5/22,254637,3142,,,0,,123.52649178442373,,,,,566,NGA,2022/03/05,0,26516526,0
Nigeria,3/6/22,254640,3142,,,3,,123.52794710896553,,,,,566,NGA,2022/03/06,0,27583270,1066744
Nigeria,3/7/22,254659,3142,,,19,,123.53716416439701,,,,,566,NGA,2022/03/07,0,27583270,0
Nigeria,3/8/22,254777,3142,,,118,,123.59440692970827,,,,,566,NGA,2022/03/08,0,27583270,0
Nigeria,3/10/22,254861,3142,,,84,,123.635156016879,,,,,566,NGA,2022/03/10,0,27583270,0
Nigeria,3/11/22,254894,3142,,,33,,123.65116458683892,,,,,566,NGA,2022/03/11,0,27583270,0
Nigeria,3/12/22,254953,3142,,,59,,123.67978596949455,,,,,566,NGA,2022/03/12,0,27583270,0
Nigeria,3/14/22,254989,3142,,,36,,123.69724986399628,,,,,566,NGA,2022/03/14,0,28684071,0
Nigeria,3/15/22,255001,3142,,,12,,123.70307116216352,,,,,566,NGA,2022/03/15,0,28684071,0
Nigeria,3/17/22,255092,3142,,,91,,123.74721600659848,,,,,566,NGA,2022/03/17,0,28684071,0
Nigeria,3/18/22,255103,3142,,,11,,123.75255219658513,,,,,566,NGA,2022/03/18,0,29613077,929006
Nigeria,3/22/22,255190,3142,,,87,,123.79475660829766,,,,,566,NGA,2022/03/22,0,29613077,0
Nigeria,3/23/22,255244,3142,,,54,,123.82095245005027,,,,,566,NGA,2022/03/23,0,29613077,0
Nigeria,3/26/22,255296,3142,,,52,,123.84617807544167,,,,,566,NGA,2022/03/26,0,29613077,0
Nigeria,3/28/22,255341,3142,,,45,,123.86800794356884,,,,,566,NGA,2022/03/28,0,31391732,0
Nigeria,3/30/22,255415,3142,,,74,,123.90390594893353,,,,,566,NGA,2022/03/30,0,31391732,0
Nigeria,4/1/22,255468,3142,,,53,,123.92961668250553,,,,,566,NGA,2022/04/01,0,,
North Macedonia,3/5/22,299419,9075,,,370,,14371.79007190239,,,,,807,MKD,2022/03/05,10,1823012,0
North Macedonia,3/6/22,299642,9079,,,223,,14382.49383213816,,,,,807,MKD,2022/03/06,4,1823012,0
North Macedonia,3/7/22,299766,9086,,,124,,14388.445698816346,,,,,807,MKD,2022/03/07,7,1823012,0
North Macedonia,3/8/22,300106,9097,,,340,,14404.765333256535,,,,,807,MKD,2022/03/08,11,1823012,0
North Macedonia,3/9/22,300398,9104,,,292,,14418.781019305168,,,,,807,MKD,2022/03/09,7,1826409,3397
North Macedonia,3/10/22,300714,9117,,,316,,14433.948679549578,,,,,807,MKD,2022/03/10,13,1826409,0
North Macedonia,3/11/22,301016,9123,,,302,,14448.444354846451,,,,,807,MKD,2022/03/11,6,1826409,0
North Macedonia,3/12/22,301293,9137,,,277,,14461.740057022722,,,,,807,MKD,2022/03/12,14,1829630,3221
North Macedonia,3/13/22,301491,9146,,,198,,14471.24384413789,,,,,807,MKD,2022/03/13,9,1829630,0
North Macedonia,3/14/22,301583,9150,,,92,,14475.659745221707,,,,,807,MKD,2022/03/14,4,1829630,0
North Macedonia,3/15/22,301895,9155,,,312,,14490.63540976682,,,,,807,MKD,2022/03/15,5,1829630,0
North Macedonia,3/16/22,302224,9159,,,329,,14506.427056033945,,,,,807,MKD,2022/03/16,4,1829630,0
North Macedonia,3/17/22,302548,9162,,,324,,14521.978707676948,,,,,807,MKD,2022/03/17,3,1829630,0
North Macedonia,3/18/22,302867,9164,,,319,,14537.290364695831,,,,,807,MKD,2022/03/18,2,1829630,0
North Macedonia,3/19/22,303140,9172,,,273,,14550.394071172806,,,,,807,MKD,2022/03/19,8,1829630,0
North Macedonia,3/20/22,303354,9180,,,214,,14560.66584108516,,,,,807,MKD,2022/03/20,8,1829630,0
North Macedonia,3/21/22,303418,9184,,,64,,14563.7377722739,,,,,807,MKD,2022/03/21,4,1829630,0
North Macedonia,3/22/22,303728,9187,,,310,,14578.617438969368,,,,,807,MKD,2022/03/22,3,1829630,0
North Macedonia,3/23/22,304047,9188,,,319,,14593.92909598825,,,,,807,MKD,2022/03/23,1,1829630,0
North Macedonia,3/24/22,304326,9191,,,279,,14607.32079601417,,,,,807,MKD,2022/03/24,3,1829630,0
North Macedonia,3/25/22,304648,9197,,,322,,14622.776449807525,,,,,807,MKD,2022/03/25,6,1836421,6791
North Macedonia,3/26/22,304878,9203,,,230,,14633.816202517064,,,,,807,MKD,2022/03/26,6,1836421,0
North Macedonia,3/27/22,305066,9206,,,188,,14642.84000038399,,,,,807,MKD,2022/03/27,3,1836421,0
North Macedonia,3/28/22,305114,9208,,,48,,14645.143948775547,,,,,807,MKD,2022/03/28,2,1836421,0
North Macedonia,3/29/22,305423,9214,,,309,,14659.97561654619,,,,,807,MKD,2022/03/29,6,1836421,0
North Macedonia,3/30/22,305717,9220,,,294,,14674.08730044447,,,,,807,MKD,2022/03/30,6,1836421,0
North Macedonia,3/31/22,305979,9221,,,262,,14686.66301874838,,,,,807,MKD,2022/03/31,1,1836421,0
North Macedonia,4/1/22,306178,9226,,,199,,14696.214804788373,,,,,807,MKD,2022/04/01,5,,
Norway,3/5/22,1305006,1664,,,5457,,24072.085326572767,,,,,578,NOR,2022/03/05,0,11239629,3106
Norway,3/6/22,1308342,1664,,,3336,,24133.621041082468,,,,,578,NOR,2022/03/06,0,11239629,0
Norway,3/7/22,1315692,1664,,,7350,,24269.198829345747,,,,,578,NOR,2022/03/07,0,11239629,0
Norway,3/8/22,1325909,1664,,,10217,,24457.6611780105,,,,,578,NOR,2022/03/08,0,11241444,1815
Norway,3/9/22,1333793,1753,,,7884,,24603.089107625154,,,,,578,NOR,2022/03/09,89,11244757,3313
Norway,3/10/22,1341163,1753,,,7370,,24739.03581504017,,,,,578,NOR,2022/03/10,0,11247992,3235
Norway,3/11/22,1346777,1753,,,5614,,24842.591420932695,,,,,578,NOR,2022/03/11,0,11251214,3222
Norway,3/12/22,1349971,1753,,,3194,,24901.507809465063,,,,,578,NOR,2022/03/12,0,11251214,0
Norway,3/13/22,1351883,1753,,,1912,,24936.776480371103,,,,,578,NOR,2022/03/13,0,11251214,0
Norway,3/14/22,1357280,1753,,,5397,,25036.329313467282,,,,,578,NOR,2022/03/14,0,11251214,0
Norway,3/15/22,1363406,1753,,,6126,,25149.32924964427,,,,,578,NOR,2022/03/15,0,11251214,0
Norway,3/16/22,1368165,1826,,,4759,,25237.113561800044,,,,,578,NOR,2022/03/16,73,11255801,4587
Norway,3/17/22,1372340,2169,,,4175,,25314.125434725105,,,,,578,NOR,2022/03/17,343,11256775,974
Norway,3/18/22,1376239,2169,,,3899,,25386.0462233562,,,,,578,NOR,2022/03/18,0,11256775,0
Norway,3/19/22,1378238,2169,,,1999,,25422.919692572294,,,,,578,NOR,2022/03/19,0,11256775,0
Norway,3/20/22,1379467,2169,,,1229,,25445.58977444652,,,,,578,NOR,2022/03/20,0,11256775,0
Norway,3/21/22,1383227,2169,,,3760,,25514.94657497304,,,,,578,NOR,2022/03/21,0,11256775,0
Norway,3/22/22,1387034,2169,,,3807,,25585.170335506144,,,,,578,NOR,2022/03/22,0,11260152,3377
Norway,3/23/22,1390035,2339,,,3001,,25640.526654224253,,,,,578,NOR,2022/03/23,170,11261106,954
Norway,3/24/22,1393061,2339,,,3026,,25696.344121882034,,,,,578,NOR,2022/03/24,0,11262895,1789
Norway,3/25/22,1395556,2339,,,2495,,25742.3667860612,,,,,578,NOR,2022/03/25,0,11264959,2064
Norway,3/26/22,1396911,2339,,,1355,,25767.36105859137,,,,,578,NOR,2022/03/26,0,11266981,2022
Norway,3/27/22,1397638,2339,,,727,,25780.771269757002,,,,,578,NOR,2022/03/27,0,11266981,0
Norway,3/28/22,1399714,2339,,,2076,,25819.065077707284,,,,,578,NOR,2022/03/28,0,11268214,1233
Norway,3/29/22,1402219,2339,,,2505,,25865.27220146232,,,,,578,NOR,2022/03/29,0,11269240,1026
Norway,3/30/22,1404207,2518,,,1988,,25901.942765144962,,,,,578,NOR,2022/03/30,179,11269240,0
Norway,3/31/22,1405960,2518,,,1753,,25934.278528794694,,,,,578,NOR,2022/03/31,0,11269240,0
Norway,4/1/22,1407422,2518,,,1462,,25961.246518786655,,,,,578,NOR,2022/04/01,0,,
Oman,3/5/22,383874,4248,,,0,,7517.180633303189,,,,,512,OMN,2022/03/05,0,6822641,0
Oman,3/6/22,384818,4249,,,944,,7535.666434680304,,,,,512,OMN,2022/03/06,1,6878593,55952
Oman,3/7/22,385153,4249,,,335,,7542.226544279173,,,,,512,OMN,2022/03/07,0,6878593,0
Oman,3/8/22,385513,4249,,,360,,7549.276214295869,,,,,512,OMN,2022/03/08,0,6878593,0
Oman,3/9/22,385769,4249,,,256,,7554.289312974409,,,,,512,OMN,2022/03/09,0,6878593,0
Oman,3/10/22,386003,4250,,,234,,7558.871598485261,,,,,512,OMN,2022/03/10,1,6878593,0
Oman,3/13/22,386460,4250,,,457,,7567.820762923122,,,,,512,OMN,2022/03/13,0,6878593,0
Oman,3/14/22,386646,4250,,,186,,7571.463092431748,,,,,512,OMN,2022/03/14,0,6878593,0
Oman,3/15/22,386829,4250,,,183,,7575.046674690236,,,,,512,OMN,2022/03/15,0,6878593,0
Oman,3/16/22,387009,4250,,,180,,7578.571509698583,,,,,512,OMN,2022/03/16,0,6878593,0
Oman,3/17/22,387180,4250,,,171,,7581.920102956514,,,,,512,OMN,2022/03/17,0,6878593,0
Oman,3/20/22,387505,4250,,,325,,7588.284388388253,,,,,512,OMN,2022/03/20,0,6920193,0
Oman,3/21/22,387627,4250,,,122,,7590.673443227245,,,,,512,OMN,2022/03/21,0,6920193,0
Oman,3/22/22,387730,4250,,,103,,7592.690432148688,,,,,512,OMN,2022/03/22,0,6920193,0
Oman,3/23/22,387829,4250,,,99,,7594.62909140328,,,,,512,OMN,2022/03/23,0,6920193,0
Oman,3/24/22,387922,4250,,,93,,7596.450256157593,,,,,512,OMN,2022/03/24,0,6920193,0
Oman,3/27/22,388086,4250,,,164,,7599.661772498533,,,,,512,OMN,2022/03/27,0,6986946,66753
Oman,3/28/22,388160,4250,,,74,,7601.110871335298,,,,,512,OMN,2022/03/28,0,6986946,0
Oman,3/29/22,388229,4250,,,69,,7602.4620580884975,,,,,512,OMN,2022/03/29,0,6986946,0
Oman,3/30/22,388279,4250,,,50,,7603.441178924149,,,,,512,OMN,2022/03/30,0,6986946,0
Oman,3/31/22,388343,4250,,,64,,7604.694453593785,,,,,512,OMN,2022/03/31,0,6986946,0
Oman,4/1/22,388343,4250,,,0,,7604.694453593785,,,,,512,OMN,2022/04/01,0,,
Pakistan,3/5/22,1514258,30265,,,755,,685.5185932190648,,,,,586,PAK,2022/03/05,7,216932641,1392642
Pakistan,3/6/22,1515014,30272,,,756,,685.8608414069387,,,,,586,PAK,2022/03/06,7,216932641,0
Pakistan,3/7/22,1515392,30281,,,378,,686.0319655008756,,,,,586,PAK,2022/03/07,9,216932641,0
Pakistan,3/8/22,1516150,30287,,,758,,686.3751191072361,,,,,586,PAK,2022/03/08,6,217444622,511981
Pakistan,3/9/22,1516789,30291,,,639,,686.6644003136532,,,,,586,PAK,2022/03/09,4,218689769,1245147
Pakistan,3/10/22,1517512,30298,,,723,,686.9917090965009,,,,,586,PAK,2022/03/10,7,219368557,678788
Pakistan,3/11/22,1518083,30304,,,571,,687.2502060743793,,,,,586,PAK,2022/03/11,6,219368557,0
Pakistan,3/12/22,1518692,30307,,,609,,687.5259060034999,,,,,586,PAK,2022/03/12,3,219368557,0
Pakistan,3/13/22,1519154,30309,,,462,,687.7350576738673,,,,,586,PAK,2022/03/13,2,219368557,0
Pakistan,3/14/22,1519627,30313,,,473,,687.9491891459102,,,,,586,PAK,2022/03/14,4,219368557,0
Pakistan,3/15/22,1520120,30317,,,493,,688.1723748028174,,,,,586,PAK,2022/03/15,4,219368557,0
Pakistan,3/16/22,1520634,30319,,,514,,688.4050673538322,,,,,586,PAK,2022/03/16,2,219368557,0
Pakistan,3/17/22,1520817,30326,,,183,,688.4879131453414,,,,,586,PAK,2022/03/17,7,219368557,0
Pakistan,3/18/22,1521513,30328,,,696,,688.8029987786222,,,,,586,PAK,2022/03/18,2,226203802,6835245
Pakistan,3/19/22,1521888,30329,,,375,,688.9727647448294,,,,,586,PAK,2022/03/19,1,226203802,0
Pakistan,3/20/22,1522191,30331,,,303,,689.109935645525,,,,,586,PAK,2022/03/20,2,226203802,0
Pakistan,3/21/22,1522419,30333,,,228,,689.213153352979,,,,,586,PAK,2022/03/21,2,226203802,0
Pakistan,3/22/22,1522862,30333,,,443,,689.4137035477253,,,,,586,PAK,2022/03/22,0,226203802,0
Pakistan,3/23/22,1523072,30333,,,210,,689.5087724888014,,,,,586,PAK,2022/03/23,0,226203802,0
Pakistan,3/24/22,1523401,30336,,,329,,689.6577138298205,,,,,586,PAK,2022/03/24,3,226203802,0
Pakistan,3/25/22,1523590,30340,,,189,,689.7432758767891,,,,,586,PAK,2022/03/25,4,226203802,0
Pakistan,3/26/22,1523900,30345,,,310,,689.8836157421871,,,,,586,PAK,2022/03/26,5,226203802,0
Pakistan,3/27/22,1524086,30346,,,186,,689.9678196614259,,,,,586,PAK,2022/03/27,1,226203802,0
Pakistan,3/28/22,1524355,30347,,,269,,690.0895984478519,,,,,586,PAK,2022/03/28,1,226203802,0
Pakistan,3/29/22,1524549,30349,,,194,,690.1774240410365,,,,,586,PAK,2022/03/29,2,226203802,0
Pakistan,3/30/22,1524793,30355,,,244,,690.2878850963821,,,,,586,PAK,2022/03/30,6,226203802,0
Pakistan,3/31/22,1524973,30359,,,180,,690.3693727601616,,,,,586,PAK,2022/03/31,4,226203802,0
Pakistan,4/1/22,1525181,30360,,,208,,690.4635362827513,,,,,586,PAK,2022/04/01,1,,
Palau,3/5/22,3844,6,,,0,,21346.068414038204,,,,,585,PLW,2022/03/05,0,44526,0
Palau,3/7/22,3864,6,,,20,,21457.130164371392,,,,,585,PLW,2022/03/07,0,44526,0
Palau,3/9/22,3888,6,,,24,,21590.404264771212,,,,,585,PLW,2022/03/09,0,44526,0
Palau,3/11/22,3899,6,,,11,,21651.488227454465,,,,,585,PLW,2022/03/11,0,44526,0
Palau,3/14/22,3922,6,,,23,,21779.209240337626,,,,,585,PLW,2022/03/14,0,44526,0
Palau,3/16/22,3935,6,,,13,,21851.399378054197,,,,,585,PLW,2022/03/16,0,44526,0
Palau,3/18/22,3945,6,,,10,,21906.93025322079,,,,,585,PLW,2022/03/18,0,44526,0
Palau,3/21/22,3966,6,,,21,,22023.545091070635,,,,,585,PLW,2022/03/21,0,44526,0
Palau,3/23/22,3976,6,,,10,,22079.07596623723,,,,,585,PLW,2022/03/23,0,44526,0
Palau,3/25/22,3987,6,,,11,,22140.15992892048,,,,,585,PLW,2022/03/25,0,44526,0
Palau,3/28/22,4014,6,,,27,,22290.09329187028,,,,,585,PLW,2022/03/28,0,44526,0
Palau,3/30/22,4024,6,,,10,,22345.624167036873,,,,,585,PLW,2022/03/30,0,44526,0
Palau,4/1/22,4042,6,,,18,,22445.57974233674,,,,,585,PLW,2022/04/01,0,,
Panama,3/5/22,757487,8111,,,426,,17555.68317925784,,,,,591,PAN,2022/03/05,5,7544898,0
Panama,3/7/22,757930,8118,,,443,,17565.950243442985,,,,,591,PAN,2022/03/07,7,7544898,0
Panama,3/8/22,758312,8122,,,382,,17574.80355838367,,,,,591,PAN,2022/03/08,4,7544898,0
Panama,3/9/22,758613,8125,,,301,,17581.77959973746,,,,,591,PAN,2022/03/09,3,7544898,0
Panama,3/10/22,758923,8128,,,310,,17588.964227045348,,,,,591,PAN,2022/03/10,3,7544898,0
Panama,3/11/22,759224,8131,,,301,,17595.940268399136,,,,,591,PAN,2022/03/11,3,7737902,193004
Panama,3/13/22,759636,8137,,,412,,17605.48886985349,,,,,591,PAN,2022/03/13,6,7737902,0
Panama,3/14/22,759782,8140,,,146,,17608.872597553334,,,,,591,PAN,2022/03/14,3,7737902,0
Panama,3/15/22,760105,8143,,,323,,17616.35851568381,,,,,591,PAN,2022/03/15,3,7737902,0
Panama,3/16/22,760405,8146,,,300,,17623.311380820476,,,,,591,PAN,2022/03/16,3,7775051,37149
Panama,3/17/22,760735,8150,,,330,,17630.959532470806,,,,,591,PAN,2022/03/17,4,7775051,0
Panama,3/18/22,761004,8153,,,269,,17637.193934876683,,,,,591,PAN,2022/03/18,3,7789018,13967
Panama,3/20/22,761508,8156,,,504,,17648.874748306283,,,,,591,PAN,2022/03/20,3,7789018,0
Panama,3/22/22,762008,8159,,,500,,17660.46285686739,,,,,591,PAN,2022/03/22,3,7789018,0
Panama,3/23/22,762394,8159,,,386,,17669.408876676567,,,,,591,PAN,2022/03/23,0,7789018,0
Panama,3/24/22,762735,8160,,,341,,17677.311966715242,,,,,591,PAN,2022/03/24,1,7869265,80247
Panama,3/25/22,763025,8162,,,290,,17684.03306968069,,,,,591,PAN,2022/03/25,2,7869265,0
Panama,3/26/22,763280,8163,,,255,,17689.943005046855,,,,,591,PAN,2022/03/26,1,7889044,19779
Panama,3/27/22,763483,8164,,,203,,17694.647777122664,,,,,591,PAN,2022/03/27,1,7889044,0
Panama,3/28/22,763608,8167,,,125,,17697.54480426294,,,,,591,PAN,2022/03/28,3,7889044,0
Panama,3/29/22,763933,8168,,,325,,17705.077074827663,,,,,591,PAN,2022/03/29,1,7889044,0
Panama,3/30/22,764243,8168,,,310,,17712.26170213555,,,,,591,PAN,2022/03/30,0,7889044,0
Panama,3/31/22,764536,8170,,,293,,17719.05233375236,,,,,591,PAN,2022/03/31,2,7889044,0
Panama,4/1/22,764831,8170,,,295,,17725.889317803412,,,,,591,PAN,2022/04/01,0,,
Papua New Guinea,3/5/22,41421,638,,,0,,462.95825417761677,,,,,598,PNG,2022/03/05,0,547855,0
Papua New Guinea,3/7/22,41533,639,,,112,,464.2100666511904,,,,,598,PNG,2022/03/07,1,547855,0
Papua New Guinea,3/25/22,43076,640,,,1543,,481.45601885408416,,,,,598,PNG,2022/03/25,1,561863,0
Papua New Guinea,3/28/22,43203,640,,,127,,482.87548478393995,,,,,598,PNG,2022/03/28,0,561863,0
Papua New Guinea,4/1/22,43203,640,,,0,,482.87548478393995,,,,,598,PNG,2022/04/01,0,,
Paraguay,3/5/22,643619,18460,,,277,,9023.712483508656,,,,,600,PRY,2022/03/05,6,8183512,58529
Paraguay,3/6/22,643879,18471,,,260,,9027.357753840502,,,,,600,PRY,2022/03/06,11,8183512,0
Paraguay,3/7/22,644199,18482,,,320,,9031.844240402774,,,,,600,PRY,2022/03/07,11,8183512,0
Paraguay,3/8/22,644609,18494,,,410,,9037.592551310685,,,,,600,PRY,2022/03/08,12,8183512,0
Paraguay,3/9/22,645020,18510,,,411,,9043.354882489102,,,,,600,PRY,2022/03/09,16,8183512,0
Paraguay,3/10/22,645383,18517,,,363,,9048.44424068318,,,,,600,PRY,2022/03/10,7,8183512,0
Paraguay,3/11/22,645655,18522,,,272,,9052.25775426111,,,,,600,PRY,2022/03/11,5,8218163,34651
Paraguay,3/12/22,645768,18529,,,113,,9053.842044828412,,,,,600,PRY,2022/03/12,7,8218163,0
Paraguay,3/13/22,645883,18538,,,115,,9055.45437593673,,,,,600,PRY,2022/03/13,9,8218163,0
Paraguay,3/14/22,646054,18548,,,171,,9057.851842193444,,,,,600,PRY,2022/03/14,10,8218163,0
Paraguay,3/15/22,646283,18552,,,229,,9061.06248413957,,,,,600,PRY,2022/03/15,4,8218163,0
Paraguay,3/16/22,646495,18555,,,212,,9064.034781487075,,,,,600,PRY,2022/03/16,3,8298325,80162
Paraguay,3/17/22,646630,18559,,,135,,9065.927518005532,,,,,600,PRY,2022/03/17,4,8298325,0
Paraguay,3/18/22,646843,18571,,,213,,9068.913835623545,,,,,600,PRY,2022/03/18,12,8375280,76955
Paraguay,3/19/22,646968,18577,,,125,,9070.666369436933,,,,,600,PRY,2022/03/19,6,8375280,0
Paraguay,3/20/22,647099,18586,,,131,,9072.503024873362,,,,,600,PRY,2022/03/20,9,8375280,0
Paraguay,3/21/22,647268,18599,,,169,,9074.872450589062,,,,,600,PRY,2022/03/21,13,8375280,0
Paraguay,3/22/22,647428,18603,,,160,,9077.115693870197,,,,,600,PRY,2022/03/22,4,8375280,0
Paraguay,3/23/22,647538,18606,,,110,,9078.657923625979,,,,,600,PRY,2022/03/23,3,8375280,0
Paraguay,3/24/22,647672,18608,,,134,,9080.53663987393,,,,,600,PRY,2022/03/24,2,8375280,0
Paraguay,3/25/22,647762,18662,,,90,,9081.798464219568,,,,,600,PRY,2022/03/25,54,8375280,0
Paraguay,3/26/22,647836,18663,,,74,,9082.835964237094,,,,,600,PRY,2022/03/26,1,8428214,52934
Paraguay,3/27/22,647906,18664,,,70,,9083.81738317259,,,,,600,PRY,2022/03/27,1,8428214,0
Paraguay,3/28/22,647950,18664,,,44,,9084.434275074904,,,,,600,PRY,2022/03/28,0,8428214,0
Paraguay,4/1/22,648353,18731,,,403,,9090.084444089265,,,,,600,PRY,2022/04/01,67,,
Peru,3/5/22,3525940,211032,,,1436,,10693.790089884564,,,,,604,PER,2022/03/05,37,61868467,0
Peru,3/6/22,3527549,211108,,,1609,,10698.67001077222,,,,,604,PER,2022/03/06,76,62432103,563636
Peru,3/7/22,3528038,211155,,,489,,10700.153094248953,,,,,604,PER,2022/03/07,47,62432103,0
Peru,3/8/22,3528939,211252,,,901,,10702.88572863042,,,,,604,PER,2022/03/08,97,62432103,0
Peru,3/10/22,3531075,211364,,,2136,,10709.363982835537,,,,,604,PER,2022/03/10,112,62912272,480169
Peru,3/11/22,3534687,211423,,,3612,,10720.318783485765,,,,,604,PER,2022/03/11,59,62912272,0
Peru,3/12/22,3535726,211482,,,1039,,10723.469956762507,,,,,604,PER,2022/03/12,59,62912272,0
Peru,3/13/22,3536496,211546,,,770,,10725.805282482515,,,,,604,PER,2022/03/13,64,62912272,0
Peru,3/14/22,3536842,211579,,,346,,10726.854662611247,,,,,604,PER,2022/03/14,33,63384360,472088
Peru,3/15/22,3537488,211619,,,646,,10728.81390990362,,,,,604,PER,2022/03/15,40,63657599,273239
Peru,3/17/22,3539400,211691,,,1912,,10734.612796626552,,,,,604,PER,2022/03/17,72,64152314,494715
Peru,3/18/22,3540108,211751,,,708,,10736.760083132744,,,,,604,PER,2022/03/18,60,64343352,191038
Peru,3/19/22,3540793,211814,,,685,,10738.837613156387,,,,,604,PER,2022/03/19,63,64343352,0
Peru,3/20/22,3541397,211865,,,604,,10740.66947904585,,,,,604,PER,2022/03/20,51,64343352,0
Peru,3/21/22,3541994,211924,,,597,,10742.480114701493,,,,,604,PER,2022/03/21,59,64574419,231067
Peru,3/22/22,3542602,211944,,,608,,10744.324112153137,,,,,604,PER,2022/03/22,20,64574419,0
Peru,3/24/22,3543790,212022,,,1188,,10747.927186121153,,,,,604,PER,2022/03/24,78,64981018,406599
Peru,3/25/22,3544338,212050,,,548,,10749.58921014007,,,,,604,PER,2022/03/25,28,64981018,0
Peru,3/26/22,3544862,212102,,,524,,10751.178444785894,,,,,604,PER,2022/03/26,52,64981018,0
Peru,3/27/22,3545403,212128,,,541,,10752.819238570992,,,,,604,PER,2022/03/27,26,66378815,1397797
Peru,3/28/22,3545628,212157,,,225,,10753.501638943722,,,,,604,PER,2022/03/28,29,66378815,0
Peru,3/30/22,3546696,212207,,,1068,,10756.740766046281,,,,,604,PER,2022/03/30,50,66378815,0
Peru,4/1/22,3547125,212222,,,429,,10758.041876090287,,,,,604,PER,2022/04/01,15,,
Philippines,3/5/22,3666678,56879,,,931,,3346.0865987957686,,,,,608,PHL,2022/03/05,109,141959452,0
Philippines,3/6/22,3667542,57023,,,864,,3346.8750560372714,,,,,608,PHL,2022/03/06,144,141959452,0
Philippines,3/7/22,3668268,57066,,,726,,3347.5375791360343,,,,,608,PHL,2022/03/07,43,141959452,0
Philippines,3/8/22,3668710,57072,,,442,,3347.9409334193033,,,,,608,PHL,2022/03/08,6,141959452,0
Philippines,3/9/22,3669283,57182,,,573,,3348.46383388155,,,,,608,PHL,2022/03/09,110,141959452,0
Philippines,3/10/22,3668940,57258,,,,,3348.150823657203,,,,,608,PHL,2022/03/10,76,141959452,0
Philippines,3/11/22,3669523,57317,,,583,,3348.6828497819674,,,,,608,PHL,2022/03/11,59,141959452,0
Philippines,3/12/22,3670177,57441,,,654,,3349.279668110605,,,,,608,PHL,2022/03/12,124,141959452,0
Philippines,3/13/22,3670739,57610,,,562,,3349.7925303440825,,,,,608,PHL,2022/03/13,169,141959452,0
Philippines,3/14/22,3671293,57625,,,554,,3350.2980920475466,,,,,608,PHL,2022/03/14,15,141959452,0
Philippines,3/16/22,3672069,57735,,,776,,3351.0062434588963,,,,,608,PHL,2022/03/16,110,145729130,8377308
Philippines,3/17/22,3672661,57880,,,592,,3351.546482679926,,,,,608,PHL,2022/03/17,145,145729130,0
Philippines,3/18/22,3673201,57999,,,540,,3352.0392684558656,,,,,608,PHL,2022/03/18,119,145729130,0
Philippines,3/19/22,3673717,58023,,,516,,3352.510152641763,,,,,608,PHL,2022/03/19,24,145729130,0
Philippines,3/20/22,3674286,58263,,,569,,3353.0294028390026,,,,,608,PHL,2022/03/20,240,145729130,0
Philippines,3/21/22,3674694,58276,,,408,,3353.4017298697127,,,,,608,PHL,2022/03/21,13,145729130,0
Philippines,3/22/22,3674983,58281,,,289,,3353.6654615164653,,,,,608,PHL,2022/03/22,5,147208745,1479615
Philippines,3/23/22,3675384,58563,,,401,,3354.0314005834125,,,,,608,PHL,2022/03/23,282,147208745,0
Philippines,3/24/22,3675821,58771,,,437,,3354.430192035423,,,,,608,PHL,2022/03/24,208,147208745,0
Philippines,3/25/22,3676230,58831,,,409,,3354.803431632384,,,,,608,PHL,2022/03/25,60,145729130,
Philippines,3/26/22,3676665,58884,,,435,,3355.200397951891,,,,,608,PHL,2022/03/26,53,141226139,
Philippines,3/27/22,3676991,59015,,,326,,3355.4978945499583,,,,,608,PHL,2022/03/27,131,141226139,0
Philippines,3/28/22,3677376,59030,,,385,,3355.8492325568777,,,,,608,PHL,2022/03/28,15,141226139,0
Philippines,3/29/22,3677616,59038,,,240,,3356.0682484572953,,,,,608,PHL,2022/03/29,8,148799120,7572981
Philippines,3/30/22,3677924,59125,,,308,,3356.3493188628313,,,,,608,PHL,2022/03/30,87,148799120,0
Philippines,3/31/22,3678245,59249,,,321,,3356.6422526296396,,,,,608,PHL,2022/03/31,124,148799120,0
Philippines,4/1/22,3678598,59298,,,353,,3356.9643885165037,,,,,608,PHL,2022/04/01,49,,
Poland,3/5/22,5734041,112535,,,12725,,15150.740733547962,,,,,616,POL,2022/03/05,199,53504033,16949
Poland,3/6/22,5741739,112545,,,7698,,15171.080734982703,,,,,616,POL,2022/03/06,10,53507461,3428
Poland,3/7/22,5747322,112551,,,5583,,15185.832388400491,,,,,616,POL,2022/03/07,6,53526887,19426
Poland,3/8/22,5760498,112768,,,13176,,15220.646607535868,,,,,616,POL,2022/03/08,217,53547442,20555
Poland,3/9/22,5774938,113002,,,14440,,15258.800624256786,,,,,616,POL,2022/03/09,234,53572077,24635
Poland,3/10/22,5788363,113186,,,13425,,15294.272762378554,,,,,616,POL,2022/03/10,184,53596915,24838
Poland,3/11/22,5799996,113307,,,11633,,15325.009997594236,,,,,616,POL,2022/03/11,121,53632473,35558
Poland,3/12/22,5811109,113434,,,11113,,15354.373265448778,,,,,616,POL,2022/03/12,127,53632473,0
Poland,3/13/22,5818687,113443,,,7578,,15374.396197492482,,,,,616,POL,2022/03/13,9,53651153,18680
Poland,3/14/22,5823982,113444,,,5295,,15388.386884371796,,,,,616,POL,2022/03/14,1,53670465,19312
Poland,3/15/22,5836672,113622,,,12690,,15421.91697247349,,,,,616,POL,2022/03/15,178,53689500,19035
Poland,3/16/22,5851147,113773,,,14475,,15460.163467766792,,,,,616,POL,2022/03/16,151,53711008,21508
Poland,3/17/22,5863414,113980,,,12267,,15492.575886265096,,,,,616,POL,2022/03/17,207,53731568,20560
Poland,3/18/22,5875072,114087,,,11658,,15523.379177603909,,,,,616,POL,2022/03/18,107,53764040,32472
Poland,3/19/22,5885446,114206,,,10374,,15550.789826458675,,,,,616,POL,2022/03/19,119,53776917,12877
Poland,3/20/22,5891140,114218,,,5694,,15565.834769063169,,,,,616,POL,2022/03/20,12,53779125,2208
Poland,3/21/22,5895304,114221,,,4164,,15576.837076931999,,,,,616,POL,2022/03/21,3,53794002,14877
Poland,3/22/22,5905463,114355,,,10159,,15603.67964312783,,,,,616,POL,2022/03/22,134,53809376,15374
Poland,3/23/22,5915888,114480,,,10425,,15631.225046473786,,,,,616,POL,2022/03/23,125,53809376,0
Poland,3/24/22,5924876,114626,,,8988,,15654.973543862125,,,,,616,POL,2022/03/24,146,53843927,34551
Poland,3/25/22,5933107,114736,,,8231,,15676.721861842034,,,,,616,POL,2022/03/25,110,53870219,26292
Poland,3/26/22,5939735,114821,,,6628,,15694.234661206732,,,,,616,POL,2022/03/26,85,53880551,10332
Poland,3/27/22,5943227,114828,,,3492,,15703.46138048578,,,,,616,POL,2022/03/27,7,53882175,1624
Poland,3/28/22,5945594,114829,,,2367,,15709.715574223897,,,,,616,POL,2022/03/28,1,53895022,12847
Poland,3/29/22,5952200,114939,,,6606,,15727.170244200239,,,,,616,POL,2022/03/29,110,53908363,13341
Poland,3/30/22,5957940,115040,,,5740,,15742.336730071296,,,,,616,POL,2022/03/30,101,53908363,0
Poland,3/31/22,5962931,115173,,,4991,,15755.524174493326,,,,,616,POL,2022/03/31,133,53908363,0
Poland,4/1/22,5966970,115247,,,4039,,15766.196201746498,,,,,616,POL,2022/04/01,74,,
Portugal,3/5/22,3322134,21182,,,13696,,32580.45955424629,,,,,620,PRT,2022/03/05,20,23288435,0
Portugal,3/6/22,3332200,21199,,,10066,,32679.17769923172,,,,,620,PRT,2022/03/06,17,23288435,0
Portugal,3/7/22,3337806,21216,,,5606,,32734.156232987767,,,,,620,PRT,2022/03/07,17,23288435,0
Portugal,3/8/22,3352874,21248,,,15068,,32881.92943074661,,,,,620,PRT,2022/03/08,32,23288435,0
Portugal,3/9/22,3367469,21267,,,14595,,33025.06387601409,,,,,620,PRT,2022/03/09,19,23288435,0
Portugal,3/10/22,3380263,21285,,,12794,,33150.53575629858,,,,,620,PRT,2022/03/10,18,23288435,0
Portugal,3/14/22,3413013,21342,,,32750,,33471.717879115284,,,,,620,PRT,2022/03/14,57,23288435,0
Portugal,3/18/22,3458727,21408,,,45714,,33920.03908712882,,,,,620,PRT,2022/03/18,66,23518201,0
Portugal,3/25/22,3534003,21545,,,75276,,34658.27742230899,,,,,620,PRT,2022/03/25,137,23518201,0
Portugal,3/31/22,3588776,21695,,,54773,,35195.44103797432,,,,,620,PRT,2022/03/31,150,23586345,0
Portugal,4/1/22,3604114,21716,,,15338,,35345.86214941745,,,,,620,PRT,2022/04/01,21,,
Qatar,3/5/22,358083,670,,,163,,12428.862987928054,,,,,634,QAT,2022/03/05,0,5955033,0
Qatar,3/6/22,358253,670,,,170,,12434.763593955002,,,,,634,QAT,2022/03/06,0,5955033,0
Qatar,3/7/22,358418,670,,,165,,12440.490652745864,,,,,634,QAT,2022/03/07,0,5955033,0
Qatar,3/8/22,358564,671,,,146,,12445.558232039597,,,,,634,QAT,2022/03/08,1,5955033,0
Qatar,3/9/22,358694,672,,,130,,12450.07046017785,,,,,634,QAT,2022/03/09,1,5955033,0
Qatar,3/10/22,358821,672,,,127,,12454.478559974454,,,,,634,QAT,2022/03/10,0,5955033,0
Qatar,3/11/22,358946,674,,,125,,12458.817240876622,,,,,634,QAT,2022/03/11,2,5955033,0
Qatar,3/12/22,359028,675,,,82,,12461.663415548444,,,,,634,QAT,2022/03/12,1,5955033,0
Qatar,3/13/22,359149,676,,,121,,12465.863258661742,,,,,634,QAT,2022/03/13,1,5955033,0
Qatar,3/14/22,359259,677,,,110,,12469.68129785565,,,,,634,QAT,2022/03/14,1,5955033,0
Qatar,3/15/22,359361,677,,,102,,12473.22166147182,,,,,634,QAT,2022/03/15,0,5955033,0
Qatar,3/16/22,359449,677,,,88,,12476.276092826945,,,,,634,QAT,2022/03/16,0,5955033,0
Qatar,3/17/22,359517,677,,,68,,12478.636335237725,,,,,634,QAT,2022/03/17,0,5955033,0
Qatar,3/18/22,359670,677,,,153,,12483.946880661979,,,,,634,QAT,2022/03/18,0,5955033,0
Qatar,3/19/22,359806,677,,,136,,12488.667365483538,,,,,634,QAT,2022/03/19,0,5955033,0
Qatar,3/20/22,359956,677,,,150,,12493.87378256614,,,,,634,QAT,2022/03/20,0,5955033,0
Qatar,3/21/22,360109,677,,,153,,12499.184327990393,,,,,634,QAT,2022/03/21,0,5955033,0
Qatar,3/22/22,360251,677,,,142,,12504.113069495255,,,,,634,QAT,2022/03/22,0,5955033,0
Qatar,3/23/22,360382,677,,,131,,12508.660007080727,,,,,634,QAT,2022/03/23,0,5955033,0
Qatar,3/24/22,360497,677,,,115,,12512.651593510722,,,,,634,QAT,2022/03/24,0,5955033,0
Qatar,3/25/22,360619,677,,,122,,12516.886146071238,,,,,634,QAT,2022/03/25,0,5955033,0
Qatar,3/26/22,360704,677,,,85,,12519.836449084713,,,,,634,QAT,2022/03/26,0,5955033,0
Qatar,3/27/22,360868,677,,,164,,12525.528798428357,,,,,634,QAT,2022/03/27,0,5955033,0
Qatar,3/28/22,361020,677,,,152,,12530.804634405393,,,,,634,QAT,2022/03/28,0,5955033,0
Qatar,3/29/22,361160,677,,,140,,12535.66395701582,,,,,634,QAT,2022/03/29,0,5955033,0
Qatar,3/30/22,361283,677,,,123,,12539.933219023555,,,,,634,QAT,2022/03/30,0,5955033,0
Qatar,3/31/22,361415,677,,,132,,12544.514866056243,,,,,634,QAT,2022/03/31,0,5955033,0
Qatar,4/1/22,361545,677,,,130,,12549.027094194498,,,,,634,QAT,2022/04/01,0,,
Romania,3/5/22,2765169,63931,,,4837,,14373.711968001135,,,,,642,ROU,2022/03/05,82,16717819,3643
Romania,3/6/22,2768261,63961,,,3092,,14389.78459047197,,,,,642,ROU,2022/03/06,30,16719695,1876
Romania,3/7/22,2771449,63993,,,3188,,14406.35623356286,,,,,642,ROU,2022/03/07,32,16722679,2984
Romania,3/8/22,2776910,64094,,,5461,,14434.743229459766,,,,,642,ROU,2022/03/08,101,16725732,3053
Romania,3/9/22,2781086,64156,,,4176,,14456.45062643202,,,,,642,ROU,2022/03/09,62,16728347,2615
Romania,3/10/22,2784651,64226,,,3565,,14474.981965082903,,,,,642,ROU,2022/03/10,70,16730996,2649
Romania,3/11/22,2787625,64276,,,2974,,14490.441208041593,,,,,642,ROU,2022/03/11,50,16733966,2970
Romania,3/12/22,2790368,64335,,,2743,,14504.699682633282,,,,,642,ROU,2022/03/12,59,16736115,2149
Romania,3/13/22,2791994,64361,,,1626,,14513.15184438541,,,,,642,ROU,2022/03/13,26,16737321,1206
Romania,3/14/22,2794081,64381,,,2087,,14524.000344740078,,,,,642,ROU,2022/03/14,20,16737321,0
Romania,3/15/22,2798935,64450,,,4854,,14549.23207484145,,,,,642,ROU,2022/03/15,69,16737321,0
Romania,3/16/22,2802848,64518,,,3913,,14569.57236324002,,,,,642,ROU,2022/03/16,68,16737321,0
Romania,3/17/22,2806881,64581,,,4033,,14590.536427413655,,,,,642,ROU,2022/03/17,63,16737321,0
Romania,3/18/22,2810630,64625,,,3749,,14610.024222252972,,,,,642,ROU,2022/03/18,44,16737321,0
Romania,3/19/22,2813798,64669,,,3168,,14626.491902714683,,,,,642,ROU,2022/03/19,44,16737321,0
Romania,3/20/22,2816039,64685,,,2241,,14638.140915314018,,,,,642,ROU,2022/03/20,16,16737321,0
Romania,3/21/22,2818275,64697,,,2236,,14649.763937256059,,,,,642,ROU,2022/03/21,12,16737321,0
Romania,3/22/22,2823415,64749,,,5140,,14676.482332954667,,,,,642,ROU,2022/03/22,52,16737321,0
Romania,3/23/22,2827936,64789,,,4521,,14699.983085280233,,,,,642,ROU,2022/03/23,40,16737321,0
Romania,3/24/22,2832024,64826,,,4088,,14721.233046684107,,,,,642,ROU,2022/03/24,37,16737321,0
Romania,3/25/22,2835749,64867,,,3725,,14740.59608636841,,,,,642,ROU,2022/03/25,41,16737321,0
Romania,3/26/22,2838849,64895,,,3100,,14756.710293890917,,,,,642,ROU,2022/03/26,28,16737321,0
Romania,3/27/22,2840788,64905,,,1939,,14766.789470789672,,,,,642,ROU,2022/03/27,10,16737321,0
Romania,3/28/22,2842739,64913,,,1951,,14776.931025265934,,,,,642,ROU,2022/03/28,8,16737321,0
Romania,3/29/22,2847015,64958,,,4276,,14799.158235384077,,,,,642,ROU,2022/03/29,45,16737321,0
Romania,3/30/22,2850598,64994,,,3583,,14817.78314040122,,,,,642,ROU,2022/03/30,36,16737321,0
Romania,3/31/22,2853570,65015,,,2972,,14833.23198709699,,,,,642,ROU,2022/03/31,21,16737321,0
Romania,4/1/22,2856491,65042,,,2921,,14848.41572908836,,,,,642,ROU,2022/04/01,27,,
Russia,3/5/22,16619507,348467,,,85575,,11388.336243543848,,,,,643,RUS,2022/03/05,737,161243863,286708
Russia,3/6/22,16698139,349196,,,78632,,11442.21796551685,,,,,643,RUS,2022/03/06,729,161246982,3119
Russia,3/7/22,16770275,349853,,,72136,,11491.648374208531,,,,,643,RUS,2022/03/07,657,161246982,0
Russia,3/8/22,16835844,350490,,,65569,,11536.578817641837,,,,,643,RUS,2022/03/08,637,161300053,53071
Russia,3/9/22,16893631,351124,,,57787,,11576.176730293859,,,,,643,RUS,2022/03/09,634,161429748,129695
Russia,3/10/22,16943915,351776,,,50284,,11610.633293877265,,,,,643,RUS,2022/03/10,652,161451708,21960
Russia,3/11/22,16993625,352437,,,49710,,11644.69653020952,,,,,643,RUS,2022/03/11,661,161480902,29194
Russia,3/12/22,17040721,353054,,,47096,,11676.968551499078,,,,,643,RUS,2022/03/12,617,161480902,0
Russia,3/13/22,17084672,353635,,,43951,,11707.085495776666,,,,,643,RUS,2022/03/13,581,161729803,248901
Russia,3/14/22,17124792,354157,,,40120,,11734.577289010424,,,,,643,RUS,2022/03/14,522,161799245,69442
Russia,3/15/22,17160872,354702,,,36080,,11759.300716225625,,,,,643,RUS,2022/03/15,545,161833738,34493
Russia,3/16/22,17196841,355267,,,35969,,11783.94808189923,,,,,643,RUS,2022/03/16,565,161840383,6645
Russia,3/17/22,17231013,355816,,,34172,,11807.36407288587,,,,,643,RUS,2022/03/17,549,161841637,1254
Russia,3/18/22,17264828,356327,,,33815,,11830.535433508987,,,,,643,RUS,2022/03/18,511,161844766,3129
Russia,3/19/22,17297181,356812,,,32353,,11852.704974548164,,,,,643,RUS,2022/03/19,485,162052208,207442
Russia,3/20/22,17327694,357234,,,30513,,11873.613675618493,,,,,643,RUS,2022/03/20,422,162246779,194571
Russia,3/21/22,17356036,357634,,,28342,,11893.034722573408,,,,,643,RUS,2022/03/21,400,162443249,196470
Russia,3/22/22,17382051,358093,,,26015,,11910.861218111198,,,,,643,RUS,2022/03/22,459,162700595,257346
Russia,3/23/22,17408475,358510,,,26424,,11928.967976446413,,,,,643,RUS,2022/03/23,417,162700595,0
Russia,3/24/22,17433393,358919,,,24918,,11946.042764676691,,,,,643,RUS,2022/03/24,409,163065113,364518
Russia,3/25/22,17458275,359307,,,24882,,11963.092884298883,,,,,643,RUS,2022/03/25,388,163472534,407421
Russia,3/26/22,17481799,359693,,,23524,,11979.212449204937,,,,,643,RUS,2022/03/26,386,163480985,8451
Russia,3/27/22,17504537,360021,,,22738,,11994.793416167779,,,,,643,RUS,2022/03/27,328,163513489,32504
Russia,3/28/22,17525184,360347,,,20647,,12008.941548144283,,,,,643,RUS,2022/03/28,326,163612344,98855
Russia,3/29/22,17544419,360674,,,19235,,12022.122122492521,,,,,643,RUS,2022/03/29,327,163623016,10672
Russia,3/30/22,17564186,361014,,,19767,,12035.667244049144,,,,,643,RUS,2022/03/30,340,163631475,8459
Russia,3/31/22,17583111,361348,,,18925,,12048.635394272196,,,,,643,RUS,2022/03/31,334,163631475,0
Russia,4/1/22,17601907,361679,,,18796,,12061.515148649607,,,,,643,RUS,2022/04/01,331,,
Rwanda,3/5/22,129551,1458,,,3,,1000.2232051690951,,,,,646,RWA,2022/03/05,0,18038703,0
Rwanda,3/6/22,129556,1458,,,5,,1000.2618086227608,,,,,646,RWA,2022/03/06,0,18038703,0
Rwanda,3/7/22,129560,1458,,,4,,1000.2926913856934,,,,,646,RWA,2022/03/07,0,18038703,0
Rwanda,3/8/22,129567,1459,,,7,,1000.3467362208254,,,,,646,RWA,2022/03/08,1,18038703,0
Rwanda,3/9/22,129569,1459,,,2,,1000.3621776022916,,,,,646,RWA,2022/03/09,0,18038703,0
Rwanda,3/10/22,129576,1459,,,7,,1000.4162224374236,,,,,646,RWA,2022/03/10,0,18038703,0
Rwanda,3/11/22,129589,1459,,,13,,1000.5165914169544,,,,,646,RWA,2022/03/11,0,18038703,0
Rwanda,3/12/22,129596,1459,,,7,,1000.5706362520864,,,,,646,RWA,2022/03/12,0,18038703,0
Rwanda,3/13/22,129601,1459,,,5,,1000.6092397057521,,,,,646,RWA,2022/03/13,0,18038703,0
Rwanda,3/14/22,129602,1459,,,1,,1000.6169603964853,,,,,646,RWA,2022/03/14,0,18038703,0
Rwanda,3/15/22,129610,1459,,,8,,1000.6787259223504,,,,,646,RWA,2022/03/15,0,18038703,0
Rwanda,3/16/22,129615,1459,,,5,,1000.7173293760161,,,,,646,RWA,2022/03/16,0,18038703,0
Rwanda,3/17/22,129623,1459,,,8,,1000.7790949018812,,,,,646,RWA,2022/03/17,0,18038703,0
Rwanda,3/18/22,129635,1459,,,12,,1000.8717431906789,,,,,646,RWA,2022/03/18,0,18038703,0
Rwanda,3/19/22,129637,1459,,,2,,1000.8871845721452,,,,,646,RWA,2022/03/19,0,18038703,0
Rwanda,3/20/22,129647,1459,,,10,,1000.9643914794766,,,,,646,RWA,2022/03/20,0,18038703,0
Rwanda,3/21/22,129658,1459,,,11,,1001.0493190775411,,,,,646,RWA,2022/03/21,0,18038703,0
Rwanda,3/22/22,129674,1459,,,16,,1001.1728501292714,,,,,646,RWA,2022/03/22,0,18038703,0
Rwanda,3/23/22,129693,1459,,,19,,1001.319543253201,,,,,646,RWA,2022/03/23,0,18038703,0
Rwanda,3/24/22,129705,1459,,,12,,1001.4121915419987,,,,,646,RWA,2022/03/24,0,18038703,0
Rwanda,3/25/22,129706,1459,,,1,,1001.4199122327319,,,,,646,RWA,2022/03/25,0,18038703,0
Rwanda,3/26/22,129708,1459,,,2,,1001.4353536141982,,,,,646,RWA,2022/03/26,0,18038703,0
Rwanda,3/27/22,129709,1459,,,1,,1001.4430743049313,,,,,646,RWA,2022/03/27,0,19421047,1382344
Rwanda,3/28/22,129712,1459,,,3,,1001.4662363771307,,,,,646,RWA,2022/03/28,0,19421047,0
Rwanda,3/29/22,129714,1459,,,2,,1001.481677758597,,,,,646,RWA,2022/03/29,0,19421047,0
Rwanda,3/30/22,129718,1459,,,4,,1001.5125605215296,,,,,646,RWA,2022/03/30,0,19421047,0
Rwanda,3/31/22,129722,1459,,,4,,1001.5434432844621,,,,,646,RWA,2022/03/31,0,19421047,0
Rwanda,4/1/22,129726,1459,,,4,,1001.5743260473947,,,,,646,RWA,2022/04/01,0,,
Saint Kitts and Nevis,3/5/22,5536,42,,,3,,10407.580087231163,,,,,659,KNA,2022/03/05,0,60467,0
Saint Kitts and Nevis,3/8/22,5537,42,,,1,,10409.460069183337,,,,,659,KNA,2022/03/08,0,60467,0
Saint Kitts and Nevis,3/10/22,5538,42,,,1,,10411.340051135508,,,,,659,KNA,2022/03/10,0,60467,0
Saint Kitts and Nevis,3/12/22,5540,42,,,2,,10415.100015039856,,,,,659,KNA,2022/03/12,0,60467,0
Saint Kitts and Nevis,3/14/22,5541,42,,,1,,10416.97999699203,,,,,659,KNA,2022/03/14,0,60467,0
Saint Kitts and Nevis,3/17/22,5544,42,,,3,,10422.619942848549,,,,,659,KNA,2022/03/17,0,60467,0
Saint Kitts and Nevis,3/20/22,5548,42,,,4,,10430.139870657242,,,,,659,KNA,2022/03/20,0,60467,0
Saint Kitts and Nevis,3/28/22,5549,42,,,1,,10432.019852609415,,,,,659,KNA,2022/03/28,0,60467,0
Saint Kitts and Nevis,3/30/22,5549,43,,,0,,10432.019852609415,,,,,659,KNA,2022/03/30,1,60467,0
Saint Kitts and Nevis,4/1/22,5549,43,,,0,,10432.019852609415,,,,,659,KNA,2022/04/01,0,,
Saint Lucia,3/5/22,22733,360,,,0,,12379.85285548579,,,,,662,LCA,2022/03/05,0,116213,0
Saint Lucia,3/6/22,22779,362,,,46,,12404.90336493691,,,,,662,LCA,2022/03/06,2,116213,0
Saint Lucia,3/7/22,22795,362,,,16,,12413.616585615562,,,,,662,LCA,2022/03/07,0,116213,0
Saint Lucia,3/8/22,22808,364,,,13,,12420.696077416966,,,,,662,LCA,2022/03/08,2,116213,0
Saint Lucia,3/9/22,22811,364,,,3,,12422.329806294212,,,,,662,LCA,2022/03/09,0,116213,0
Saint Lucia,3/10/22,22822,364,,,11,,12428.320145510785,,,,,662,LCA,2022/03/10,0,116213,0
Saint Lucia,3/11/22,22833,364,,,11,,12434.310484727357,,,,,662,LCA,2022/03/11,0,116213,0
Saint Lucia,3/12/22,22833,365,,,0,,12434.310484727357,,,,,662,LCA,2022/03/12,1,116213,0
Saint Lucia,3/13/22,22847,365,,,14,,12441.934552821178,,,,,662,LCA,2022/03/13,0,116213,0
Saint Lucia,3/14/22,22853,365,,,6,,12445.202010575671,,,,,662,LCA,2022/03/14,0,116213,0
Saint Lucia,3/15/22,22856,365,,,3,,12446.83573945292,,,,,662,LCA,2022/03/15,0,116213,0
Saint Lucia,3/16/22,22862,365,,,6,,12450.103197207412,,,,,662,LCA,2022/03/16,0,116213,0
Saint Lucia,3/17/22,22870,365,,,8,,12454.459807546738,,,,,662,LCA,2022/03/17,0,116213,0
Saint Lucia,3/18/22,22878,365,,,8,,12458.816417886064,,,,,662,LCA,2022/03/18,0,116213,0
Saint Lucia,3/20/22,22884,365,,,6,,12462.083875640557,,,,,662,LCA,2022/03/20,0,116213,0
Saint Lucia,3/21/22,22891,365,,,7,,12465.895909687468,,,,,662,LCA,2022/03/21,0,116213,0
Saint Lucia,3/22/22,22892,365,,,1,,12466.440485979883,,,,,662,LCA,2022/03/22,0,116213,0
Saint Lucia,3/23/22,22905,365,,,13,,12473.519977781287,,,,,662,LCA,2022/03/23,0,116213,0
Saint Lucia,3/24/22,22907,365,,,2,,12474.609130366118,,,,,662,LCA,2022/03/24,0,116213,0
Saint Lucia,3/25/22,22919,365,,,12,,12481.144045875108,,,,,662,LCA,2022/03/25,0,116213,0
Saint Lucia,3/27/22,22929,365,,,10,,12486.589808799265,,,,,662,LCA,2022/03/27,0,116213,0
Saint Lucia,3/28/22,22941,365,,,12,,12493.124724308253,,,,,662,LCA,2022/03/28,0,116213,0
Saint Lucia,3/29/22,22947,365,,,6,,12496.392182062746,,,,,662,LCA,2022/03/29,0,116213,0
Saint Lucia,3/30/22,22953,365,,,6,,12499.65963981724,,,,,662,LCA,2022/03/30,0,117740,1527
Saint Lucia,4/1/22,22959,365,,,6,,12502.927097571734,,,,,662,LCA,2022/04/01,0,,
Saint Vincent and the Grenadines,3/5/22,8316,106,,,0,,7495.470810386942,,,,,670,VCT,2022/03/05,0,67452,0
Saint Vincent and the Grenadines,3/7/22,8320,106,,,4,,7499.076135452063,,,,,670,VCT,2022/03/07,0,68048,0
Saint Vincent and the Grenadines,3/8/22,8321,106,,,1,,7499.977466718343,,,,,670,VCT,2022/03/08,0,68048,0
Saint Vincent and the Grenadines,3/11/22,8323,106,,,2,,7501.780129250904,,,,,670,VCT,2022/03/11,0,68864,0
Saint Vincent and the Grenadines,3/16/22,8326,106,,,3,,7504.484123049744,,,,,670,VCT,2022/03/16,0,69127,0
Saint Vincent and the Grenadines,3/21/22,8329,106,,,3,,7507.188116848585,,,,,670,VCT,2022/03/21,0,69127,0
Saint Vincent and the Grenadines,3/22/22,8330,106,,,1,,7508.089448114865,,,,,670,VCT,2022/03/22,0,69127,0
Saint Vincent and the Grenadines,3/25/22,8332,106,,,2,,7509.892110647426,,,,,670,VCT,2022/03/25,0,69578,451
Saint Vincent and the Grenadines,3/28/22,8333,106,,,1,,7510.793441913706,,,,,670,VCT,2022/03/28,0,69602,0
Saint Vincent and the Grenadines,3/29/22,8335,106,,,2,,7512.596104446267,,,,,670,VCT,2022/03/29,0,69602,0
Saint Vincent and the Grenadines,4/1/22,8335,106,,,0,,7512.596104446267,,,,,670,VCT,2022/04/01,0,,
Samoa,3/5/22,33,0,,,0,,16.82557487380819,,,,,882,WSM,2022/03/05,0,276278,0
Samoa,3/7/22,41,0,,,8,,20.904502115943508,,,,,882,WSM,2022/03/07,0,276278,0
Samoa,3/10/22,45,0,,,4,,22.943965737011165,,,,,882,WSM,2022/03/10,0,276278,0
Samoa,3/11/22,46,0,,,1,,23.453831642278082,,,,,882,WSM,2022/03/11,0,276278,0
Samoa,3/12/22,48,0,,,2,,24.47356345281191,,,,,882,WSM,2022/03/12,0,276278,0
Samoa,3/17/22,49,0,,,1,,24.983429358078826,,,,,882,WSM,2022/03/17,0,276278,0
Samoa,3/18/22,60,0,,,11,,30.59195431601489,,,,,882,WSM,2022/03/18,0,299293,0
Samoa,3/20/22,111,0,,,51,,56.59511548462754,,,,,882,WSM,2022/03/20,0,299293,0
Samoa,3/21/22,229,0,,,118,,116.75929230612348,,,,,882,WSM,2022/03/21,0,299293,0
Samoa,3/22/22,295,0,,,66,,150.41044205373987,,,,,882,WSM,2022/03/22,0,304893,0
Samoa,3/24/22,796,0,,,501,,405.8532605924642,,,,,882,WSM,2022/03/24,0,304893,0
Samoa,3/26/22,889,0,,,93,,453.27078978228724,,,,,882,WSM,2022/03/26,0,304893,0
Samoa,3/27/22,1105,0,,,216,,563.4018253199408,,,,,882,WSM,2022/03/27,0,304893,0
Samoa,3/29/22,1541,0,,,436,,785.7033600163157,,,,,882,WSM,2022/03/29,0,304893,0
Samoa,3/31/22,1713,0,,,172,,873.4002957222251,,,,,882,WSM,2022/03/31,0,304893,0
Samoa,4/1/22,2128,1,,,415,,1084.9946464079947,,,,,882,WSM,2022/04/01,1,,
San Marino,3/5/22,14487,112,,,0,,42686.66391655371,,,,,674,SMR,2022/03/05,0,69215,0
San Marino,3/7/22,14523,112,,,36,,42792.73970180918,,,,,674,SMR,2022/03/07,0,69215,0
San Marino,3/8/22,14581,112,,,58,,42963.6395780541,,,,,674,SMR,2022/03/08,0,69215,0
San Marino,3/9/22,14629,112,,,48,,43105.07395839472,,,,,674,SMR,2022/03/09,0,69215,0
San Marino,3/10/22,14653,112,,,24,,43175.79114856503,,,,,674,SMR,2022/03/10,0,69215,0
San Marino,3/11/22,14691,112,,,38,,43287.76003300135,,,,,674,SMR,2022/03/11,0,69215,0
San Marino,3/14/22,14726,112,,,35,,43390.88926866639,,,,,674,SMR,2022/03/14,0,69215,0
San Marino,3/15/22,14789,112,,,63,,43576.52189286346,,,,,674,SMR,2022/03/15,0,69215,0
San Marino,3/16/22,14834,112,,,45,,43709.11662443279,,,,,674,SMR,2022/03/16,0,69215,0
San Marino,3/18/22,14870,112,,,36,,43815.19240968826,,,,,674,SMR,2022/03/18,0,69215,0
San Marino,3/21/22,14968,112,,,98,,44103.954269550355,,,,,674,SMR,2022/03/21,0,69215,0
San Marino,3/22/22,15034,112,,,66,,44298.42654251871,,,,,674,SMR,2022/03/22,0,69215,0
San Marino,3/23/22,15079,112,,,45,,44431.021274088045,,,,,674,SMR,2022/03/23,0,69215,0
San Marino,3/24/22,15125,112,,,46,,44566.5625552478,,,,,674,SMR,2022/03/24,0,69215,0
San Marino,3/28/22,15181,113,,,56,,44731.56933231186,,,,,674,SMR,2022/03/28,1,69215,0
San Marino,3/29/22,15272,113,,,91,,44999.70534504096,,,,,674,SMR,2022/03/29,0,69215,0
San Marino,3/30/22,15307,113,,,35,,45102.834580705996,,,,,674,SMR,2022/03/30,0,69215,0
San Marino,3/31/22,15345,113,,,38,,45214.803465142315,,,,,674,SMR,2022/03/31,0,69215,0
San Marino,4/1/22,15345,113,,,0,,45214.803465142315,,,,,674,SMR,2022/04/01,0,,
Sao Tome and Principe,3/5/22,5939,72,,,0,,2709.879951268702,,,,,678,STP,2022/03/05,0,151040,0
Sao Tome and Principe,3/14/22,5936,72,,,,,2708.511094583434,,,,,678,STP,2022/03/14,0,151040,0
Sao Tome and Principe,3/15/22,5937,72,,,1,,2708.96738014519,,,,,678,STP,2022/03/15,0,151040,0
Sao Tome and Principe,3/16/22,5938,72,,,1,,2709.423665706946,,,,,678,STP,2022/03/16,0,151040,0
Sao Tome and Principe,3/19/22,5940,73,,,2,,2710.336236830458,,,,,678,STP,2022/03/19,1,151040,0
Sao Tome and Principe,3/20/22,5941,73,,,1,,2710.792522392214,,,,,678,STP,2022/03/20,0,151040,0
Sao Tome and Principe,3/22/22,5943,73,,,2,,2711.705093515726,,,,,678,STP,2022/03/22,0,151040,0
Sao Tome and Principe,3/25/22,5944,73,,,1,,2712.161379077482,,,,,678,STP,2022/03/25,0,151040,0
Sao Tome and Principe,3/26/22,5945,73,,,1,,2712.617664639238,,,,,678,STP,2022/03/26,0,151040,0
Sao Tome and Principe,4/1/22,5945,73,,,0,,2712.617664639238,,,,,678,STP,2022/04/01,0,,
Saudi Arabia,3/5/22,747119,9006,,,283,,2146.0385311404793,,,,,682,SAU,2022/03/05,1,61371133,78309
Saudi Arabia,3/6/22,747436,9008,,,317,,2146.9490878447946,,,,,682,SAU,2022/03/06,2,61459981,88848
Saudi Arabia,3/7/22,747715,9009,,,279,,2147.7504926413376,,,,,682,SAU,2022/03/07,1,61535839,75858
Saudi Arabia,3/8/22,747934,9011,,,219,,2148.379552320344,,,,,682,SAU,2022/03/08,2,61605907,70068
Saudi Arabia,3/9/22,748121,9013,,,187,,2148.9166946033315,,,,,682,SAU,2022/03/09,2,61686846,80939
Saudi Arabia,3/10/22,748311,9014,,,190,,2149.462454142196,,,,,682,SAU,2022/03/10,1,61762686,75840
Saudi Arabia,3/11/22,748489,9016,,,178,,2149.9737446575527,,,,,682,SAU,2022/03/11,2,61808334,45648
Saudi Arabia,3/12/22,748624,9017,,,135,,2150.361521172009,,,,,682,SAU,2022/03/12,1,61869679,61345
Saudi Arabia,3/13/22,748769,9018,,,145,,2150.778021872721,,,,,682,SAU,2022/03/13,1,61924677,54998
Saudi Arabia,3/14/22,748915,9020,,,146,,2151.197394992059,,,,,682,SAU,2022/03/14,2,62012932,88255
Saudi Arabia,3/15/22,749044,9021,,,129,,2151.567936994761,,,,,682,SAU,2022/03/15,1,62077448,64516
Saudi Arabia,3/16/22,749171,9023,,,127,,2151.9327341602125,,,,,682,SAU,2022/03/16,2,62143452,66004
Saudi Arabia,3/17/22,749268,9024,,,97,,2152.211358766896,,,,,682,SAU,2022/03/17,1,62208836,65384
Saudi Arabia,3/18/22,749373,9025,,,105,,2152.5129627225842,,,,,682,SAU,2022/03/18,1,62253891,45055
Saudi Arabia,3/19/22,749471,9027,,,98,,2152.794459747893,,,,,682,SAU,2022/03/19,2,62323809,69918
Saudi Arabia,3/20/22,749597,9028,,,126,,2153.1563844947186,,,,,682,SAU,2022/03/20,1,62388851,65042
Saudi Arabia,3/21/22,749730,9030,,,133,,2153.5384161719235,,,,,682,SAU,2022/03/21,2,62388851,0
Saudi Arabia,3/22/22,749855,9032,,,125,,2153.897468500124,,,,,682,SAU,2022/03/22,2,62388851,0
Saudi Arabia,3/23/22,749965,9033,,,110,,2154.21343454894,,,,,682,SAU,2022/03/23,1,62388851,0
Saudi Arabia,3/24/22,750080,9034,,,115,,2154.5437626908843,,,,,682,SAU,2022/03/24,1,62388851,0
Saudi Arabia,3/25/22,750179,9036,,,99,,2154.8281321348186,,,,,682,SAU,2022/03/25,2,62388851,0
Saudi Arabia,3/26/22,750258,9038,,,79,,2155.055053206241,,,,,682,SAU,2022/03/26,2,62388851,0
Saudi Arabia,3/27/22,750356,9039,,,98,,2155.33655023155,,,,,682,SAU,2022/03/27,1,62388851,0
Saudi Arabia,3/28/22,750483,9040,,,127,,2155.7013473970014,,,,,682,SAU,2022/03/28,1,62388851,0
Saudi Arabia,3/29/22,750589,9042,,,106,,2156.005823771315,,,,,682,SAU,2022/03/29,2,62388851,0
Saudi Arabia,3/30/22,750707,9043,,,118,,2156.344769169136,,,,,682,SAU,2022/03/30,1,62388851,0
Saudi Arabia,3/31/22,750814,9045,,,107,,2156.6521179620754,,,,,682,SAU,2022/03/31,2,62388851,0
Saudi Arabia,4/1/22,750910,9046,,,96,,2156.927870150133,,,,,682,SAU,2022/04/01,1,,
Senegal,3/5/22,85747,1961,,,8,,512.1079698732615,,,,,686,SEN,2022/03/05,0,2473562,0
Senegal,3/6/22,85757,1961,,,10,,512.16769300875,,,,,686,SEN,2022/03/06,0,2493984,20422
Senegal,3/7/22,85768,1962,,,11,,512.2333884577874,,,,,686,SEN,2022/03/07,1,2493984,0
Senegal,3/8/22,85772,1962,,,4,,512.2572777119827,,,,,686,SEN,2022/03/08,0,2493984,0
Senegal,3/9/22,85775,1962,,,3,,512.2751946526294,,,,,686,SEN,2022/03/09,0,2493984,0
Senegal,3/10/22,85782,1962,,,7,,512.3170008474713,,,,,686,SEN,2022/03/10,0,2493984,0
Senegal,3/11/22,85785,1964,,,3,,512.3349177881179,,,,,686,SEN,2022/03/11,2,2493984,0
Senegal,3/13/22,85797,1964,,,12,,512.406585550704,,,,,686,SEN,2022/03/13,0,2493984,0
Senegal,3/14/22,85806,1964,,,9,,512.4603363726437,,,,,686,SEN,2022/03/14,0,2488671,
Senegal,3/15/22,85808,1964,,,2,,512.4722809997414,,,,,686,SEN,2022/03/15,0,2488671,0
Senegal,3/16/22,85815,1964,,,7,,512.5140871945833,,,,,686,SEN,2022/03/16,0,2488671,0
Senegal,3/17/22,85818,1964,,,3,,512.53200413523,,,,,686,SEN,2022/03/17,0,2488671,0
Senegal,3/18/22,85820,1964,,,2,,512.5439487623275,,,,,686,SEN,2022/03/18,0,2496373,7702
Senegal,3/19/22,85821,1964,,,1,,512.5499210758765,,,,,686,SEN,2022/03/19,0,2496373,0
Senegal,3/20/22,85827,1964,,,6,,512.5857549571696,,,,,686,SEN,2022/03/20,0,2496373,0
Senegal,3/21/22,85831,1964,,,4,,512.609644211365,,,,,686,SEN,2022/03/21,0,2496373,0
Senegal,3/22/22,85832,1964,,,1,,512.6156165249138,,,,,686,SEN,2022/03/22,0,2496373,0
Senegal,3/23/22,85838,1988,,,6,,512.6514504062069,,,,,686,SEN,2022/03/23,24,2496373,0
Senegal,3/24/22,85842,1964,,,4,,512.6753396604023,,,,,686,SEN,2022/03/24,,2496373,0
Senegal,3/25/22,85854,1964,,,12,,512.7470074229885,,,,,686,SEN,2022/03/25,0,2496373,0
Senegal,3/26/22,85860,1964,,,6,,512.7828413042816,,,,,686,SEN,2022/03/26,0,2496373,0
Senegal,3/27/22,85868,1964,,,8,,512.8306198126725,,,,,686,SEN,2022/03/27,0,2496373,0
Senegal,3/28/22,85876,1964,,,8,,512.8783983210632,,,,,686,SEN,2022/03/28,0,2496373,0
Senegal,3/29/22,85880,1964,,,4,,512.9022875752586,,,,,686,SEN,2022/03/29,0,2496373,0
Senegal,3/30/22,85886,1964,,,6,,512.9381214565517,,,,,686,SEN,2022/03/30,0,2496373,0
Senegal,3/31/22,85895,1964,,,9,,512.9918722784913,,,,,686,SEN,2022/03/31,0,2496373,0
Senegal,4/1/22,85901,1964,,,6,,513.0277061597844,,,,,686,SEN,2022/04/01,0,,
Serbia,3/5/22,1923977,15405,,,2146,,22020.09300281435,,,,,688,SRB,2022/03/05,30,8474034,0
Serbia,3/6/22,1925618,15437,,,1641,,22038.874398131244,,,,,688,SRB,2022/03/06,32,8474034,0
Serbia,3/7/22,1927849,15463,,,2231,,22064.40839749261,,,,,688,SRB,2022/03/07,26,8474034,0
Serbia,3/8/22,1930437,15488,,,2588,,22094.028294555457,,,,,688,SRB,2022/03/08,25,8480196,6162
Serbia,3/9/22,1932814,15512,,,2377,,22121.233277290536,,,,,688,SRB,2022/03/09,24,8480196,0
Serbia,3/10/22,1934953,15533,,,2139,,22145.714328224625,,,,,688,SRB,2022/03/10,21,8483405,3209
Serbia,3/11/22,1937183,15552,,,2230,,22171.236882494388,,,,,688,SRB,2022/03/11,19,8488708,5303
Serbia,3/12/22,1939150,15570,,,1967,,22193.749377673143,,,,,688,SRB,2022/03/12,18,8488708,0
Serbia,3/13/22,1940516,15587,,,1366,,22209.383372799824,,,,,688,SRB,2022/03/13,17,8488708,0
Serbia,3/14/22,1942727,15604,,,2211,,22234.688470329173,,,,,688,SRB,2022/03/14,17,8488708,0
Serbia,3/15/22,1945142,15619,,,2415,,22262.32836654508,,,,,688,SRB,2022/03/15,15,8488708,0
Serbia,3/16/22,1947591,15633,,,2449,,22290.357395875417,,,,,688,SRB,2022/03/16,14,8488708,0
Serbia,3/17/22,1949953,15647,,,2362,,22317.390702236484,,,,,688,SRB,2022/03/17,14,8488708,0
Serbia,3/18/22,1952029,15662,,,2076,,22341.150712399725,,,,,688,SRB,2022/03/18,15,8488708,0
Serbia,3/19/22,1953897,15676,,,1868,,22362.530143510005,,,,,688,SRB,2022/03/19,14,8488708,0
Serbia,3/20/22,1955280,15687,,,1383,,22378.358705193896,,,,,688,SRB,2022/03/20,11,8488708,0
Serbia,3/21/22,1957450,15696,,,2170,,22403.194553967613,,,,,688,SRB,2022/03/21,9,8488708,0
Serbia,3/22/22,1959699,15706,,,2249,,22428.93456497779,,,,,688,SRB,2022/03/22,10,8493801,5093
Serbia,3/23/22,1962013,15718,,,2314,,22455.41850694202,,,,,688,SRB,2022/03/23,12,8493801,0
Serbia,3/24/22,1964129,15727,,,2116,,22479.636320769292,,,,,688,SRB,2022/03/24,9,8493801,0
Serbia,3/25/22,1966078,15737,,,1949,,22501.942804299233,,,,,688,SRB,2022/03/25,10,8494958,1157
Serbia,3/26/22,1967771,15746,,,1693,,22521.31934437937,,,,,688,SRB,2022/03/26,9,8494958,0
Serbia,3/27/22,1969044,15758,,,1273,,22535.88894598718,,,,,688,SRB,2022/03/27,12,8494958,0
Serbia,3/28/22,1970827,15768,,,1783,,22556.29554431139,,,,,688,SRB,2022/03/28,10,8494958,0
Serbia,3/29/22,1972760,15779,,,1933,,22578.41890637572,,,,,688,SRB,2022/03/29,11,8494958,0
Serbia,3/30/22,1974652,15788,,,1892,,22600.073019684412,,,,,688,SRB,2022/03/30,9,8494958,0
Serbia,3/31/22,1976567,15799,,,1915,,22621.990370099928,,,,,688,SRB,2022/03/31,11,8494958,0
Serbia,4/1/22,1978228,15809,,,1661,,22641.00066724884,,,,,688,SRB,2022/04/01,10,,
Seychelles,3/5/22,39427,163,,,0,,40092.53609924751,,,,,690,SYC,2022/03/05,0,190758,0
Seychelles,3/8/22,39605,163,,,178,,40273.54077689648,,,,,690,SYC,2022/03/08,0,190758,0
Seychelles,3/14/22,39653,163,,,48,,40322.351027049015,,,,,690,SYC,2022/03/14,0,190758,0
Seychelles,3/15/22,39761,163,,,108,,40432.17408989221,,,,,690,SYC,2022/03/15,0,190758,0
Seychelles,3/17/22,39771,163,,,10,,40442.34289200732,,,,,690,SYC,2022/03/17,0,190758,0
Seychelles,3/18/22,39797,163,,,26,,40468.78177750661,,,,,690,SYC,2022/03/18,0,190758,0
Seychelles,3/21/22,39883,163,,,86,,40556.233475696565,,,,,690,SYC,2022/03/21,0,190758,0
Seychelles,3/22/22,39991,163,,,108,,40666.05653853976,,,,,690,SYC,2022/03/22,0,190758,0
Seychelles,3/24/22,40009,163,,,18,,40684.36038234696,,,,,690,SYC,2022/03/24,0,190758,0
Seychelles,3/25/22,40044,163,,,35,,40719.951189749845,,,,,690,SYC,2022/03/25,0,190758,0
Seychelles,3/28/22,40209,164,,,165,,40887.73642464918,,,,,690,SYC,2022/03/28,1,190758,0
Seychelles,3/30/22,40421,164,,,212,,41103.315029489524,,,,,690,SYC,2022/03/30,0,199466,8708
Seychelles,4/1/22,40421,164,,,0,,41103.315029489524,,,,,690,SYC,2022/04/01,0,,
Sierra Leone,3/5/22,7665,125,,,0,,96.0889358573446,,,,,694,SLE,2022/03/05,0,1813692,0
Sierra Leone,3/7/22,7666,125,,,1,,96.1014719220357,,,,,694,SLE,2022/03/07,0,1859571,0
Sierra Leone,3/10/22,7667,125,,,1,,96.11400798672682,,,,,694,SLE,2022/03/10,0,1859571,0
Sierra Leone,3/14/22,7668,125,,,1,,96.12654405141792,,,,,694,SLE,2022/03/14,0,1859571,0
Sierra Leone,3/15/22,7670,125,,,2,,96.15161618080013,,,,,694,SLE,2022/03/15,0,1859571,0
Sierra Leone,3/18/22,7673,125,,,3,,96.18922437487346,,,,,694,SLE,2022/03/18,0,2134324,274753
Sierra Leone,3/20/22,7674,125,,,1,,96.20176043956457,,,,,694,SLE,2022/03/20,0,2134324,0
Sierra Leone,4/1/22,7674,125,,,0,,96.20176043956457,,,,,694,SLE,2022/04/01,0,,
Singapore,3/5/22,819663,1073,,,16274,,14010.511862295938,,,,,702,SGP,2022/03/05,6,13572663,0
Singapore,3/6/22,832821,1078,,,13158,,14235.421752194701,,,,,702,SGP,2022/03/06,5,13572663,0
Singapore,3/7/22,846341,1084,,,13520,,14466.519313482988,,,,,702,SGP,2022/03/07,6,13572663,0
Singapore,3/8/22,846341,1099,,,0,,14466.519313482988,,,,,702,SGP,2022/03/08,15,13651279,78616
Singapore,3/9/22,885593,1110,,,39252,,15137.454333874099,,,,,702,SGP,2022/03/09,11,13651279,0
Singapore,3/10/22,901758,1116,,,16165,,15413.762919541641,,,,,702,SGP,2022/03/10,6,13651279,0
Singapore,3/11/22,917103,1129,,,15345,,15676.055233000869,,,,,702,SGP,2022/03/11,13,13651279,0
Singapore,3/12/22,929735,1139,,,12632,,15891.974197068444,,,,,702,SGP,2022/03/12,10,13651279,0
Singapore,3/13/22,939436,1145,,,9701,,16057.793534498747,,,,,702,SGP,2022/03/13,6,13651279,0
Singapore,3/14/22,948478,1153,,,9042,,16212.348575117732,,,,,702,SGP,2022/03/14,8,13651279,0
Singapore,3/15/22,964329,1159,,,15851,,16483.289954110383,,,,,702,SGP,2022/03/15,6,13651279,0
Singapore,3/16/22,975607,1170,,,11278,,16676.064976019356,,,,,702,SGP,2022/03/16,11,13721340,70061
Singapore,3/17/22,986320,1182,,,10713,,16859.1824445165,,,,,702,SGP,2022/03/17,12,13721340,0
Singapore,3/18/22,996914,1191,,,10594,,17040.265844241952,,,,,702,SGP,2022/03/18,9,13721340,0
Singapore,3/19/22,1007158,1194,,,10244,,17215.366688756538,,,,,702,SGP,2022/03/19,3,13721340,0
Singapore,3/20/22,1015017,1198,,,7859,,17349.7006927628,,,,,702,SGP,2022/03/20,4,13721340,0
Singapore,3/21/22,1022555,1208,,,7538,,17478.547838989954,,,,,702,SGP,2022/03/21,10,13721340,0
Singapore,3/22/22,1035721,1214,,,13166,,17703.594473007823,,,,,702,SGP,2022/03/22,6,13780673,59333
Singapore,3/23/22,1044661,1220,,,8940,,17856.406026108212,,,,,702,SGP,2022/03/23,6,13780673,0
Singapore,3/24/22,1053139,1226,,,8478,,18001.32060633026,,,,,702,SGP,2022/03/24,6,13780673,0
Singapore,3/25/22,1060723,1239,,,7584,,18130.954031242272,,,,,702,SGP,2022/03/25,13,13780673,0
Singapore,3/26/22,1067157,1246,,,6434,,18240.930489032864,,,,,702,SGP,2022/03/26,7,13780673,0
Singapore,3/27/22,1067157,1250,,,0,,18240.930489032864,,,,,702,SGP,2022/03/27,4,13780673,0
Singapore,3/28/22,1072005,1254,,,4848,,18323.797425210796,,,,,702,SGP,2022/03/28,4,13780673,0
Singapore,3/29/22,1085094,1258,,,13089,,18547.527897082273,,,,,702,SGP,2022/03/29,4,13825593,44920
Singapore,3/30/22,1090823,1263,,,5729,,18645.453779376698,,,,,702,SGP,2022/03/30,5,13825593,0
Singapore,3/31/22,1096428,1268,,,5605,,18741.260127824982,,,,,702,SGP,2022/03/31,5,13825593,0
Singapore,4/1/22,1101438,1270,,,5010,,18826.8961324148,,,,,702,SGP,2022/04/01,2,,
Slovakia,3/5/22,2190599,18663,,,12365,,40123.484264447325,,,,,703,SVK,2022/03/05,32,7033744,2291
Slovakia,3/6/22,2197979,18687,,,7380,,40258.65793789081,,,,,703,SVK,2022/03/06,24,7033744,0
Slovakia,3/7/22,2203141,18704,,,5162,,40353.20624443759,,,,,703,SVK,2022/03/07,17,7033744,0
Slovakia,3/8/22,2216994,18750,,,13853,,40606.94078349079,,,,,703,SVK,2022/03/08,46,7034853,1109
Slovakia,3/9/22,2231352,18786,,,14358,,40869.925011580424,,,,,703,SVK,2022/03/09,36,7035725,872
Slovakia,3/10/22,2246029,18817,,,14677,,41138.75211254655,,,,,703,SVK,2022/03/10,31,7038804,3079
Slovakia,3/11/22,2258399,18847,,,12370,,41365.323703399656,,,,,703,SVK,2022/03/11,30,7038804,0
Slovakia,3/12/22,2269610,18881,,,11211,,41570.666800008716,,,,,703,SVK,2022/03/12,34,7040648,1844
Slovakia,3/13/22,2278164,18918,,,8554,,41727.34371093495,,,,,703,SVK,2022/03/13,37,7040648,0
Slovakia,3/14/22,2282747,18950,,,4583,,41811.28692846767,,,,,703,SVK,2022/03/14,32,7040750,102
Slovakia,3/15/22,2295377,18979,,,12630,,42042.620735458346,,,,,703,SVK,2022/03/15,29,7041857,1107
Slovakia,3/16/22,2309029,19009,,,13652,,42292.67371511288,,,,,703,SVK,2022/03/16,30,7042260,403
Slovakia,3/17/22,2322231,19040,,,13202,,42534.48439760622,,,,,703,SVK,2022/03/17,31,7043647,1387
Slovakia,3/18/22,2333162,19073,,,10931,,42734.69895375943,,,,,703,SVK,2022/03/18,33,7046698,3051
Slovakia,3/19/22,2344057,19093,,,10895,,42934.25412613975,,,,,703,SVK,2022/03/19,20,7046698,0
Slovakia,3/20/22,2351701,19110,,,7644,,43074.26328058446,,,,,703,SVK,2022/03/20,17,7046719,21
Slovakia,3/21/22,2355564,19133,,,3863,,43145.01882265929,,,,,703,SVK,2022/03/21,23,7046723,4
Slovakia,3/22/22,2366902,19161,,,11338,,43352.688078689396,,,,,703,SVK,2022/03/22,28,7047655,932
Slovakia,3/23/22,2379094,19185,,,12192,,43575.99938310985,,,,,703,SVK,2022/03/23,24,7048320,665
Slovakia,3/24/22,2390390,19209,,,11296,,43782.89935807158,,,,,703,SVK,2022/03/24,24,7049461,1141
Slovakia,3/25/22,2399832,19229,,,9442,,43955.84106872922,,,,,703,SVK,2022/03/25,20,7049461,0
Slovakia,3/26/22,2408571,19251,,,8739,,44115.90647959949,,,,,703,SVK,2022/03/26,22,7051690,2229
Slovakia,3/27/22,2414805,19270,,,6234,,44230.08976960582,,,,,703,SVK,2022/03/27,19,7051801,111
Slovakia,3/28/22,2418385,19292,,,3580,,44295.66182257704,,,,,703,SVK,2022/03/28,22,7051819,18
Slovakia,3/29/22,2426662,19311,,,8277,,44447.26514169516,,,,,703,SVK,2022/03/29,19,7052526,707
Slovakia,3/30/22,2434708,19334,,,8046,,44594.637414937206,,,,,703,SVK,2022/03/30,23,7052526,0
Slovakia,3/31/22,2443137,19352,,,8429,,44749.02479887421,,,,,703,SVK,2022/03/31,18,7052526,0
Slovakia,4/1/22,2450101,19368,,,6964,,44876.578926497576,,,,,703,SVK,2022/04/01,16,,
Slovenia,3/5/22,902744,6351,,,1887,,43423.45011765657,,,,,705,SVN,2022/03/05,10,3112953,22
Slovenia,3/6/22,903686,6363,,,942,,43468.76184502427,,,,,705,SVN,2022/03/06,12,3112964,11
Slovenia,3/7/22,904459,6367,,,773,,43505.94439837378,,,,,705,SVN,2022/03/07,4,3113415,451
Slovenia,3/8/22,907630,6374,,,3171,,43658.47463986316,,,,,705,SVN,2022/03/08,7,3113800,385
Slovenia,3/9/22,909863,6382,,,2233,,43765.88556047047,,,,,705,SVN,2022/03/09,8,3114670,870
Slovenia,3/10/22,912193,6388,,,2330,,43877.962338354504,,,,,705,SVN,2022/03/10,6,3115281,611
Slovenia,3/11/22,914427,6396,,,2234,,43985.42136058322,,,,,705,SVN,2022/03/11,8,3116044,763
Slovenia,3/12/22,916712,6404,,,2285,,44095.333565503825,,,,,705,SVN,2022/03/12,8,3116104,60
Slovenia,3/13/22,917820,6410,,,1108,,44148.6301620255,,,,,705,SVN,2022/03/13,6,3116115,11
Slovenia,3/14/22,918762,6415,,,942,,44193.94188939321,,,,,705,SVN,2022/03/14,5,3116507,392
Slovenia,3/15/22,923011,6419,,,4249,,44398.32567876198,,,,,705,SVN,2022/03/15,4,3116966,459
Slovenia,3/16/22,925939,6424,,,2928,,44539.167226248865,,,,,705,SVN,2022/03/16,5,3117901,935
Slovenia,3/17/22,929013,6428,,,3074,,44687.03161046153,,,,,705,SVN,2022/03/17,4,3118763,862
Slovenia,3/18/22,932155,6429,,,3142,,44838.16690493003,,,,,705,SVN,2022/03/18,1,3119643,880
Slovenia,3/19/22,935373,6435,,,3218,,44992.957922625654,,,,,705,SVN,2022/03/19,6,3119723,80
Slovenia,3/20/22,936847,6442,,,1474,,45063.859712583195,,,,,705,SVN,2022/03/20,7,3119741,18
Slovenia,3/21/22,937936,6449,,,1089,,45116.242378298084,,,,,705,SVN,2022/03/21,7,3120155,414
Slovenia,3/22/22,942954,6451,,,5018,,45357.61631453073,,,,,705,SVN,2022/03/22,2,3120613,458
Slovenia,3/23/22,946340,6454,,,3386,,45520.488404623145,,,,,705,SVN,2022/03/23,3,3120613,0
Slovenia,3/24/22,949640,6461,,,3300,,45679.223755274346,,,,,705,SVN,2022/03/24,7,3122460,1847
Slovenia,3/25/22,952479,6469,,,2839,,45815.78425845579,,,,,705,SVN,2022/03/25,8,3123442,982
Slovenia,3/26/22,955473,6471,,,2994,,45959.80051295569,,,,,705,SVN,2022/03/26,2,3123477,35
Slovenia,3/27/22,956742,6475,,,1269,,46020.84147052429,,,,,705,SVN,2022/03/27,4,3123492,15
Slovenia,3/28/22,957720,6479,,,978,,46067.88485626273,,,,,705,SVN,2022/03/28,4,3123845,353
Slovenia,3/29/22,962199,6480,,,4479,,46283.33201855568,,,,,705,SVN,2022/03/29,1,3124289,444
Slovenia,3/30/22,965295,6482,,,3096,,46432.25463843935,,,,,705,SVN,2022/03/30,2,3124289,0
Slovenia,3/31/22,968109,6487,,,2814,,46567.61260108556,,,,,705,SVN,2022/03/31,5,3124289,0
Slovenia,4/1/22,970541,6493,,,2432,,46684.59574435335,,,,,705,SVN,2022/04/01,6,,
Solomon Islands,3/5/22,7940,115,,,614,,1216.190963425431,,,,,90,SLB,2022/03/05,4,301294,0
Solomon Islands,3/6/22,8026,116,,,86,,1229.3638126514495,,,,,90,SLB,2022/03/06,1,315423,0
Solomon Islands,3/7/22,8150,118,,,124,,1248.3572231633832,,,,,90,SLB,2022/03/07,2,315423,0
Solomon Islands,3/9/22,8491,118,,,341,,1300.5891020712008,,,,,90,SLB,2022/03/09,0,315423,0
Solomon Islands,3/13/22,9124,120,,,633,,1397.5473992813138,,,,,90,SLB,2022/03/13,2,315423,0
Solomon Islands,3/15/22,9412,125,,,288,,1441.661126921934,,,,,90,SLB,2022/03/15,5,315423,0
Solomon Islands,3/17/22,9758,127,,,346,,1494.6588691568456,,,,,90,SLB,2022/03/17,2,315423,0
Solomon Islands,3/19/22,9851,127,,,93,,1508.903927040796,,,,,90,SLB,2022/03/19,0,343133,0
Solomon Islands,3/22/22,10204,128,,,353,,1562.9738779336394,,,,,90,SLB,2022/03/22,1,343133,0
Solomon Islands,3/24/22,10426,129,,,222,,1596.9782096566175,,,,,90,SLB,2022/03/24,1,343133,0
Solomon Islands,3/27/22,10778,133,,,352,,1650.8949878840422,,,,,90,SLB,2022/03/27,4,358595,0
Solomon Islands,3/30/22,11174,133,,,396,,1711.551363389895,,,,,90,SLB,2022/03/30,0,358595,0
Solomon Islands,3/31/22,11470,133,,,296,,1756.8904723538656,,,,,90,SLB,2022/03/31,0,358595,0
Solomon Islands,4/1/22,11470,133,,,0,,1756.8904723538656,,,,,90,SLB,2022/04/01,0,,
Somalia,3/5/22,26351,1348,,,0,,165.80026991385446,,,,,706,SOM,2022/03/05,0,1794447,0
Somalia,3/7/22,26400,1359,,,49,,166.1085775008826,,,,,706,SOM,2022/03/07,11,1838348,0
Somalia,3/14/22,26410,1361,,,10,,166.17149741660265,,,,,706,SOM,2022/03/14,2,1838348,0
Somalia,4/1/22,26410,1361,,,0,,166.17149741660265,,,,,706,SOM,2022/04/01,0,,
South Africa,3/5/22,3683172,99543,,,1735,,6210.172573361509,,,,,710,ZAF,2022/03/05,26,32018307,28390
South Africa,3/6/22,3684319,99543,,,1147,,6212.106522669781,,,,,710,ZAF,2022/03/06,0,32027166,8859
South Africa,3/7/22,3685120,99609,,,801,,6213.457083607816,,,,,710,ZAF,2022/03/07,66,32126152,98986
South Africa,3/8/22,3686556,99625,,,1436,,6215.878313953655,,,,,710,ZAF,2022/03/08,16,32225496,99344
South Africa,3/9/22,3688423,99656,,,1867,,6219.026250621958,,,,,710,ZAF,2022/03/09,31,32332691,107195
South Africa,3/10/22,3690291,99681,,,1868,,6222.175873383816,,,,,710,ZAF,2022/03/10,25,32421223,88532
South Africa,3/11/22,3691962,99709,,,1671,,6224.993335715221,,,,,710,ZAF,2022/03/11,28,32517834,96611
South Africa,3/12/22,3693532,99712,,,1570,,6227.640502597512,,,,,710,ZAF,2022/03/12,3,32540997,23163
South Africa,3/13/22,3694504,99725,,,972,,6229.279385533553,,,,,710,ZAF,2022/03/13,13,32548342,7345
South Africa,3/14/22,3695175,99725,,,671,,6230.41075430936,,,,,710,ZAF,2022/03/14,0,32630886,82544
South Africa,3/15/22,3696823,99727,,,1648,,6233.189436488987,,,,,710,ZAF,2022/03/15,2,32722417,91531
South Africa,3/16/22,3698803,99767,,,1980,,6236.527901729072,,,,,710,ZAF,2022/03/16,40,32817492,95075
South Africa,3/17/22,3700484,99829,,,1681,,6239.362224996034,,,,,710,ZAF,2022/03/17,62,32903329,85837
South Africa,3/18/22,3702042,99868,,,1558,,6241.989158755656,,,,,710,ZAF,2022/03/18,39,32903329,0
South Africa,3/19/22,3703329,99879,,,1287,,6244.159161161711,,,,,710,ZAF,2022/03/19,11,33008136,104807
South Africa,3/20/22,3704218,99881,,,889,,6245.658098332639,,,,,710,ZAF,2022/03/20,2,33014381,6245
South Africa,3/21/22,3704784,99890,,,566,,6246.6124272851075,,,,,710,ZAF,2022/03/21,9,33023123,8742
South Africa,3/22/22,3705696,99893,,,912,,6248.150144607814,,,,,710,ZAF,2022/03/22,3,33105213,82090
South Africa,3/23/22,3707089,99899,,,1393,,6250.498872930762,,,,,710,ZAF,2022/03/23,6,33105213,0
South Africa,3/24/22,3709209,99932,,,2120,,6254.073391268632,,,,,710,ZAF,2022/03/24,33,33105213,0
South Africa,3/25/22,3710766,99939,,,1557,,6256.698638934699,,,,,710,ZAF,2022/03/25,7,33201427,96214
South Africa,3/26/22,3712263,99965,,,1497,,6259.22272098743,,,,,710,ZAF,2022/03/26,26,33296217,94790
South Africa,3/27/22,3713252,99966,,,989,,6260.890267513917,,,,,710,ZAF,2022/03/27,1,33405701,109484
South Africa,3/28/22,3713833,99970,,,581,,6261.8698878697205,,,,,710,ZAF,2022/03/28,4,33405701,0
South Africa,3/29/22,3715390,99976,,,1557,,6264.495135535787,,,,,710,ZAF,2022/03/29,6,33485691,79990
South Africa,3/30/22,3717067,100020,,,1677,,6267.3227144285265,,,,,710,ZAF,2022/03/30,44,33656772,171081
South Africa,3/31/22,3718953,100032,,,1886,,6270.502686874385,,,,,710,ZAF,2022/03/31,12,33656772,0
South Africa,4/1/22,3718953,100032,,,0,,6270.502686874385,,,,,710,ZAF,2022/04/01,0,,
South Sudan,3/5/22,16999,137,,,0,,151.86181477146712,,,,,728,SSD,2022/03/05,0,431539,0
South Sudan,3/7/22,17015,137,,,16,,152.00475194637997,,,,,728,SSD,2022/03/07,0,518428,0
South Sudan,3/8/22,17025,137,,,10,,152.0940876807005,,,,,728,SSD,2022/03/08,0,518428,0
South Sudan,3/9/22,17034,137,,,9,,152.17448984158898,,,,,728,SSD,2022/03/09,0,518428,0
South Sudan,3/10/22,17044,138,,,10,,152.26382557590952,,,,,728,SSD,2022/03/10,1,518428,0
South Sudan,3/11/22,17051,138,,,7,,152.32636058993387,,,,,728,SSD,2022/03/11,0,518428,0
South Sudan,3/13/22,17061,138,,,10,,152.4156963242544,,,,,728,SSD,2022/03/13,0,524292,0
South Sudan,3/14/22,17064,138,,,3,,152.44249704455058,,,,,728,SSD,2022/03/14,0,524292,0
South Sudan,3/15/22,17067,138,,,3,,152.46929776484671,,,,,728,SSD,2022/03/15,0,524292,0
South Sudan,3/16/22,17073,138,,,6,,152.52289920543905,,,,,728,SSD,2022/03/16,0,524292,0
South Sudan,3/17/22,17084,138,,,11,,152.62116851319163,,,,,728,SSD,2022/03/17,0,524292,0
South Sudan,3/18/22,17093,138,,,9,,152.7015706740801,,,,,728,SSD,2022/03/18,0,524292,0
South Sudan,3/21/22,17137,138,,,44,,153.09464790509043,,,,,728,SSD,2022/03/21,0,524292,0
South Sudan,3/22/22,17144,138,,,7,,153.1571829191148,,,,,728,SSD,2022/03/22,0,524292,0
South Sudan,3/23/22,17153,138,,,9,,153.23758508000327,,,,,728,SSD,2022/03/23,0,524292,0
South Sudan,3/24/22,17184,138,,,31,,153.51452585639692,,,,,728,SSD,2022/03/24,0,524292,0
South Sudan,3/28/22,17222,138,,,38,,153.85400164681494,,,,,728,SSD,2022/03/28,0,575057,0
South Sudan,3/29/22,17237,138,,,15,,153.9880052482957,,,,,728,SSD,2022/03/29,0,575057,0
South Sudan,3/31/22,17262,138,,,25,,154.21134458409705,,,,,728,SSD,2022/03/31,0,575057,0
South Sudan,4/1/22,17278,138,,,16,,154.3542817590099,,,,,728,SSD,2022/04/01,0,,
Spain,3/5/22,11100428,100413,,,0,,23741.801988472496,,,,,724,ESP,2022/03/05,0,98615715,0
Spain,3/7/22,11136425,100574,,,35997,,23818.79304198674,,,,,724,ESP,2022/03/07,161,98615715,0
Spain,3/8/22,11159574,100859,,,23149,,23868.304553996113,,,,,724,ESP,2022/03/08,285,98615715,0
Spain,3/9/22,11181510,100992,,,21936,,23915.221679031212,,,,,724,ESP,2022/03/09,133,98615715,0
Spain,3/10/22,11204125,101077,,,22615,,23963.591061902694,,,,,724,ESP,2022/03/10,85,98615715,0
Spain,3/11/22,11223974,101135,,,19849,,24006.04447249814,,,,,724,ESP,2022/03/11,58,98615715,0
Spain,3/15/22,11260040,101416,,,36066,,24083.183104496497,,,,,724,ESP,2022/03/15,281,98615715,0
Spain,3/18/22,11324637,101703,,,64597,,24221.34437026475,,,,,724,ESP,2022/03/18,287,99516790,0
Spain,3/22/22,11378784,102053,,,54147,,24337.154981555577,,,,,724,ESP,2022/03/22,350,99516790,0
Spain,3/25/22,11451676,102392,,,72892,,24493.0577476961,,,,,724,ESP,2022/03/25,339,99516790,0
Spain,3/29/22,11508309,102218,,,56633,,24614.185462052086,,,,,724,ESP,2022/03/29,,100450807,0
Spain,4/1/22,11551574,102541,,,43265,,24706.721449225846,,,,,724,ESP,2022/04/01,323,,
Sri Lanka,3/5/22,649632,16321,,,639,,3033.7851563868167,,,,,144,LKA,2022/03/05,14,38390533,36835
Sri Lanka,3/6/22,650140,16331,,,508,,3036.1575192929613,,,,,144,LKA,2022/03/06,10,38432862,42329
Sri Lanka,3/7/22,650802,16339,,,662,,3039.249063080102,,,,,144,LKA,2022/03/07,8,38432862,0
Sri Lanka,3/8/22,653029,16339,,,2227,,3049.649165820228,,,,,144,LKA,2022/03/08,0,38454224,21362
Sri Lanka,3/9/22,654336,16361,,,1307,,3055.7528632972576,,,,,144,LKA,2022/03/09,22,38524249,70025
Sri Lanka,3/10/22,654916,16374,,,580,,3058.4614666152966,,,,,144,LKA,2022/03/10,13,38553785,29536
Sri Lanka,3/11/22,655383,16381,,,467,,3060.64235928689,,,,,144,LKA,2022/03/11,7,38706586,152801
Sri Lanka,3/12/22,655730,16390,,,347,,3062.262851271993,,,,,144,LKA,2022/03/12,9,38739966,33380
Sri Lanka,3/13/22,656041,16397,,,311,,3063.7152230511483,,,,,144,LKA,2022/03/13,7,38739966,0
Sri Lanka,3/14/22,656386,16407,,,345,,3065.3263750248093,,,,,144,LKA,2022/03/14,10,38773496,33530
Sri Lanka,3/15/22,656814,16415,,,428,,3067.3251374732936,,,,,144,LKA,2022/03/15,8,38922999,149503
Sri Lanka,3/16/22,657134,16416,,,320,,3068.8195393039355,,,,,144,LKA,2022/03/16,1,38982099,59100
Sri Lanka,3/17/22,657435,16419,,,301,,3070.2252110258837,,,,,144,LKA,2022/03/17,3,38992876,10777
Sri Lanka,3/18/22,657723,16422,,,288,,3071.5701726734615,,,,,144,LKA,2022/03/18,3,38992876,0
Sri Lanka,3/19/22,657961,16426,,,238,,3072.6816340350015,,,,,144,LKA,2022/03/19,4,38992876,0
Sri Lanka,3/20/22,658197,16431,,,236,,3073.7837553851004,,,,,144,LKA,2022/03/20,5,38992876,0
Sri Lanka,3/21/22,658493,16436,,,296,,3075.1660770784442,,,,,144,LKA,2022/03/21,5,39061330,68454
Sri Lanka,3/22/22,659859,16440,,,1366,,3081.5453048929985,,,,,144,LKA,2022/03/22,4,39102567,41237
Sri Lanka,3/23/22,660151,16445,,,292,,3082.9089465634597,,,,,144,LKA,2022/03/23,5,39102567,0
Sri Lanka,3/24/22,660399,16450,,,248,,3084.0671079822073,,,,,144,LKA,2022/03/24,5,39183033,80466
Sri Lanka,3/25/22,660633,16452,,,234,,3085.1598893208643,,,,,144,LKA,2022/03/25,2,39183033,0
Sri Lanka,3/26/22,660797,16454,,,164,,3085.9257702590685,,,,,144,LKA,2022/03/26,2,39183033,0
Sri Lanka,3/27/22,660890,16459,,,93,,3086.360080791099,,,,,144,LKA,2022/03/27,5,39224366,41333
Sri Lanka,3/28/22,661053,16465,,,163,,3087.1212917235825,,,,,144,LKA,2022/03/28,6,39224366,0
Sri Lanka,3/29/22,661285,16469,,,232,,3088.204733050798,,,,,144,LKA,2022/03/29,4,39235852,11486
Sri Lanka,3/30/22,661453,16473,,,168,,3088.9892940118852,,,,,144,LKA,2022/03/30,4,39293230,57378
Sri Lanka,3/31/22,661631,16477,,,178,,3089.82055503018,,,,,144,LKA,2022/03/31,4,39293230,0
Sri Lanka,4/1/22,661781,16479,,,150,,3090.5210558882936,,,,,144,LKA,2022/04/01,2,,
Sudan,3/5/22,61569,3912,,,0,,140.4105505156768,,,,,729,SDN,2022/03/05,0,5711034,0
Sudan,3/7/22,61625,4865,,,56,,140.53826074044701,,,,,729,SDN,2022/03/07,953,5711034,0
Sudan,3/8/22,61631,4865,,,6,,140.55194397881525,,,,,729,SDN,2022/03/08,0,5711034,0
Sudan,3/9/22,61643,4865,,,12,,140.57931045555173,,,,,729,SDN,2022/03/09,0,5711034,0
Sudan,3/11/22,61655,4865,,,12,,140.6066769322882,,,,,729,SDN,2022/03/11,0,5711034,0
Sudan,3/14/22,61713,4872,,,58,,140.7389482365145,,,,,729,SDN,2022/03/14,7,5711034,0
Sudan,3/15/22,61715,4874,,,2,,140.74350931597058,,,,,729,SDN,2022/03/15,2,5711034,0
Sudan,3/17/22,61775,4888,,,60,,140.88034169965297,,,,,729,SDN,2022/03/17,14,5711034,0
Sudan,3/21/22,61842,4897,,,67,,141.0331378614316,,,,,729,SDN,2022/03/21,9,6131070,0
Sudan,3/22/22,61853,4898,,,11,,141.05822379844005,,,,,729,SDN,2022/03/22,1,6131070,0
Sudan,3/23/22,61862,4900,,,9,,141.07874865599243,,,,,729,SDN,2022/03/23,2,6131070,0
Sudan,3/25/22,61889,4901,,,27,,141.1403232286495,,,,,729,SDN,2022/03/25,1,6131070,0
Sudan,3/28/22,61916,4902,,,27,,141.20189780130656,,,,,729,SDN,2022/03/28,1,6131070,0
Sudan,3/29/22,61929,4905,,,13,,141.23154481777107,,,,,729,SDN,2022/03/29,3,6131070,0
Sudan,3/31/22,61955,4907,,,26,,141.2908388507001,,,,,729,SDN,2022/03/31,2,6131070,0
Sudan,4/1/22,61955,4907,,,0,,141.2908388507001,,,,,729,SDN,2022/04/01,0,,
Summer Olympics 2020,3/5/22,865,0,,,0,,,,,,,2020,,2022/03/05,0,,
Summer Olympics 2020,4/1/22,865,0,,,0,,,,,,,2020,,2022/04/01,0,,
Suriname,3/5/22,78487,1318,,,33,,13379.210887878984,,,,,740,SUR,2022/03/05,1,539297,0
Suriname,3/6/22,78511,1318,,,24,,13383.302024771834,,,,,740,SUR,2022/03/06,0,539297,0
Suriname,3/7/22,78579,1319,,,68,,13394.893579301575,,,,,740,SUR,2022/03/07,1,539297,0
Suriname,3/8/22,78623,1319,,,44,,13402.393996938466,,,,,740,SUR,2022/03/08,0,539297,0
Suriname,3/9/22,78654,1319,,,31,,13407.67838209173,,,,,740,SUR,2022/03/09,0,539297,0
Suriname,3/10/22,78705,1319,,,51,,13416.372047989036,,,,,740,SUR,2022/03/10,0,539297,0
Suriname,3/11/22,78740,1320,,,35,,13422.338289291109,,,,,740,SUR,2022/03/11,1,539297,0
Suriname,3/12/22,78754,1321,,,14,,13424.724785811937,,,,,740,SUR,2022/03/12,1,539297,0
Suriname,3/13/22,78763,1321,,,9,,13426.258962146756,,,,,740,SUR,2022/03/13,0,539297,0
Suriname,3/14/22,78793,1321,,,30,,13431.372883262819,,,,,740,SUR,2022/03/14,0,539297,0
Suriname,3/15/22,78828,1322,,,35,,13437.33912456489,,,,,740,SUR,2022/03/15,1,539297,0
Suriname,3/16/22,78860,1322,,,32,,13442.793973755357,,,,,740,SUR,2022/03/16,0,539297,0
Suriname,3/17/22,78893,1322,,,33,,13448.419286983026,,,,,740,SUR,2022/03/17,0,539297,0
Suriname,3/18/22,78916,1323,,,23,,13452.339959838673,,,,,740,SUR,2022/03/18,1,539297,0
Suriname,3/19/22,78928,1323,,,12,,13454.385528285098,,,,,740,SUR,2022/03/19,0,539297,0
Suriname,3/20/22,78946,1323,,,18,,13457.453880954736,,,,,740,SUR,2022/03/20,0,539297,0
Suriname,3/21/22,79025,1324,,,79,,13470.9205398937,,,,,740,SUR,2022/03/21,1,539297,0
Suriname,3/22/22,79055,1324,,,30,,13476.03446100976,,,,,740,SUR,2022/03/22,0,539297,0
Suriname,3/23/22,79100,1324,,,45,,13483.705342683854,,,,,740,SUR,2022/03/23,0,539297,0
Suriname,3/24/22,79112,1324,,,12,,13485.750911130279,,,,,740,SUR,2022/03/24,0,539297,0
Suriname,3/25/22,79133,1324,,,21,,13489.330655911523,,,,,740,SUR,2022/03/25,0,539297,0
Suriname,3/26/22,79150,1324,,,17,,13492.228544543957,,,,,740,SUR,2022/03/26,0,539297,0
Suriname,3/27/22,79155,1324,,,5,,13493.080864729967,,,,,740,SUR,2022/03/27,0,539297,0
Suriname,3/28/22,79173,1324,,,18,,13496.149217399605,,,,,740,SUR,2022/03/28,0,539297,0
Suriname,3/29/22,79188,1324,,,15,,13498.706177957636,,,,,740,SUR,2022/03/29,0,539297,0
Suriname,3/30/22,79202,1324,,,14,,13501.092674478465,,,,,740,SUR,2022/03/30,0,539297,0
Suriname,3/31/22,79221,1324,,,19,,13504.331491185305,,,,,740,SUR,2022/03/31,0,539297,0
Suriname,4/1/22,79229,1325,,,8,,13505.695203482921,,,,,740,SUR,2022/04/01,1,,
Sweden,3/5/22,2455966,17512,,,0,,24318.25270539356,,,,,752,SWE,2022/03/05,0,20623250,0
Sweden,3/8/22,2460783,17549,,,4817,,24365.949222072486,,,,,752,SWE,2022/03/08,37,20676103,0
Sweden,3/9/22,2462952,17693,,,2169,,24387.42602188079,,,,,752,SWE,2022/03/09,144,20712342,36239
Sweden,3/10/22,2465099,17749,,,2147,,24408.68498416222,,,,,752,SWE,2022/03/10,56,20728256,15914
Sweden,3/11/22,2466577,17798,,,1478,,24423.31970528563,,,,,752,SWE,2022/03/11,49,20757514,29258
Sweden,3/15/22,2470254,17874,,,3677,,24459.728277390346,,,,,752,SWE,2022/03/15,76,20814970,0
Sweden,3/16/22,2472068,17937,,,1814,,24477.689971651416,,,,,752,SWE,2022/03/16,63,20836966,21996
Sweden,3/17/22,2473707,17994,,,1639,,24493.91886740329,,,,,752,SWE,2022/03/17,57,20866734,29768
Sweden,3/18/22,2475687,18053,,,1980,,24513.524244821656,,,,,752,SWE,2022/03/18,59,20909304,42570
Sweden,3/24/22,2481736,18189,,,6049,,24573.419663005345,,,,,752,SWE,2022/03/24,136,21026443,26214
Sweden,3/31/22,2487852,18365,,,6116,,24633.978495475414,,,,,752,SWE,2022/03/31,176,21053545,0
Sweden,4/1/22,2487852,18365,,,0,,24633.978495475414,,,,,752,SWE,2022/04/01,0,,
Switzerland,3/5/22,2890568,13174,,,0,,33399.1402046861,,,,,756,CHE,2022/03/05,1,15575508,0
Switzerland,3/6/22,2890568,13173,,,0,,33399.1402046861,,,,,756,CHE,2022/03/06,,15575508,0
Switzerland,3/7/22,2948689,13193,,,58121,,34070.70075189916,,,,,756,CHE,2022/03/07,20,15581577,6069
Switzerland,3/8/22,2974778,13203,,,26089,,34372.146754484136,,,,,756,CHE,2022/03/08,10,15584065,2488
Switzerland,3/9/22,3008537,13213,,,33759,,34762.21596377795,,,,,756,CHE,2022/03/09,10,15586057,1992
Switzerland,3/10/22,3040668,13231,,,32131,,35133.474406380505,,,,,756,CHE,2022/03/10,18,15591694,5637
Switzerland,3/11/22,3072758,13265,,,32090,,35504.25911345827,,,,,756,CHE,2022/03/11,34,15593678,1984
Switzerland,3/12/22,3072758,13266,,,0,,35504.25911345827,,,,,756,CHE,2022/03/12,1,15593678,0
Switzerland,3/14/22,3141904,13286,,,69146,,36303.20829873716,,,,,756,CHE,2022/03/14,20,15599791,6113
Switzerland,3/15/22,3170937,13294,,,29033,,36638.67082290634,,,,,756,CHE,2022/03/15,8,15602223,2432
Switzerland,3/16/22,3206975,13312,,,36038,,37055.07279466292,,,,,756,CHE,2022/03/16,18,15603416,1193
Switzerland,3/17/22,3241348,13322,,,34373,,37452.23648230344,,,,,756,CHE,2022/03/17,10,15608057,4641
Switzerland,3/18/22,3268953,13328,,,27605,,37771.19914478028,,,,,756,CHE,2022/03/18,6,15609570,1513
Switzerland,3/20/22,3268953,13423,,,0,,37771.19914478028,,,,,756,CHE,2022/03/20,95,15609570,0
Switzerland,3/21/22,3329950,13445,,,60997,,38475.990505877904,,,,,756,CHE,2022/03/21,22,15615726,6156
Switzerland,3/22/22,3353754,13456,,,23804,,38751.03441885015,,,,,756,CHE,2022/03/22,11,15617978,2252
Switzerland,3/23/22,3379845,13483,,,26091,,39052.50353048511,,,,,756,CHE,2022/03/23,27,15619198,1220
Switzerland,3/24/22,3402297,13498,,,22452,,39311.92572566461,,,,,756,CHE,2022/03/24,15,15622607,3409
Switzerland,3/25/22,3419549,13507,,,17252,,39511.26439087202,,,,,756,CHE,2022/03/25,9,15625379,2772
Switzerland,3/28/22,3453885,13524,,,34336,,39908.000561087734,,,,,756,CHE,2022/03/28,17,15632830,7451
Switzerland,3/29/22,3468289,13534,,,14404,,40074.43193911043,,,,,756,CHE,2022/03/29,10,15635047,2217
Switzerland,3/30/22,3484702,13558,,,16413,,40264.076357847334,,,,,756,CHE,2022/03/30,24,15636249,1202
Switzerland,3/31/22,3497499,13564,,,12797,,40411.93961420366,,,,,756,CHE,2022/03/31,6,15636249,0
Switzerland,4/1/22,3507309,13570,,,9810,,40525.289504401,,,,,756,CHE,2022/04/01,6,,
Syria,3/5/22,54963,3092,,,69,,314.06249491090534,,,,,760,SYR,2022/03/05,3,3187594,0
Syria,3/6/22,55026,3095,,,63,,314.42248139598416,,,,,760,SYR,2022/03/06,3,3187594,0
Syria,3/7/22,55085,3099,,,59,,314.75961159629605,,,,,760,SYR,2022/03/07,4,3187594,0
Syria,3/8/22,55140,3102,,,55,,315.07388551184107,,,,,760,SYR,2022/03/08,3,3187594,0
Syria,3/9/22,55193,3105,,,53,,315.3767312850026,,,,,760,SYR,2022/03/09,3,3187594,0
Syria,3/10/22,55243,3107,,,50,,315.662434844589,,,,,760,SYR,2022/03/10,2,3187594,0
Syria,3/11/22,55288,3110,,,45,,315.9195680482167,,,,,760,SYR,2022/03/11,3,3187594,0
Syria,3/12/22,55329,3114,,,41,,316.15384496707753,,,,,760,SYR,2022/03/12,4,3187594,0
Syria,3/13/22,55366,3117,,,37,,316.3652656011714,,,,,760,SYR,2022/03/13,3,3187594,0
Syria,3/14/22,55399,3117,,,33,,316.5538299504984,,,,,760,SYR,2022/03/14,0,3187594,0
Syria,3/15/22,55431,3118,,,32,,316.7366802286337,,,,,760,SYR,2022/03/15,1,3187594,0
Syria,3/16/22,55460,3120,,,29,,316.9023882931938,,,,,760,SYR,2022/03/16,2,3187594,0
Syria,3/17/22,55488,3122,,,28,,317.0623822865622,,,,,760,SYR,2022/03/17,2,3187594,0
Syria,3/19/22,55538,3125,,,50,,317.34808584614854,,,,,760,SYR,2022/03/19,3,3187594,0
Syria,3/20/22,55558,3127,,,20,,317.4623672699831,,,,,760,SYR,2022/03/20,2,3187594,0
Syria,3/21/22,55577,3127,,,19,,317.5709346226259,,,,,760,SYR,2022/03/21,0,3187594,0
Syria,3/23/22,55595,3128,,,18,,317.67378790407696,,,,,760,SYR,2022/03/23,1,3187594,0
Syria,3/24/22,55623,3130,,,28,,317.83378189744536,,,,,760,SYR,2022/03/24,2,3187594,0
Syria,3/26/22,55634,3131,,,11,,317.8966366805543,,,,,760,SYR,2022/03/26,1,3187594,0
Syria,3/27/22,55663,3135,,,29,,318.06234474511444,,,,,760,SYR,2022/03/27,4,3187594,0
Syria,3/28/22,55672,3137,,,9,,318.11377138584,,,,,760,SYR,2022/03/28,2,3187594,0
Syria,3/29/22,55680,3138,,,8,,318.1594839553738,,,,,760,SYR,2022/03/29,1,3187594,0
Syria,3/30/22,55688,3140,,,8,,318.2051965249076,,,,,760,SYR,2022/03/30,2,3369196,0
Syria,3/31/22,55695,3141,,,7,,318.2451950232497,,,,,760,SYR,2022/03/31,1,3369196,0
Syria,4/1/22,55701,3142,,,6,,318.27947945040006,,,,,760,SYR,2022/04/01,1,,
Taiwan*,3/5/22,20797,853,,,80,,87.32080644839614,,,,,158,TWN,2022/03/05,0,47794860,184266
Taiwan*,3/6/22,20840,853,,,43,,87.50135146341182,,,,,158,TWN,2022/03/06,0,47949019,154159
Taiwan*,3/7/22,20869,853,,,29,,87.62311438051542,,,,,158,TWN,2022/03/07,0,47949019,0
Taiwan*,3/8/22,20922,853,,,53,,87.84564660832544,,,,,158,TWN,2022/03/08,0,48068834,119815
Taiwan*,3/9/22,20999,853,,,77,,88.16894814684188,,,,,158,TWN,2022/03/09,0,48256933,188099
Taiwan*,3/10/22,21081,853,,,82,,88.5132432917555,,,,,158,TWN,2022/03/10,0,48350253,93320
Taiwan*,3/11/22,21163,853,,,82,,88.85753843666912,,,,,158,TWN,2022/03/11,0,48470509,120256
Taiwan*,3/12/22,21225,853,,,62,,89.11785915599404,,,,,158,TWN,2022/03/12,0,48470509,0
Taiwan*,3/13/22,21288,853,,,63,,89.3823785965984,,,,,158,TWN,2022/03/13,0,48470509,0
Taiwan*,3/14/22,21363,853,,,75,,89.69728269255599,,,,,158,TWN,2022/03/14,0,48565707,95198
Taiwan*,3/15/22,21402,853,,,39,,89.86103282245392,,,,,158,TWN,2022/03/15,0,48650083,84376
Taiwan*,3/16/22,21492,853,,,90,,90.23891773760302,,,,,158,TWN,2022/03/16,0,48781646,131563
Taiwan*,3/17/22,21583,853,,,91,,90.62100137403154,,,,,158,TWN,2022/03/17,0,48861874,80228
Taiwan*,3/18/22,21658,853,,,75,,90.93590546998911,,,,,158,TWN,2022/03/18,0,48954969,93095
Taiwan*,3/19/22,21784,853,,,126,,91.46494435119784,,,,,158,TWN,2022/03/19,0,48954969,0
Taiwan*,3/20/22,21905,853,,,121,,91.9729896260094,,,,,158,TWN,2022/03/20,0,48954969,0
Taiwan*,3/21/22,22003,853,,,98,,92.38446431139397,,,,,158,TWN,2022/03/21,0,49025107,70138
Taiwan*,3/22/22,22091,853,,,88,,92.75395178398419,,,,,158,TWN,2022/03/22,0,49105829,80722
Taiwan*,3/23/22,22188,853,,,97,,93.16122774808932,,,,,158,TWN,2022/03/23,0,49167713,61884
Taiwan*,3/24/22,22327,853,,,139,,93.7448500059307,,,,,158,TWN,2022/03/24,0,49222626,54913
Taiwan*,3/25/22,22463,853,,,136,,94.31587609993376,,,,,158,TWN,2022/03/25,0,49257341,34715
Taiwan*,3/26/22,22566,853,,,103,,94.7483443917155,,,,,158,TWN,2022/03/26,0,49310076,52735
Taiwan*,3/27/22,22769,853,,,203,,95.60068481144067,,,,,158,TWN,2022/03/27,0,49310076,0
Taiwan*,3/28/22,22896,853,,,127,,96.13392241392884,,,,,158,TWN,2022/03/28,0,49351562,41486
Taiwan*,3/29/22,22992,853,,,96,,96.53699965675453,,,,,158,TWN,2022/03/29,0,49481298,129736
Taiwan*,3/30/22,23155,853,,,163,,97.22139122530234,,,,,158,TWN,2022/03/30,0,49481298,0
Taiwan*,3/31/22,23394,853,,,239,,98.22488561108715,,,,,158,TWN,2022/03/31,0,49481298,0
Taiwan*,4/1/22,23629,853,,,235,,99.21158511175422,,,,,158,TWN,2022/04/01,0,,
Tajikistan,3/5/22,17786,125,,,0,,186.4821514584003,,,,,762,TJK,2022/03/05,0,9279471,0
Tajikistan,4/1/22,17786,125,,,0,,186.4821514584003,,,,,762,TJK,2022/04/01,0,,
Tanzania,3/5/22,33620,798,,,0,,56.28265329284576,,,,,834,TZA,2022/03/05,0,4278673,0
Tanzania,3/9/22,33726,800,,,106,,56.460106036719694,,,,,834,TZA,2022/03/09,2,4440797,0
Tanzania,3/16/22,33773,800,,,47,,56.5387879137204,,,,,834,TZA,2022/03/16,0,5031070,0
Tanzania,3/22/22,33797,800,,,24,,56.578965893465444,,,,,834,TZA,2022/03/22,0,5031070,0
Tanzania,3/30/22,33815,800,,,18,,56.60909937827422,,,,,834,TZA,2022/03/30,0,5031070,0
Tanzania,4/1/22,33815,800,,,0,,56.60909937827422,,,,,834,TZA,2022/04/01,0,,
Thailand,3/5/22,3026695,23235,,,21881,,4336.240621737732,,,,,764,THA,2022/03/05,59,124396024,0
Thailand,3/6/22,3047857,23300,,,21162,,4366.558682869499,,,,,764,THA,2022/03/06,65,124649712,253688
Thailand,3/7/22,3066800,23369,,,18943,,4393.697659904707,,,,,764,THA,2022/03/07,69,124649712,0
Thailand,3/8/22,3088873,23438,,,22073,,4425.320879040964,,,,,764,THA,2022/03/08,69,125036572,386860
Thailand,3/9/22,3111857,23512,,,22984,,4458.249256181714,,,,,764,THA,2022/03/09,74,125370801,334229
Thailand,3/10/22,3136649,23575,,,24792,,4493.7678920185335,,,,,764,THA,2022/03/10,63,125454705,83904
Thailand,3/11/22,3161241,23643,,,24592,,4528.999994813752,,,,,764,THA,2022/03/11,68,125782375,327670
Thailand,3/12/22,3161241,23709,,,0,,4528.999994813752,,,,,764,THA,2022/03/12,66,125877496,95121
Thailand,3/13/22,3206955,23778,,,45714,,4594.492852132417,,,,,764,THA,2022/03/13,69,126087224,209728
Thailand,3/14/22,3226697,23848,,,19742,,4622.77652866882,,,,,764,THA,2022/03/14,70,126267971,180747
Thailand,3/15/22,3250642,23918,,,23945,,4657.08169707446,,,,,764,THA,2022/03/15,70,126267971,0
Thailand,3/16/22,3276098,23995,,,25456,,4693.551622609394,,,,,764,THA,2022/03/16,77,126613089,345118
Thailand,3/17/22,3303169,24075,,,27071,,4732.3353024552525,,,,,764,THA,2022/03/17,80,126659661,46572
Thailand,3/18/22,3328973,24162,,,25804,,4769.303795482571,,,,,764,THA,2022/03/18,87,126977751,318090
Thailand,3/19/22,3353969,24246,,,24996,,4805.1146950218235,,,,,764,THA,2022/03/19,84,126977751,0
Thailand,3/20/22,3377410,24334,,,23441,,4838.69780016263,,,,,764,THA,2022/03/20,88,127290646,312895
Thailand,3/21/22,3398792,24417,,,21382,,4869.331047640158,,,,,764,THA,2022/03/21,83,127383667,93021
Thailand,3/22/22,3423956,24497,,,25164,,4905.382634934354,,,,,764,THA,2022/03/22,80,127488916,105249
Thailand,3/24/22,3450980,24579,,,27024,,4944.098979515437,,,,,764,THA,2022/03/24,82,127862740,373824
Thailand,3/25/22,3503264,24715,,,52284,,5019.004447250685,,,,,764,THA,2022/03/25,136,127950674,87934
Thailand,3/26/22,3529085,24799,,,25821,,5055.9972955865405,,,,,764,THA,2022/03/26,84,128399428,448754
Thailand,3/27/22,3553720,24880,,,24635,,5091.291002985703,,,,,764,THA,2022/03/27,81,128649461,250033
Thailand,3/28/22,3575398,24958,,,21678,,5122.3483193648,,,,,764,THA,2022/03/28,78,128649997,536
Thailand,3/29/22,3600787,25045,,,25389,,5158.722256330797,,,,,764,THA,2022/03/29,87,128882372,232375
Thailand,3/30/22,3628347,25130,,,27560,,5198.20650946337,,,,,764,THA,2022/03/30,85,129071569,189197
Thailand,3/31/22,3656726,25222,,,28379,,5238.864115401298,,,,,764,THA,2022/03/31,92,129071569,0
Thailand,4/1/22,3684755,25318,,,28029,,5279.0202885164235,,,,,764,THA,2022/04/01,96,,
Timor-Leste,3/5/22,22741,129,,,0,,1724.8388628396244,,,,,626,TLS,2022/03/05,0,1259011,0
Timor-Leste,3/6/22,22759,129,,,18,,1726.2041106093404,,,,,626,TLS,2022/03/06,0,1265017,0
Timor-Leste,3/7/22,22762,129,,,3,,1726.4316519042932,,,,,626,TLS,2022/03/07,0,1265017,0
Timor-Leste,3/8/22,22768,129,,,6,,1726.8867344941984,,,,,626,TLS,2022/03/08,0,1265017,0
Timor-Leste,3/9/22,22777,129,,,9,,1727.5693583790564,,,,,626,TLS,2022/03/09,0,1265017,0
Timor-Leste,3/10/22,22784,129,,,7,,1728.1002880672795,,,,,626,TLS,2022/03/10,0,1265017,0
Timor-Leste,3/12/22,22789,129,,,5,,1728.4795235588672,,,,,626,TLS,2022/03/12,0,1265017,0
Timor-Leste,3/17/22,22801,129,,,12,,1729.389688738678,,,,,626,TLS,2022/03/17,0,1285685,0
Timor-Leste,3/21/22,22805,130,,,4,,1729.6930771319483,,,,,626,TLS,2022/03/21,1,1285685,0
Timor-Leste,3/22/22,22815,130,,,10,,1730.4515481151238,,,,,626,TLS,2022/03/22,0,1285685,0
Timor-Leste,3/23/22,22818,130,,,3,,1730.6790894100764,,,,,626,TLS,2022/03/23,0,1285685,0
Timor-Leste,3/24/22,22813,130,,,,,1730.2998539184887,,,,,626,TLS,2022/03/24,0,1285685,0
Timor-Leste,3/25/22,22817,130,,,4,,1730.6032423117588,,,,,626,TLS,2022/03/25,0,1285685,0
Timor-Leste,3/26/22,22821,130,,,4,,1730.906630705029,,,,,626,TLS,2022/03/26,0,1285685,0
Timor-Leste,3/28/22,22822,130,,,1,,1730.9824778033467,,,,,626,TLS,2022/03/28,0,1297126,0
Timor-Leste,3/29/22,22827,130,,,5,,1731.3617132949346,,,,,626,TLS,2022/03/29,0,1297126,0
Timor-Leste,3/30/22,22830,130,,,3,,1731.589254589887,,,,,626,TLS,2022/03/30,0,1297126,0
Timor-Leste,4/1/22,22832,130,,,2,,1731.7409487865223,,,,,626,TLS,2022/04/01,0,,
Togo,3/5/22,36815,272,,,0,,444.6934357257635,,,,,768,TGO,2022/03/05,0,2515341,0
Togo,3/6/22,36821,272,,,6,,444.7659105489159,,,,,768,TGO,2022/03/06,0,2734547,219206
Togo,3/7/22,36833,272,,,12,,444.9108601952206,,,,,768,TGO,2022/03/07,0,2734547,0
Togo,3/8/22,36838,272,,,5,,444.9712558811809,,,,,768,TGO,2022/03/08,0,2734547,0
Togo,3/9/22,36843,272,,,5,,445.03165156714124,,,,,768,TGO,2022/03/09,0,2734547,0
Togo,3/11/22,36848,272,,,5,,445.09204725310155,,,,,768,TGO,2022/03/11,0,2734547,0
Togo,3/12/22,36850,272,,,2,,445.11620552748565,,,,,768,TGO,2022/03/12,0,2734547,0
Togo,3/13/22,36854,272,,,4,,445.1645220762539,,,,,768,TGO,2022/03/13,0,2734547,0
Togo,3/14/22,36860,272,,,6,,445.2369968994063,,,,,768,TGO,2022/03/14,0,2734547,0
Togo,3/16/22,36870,272,,,10,,445.3577882713269,,,,,768,TGO,2022/03/16,0,2734547,0
Togo,3/17/22,36871,272,,,1,,445.3698674085189,,,,,768,TGO,2022/03/17,0,2734547,0
Togo,3/19/22,36876,272,,,5,,445.43026309447924,,,,,768,TGO,2022/03/19,0,2753329,0
Togo,3/20/22,36878,272,,,2,,445.4544213688634,,,,,768,TGO,2022/03/20,0,2753329,0
Togo,3/21/22,36882,272,,,4,,445.50273791763163,,,,,768,TGO,2022/03/21,0,2753329,0
Togo,3/22/22,36896,272,,,14,,445.6718458383205,,,,,768,TGO,2022/03/22,0,2753329,0
Togo,3/23/22,36902,272,,,6,,445.7443206614729,,,,,768,TGO,2022/03/23,0,2753329,0
Togo,3/24/22,36907,272,,,5,,445.8047163474332,,,,,768,TGO,2022/03/24,0,2753329,0
Togo,3/26/22,36911,272,,,4,,445.85303289620146,,,,,768,TGO,2022/03/26,0,2753329,0
Togo,3/27/22,36917,272,,,6,,445.9255077193538,,,,,768,TGO,2022/03/27,0,2757575,4246
Togo,3/28/22,36921,272,,,4,,445.97382426812203,,,,,768,TGO,2022/03/28,0,2757575,0
Togo,3/29/22,36924,272,,,3,,446.01006167969825,,,,,768,TGO,2022/03/29,0,2757575,0
Togo,3/30/22,36930,272,,,6,,446.08253650285064,,,,,768,TGO,2022/03/30,0,2757575,0
Togo,3/31/22,36939,272,,,9,,446.1912487375792,,,,,768,TGO,2022/03/31,0,2757575,0
Togo,4/1/22,36943,272,,,4,,446.23956528634744,,,,,768,TGO,2022/04/01,0,,
Tonga,3/5/22,898,0,,,183,,849.5983802756938,,,,,776,TON,2022/03/05,0,,
Tonga,3/7/22,1059,0,,,161,,1001.9205843117591,,,,,776,TON,2022/03/07,0,,
Tonga,3/9/22,1220,0,,,161,,1154.2427883478244,,,,,776,TON,2022/03/09,0,,
Tonga,3/10/22,1320,0,,,100,,1248.8528529664986,,,,,776,TON,2022/03/10,0,,
Tonga,3/12/22,1513,2,,,193,,1431.4502776805396,,,,,776,TON,2022/03/12,2,,
Tonga,3/13/22,1708,2,,,195,,1615.9399036869543,,,,,776,TON,2022/03/13,0,,
Tonga,3/14/22,1875,2,,,167,,1773.93871160014,,,,,776,TON,2022/03/14,0,,
Tonga,3/15/22,2072,2,,,197,,1960.3205388989281,,,,,776,TON,2022/03/15,0,,
Tonga,3/17/22,2530,2,,,458,,2393.6346348524557,,,,,776,TON,2022/03/17,0,,
Tonga,3/18/22,2788,2,,,258,,2637.728601568635,,,,,776,TON,2022/03/18,0,,
Tonga,3/20/22,3232,2,,,444,,3057.797288475548,,,,,776,TON,2022/03/20,0,,
Tonga,3/21/22,3418,2,,,186,,3233.772008666282,,,,,776,TON,2022/03/21,0,,
Tonga,3/22/22,3784,2,,,366,,3580.0448451706293,,,,,776,TON,2022/03/22,0,,
Tonga,3/24/22,4537,2,,,753,,4292.458631749246,,,,,776,TON,2022/03/24,0,,
Tonga,3/25/22,4872,2,,,335,,4609.402348221804,,,,,776,TON,2022/03/25,0,,
Tonga,3/26/22,5332,2,,,460,,5044.608645467705,,,,,776,TON,2022/03/26,0,,
Tonga,3/27/22,5591,2,,,259,,5289.6487128300705,,,,,776,TON,2022/03/27,0,,
Tonga,3/30/22,6423,6,,,832,,6076.80445045744,,,,,776,TON,2022/03/30,4,,
Tonga,4/1/22,6546,6,,,123,,6193.174829938409,,,,,776,TON,2022/04/01,0,,
Trinidad and Tobago,3/5/22,129963,3652,,,642,,9286.447715633756,,,,,780,TTO,2022/03/05,3,1528473,1417
Trinidad and Tobago,3/6/22,130400,3659,,,437,,9317.673354098026,,,,,780,TTO,2022/03/06,7,1529220,747
Trinidad and Tobago,3/7/22,130532,3665,,,132,,9327.105354732543,,,,,780,TTO,2022/03/07,6,1529220,0
Trinidad and Tobago,3/8/22,130964,3667,,,432,,9357.973720445505,,,,,780,TTO,2022/03/08,2,1529230,10
Trinidad and Tobago,3/9/22,131378,3669,,,414,,9387.55590425376,,,,,780,TTO,2022/03/09,2,1531321,2091
Trinidad and Tobago,3/10/22,131840,3673,,,462,,9420.56790647457,,,,,780,TTO,2022/03/10,4,1532235,914
Trinidad and Tobago,3/11/22,132383,3676,,,543,,9459.367727266555,,,,,780,TTO,2022/03/11,3,1533108,873
Trinidad and Tobago,3/12/22,132708,3681,,,325,,9482.59045610154,,,,,780,TTO,2022/03/12,5,1534045,937
Trinidad and Tobago,3/13/22,132933,3684,,,225,,9498.667729910374,,,,,780,TTO,2022/03/13,3,1534045,0
Trinidad and Tobago,3/14/22,133151,3686,,,218,,9514.244821867378,,,,,780,TTO,2022/03/14,2,1534637,592
Trinidad and Tobago,3/15/22,133393,3690,,,242,,9531.53682303066,,,,,780,TTO,2022/03/15,4,1534637,0
Trinidad and Tobago,3/16/22,133788,3695,,,395,,9559.761370383947,,,,,780,TTO,2022/03/16,5,1536390,1753
Trinidad and Tobago,3/17/22,134272,3700,,,484,,9594.345372710506,,,,,780,TTO,2022/03/17,5,1537143,753
Trinidad and Tobago,3/18/22,134445,3704,,,173,,9606.707009905744,,,,,780,TTO,2022/03/18,4,1537860,717
Trinidad and Tobago,3/19/22,134878,3708,,,433,,9637.64683016897,,,,,780,TTO,2022/03/19,4,1537860,0
Trinidad and Tobago,3/20/22,135097,3712,,,219,,9653.295376676235,,,,,780,TTO,2022/03/20,4,1538756,896
Trinidad and Tobago,3/21/22,135328,3716,,,231,,9669.801377786638,,,,,780,TTO,2022/03/21,4,1539289,533
Trinidad and Tobago,3/22/22,135579,3719,,,251,,9687.736469902271,,,,,780,TTO,2022/03/22,3,1539299,10
Trinidad and Tobago,3/23/22,135854,3722,,,275,,9707.386471224181,,,,,780,TTO,2022/03/23,3,1539965,666
Trinidad and Tobago,3/24/22,136220,3727,,,366,,9733.538836619886,,,,,780,TTO,2022/03/24,5,1540717,752
Trinidad and Tobago,3/25/22,136561,3729,,,341,,9757.904838259054,,,,,780,TTO,2022/03/25,2,1541448,731
Trinidad and Tobago,3/27/22,136828,3734,,,267,,9776.98320317887,,,,,780,TTO,2022/03/27,5,1542051,0
Trinidad and Tobago,3/28/22,137248,3738,,,420,,9806.994114288695,,,,,780,TTO,2022/03/28,4,1546140,4089
Trinidad and Tobago,3/29/22,137496,3741,,,248,,9824.714842753545,,,,,780,TTO,2022/03/29,3,1543684,
Trinidad and Tobago,3/30/22,137757,3746,,,261,,9843.364480371793,,,,,780,TTO,2022/03/30,5,1543684,0
Trinidad and Tobago,3/31/22,137860,3750,,,103,,9850.724299048725,,,,,780,TTO,2022/03/31,4,1543684,0
Trinidad and Tobago,4/1/22,138159,3754,,,299,,9872.08920957691,,,,,780,TTO,2022/04/01,4,,
Tunisia,3/5/22,1005167,27922,,,3413,,8504.945332863792,,,,,788,TUN,2022/03/05,48,14524342,0
Tunisia,3/7/22,1005804,27943,,,637,,8510.335133938672,,,,,788,TUN,2022/03/07,21,14629647,0
Tunisia,3/8/22,1016894,27959,,,11090,,8604.170132243888,,,,,788,TUN,2022/03/08,16,14629647,0
Tunisia,3/9/22,1017907,27989,,,1013,,8612.741354361398,,,,,788,TUN,2022/03/09,30,14629647,0
Tunisia,3/10/22,1018447,28009,,,540,,8617.31041649709,,,,,788,TUN,2022/03/10,20,14629647,0
Tunisia,3/11/22,1020546,28018,,,2099,,8635.070530243045,,,,,788,TUN,2022/03/11,9,14629647,0
Tunisia,3/12/22,1028717,28031,,,8171,,8704.207209336997,,,,,788,TUN,2022/03/12,13,14629647,0
Tunisia,3/13/22,1029228,28046,,,511,,8708.53089591355,,,,,788,TUN,2022/03/13,15,14629647,0
Tunisia,3/14/22,1029596,28062,,,368,,8711.644627146761,,,,,788,TUN,2022/03/14,16,14629647,0
Tunisia,3/15/22,1029762,28065,,,166,,8713.049190692178,,,,,788,TUN,2022/03/15,3,14629647,0
Tunisia,3/22/22,1033731,28165,,,3969,,8746.63179738951,,,,,788,TUN,2022/03/22,100,14629647,0
Tunisia,3/29/22,1035884,28323,,,2153,,8764.848817349033,,,,,788,TUN,2022/03/29,158,14629647,0
Tunisia,4/1/22,1035884,28323,,,0,,8764.848817349033,,,,,788,TUN,2022/04/01,0,,
Turkey,3/5/22,14326217,95379,,,32389,,16986.454213442983,,,,,792,TUR,2022/03/05,174,145972393,29047
Turkey,3/6/22,14353888,95549,,,27671,,17019.263445254855,,,,,792,TUR,2022/03/06,170,145990177,17784
Turkey,3/7/22,14388231,95681,,,34343,,17059.983601668253,,,,,792,TUR,2022/03/07,132,146048178,58001
Turkey,3/8/22,14425638,95811,,,37407,,17104.336712664845,,,,,792,TUR,2022/03/08,130,146097881,49703
Turkey,3/9/22,14458881,95954,,,33243,,17143.752609926312,,,,,792,TUR,2022/03/09,143,146144478,46597
Turkey,3/10/22,14488373,96094,,,29492,,17178.720983479696,,,,,792,TUR,2022/03/10,140,146183069,38591
Turkey,3/11/22,14513774,96217,,,25401,,17208.83869867804,,,,,792,TUR,2022/03/11,123,146222195,39126
Turkey,3/12/22,14534239,96349,,,20465,,17233.103847354632,,,,,792,TUR,2022/03/12,132,146235452,13257
Turkey,3/13/22,14551665,96487,,,17426,,17253.76568370148,,,,,792,TUR,2022/03/13,138,146243976,8524
Turkey,3/14/22,14576069,96620,,,24404,,17282.701265832122,,,,,792,TUR,2022/03/14,133,146273906,29930
Turkey,3/15/22,14600683,96735,,,24614,,17311.885842891763,,,,,792,TUR,2022/03/15,115,146304093,30187
Turkey,3/16/22,14623028,96853,,,22345,,17338.380089028018,,,,,792,TUR,2022/03/16,118,146336317,32224
Turkey,3/17/22,14644382,96954,,,21354,,17363.6993162374,,,,,792,TUR,2022/03/17,101,146377975,41658
Turkey,3/18/22,14663508,97077,,,19126,,17386.376825819047,,,,,792,TUR,2022/03/18,123,146421935,43960
Turkey,3/19/22,14680836,97182,,,17328,,17406.922464532363,,,,,792,TUR,2022/03/19,105,146435701,13766
Turkey,3/20/22,14693917,97267,,,13081,,17422.43247722909,,,,,792,TUR,2022/03/20,85,146446575,10874
Turkey,3/21/22,14708850,97347,,,14933,,17440.13838806161,,,,,792,TUR,2022/03/21,80,146503050,56475
Turkey,3/22/22,14726276,97437,,,17426,,17460.80022440846,,,,,792,TUR,2022/03/22,90,146561848,58798
Turkey,3/23/22,14743437,97521,,,17161,,17481.147852868708,,,,,792,TUR,2022/03/23,84,146561848,0
Turkey,3/24/22,14760331,97598,,,16894,,17501.178902062078,,,,,792,TUR,2022/03/24,77,146675886,114038
Turkey,3/25/22,14775634,97666,,,15303,,17519.323518245703,,,,,792,TUR,2022/03/25,68,146733931,58045
Turkey,3/26/22,14789483,97736,,,13849,,17535.7441409685,,,,,792,TUR,2022/03/26,70,146751309,17378
Turkey,3/27/22,14800677,97800,,,11194,,17549.0167563746,,,,,792,TUR,2022/03/27,64,146762564,11255
Turkey,3/28/22,14815041,97861,,,14364,,17566.04800951853,,,,,792,TUR,2022/03/28,61,146823531,60967
Turkey,3/29/22,14831231,97924,,,16190,,17585.244332854665,,,,,792,TUR,2022/03/29,63,146881913,58382
Turkey,3/30/22,14846224,97977,,,14993,,17603.021385095475,,,,,792,TUR,2022/03/30,53,146940492,58579
Turkey,3/31/22,14860560,98033,,,14336,,17620.019438915537,,,,,792,TUR,2022/03/31,56,146940492,0
Turkey,4/1/22,14873927,98078,,,13367,,17635.868558991766,,,,,792,TUR,2022/04/01,45,,
US,3/5/22,79267676,959337,,,14964,,24059.419761627018,,,,,840,USA,2022/03/05,289,553006972,340290
US,3/6/22,79280091,959540,,,12415,,24063.187977265643,,,,,840,USA,2022/03/06,203,553229683,222711
US,3/7/22,79344124,961268,,,64033,,24082.623349959,,,,,840,USA,2022/03/07,1728,553425305,195622
US,3/8/22,79373861,962666,,,29737,,24091.64915974118,,,,,840,USA,2022/03/08,1398,553712260,286955
US,3/9/22,79411563,964679,,,37702,,24103.09251584327,,,,,840,USA,2022/03/09,2013,554017734,305474
US,3/10/22,79458164,966445,,,46601,,24117.236907061593,,,,,840,USA,2022/03/10,1766,554368507,350773
US,3/11/22,79507897,968079,,,49733,,24132.33192666334,,,,,840,USA,2022/03/11,1634,554508987,140480
US,3/12/22,79518152,968331,,,10255,,24135.444536520296,,,,,840,USA,2022/03/12,252,554889994,381007
US,3/13/22,79529215,968517,,,11063,,24138.802391502988,,,,,840,USA,2022/03/13,186,555084571,194577
US,3/14/22,79564556,966054,,,35341,,24149.529134063167,,,,,840,USA,2022/03/14,,555226161,141590
US,3/15/22,79588935,967131,,,24379,,24156.928677281372,,,,,840,USA,2022/03/15,1077,555511880,285719
US,3/16/22,79635070,968952,,,46135,,24170.931627622726,,,,,840,USA,2022/03/16,1821,555742201,230321
US,3/17/22,79688242,970452,,,53172,,24187.070456614827,,,,,840,USA,2022/03/17,1500,556002303,260102
US,3/18/22,79719558,971248,,,31316,,24196.575526364257,,,,,840,USA,2022/03/18,796,556210028,207725
US,3/19/22,79730426,971516,,,10868,,24199.87419471388,,,,,840,USA,2022/03/19,268,556460943,250915
US,3/20/22,79741860,971598,,,11434,,24203.344656059995,,,,,840,USA,2022/03/20,82,556460943,0
US,3/21/22,79784079,973126,,,42219,,24216.159017400878,,,,,840,USA,2022/03/21,1528,556460943,0
US,3/22/22,79808606,973680,,,24527,,24223.603481755978,,,,,840,USA,2022/03/22,554,556460943,0
US,3/23/22,79849294,975305,,,40688,,24235.953152146983,,,,,840,USA,2022/03/23,1625,556460943,0
US,3/24/22,79892239,976158,,,42945,,24248.987869875597,,,,,840,USA,2022/03/24,853,557084678,623735
US,3/25/22,79938802,976769,,,46563,,24263.120727288504,,,,,840,USA,2022/03/25,611,557274228,189550
US,3/26/22,79948104,976910,,,9302,,24265.944081446418,,,,,840,USA,2022/03/26,141,557542983,268755
US,3/27/22,79959434,976963,,,11330,,24269.38297658823,,,,,840,USA,2022/03/27,53,557684296,141313
US,3/28/22,79997992,977948,,,38558,,24281.086146833422,,,,,840,USA,2022/03/28,985,558051039,366743
US,3/29/22,80022188,978909,,,24196,,24288.430145672904,,,,,840,USA,2022/03/29,961,558239925,188886
US,3/30/22,80059154,980130,,,36966,,24299.65011017531,,,,,840,USA,2022/03/30,1221,558469759,229834
US,3/31/22,80102065,980638,,,42911,,24312.674508183285,,,,,840,USA,2022/03/31,508,558469759,0
US,4/1/22,80140309,982371,,,38244,,24324.28237277318,,,,,840,USA,2022/04/01,1733,,
Uganda,3/5/22,163383,3590,,,0,,357.191578671214,,,,,800,UGA,2022/03/05,0,16672943,0
Uganda,3/7/22,163402,3592,,,19,,357.23311689731315,,,,,800,UGA,2022/03/07,2,16672943,0
Uganda,3/8/22,163416,3592,,,14,,357.2637240112809,,,,,800,UGA,2022/03/08,0,16672943,0
Uganda,3/9/22,163454,3593,,,38,,357.34680046347916,,,,,800,UGA,2022/03/09,1,16672943,0
Uganda,3/10/22,163513,3593,,,59,,357.47578758662905,,,,,800,UGA,2022/03/10,0,16672943,0
Uganda,3/11/22,163529,3594,,,16,,357.5107671454494,,,,,800,UGA,2022/03/11,1,16672943,0
Uganda,3/14/22,163541,3594,,,12,,357.53700181456463,,,,,800,UGA,2022/03/14,0,17060289,0
Uganda,3/15/22,163597,3594,,,56,,357.65943027043573,,,,,800,UGA,2022/03/15,0,17060289,0
Uganda,3/16/22,163609,3594,,,12,,357.685664939551,,,,,800,UGA,2022/03/16,0,17060289,0
Uganda,3/17/22,163627,3595,,,18,,357.7250169432238,,,,,800,UGA,2022/03/17,1,17060289,0
Uganda,3/18/22,163634,3595,,,7,,357.7403205002077,,,,,800,UGA,2022/03/18,0,17197954,137665
Uganda,3/19/22,163635,3595,,,1,,357.74250672263395,,,,,800,UGA,2022/03/19,0,17197954,0
Uganda,3/20/22,163688,3595,,,53,,357.85837651122625,,,,,800,UGA,2022/03/20,0,17197954,0
Uganda,3/21/22,163768,3595,,,80,,358.03327430532784,,,,,800,UGA,2022/03/21,0,17197954,0
Uganda,3/23/22,163775,3595,,,7,,358.04857786231173,,,,,800,UGA,2022/03/23,0,17197954,0
Uganda,3/24/22,163817,3595,,,42,,358.14039920421504,,,,,800,UGA,2022/03/24,0,17197954,0
Uganda,3/25/22,163830,3595,,,13,,358.16882009575653,,,,,800,UGA,2022/03/25,0,17197954,0
Uganda,3/26/22,163843,3595,,,13,,358.1972409872981,,,,,800,UGA,2022/03/26,0,17197954,0
Uganda,3/27/22,163862,3595,,,19,,358.23877921339715,,,,,800,UGA,2022/03/27,0,17197954,0
Uganda,3/28/22,163869,3596,,,7,,358.25408277038105,,,,,800,UGA,2022/03/28,1,17197954,0
Uganda,3/29/22,163878,3596,,,9,,358.2737587722175,,,,,800,UGA,2022/03/29,0,17197954,0
Uganda,3/30/22,163892,3596,,,14,,358.3043658861853,,,,,800,UGA,2022/03/30,0,17197954,0
Uganda,3/31/22,163905,3596,,,13,,358.33278677772677,,,,,800,UGA,2022/03/31,0,17197954,0
Uganda,4/1/22,163919,3596,,,14,,358.36339389169456,,,,,800,UGA,2022/04/01,0,,
Ukraine,3/5/22,5040518,112459,,,0,,11525.462515124758,,,,,804,UKR,2022/03/05,0,0,0
Ukraine,4/1/22,5040518,112459,,,0,,11525.462515124758,,,,,804,UKR,2022/04/01,0,,
United Arab Emirates,3/5/22,882477,2301,,,558,,8922.561271536035,,,,,784,ARE,2022/03/05,0,24225972,8176
United Arab Emirates,3/6/22,882884,2301,,,407,,8926.676373048613,,,,,784,ARE,2022/03/06,0,24247279,21307
United Arab Emirates,3/7/22,883270,2302,,,386,,8930.57914745612,,,,,784,ARE,2022/03/07,1,24258048,10769
United Arab Emirates,3/8/22,883593,2302,,,323,,8933.84494054841,,,,,784,ARE,2022/03/08,0,24267541,9493
United Arab Emirates,3/9/22,883985,2302,,,392,,8937.80837984308,,,,,784,ARE,2022/03/09,0,24279209,11668
United Arab Emirates,3/10/22,884354,2302,,,369,,8941.539270403624,,,,,784,ARE,2022/03/10,0,24292910,13701
United Arab Emirates,3/11/22,884736,2302,,,382,,8945.401601553021,,,,,784,ARE,2022/03/11,0,24305708,12798
United Arab Emirates,3/12/22,885089,2302,,,353,,8948.97071908113,,,,,784,ARE,2022/03/12,0,24320692,14984
United Arab Emirates,3/13/22,885407,2302,,,318,,8952.185958100785,,,,,784,ARE,2022/03/13,0,24320692,0
United Arab Emirates,3/14/22,885703,2302,,,296,,8955.17875920084,,,,,784,ARE,2022/03/14,0,24320692,0
United Arab Emirates,3/15/22,885983,2302,,,280,,8958.009787268462,,,,,784,ARE,2022/03/15,0,24320692,0
United Arab Emirates,3/16/22,886301,2302,,,318,,8961.225026288117,,,,,784,ARE,2022/03/16,0,24341810,21118
United Arab Emirates,3/17/22,886687,2302,,,386,,8965.127800695624,,,,,784,ARE,2022/03/17,0,24356716,14906
United Arab Emirates,3/18/22,887018,2302,,,331,,8968.474480304134,,,,,784,ARE,2022/03/18,0,24381994,25278
United Arab Emirates,3/19/22,887385,2302,,,367,,8972.185149235622,,,,,784,ARE,2022/03/19,0,24381994,0
United Arab Emirates,3/20/22,887732,2302,,,347,,8975.693601876566,,,,,784,ARE,2022/03/20,0,24381994,0
United Arab Emirates,3/21/22,888070,2302,,,338,,8979.111057186767,,,,,784,ARE,2022/03/21,0,24385251,3257
United Arab Emirates,3/22/22,888386,2302,,,316,,8982.306074577367,,,,,784,ARE,2022/03/22,0,24397425,12174
United Arab Emirates,3/23/22,888718,2302,,,332,,8985.662865000404,,,,,784,ARE,2022/03/23,0,24397425,0
United Arab Emirates,3/24/22,889108,2302,,,390,,8989.60608266602,,,,,784,ARE,2022/03/24,0,24454578,57153
United Arab Emirates,3/25/22,889456,2302,,,348,,8993.124646121492,,,,,784,ARE,2022/03/25,0,24462554,7976
United Arab Emirates,3/26/22,889797,2302,,,341,,8996.572433875273,,,,,784,ARE,2022/03/26,0,24470959,8405
United Arab Emirates,3/27/22,890112,2302,,,315,,8999.757340451346,,,,,784,ARE,2022/03/27,0,24482816,11857
United Arab Emirates,3/28/22,890398,2302,,,286,,9002.649033406131,,,,,784,ARE,2022/03/28,0,24491525,8709
United Arab Emirates,3/29/22,890699,2302,,,301,,9005.692388578824,,,,,784,ARE,2022/03/29,0,24498689,7164
United Arab Emirates,3/30/22,890987,2302,,,288,,9008.604303162663,,,,,784,ARE,2022/03/30,0,24512442,13753
United Arab Emirates,3/31/22,891300,2302,,,313,,9011.768988109681,,,,,784,ARE,2022/03/31,0,24512442,0
United Arab Emirates,4/1/22,891588,2302,,,288,,9014.68090269352,,,,,784,ARE,2022/04/01,0,,
United Kingdom,3/5/22,19256835,162582,,,0,,28366.42881498814,,,,,826,GBR,2022/03/05,0,141332259,814
United Kingdom,3/7/22,19383743,162722,,,126908,,28553.371619870275,,,,,826,GBR,2022/03/07,140,141462696,129504
United Kingdom,3/8/22,19446892,162936,,,63149,,28646.393739716954,,,,,826,GBR,2022/03/08,214,141500275,37579
United Kingdom,3/9/22,19515547,163059,,,68655,,28747.526515185662,,,,,826,GBR,2022/03/09,123,141540268,39993
United Kingdom,3/10/22,19600293,163203,,,84746,,28872.362261888327,,,,,826,GBR,2022/03/10,144,141582588,42320
United Kingdom,3/11/22,19673347,163317,,,73054,,28979.975018120083,,,,,826,GBR,2022/03/11,114,141623162,40574
United Kingdom,3/14/22,19845016,163454,,,171669,,29232.853358108987,,,,,826,GBR,2022/03/14,137,141740145,115737
United Kingdom,3/15/22,19965698,163680,,,120682,,29410.624905834786,,,,,826,GBR,2022/03/15,226,141786512,46367
United Kingdom,3/16/22,20059641,163833,,,93943,,29549.008364080466,,,,,826,GBR,2022/03/16,153,141822764,36252
United Kingdom,3/17/22,20150847,163972,,,91206,,29683.360063438115,,,,,826,GBR,2022/03/17,139,141865905,43141
United Kingdom,3/18/22,20243940,164099,,,93093,,29820.49142265024,,,,,826,GBR,2022/03/18,127,141906036,40131
United Kingdom,3/21/22,20470351,164266,,,226411,,30154.007886515163,,,,,826,GBR,2022/03/21,167,142022776,116740
United Kingdom,3/22/22,20566021,164516,,,95670,,30294.93531538548,,,,,826,GBR,2022/03/22,250,142056831,34055
United Kingdom,3/23/22,20669099,164712,,,103078,,30446.77515559761,,,,,826,GBR,2022/03/23,196,142056954,123
United Kingdom,3/24/22,20770686,164874,,,101587,,30596.418666799123,,,,,826,GBR,2022/03/24,162,142128236,71282
United Kingdom,3/25/22,20848912,165046,,,78226,,30711.650077385613,,,,,826,GBR,2022/03/25,172,142150034,21798
United Kingdom,3/26/22,20848913,165046,,,1,,30711.651550443297,,,,,826,GBR,2022/03/26,0,142150663,629
United Kingdom,3/28/22,21064311,165264,,,215398,,31028.94523000647,,,,,826,GBR,2022/03/28,218,142263349,105205
United Kingdom,3/29/22,21145773,165569,,,81462,,31148.943455266566,,,,,826,GBR,2022/03/29,305,142294021,30672
United Kingdom,3/30/22,21234719,165782,,,88946,,31279.966044252655,,,,,826,GBR,2022/03/30,213,142325550,31529
United Kingdom,3/31/22,21309769,165977,,,75050,,31390.519023626726,,,,,826,GBR,2022/03/31,195,142325550,0
United Kingdom,4/1/22,21379545,166168,,,69776,,31493.303096762036,,,,,826,GBR,2022/04/01,191,,
Uruguay,3/5/22,853170,7040,,,1929,,24560.6520028776,,,,,858,URY,2022/03/05,9,7669517,41
Uruguay,3/6/22,854375,7046,,,1205,,24595.340969511995,,,,,858,URY,2022/03/06,6,7669517,0
Uruguay,3/7/22,855883,7051,,,1508,,24638.752555972304,,,,,858,URY,2022/03/07,5,7702273,32756
Uruguay,3/8/22,857635,7059,,,1752,,24689.18829833202,,,,,858,URY,2022/03/08,8,7729507,27234
Uruguay,3/9/22,859165,7069,,,1530,,24733.233210324244,,,,,858,URY,2022/03/09,10,7757810,28303
Uruguay,3/10/22,860663,7075,,,1498,,24776.35692154277,,,,,858,URY,2022/03/10,6,7795465,37655
Uruguay,3/11/22,862153,7083,,,1490,,24819.250332567874,,,,,858,URY,2022/03/11,8,7826167,30702
Uruguay,3/12/22,863365,7090,,,1212,,24854.140811871515,,,,,858,URY,2022/03/12,7,7826402,235
Uruguay,3/13/22,864376,7095,,,1011,,24883.244998815393,,,,,858,URY,2022/03/13,5,7826403,1
Uruguay,3/14/22,865644,7103,,,1268,,24919.747579472998,,,,,858,URY,2022/03/14,8,7855768,29365
Uruguay,3/15/22,867282,7110,,,1638,,24966.901544076434,,,,,858,URY,2022/03/15,7,7875803,20035
Uruguay,3/16/22,868952,7116,,,1670,,25014.976709453564,,,,,858,URY,2022/03/16,6,7892270,16467
Uruguay,3/17/22,871081,7120,,,2129,,25076.26534842836,,,,,858,URY,2022/03/17,4,7909129,16859
Uruguay,3/18/22,872938,7127,,,1857,,25129.72378082676,,,,,858,URY,2022/03/18,7,7919647,10518
Uruguay,3/19/22,874404,7134,,,1466,,25171.926291271593,,,,,858,URY,2022/03/19,7,7920121,474
Uruguay,3/20/22,875313,7138,,,909,,25198.094150749326,,,,,858,URY,2022/03/20,4,7920121,0
Uruguay,3/21/22,876400,7141,,,1087,,25229.386189530727,,,,,858,URY,2022/03/21,3,7944315,24194
Uruguay,3/22/22,877763,7142,,,1363,,25268.623584985235,,,,,858,URY,2022/03/22,1,7957053,12738
Uruguay,3/23/22,879618,7144,,,1855,,25322.024442335278,,,,,858,URY,2022/03/23,2,7961550,4497
Uruguay,3/24/22,881152,7147,,,1534,,25366.18450442421,,,,,858,URY,2022/03/24,3,7985561,24011
Uruguay,3/25/22,882379,7149,,,1227,,25401.506796590522,,,,,858,URY,2022/03/25,2,8003203,17642
Uruguay,3/26/22,883354,7150,,,975,,25429.574632663993,,,,,858,URY,2022/03/26,1,8003482,279
Uruguay,3/27/22,884081,7151,,,727,,25450.503162741345,,,,,858,URY,2022/03/27,1,8003482,0
Uruguay,3/28/22,884742,7154,,,661,,25469.53171622295,,,,,858,URY,2022/03/28,3,8017224,13742
Uruguay,3/29/22,885980,7156,,,1238,,25505.170671155218,,,,,858,URY,2022/03/29,2,8027751,10527
Uruguay,3/30/22,887028,7156,,,1048,,25535.33999649368,,,,,858,URY,2022/03/30,0,8038655,10904
Uruguay,3/31/22,887935,7159,,,907,,25561.450280923054,,,,,858,URY,2022/03/31,3,8038655,0
Uruguay,4/1/22,888639,7161,,,704,,25581.71669794431,,,,,858,URY,2022/04/01,2,,
Uzbekistan,3/5/22,236840,1637,,,69,,707.6356981235194,,,,,860,UZB,2022/03/05,0,42121870,0
Uzbekistan,3/6/22,236899,1637,,,59,,707.8119796054874,,,,,860,UZB,2022/03/06,0,42121870,0
Uzbekistan,3/7/22,236967,1637,,,68,,708.0151514830098,,,,,860,UZB,2022/03/07,0,42121870,0
Uzbekistan,3/8/22,236994,1637,,,27,,708.0958226696731,,,,,860,UZB,2022/03/08,0,42121870,0
Uzbekistan,3/9/22,237045,1637,,,51,,708.2482015778148,,,,,860,UZB,2022/03/09,0,42121870,0
Uzbekistan,3/10/22,237059,1637,,,14,,708.2900310820106,,,,,860,UZB,2022/03/10,0,42121870,0
Uzbekistan,3/11/22,237129,1637,,,70,,708.4991786029896,,,,,860,UZB,2022/03/11,0,42121870,0
Uzbekistan,3/12/22,237169,1637,,,40,,708.6186914721204,,,,,860,UZB,2022/03/12,0,42121870,0
Uzbekistan,3/13/22,237238,1637,,,69,,708.824851171371,,,,,860,UZB,2022/03/13,0,42121870,0
Uzbekistan,3/14/22,237260,1637,,,22,,708.890583249393,,,,,860,UZB,2022/03/14,0,42121870,0
Uzbekistan,3/15/22,237281,1637,,,21,,708.9533275056866,,,,,860,UZB,2022/03/15,0,42121870,0
Uzbekistan,3/16/22,237341,1637,,,60,,709.1325968093829,,,,,860,UZB,2022/03/16,0,42121870,0
Uzbekistan,3/17/22,237384,1637,,,43,,709.2610731436985,,,,,860,UZB,2022/03/17,0,43564564,0
Uzbekistan,3/18/22,237414,1637,,,30,,709.3507077955466,,,,,860,UZB,2022/03/18,0,43564564,0
Uzbekistan,3/19/22,237438,1637,,,24,,709.4224155170251,,,,,860,UZB,2022/03/19,0,43564564,0
Uzbekistan,3/20/22,237476,1637,,,38,,709.5359527426994,,,,,860,UZB,2022/03/20,0,43564564,0
Uzbekistan,3/21/22,237508,1637,,,32,,709.631563038004,,,,,860,UZB,2022/03/21,0,43564564,0
Uzbekistan,3/22/22,237520,1637,,,12,,709.6674168987432,,,,,860,UZB,2022/03/22,0,43564564,0
Uzbekistan,3/23/22,237527,1637,,,7,,709.6883316508411,,,,,860,UZB,2022/03/23,0,43564564,0
Uzbekistan,3/24/22,237533,1637,,,6,,709.7062585812107,,,,,860,UZB,2022/03/24,0,43564564,0
Uzbekistan,3/25/22,237542,1637,,,9,,709.7331489767652,,,,,860,UZB,2022/03/25,0,43564564,0
Uzbekistan,3/26/22,237589,1637,,,47,,709.8735765979939,,,,,860,UZB,2022/03/26,0,43564564,0
Uzbekistan,3/27/22,237641,1637,,,52,,710.0289433278639,,,,,860,UZB,2022/03/27,0,44177104,0
Uzbekistan,3/28/22,237679,1637,,,38,,710.1424805535382,,,,,860,UZB,2022/03/28,0,44177104,0
Uzbekistan,3/29/22,237687,1637,,,8,,710.1663831273644,,,,,860,UZB,2022/03/29,0,44177104,0
Uzbekistan,3/30/22,237710,1637,,,23,,710.2351030271145,,,,,860,UZB,2022/03/30,0,44177104,0
Uzbekistan,3/31/22,237749,1637,,,39,,710.3516280745171,,,,,860,UZB,2022/03/31,0,44177104,0
Uzbekistan,4/1/22,237787,1637,,,38,,710.4651653001914,,,,,860,UZB,2022/04/01,0,,
Vanuatu,3/5/22,18,1,,,0,,6.150061500615006,,,,,548,VUT,2022/03/05,0,199464,0
Vanuatu,3/7/22,42,1,,,24,,14.350143501435014,,,,,548,VUT,2022/03/07,0,199464,0
Vanuatu,3/8/22,52,1,,,10,,17.76684433511002,,,,,548,VUT,2022/03/08,0,199464,0
Vanuatu,3/9/22,95,1,,,43,,32.45865791991253,,,,,548,VUT,2022/03/09,0,199464,0
Vanuatu,3/10/22,102,1,,,7,,34.85034850348504,,,,,548,VUT,2022/03/10,0,199464,0
Vanuatu,3/11/22,164,1,,,62,,56.033893672270054,,,,,548,VUT,2022/03/11,0,199464,0
Vanuatu,3/12/22,207,1,,,43,,70.72570725707257,,,,,548,VUT,2022/03/12,0,199464,0
Vanuatu,3/14/22,259,1,,,52,,88.4925515921826,,,,,548,VUT,2022/03/14,0,199464,0
Vanuatu,3/15/22,341,1,,,82,,116.50949842831761,,,,,548,VUT,2022/03/15,0,199464,0
Vanuatu,3/16/22,386,1,,,45,,131.88465217985512,,,,,548,VUT,2022/03/16,0,199464,0
Vanuatu,3/17/22,473,1,,,87,,161.60994943282765,,,,,548,VUT,2022/03/17,0,199464,0
Vanuatu,3/18/22,480,1,,,7,,164.00164001640016,,,,,548,VUT,2022/03/18,0,199464,0
Vanuatu,3/20/22,753,1,,,273,,257.2775727757278,,,,,548,VUT,2022/03/20,0,199464,0
Vanuatu,3/21/22,1025,1,,,272,,350.2118354516879,,,,,548,VUT,2022/03/21,0,199464,0
Vanuatu,3/22/22,1117,1,,,92,,381.6454831214979,,,,,548,VUT,2022/03/22,0,199464,0
Vanuatu,3/23/22,1373,1,,,256,,469.113024463578,,,,,548,VUT,2022/03/23,0,199464,0
Vanuatu,3/24/22,1704,1,,,331,,582.2058220582206,,,,,548,VUT,2022/03/24,0,199464,0
Vanuatu,3/25/22,1963,1,,,259,,670.6983736504031,,,,,548,VUT,2022/03/25,0,199464,0
Vanuatu,3/26/22,2204,1,,,241,,753.0408637419707,,,,,548,VUT,2022/03/26,0,199464,0
Vanuatu,3/28/22,2633,1,,,429,,899.6173295066284,,,,,548,VUT,2022/03/28,0,199464,0
Vanuatu,3/29/22,2712,1,,,79,,926.609266092661,,,,,548,VUT,2022/03/29,0,199464,0
Vanuatu,3/30/22,3128,2,,,416,,1068.744020773541,,,,,548,VUT,2022/03/30,1,199464,0
Vanuatu,3/31/22,3379,2,,,251,,1154.5032116987836,,,,,548,VUT,2022/03/31,0,199464,0
Vanuatu,4/1/22,3710,2,,,331,,1267.5960092934263,,,,,548,VUT,2022/04/01,0,,
Venezuela,3/5/22,516578,5647,,,342,,1816.637485874831,,,,,862,VEN,2022/03/05,2,35352675,0
Venezuela,3/6/22,516817,5649,,,239,,1817.4779714532415,,,,,862,VEN,2022/03/06,2,35352675,0
Venezuela,3/8/22,516966,5650,,,149,,1818.0019561862252,,,,,862,VEN,2022/03/08,1,35352675,0
Venezuela,3/9/22,517164,5652,,,198,,1818.6982580461636,,,,,862,VEN,2022/03/09,2,35352675,0
Venezuela,3/10/22,517720,5655,,,556,,1820.6535299356874,,,,,862,VEN,2022/03/10,3,35352675,0
Venezuela,3/12/22,517999,5656,,,279,,1821.6346825565095,,,,,862,VEN,2022/03/12,1,35352675,0
Venezuela,3/13/22,518410,5658,,,411,,1823.0800364172906,,,,,862,VEN,2022/03/13,2,35352675,0
Venezuela,3/15/22,518460,5659,,,50,,1823.2558702203053,,,,,862,VEN,2022/03/15,1,35352675,0
Venezuela,3/16/22,519059,5663,,,599,,1825.3623591804217,,,,,862,VEN,2022/03/16,4,35352675,0
Venezuela,3/18/22,519245,5664,,,186,,1826.0164609276364,,,,,862,VEN,2022/03/18,1,35352675,0
Venezuela,3/19/22,519420,5666,,,175,,1826.631879238188,,,,,862,VEN,2022/03/19,2,35352675,0
Venezuela,3/20/22,519670,5668,,,250,,1827.5110482532618,,,,,862,VEN,2022/03/20,2,35352675,0
Venezuela,3/21/22,519724,5670,,,54,,1827.7009487605176,,,,,862,VEN,2022/03/21,2,35352675,0
Venezuela,3/22/22,519797,5671,,,73,,1827.9576661129192,,,,,862,VEN,2022/03/22,1,35352675,0
Venezuela,3/24/22,519872,5673,,,75,,1828.2214168174412,,,,,862,VEN,2022/03/24,2,35352675,0
Venezuela,3/25/22,520038,5676,,,166,,1828.8051850434501,,,,,862,VEN,2022/03/25,3,35352675,0
Venezuela,3/26/22,520077,5677,,,39,,1828.9423354098017,,,,,862,VEN,2022/03/26,1,35352675,0
Venezuela,3/27/22,520113,5679,,,36,,1829.0689357479723,,,,,862,VEN,2022/03/27,2,35352675,0
Venezuela,3/28/22,520169,5680,,,56,,1829.2658696073488,,,,,862,VEN,2022/03/28,1,35352675,0
Venezuela,3/30/22,520373,5682,,,204,,1829.9832715236487,,,,,862,VEN,2022/03/30,2,37860994,2508319
Venezuela,4/1/22,520497,5683,,,124,,1830.4193393551252,,,,,862,VEN,2022/04/01,1,,
Vietnam,3/5/22,4232520,40726,,,173258,,4348.2449297623325,,,,,704,VNM,2022/03/05,82,185731134,0
Vietnam,3/6/22,4434700,40813,,,202180,,4555.9529051291,,,,,704,VNM,2022/03/06,87,185731134,0
Vietnam,3/7/22,4582058,40891,,,147358,,4707.339945558895,,,,,704,VNM,2022/03/07,78,185731134,0
Vietnam,3/8/22,4776873,40977,,,194815,,4907.481548195539,,,,,704,VNM,2022/03/08,86,185731134,0
Vietnam,3/9/22,5042036,41086,,,265163,,5179.894595342527,,,,,704,VNM,2022/03/09,109,185731134,0
Vietnam,3/10/22,5260495,41157,,,218459,,5404.326668696215,,,,,704,VNM,2022/03/10,71,185731134,0
Vietnam,3/11/22,5448935,41228,,,188440,,5597.918967034891,,,,,704,VNM,2022/03/11,71,185731134,0
Vietnam,3/12/22,5903147,41290,,,454212,,6064.549963707608,,,,,704,VNM,2022/03/12,62,185731134,0
Vietnam,3/13/22,6112648,41385,,,209501,,6279.7791087630685,,,,,704,VNM,2022/03/13,95,185731134,0
Vietnam,3/14/22,6377438,41477,,,264790,,6551.80895739976,,,,,704,VNM,2022/03/14,92,185731134,0
Vietnam,3/15/22,6552918,41545,,,175480,,6732.086905353862,,,,,704,VNM,2022/03/15,68,185731134,0
Vietnam,3/16/22,6820458,41607,,,267540,,7006.941944079872,,,,,704,VNM,2022/03/16,62,185731134,0
Vietnam,3/17/22,7174423,41683,,,353965,,7370.585002249313,,,,,704,VNM,2022/03/17,76,185731134,0
Vietnam,3/18/22,7367112,41740,,,192689,,7568.542476111451,,,,,704,VNM,2022/03/18,57,185731134,0
Vietnam,3/19/22,7791841,41817,,,424729,,8004.884353001112,,,,,704,VNM,2022/03/19,77,185731134,0
Vietnam,3/20/22,7958048,41880,,,166207,,8175.635759974028,,,,,704,VNM,2022/03/20,63,185731134,0
Vietnam,3/21/22,8089761,41949,,,131713,,8310.950037150222,,,,,704,VNM,2022/03/21,69,185731134,0
Vietnam,3/22/22,8338914,42014,,,249153,,8566.915341268117,,,,,704,VNM,2022/03/22,65,185731134,0
Vietnam,3/23/22,8479751,42075,,,140837,,8711.603085489749,,,,,704,VNM,2022/03/23,61,185731134,0
Vietnam,3/24/22,8599751,42145,,,120000,,8834.884107569143,,,,,704,VNM,2022/03/24,70,185731134,0
Vietnam,3/25/22,8761252,42196,,,161501,,9000.800843792846,,,,,704,VNM,2022/03/25,51,185731134,0
Vietnam,3/26/22,8919557,42258,,,158305,,9163.434195461834,,,,,704,VNM,2022/03/26,62,185731134,0
Vietnam,3/27/22,9011473,42306,,,91916,,9257.863349007248,,,,,704,VNM,2022/03/27,48,185731134,0
Vietnam,3/28/22,9274849,42358,,,263376,,9528.440536267104,,,,,704,VNM,2022/03/28,52,185731134,0
Vietnam,3/29/22,9386489,42413,,,111640,,9643.132980474968,,,,,704,VNM,2022/03/29,55,185731134,0
Vietnam,3/30/22,9472254,42454,,,85765,,9731.242954296962,,,,,704,VNM,2022/03/30,41,185731134,0
Vietnam,3/31/22,9564609,42493,,,92355,,9826.123110914816,,,,,704,VNM,2022/03/31,39,185731134,0
Vietnam,4/1/22,9650663,42526,,,86054,,9914.529986531652,,,,,704,VNM,2022/04/01,33,,
West Bank and Gaza,3/5/22,649971,5557,,,0,,12740.991912833613,,,,,275,PSE,2022/03/05,0,3425379,0
West Bank and Gaza,3/7/22,651700,5581,,,1729,,12774.884463450931,,,,,275,PSE,2022/03/07,24,3609984,0
West Bank and Gaza,3/8/22,652298,5583,,,598,,12786.606699002787,,,,,275,PSE,2022/03/08,2,3609984,0
West Bank and Gaza,3/9/22,652763,5588,,,465,,12795.721815276385,,,,,275,PSE,2022/03/09,5,3609984,0
West Bank and Gaza,3/10/22,652966,5594,,,203,,12799.701102595829,,,,,275,PSE,2022/03/10,6,3609984,0
West Bank and Gaza,3/11/22,653293,5603,,,327,,12806.11108758823,,,,,275,PSE,2022/03/11,9,3609984,0
West Bank and Gaza,3/14/22,653854,5616,,,561,,12817.108034318315,,,,,275,PSE,2022/03/14,13,3609984,0
West Bank and Gaza,3/15/22,654068,5622,,,214,,12821.30294804423,,,,,275,PSE,2022/03/15,6,3609984,0
West Bank and Gaza,3/17/22,654380,5628,,,312,,12827.418897027806,,,,,275,PSE,2022/03/17,6,3609984,0
West Bank and Gaza,3/21/22,654954,5641,,,574,,12838.670674965539,,,,,275,PSE,2022/03/21,13,3677892,0
West Bank and Gaza,3/24/22,655468,5649,,,514,,12848.746308867969,,,,,275,PSE,2022/03/24,8,3677892,0
West Bank and Gaza,3/28/22,655750,5655,,,282,,12854.274185833894,,,,,275,PSE,2022/03/28,6,3694897,0
West Bank and Gaza,4/1/22,655750,5655,,,0,,12854.274185833894,,,,,275,PSE,2022/04/01,0,,
Winter Olympics 2022,3/5/22,530,0,,,0,,,,,,,2022,,2022/03/05,0,,
Winter Olympics 2022,3/6/22,532,0,,,2,,,,,,,2022,,2022/03/06,0,,
Winter Olympics 2022,3/8/22,533,0,,,1,,,,,,,2022,,2022/03/08,0,,
Winter Olympics 2022,3/10/22,535,0,,,2,,,,,,,2022,,2022/03/10,0,,
Winter Olympics 2022,4/1/22,535,0,,,0,,,,,,,2022,,2022/04/01,0,,
Yemen,3/5/22,11775,2135,,,1,,39.47902042944591,,,,,887,YEM,2022/03/05,0,772574,0
Yemen,3/6/22,11777,2138,,,2,,39.48572599554858,,,,,887,YEM,2022/03/06,3,784792,0
Yemen,3/7/22,11781,2138,,,4,,39.49913712775391,,,,,887,YEM,2022/03/07,0,784792,0
Yemen,3/10/22,11783,2139,,,2,,39.50584269385657,,,,,887,YEM,2022/03/10,1,784792,0
Yemen,3/12/22,11784,2139,,,1,,39.509195476907905,,,,,887,YEM,2022/03/12,0,784792,0
Yemen,3/14/22,11793,2139,,,9,,39.53937052436991,,,,,887,YEM,2022/03/14,0,784792,0
Yemen,3/16/22,11797,2140,,,4,,39.552781656575235,,,,,887,YEM,2022/03/16,1,784792,0
Yemen,3/19/22,11799,2140,,,2,,39.5594872226779,,,,,887,YEM,2022/03/19,0,807502,0
Yemen,3/20/22,11801,2140,,,2,,39.56619278878057,,,,,887,YEM,2022/03/20,0,807502,0
Yemen,3/21/22,11801,2142,,,0,,39.56619278878057,,,,,887,YEM,2022/03/21,2,807502,0
Yemen,3/22/22,11802,2142,,,1,,39.5695455718319,,,,,887,YEM,2022/03/22,0,807502,0
Yemen,3/24/22,11803,2142,,,1,,39.572898354883236,,,,,887,YEM,2022/03/24,0,807502,0
Yemen,3/29/22,11803,2143,,,0,,39.572898354883236,,,,,887,YEM,2022/03/29,1,807502,0
Yemen,3/30/22,11805,2143,,,2,,39.5796039209859,,,,,887,YEM,2022/03/30,0,807502,0
Yemen,3/31/22,11806,2143,,,1,,39.58295670403724,,,,,887,YEM,2022/03/31,0,807502,0
Yemen,4/1/22,11806,2143,,,0,,39.58295670403724,,,,,887,YEM,2022/04/01,0,,
Zambia,3/5/22,313744,3958,,,131,,1706.618531941656,,,,,894,ZMB,2022/03/05,0,2635418,0
Zambia,3/6/22,313821,3959,,,77,,1707.0373754158245,,,,,894,ZMB,2022/03/06,1,2635418,0
Zambia,3/7/22,313910,3959,,,89,,1707.5214931976557,,,,,894,ZMB,2022/03/07,0,2635418,0
Zambia,3/8/22,314159,3959,,,249,,1708.875935081655,,,,,894,ZMB,2022/03/08,0,2635418,0
Zambia,3/9/22,314641,3960,,,482,,1711.4977864394366,,,,,894,ZMB,2022/03/09,1,2635418,0
Zambia,3/10/22,314850,3960,,,209,,1712.634647297894,,,,,894,ZMB,2022/03/10,0,2635418,0
Zambia,3/11/22,314986,3960,,,136,,1713.374422784737,,,,,894,ZMB,2022/03/11,0,2635418,0
Zambia,3/12/22,315148,3960,,,162,,1714.2556259381822,,,,,894,ZMB,2022/03/12,0,2635418,0
Zambia,3/13/22,315202,3960,,,54,,1714.549360322664,,,,,894,ZMB,2022/03/13,0,2635418,0
Zambia,3/16/22,315496,3961,,,294,,1716.148580860398,,,,,894,ZMB,2022/03/16,1,2635418,0
Zambia,3/17/22,315623,3962,,,127,,1716.839400616494,,,,,894,ZMB,2022/03/17,1,2635418,0
Zambia,3/21/22,315892,3963,,,269,,1718.3026330132643,,,,,894,ZMB,2022/03/21,1,2635418,0
Zambia,3/22/22,316088,3963,,,196,,1719.3687800384205,,,,,894,ZMB,2022/03/22,0,2635418,0
Zambia,3/23/22,316190,3964,,,102,,1719.9236116535526,,,,,894,ZMB,2022/03/23,1,2635418,0
Zambia,3/24/22,316312,3965,,,122,,1720.587233781456,,,,,894,ZMB,2022/03/24,1,2635418,0
Zambia,3/25/22,316422,3966,,,110,,1721.1855816016966,,,,,894,ZMB,2022/03/25,1,2635418,0
Zambia,3/26/22,316501,3966,,,79,,1721.615304127142,,,,,894,ZMB,2022/03/26,0,2635418,0
Zambia,3/27/22,316550,3966,,,49,,1721.881840883431,,,,,894,ZMB,2022/03/27,0,2635418,0
Zambia,3/31/22,316850,3966,,,300,,1723.5136985749966,,,,,894,ZMB,2022/03/31,0,2635418,0
Zambia,4/1/22,316941,3966,,,91,,1724.0086954081048,,,,,894,ZMB,2022/04/01,0,,
Zimbabwe,3/5/22,239019,5397,,,280,,1608.1556479420237,,,,,716,ZWE,2022/03/05,0,7684182,0
Zimbabwe,3/6/22,239209,5399,,,190,,1609.433996412685,,,,,716,ZWE,2022/03/06,2,7684182,0
Zimbabwe,3/7/22,239710,5399,,,501,,1612.8047994853234,,,,,716,ZWE,2022/03/07,0,7684182,0
Zimbabwe,3/8/22,240343,5400,,,633,,1617.063718337579,,,,,716,ZWE,2022/03/08,1,7684182,0
Zimbabwe,3/10/22,241548,5408,,,1205,,1625.1711389015097,,,,,716,ZWE,2022/03/10,8,7684182,0
Zimbabwe,3/12/22,242069,5412,,,521,,1628.6765049710598,,,,,716,ZWE,2022/03/12,4,7684182,0
Zimbabwe,3/13/22,242515,5414,,,446,,1631.677259802191,,,,,716,ZWE,2022/03/13,2,7684182,0
Zimbabwe,3/14/22,242909,5416,,,394,,1634.3281508413518,,,,,716,ZWE,2022/03/14,2,7684182,0
Zimbabwe,3/16/22,243650,5418,,,741,,1639.3137098769307,,,,,716,ZWE,2022/03/16,2,7684182,0
Zimbabwe,3/18/22,244012,5420,,,362,,1641.7493001210328,,,,,716,ZWE,2022/03/18,2,7684182,0
Zimbabwe,3/19/22,244452,5426,,,440,,1644.7096860530903,,,,,716,ZWE,2022/03/19,6,7684182,0
Zimbabwe,3/21/22,244685,5429,,,233,,1646.2773449671117,,,,,716,ZWE,2022/03/21,3,7684182,0
Zimbabwe,3/23/22,244958,5432,,,273,,1648.1141298749567,,,,,716,ZWE,2022/03/23,3,7684182,0
Zimbabwe,3/24/22,245194,5432,,,236,,1649.701973238515,,,,,716,ZWE,2022/03/24,0,7684182,0
Zimbabwe,3/25/22,245645,5436,,,451,,1652.7363688188739,,,,,716,ZWE,2022/03/25,4,7684182,0
Zimbabwe,3/27/22,245820,5438,,,175,,1653.9137950418515,,,,,716,ZWE,2022/03/27,2,7684182,0
Zimbabwe,3/28/22,245927,5438,,,107,,1654.633707075329,,,,,716,ZWE,2022/03/28,0,7684182,0
Zimbabwe,3/29/22,246042,5439,,,115,,1655.4074443075715,,,,,716,ZWE,2022/03/29,1,7684182,0
Zimbabwe,3/30/22,246182,5440,,,140,,1656.3493852859535,,,,,716,ZWE,2022/03/30,1,7684182,0
Zimbabwe,3/31/22,246286,5444,,,104,,1657.0491128698943,,,,,716,ZWE,2022/03/31,4,7684182,0
Zimbabwe,4/1/22,246414,5444,,,128,,1657.9103160501293,,,,,716,ZWE,2022/04/01,0,,
US,3/5/22,1282945,18480,,,0,,5429535.739980533,,,Alabama,1,84000001,USA,2022/03/05,0,6114782,2941
US,3/7/22,1286655,18569,,,3710,,5445236.785306192,,,Alabama,1,84000001,USA,2022/03/07,89,6116791,1938
US,3/8/22,1287286,18648,,,631,,5447907.23263786,,,Alabama,1,84000001,USA,2022/03/08,79,6117662,871
US,3/9/22,1287822,18694,,,536,,5450175.631639088,,,Alabama,1,84000001,USA,2022/03/09,46,6119910,2248
US,3/10/22,1288454,18766,,,632,,5452850.311058445,,,Alabama,1,84000001,USA,2022/03/10,72,6124293,4383
US,3/11/22,1288999,18832,,,545,,5455156.798848872,,,Alabama,1,84000001,USA,2022/03/11,66,6126993,2700
US,3/14/22,1289510,18890,,,511,,5457319.395657878,,,Alabama,1,84000001,USA,2022/03/14,58,6132079,1462
US,3/15/22,1289727,18943,,,217,,5458237.75868636,,,Alabama,1,84000001,USA,2022/03/15,53,6133930,1851
US,3/16/22,1290165,18944,,,438,,5460091.413094079,,,Alabama,1,84000001,USA,2022/03/16,1,6136613,2683
US,3/17/22,1290692,18998,,,527,,5462321.723306107,,,Alabama,1,84000001,USA,2022/03/17,54,6138900,2287
US,3/18/22,1291186,19038,,,494,,5464412.374624402,,,Alabama,1,84000001,USA,2022/03/18,40,6141345,2445
US,3/21/22,1291561,19093,,,375,,5465999.407507723,,,Alabama,1,84000001,USA,2022/03/21,55,6145891,799
US,3/22/22,1291761,19139,,,200,,5466845.825045495,,,Alabama,1,84000001,USA,2022/03/22,46,6145984,93
US,3/23/22,1291946,19169,,,185,,5467628.761267933,,,Alabama,1,84000001,USA,2022/03/23,30,6145984,0
US,3/24/22,1292344,19173,,,398,,5469313.132168098,,,Alabama,1,84000001,USA,2022/03/24,4,6149794,3810
US,3/25/22,1292508,19210,,,164,,5470007.194549071,,,Alabama,1,84000001,USA,2022/03/25,37,6152000,2206
US,3/28/22,1294532,19234,,,2024,,5478572.940031317,,,Alabama,1,84000001,USA,2022/03/28,24,6154130,2
US,3/29/22,1294816,19280,,,284,,5479774.852934953,,,Alabama,1,84000001,USA,2022/03/29,46,6157587,3457
US,3/30/22,1295069,19284,,,253,,5480845.571120233,,,Alabama,1,84000001,USA,2022/03/30,4,6159241,1654
US,3/31/22,1295327,19290,,,258,,5481937.449743959,,,Alabama,1,84000001,USA,2022/03/31,6,6159241,0
US,4/1/22,1295353,19294,,,26,,5482047.484023869,,,Alabama,1,84000001,USA,2022/04/01,4,,
US,3/5/22,240789,1191,,,0,,4603996.175908222,,,Alaska,2,84000002,USA,2022/03/05,0,1098366,152
US,3/7/22,241256,1191,,,467,,4612925.430210325,,,Alaska,2,84000002,USA,2022/03/07,0,1099705,1287
US,3/9/22,242742,1201,,,1486,,4641338.432122371,,,Alaska,2,84000002,USA,2022/03/09,10,1105378,533
US,3/11/22,243397,1201,,,655,,4653862.332695984,,,Alaska,2,84000002,USA,2022/03/11,0,1106583,484
US,3/14/22,243910,1201,,,513,,4663671.128107075,,,Alaska,2,84000002,USA,2022/03/14,0,1107149,0
US,3/16/22,244386,1202,,,476,,4672772.466539197,,,Alaska,2,84000002,USA,2022/03/16,1,1108025,40
US,3/18/22,244887,1202,,,501,,4682351.816443595,,,Alaska,2,84000002,USA,2022/03/18,0,1108238,156
US,3/21/22,245251,1202,,,364,,4689311.663479923,,,Alaska,2,84000002,USA,2022/03/21,0,1110575,765
US,3/23/22,245832,1222,,,581,,4700420.6500956025,,,Alaska,2,84000002,USA,2022/03/23,20,1110690,0
US,3/28/22,246385,1222,,,553,,4710994.263862332,,,Alaska,2,84000002,USA,2022/03/28,0,1114710,1324
US,3/30/22,247211,1228,,,826,,4726787.76290631,,,Alaska,2,84000002,USA,2022/03/30,6,1114829,46
US,4/1/22,247739,1228,,,528,,4736883.3652007645,,,Alaska,2,84000002,USA,2022/04/01,0,,
US,3/5/22,196,0,,,0,,352.25822684710914,,,American Samoa,60,16,ASM,2022/03/05,0,90428,1518
US,3/7/22,290,0,,,94,,521.1983968656207,,,American Samoa,60,16,ASM,2022/03/07,0,92238,1810
US,3/8/22,304,0,,,14,,546.3596987832714,,,American Samoa,60,16,ASM,2022/03/08,0,92238,0
US,3/9/22,352,0,,,48,,632.6270196437879,,,American Samoa,60,16,ASM,2022/03/09,0,92238,0
US,3/10/22,404,0,,,52,,726.0832839093474,,,American Samoa,60,16,ASM,2022/03/10,0,93864,1626
US,3/11/22,443,0,,,39,,796.1754821085171,,,American Samoa,60,16,ASM,2022/03/11,0,93864,0
US,3/14/22,555,0,,,112,,997.4658974497223,,,American Samoa,60,16,ASM,2022/03/14,0,98196,2053
US,3/15/22,588,0,,,33,,1056.7746805413274,,,American Samoa,60,16,ASM,2022/03/15,0,98196,0
US,3/16/22,779,0,,,191,,1400.0467281321328,,,American Samoa,60,16,ASM,2022/03/16,0,98196,0
US,3/18/22,1066,0,,,287,,1915.8534174439712,,,American Samoa,60,16,ASM,2022/03/18,0,99984,460
US,3/21/22,1397,0,,,331,,2510.738484211283,,,American Samoa,60,16,ASM,2022/03/21,0,100375,0
US,3/22/22,1556,0,,,159,,2796.4989845617442,,,American Samoa,60,16,ASM,2022/03/22,0,100375,0
US,3/23/22,1626,0,,,70,,2922.3054941499972,,,American Samoa,60,16,ASM,2022/03/23,0,100375,0
US,3/24/22,1993,0,,,367,,3581.8910515626967,,,American Samoa,60,16,ASM,2022/03/24,0,102185,1810
US,3/25/22,2262,1,,,269,,4065.3474955518413,,,American Samoa,60,16,ASM,2022/03/25,1,102185,0
US,3/28/22,3278,2,,,1016,,5891.3391204327745,,,American Samoa,60,16,ASM,2022/03/28,1,102883,0
US,3/29/22,3442,2,,,164,,6186.085800039539,,,American Samoa,60,16,ASM,2022/03/29,0,103710,827
US,3/31/22,3483,3,,,41,,6259.77246994123,,,American Samoa,60,16,ASM,2022/03/31,1,103883,0
US,4/1/22,3817,4,,,334,,6860.0492442623245,,,American Samoa,60,16,ASM,2022/04/01,1,,
US,3/5/22,1980769,27708,,,0,,926515.1763203562,,,Arizona,4,84000004,USA,2022/03/05,0,11586764,8291
US,3/9/22,1980769,28090,,,0,,926515.1763203562,,,Arizona,4,84000004,USA,2022/03/09,382,11609402,5683
US,3/10/22,1987318,28090,,,6549,,929578.5057089532,,,Arizona,4,84000004,USA,2022/03/10,0,11617378,7976
US,3/16/22,1987318,28547,,,0,,929578.5057089532,,,Arizona,4,84000004,USA,2022/03/16,457,11656237,6260
US,3/17/22,1992471,28547,,,5153,,931988.8487139068,,,Arizona,4,84000004,USA,2022/03/17,0,11662231,5994
US,3/23/22,1992471,28883,,,0,,931988.8487139068,,,Arizona,4,84000004,USA,2022/03/23,336,11688234,0
US,3/24/22,1997037,28883,,,4566,,934124.6193641335,,,Arizona,4,84000004,USA,2022/03/24,0,11729275,41041
US,3/30/22,1997037,29268,,,0,,934124.6193641335,,,Arizona,4,84000004,USA,2022/03/30,385,11756616,4501
US,3/31/22,2007180,29268,,,10143,,938869.0612619102,,,Arizona,4,84000004,USA,2022/03/31,0,11756616,0
US,4/1/22,2007180,29268,,,0,,938869.0612619102,,,Arizona,4,84000004,USA,2022/04/01,0,,
US,3/5/22,822900,10699,,,698,,3855958.0150883277,,,Arkansas,5,84000005,USA,2022/03/05,18,4094133,23
US,3/6/22,823210,10713,,,310,,3857410.618059135,,,Arkansas,5,84000005,USA,2022/03/06,14,4094174,41
US,3/7/22,823532,10724,,,322,,3858919.450822361,,,Arkansas,5,84000005,USA,2022/03/07,11,4102177,8003
US,3/8/22,823926,10760,,,394,,3860765.6623400967,,,Arkansas,5,84000005,USA,2022/03/08,36,4102632,455
US,3/9/22,824469,10799,,,543,,3863310.060447027,,,Arkansas,5,84000005,USA,2022/03/09,39,4104490,1858
US,3/10/22,824988,10836,,,519,,3865741.9989691204,,,Arkansas,5,84000005,USA,2022/03/10,37,4104598,108
US,3/11/22,825653,10864,,,665,,3868858.066632304,,,Arkansas,5,84000005,USA,2022/03/11,28,4108828,4230
US,3/12/22,826201,10892,,,548,,3871425.8938194085,,,Arkansas,5,84000005,USA,2022/03/12,28,4110613,1785
US,3/13/22,826570,10922,,,369,,3873154.959936273,,,Arkansas,5,84000005,USA,2022/03/13,30,4112376,1763
US,3/14/22,826913,10950,,,343,,3874762.194836231,,,Arkansas,5,84000005,USA,2022/03/14,28,4112376,0
US,3/15/22,827336,10971,,,423,,3876744.2950189775,,,Arkansas,5,84000005,USA,2022/03/15,21,4113617,1241
US,3/16/22,827709,10999,,,373,,3878492.1043999814,,,Arkansas,5,84000005,USA,2022/03/16,28,4115448,1831
US,3/17/22,828166,11030,,,457,,3880633.5223279134,,,Arkansas,5,84000005,USA,2022/03/17,31,4115482,34
US,3/18/22,828889,11053,,,723,,3884021.367321119,,,Arkansas,5,84000005,USA,2022/03/18,23,4119347,3865
US,3/19/22,830020,11078,,,1131,,3889321.0252565485,,,Arkansas,5,84000005,USA,2022/03/19,25,4120997,1650
US,3/20/22,830310,11100,,,290,,3890679.9119066587,,,Arkansas,5,84000005,USA,2022/03/20,22,4123431,2434
US,3/21/22,831091,11114,,,781,,3894339.5342298863,,,Arkansas,5,84000005,USA,2022/03/21,14,4123431,0
US,3/22/22,831698,11127,,,607,,3897183.824563048,,,Arkansas,5,84000005,USA,2022/03/22,13,4124519,1088
US,3/23/22,831947,11152,,,249,,3898350.5927557284,,,Arkansas,5,84000005,USA,2022/03/23,25,4124519,0
US,3/24/22,832205,11165,,,258,,3899559.533292723,,,Arkansas,5,84000005,USA,2022/03/24,13,4128209,3690
US,3/25/22,832394,11203,,,189,,3900445.152523312,,,Arkansas,5,84000005,USA,2022/03/25,38,4128225,16
US,3/26/22,832515,11209,,,121,,3901012.1362635302,,,Arkansas,5,84000005,USA,2022/03/26,6,4131045,2820
US,3/27/22,832553,11210,,,38,,3901190.197272855,,,Arkansas,5,84000005,USA,2022/03/27,1,4131074,29
US,3/28/22,832574,11211,,,21,,3901288.599409587,,,Arkansas,5,84000005,USA,2022/03/28,1,4131075,1
US,3/29/22,832718,11211,,,144,,3901963.3569186074,,,Arkansas,5,84000005,USA,2022/03/29,0,4133784,2709
US,3/30/22,832815,11218,,,97,,3902417.881073989,,,Arkansas,5,84000005,USA,2022/03/30,7,4134916,1132
US,3/31/22,832922,11230,,,107,,3902919.263389719,,,Arkansas,5,84000005,USA,2022/03/31,12,4134916,0
US,4/1/22,833029,11237,,,107,,3903420.6457054494,,,Arkansas,5,84000005,USA,2022/04/01,7,,
US,3/5/22,9006221,86281,,,1442,,11448391.97640718,,,California,6,84000006,USA,2022/03/05,48,71869966,61467
US,3/6/22,9012693,86281,,,6472,,11456618.955610922,,,California,6,84000006,USA,2022/03/06,0,71912386,42420
US,3/7/22,9019402,86626,,,6709,,11465147.2008949,,,California,6,84000006,USA,2022/03/07,345,71926958,14572
US,3/8/22,9022842,86694,,,3440,,11469520.008135455,,,California,6,84000006,USA,2022/03/08,68,71969579,42621
US,3/9/22,9027450,86903,,,4608,,11475377.535973966,,,California,6,84000006,USA,2022/03/09,209,72019819,50240
US,3/10/22,9032841,87072,,,5391,,11482230.385925662,,,California,6,84000006,USA,2022/03/10,169,72069472,49653
US,3/11/22,9035571,87214,,,2730,,11485700.666090405,,,California,6,84000006,USA,2022/03/11,142,72110744,41272
US,3/12/22,9037196,87264,,,1625,,11487766.30904561,,,California,6,84000006,USA,2022/03/12,50,72159482,48738
US,3/13/22,9042350,87264,,,5154,,11494317.892917069,,,California,6,84000006,USA,2022/03/13,0,72196431,36949
US,3/14/22,9047199,87561,,,4849,,11500481.771495398,,,California,6,84000006,USA,2022/03/14,297,72218906,22475
US,3/15/22,9049049,87602,,,1850,,11502833.426552093,,,California,6,84000006,USA,2022/03/15,41,72261187,42281
US,3/16/22,9052776,87745,,,3727,,11507571.05811766,,,California,6,84000006,USA,2022/03/16,143,72292634,31447
US,3/17/22,9058921,87888,,,6145,,11515382.36640057,,,California,6,84000006,USA,2022/03/17,143,72336977,44343
US,3/18/22,9063122,88004,,,4201,,11520722.530126609,,,California,6,84000006,USA,2022/03/18,116,72366458,29481
US,3/19/22,9066385,88024,,,3263,,11524870.341180658,,,California,6,84000006,USA,2022/03/19,20,72407690,41232
US,3/20/22,9071038,88024,,,4653,,11530785.071439467,,,California,6,84000006,USA,2022/03/20,0,72434157,26467
US,3/21/22,9076550,88209,,,5512,,11537791.73234352,,,California,6,84000006,USA,2022/03/21,185,72451777,17620
US,3/22/22,9079570,88251,,,3020,,11541630.65032796,,,California,6,84000006,USA,2022/03/22,42,72488563,36786
US,3/23/22,9083279,88351,,,3709,,11546345.400925407,,,California,6,84000006,USA,2022/03/23,100,72488563,0
US,3/24/22,9086838,88476,,,3559,,11550869.476788528,,,California,6,84000006,USA,2022/03/24,125,72557645,69082
US,3/25/22,9088795,88579,,,1957,,11553357.146489043,,,California,6,84000006,USA,2022/03/25,103,72589987,32342
US,3/26/22,9089816,88597,,,1021,,11554655.00584736,,,California,6,84000006,USA,2022/03/26,18,72622423,32436
US,3/27/22,9093176,88597,,,3360,,11558926.119896272,,,California,6,84000006,USA,2022/03/27,0,72629995,7572
US,3/28/22,9095938,88742,,,2762,,11562437.077337673,,,California,6,84000006,USA,2022/03/28,145,72634494,4499
US,3/29/22,9097678,88758,,,1740,,11564648.90425586,,,California,6,84000006,USA,2022/03/29,16,72627423,
US,3/30/22,9099480,88879,,,1802,,11566939.54339757,,,California,6,84000006,USA,2022/03/30,121,72627423,0
US,3/31/22,9101621,88950,,,2141,,11569661.107438857,,,California,6,84000006,USA,2022/03/31,71,72627423,0
US,4/1/22,9109754,89012,,,8133,,11579999.491534041,,,California,6,84000006,USA,2022/04/01,62,,
US,3/5/22,1317447,11810,,,0,,13149485.976644376,,,Colorado,8,84000008,USA,2022/03/05,0,10347565,6328
US,3/7/22,1320644,11826,,,3197,,13181395.34883721,,,Colorado,8,84000008,USA,2022/03/07,16,10347694,3
US,3/8/22,1321502,11829,,,858,,13189959.07775227,,,Colorado,8,84000008,USA,2022/03/08,3,10357771,10077
US,3/9/22,1322637,11835,,,1135,,13201287.55364807,,,Colorado,8,84000008,USA,2022/03/09,6,10363575,5804
US,3/10/22,1323874,11840,,,1237,,13213634.095219083,,,Colorado,8,84000008,USA,2022/03/10,5,10368780,5205
US,3/11/22,1325063,11839,,,1189,,13225501.547060585,,,Colorado,8,84000008,USA,2022/03/11,,10373401,4621
US,3/14/22,1326391,11860,,,1328,,13238756.36291047,,,Colorado,8,84000008,USA,2022/03/14,21,10378946,57
US,3/15/22,1327685,11870,,,1294,,13251671.823535282,,,Colorado,8,84000008,USA,2022/03/15,10,10387568,8622
US,3/16/22,1329345,11873,,,1660,,13268240.343347639,,,Colorado,8,84000008,USA,2022/03/16,3,10392018,4450
US,3/17/22,1330851,11887,,,1506,,13283271.78361114,,,Colorado,8,84000008,USA,2022/03/17,14,10396327,4309
US,3/21/22,1332055,12139,,,1204,,13295288.950993113,,,Colorado,8,84000008,USA,2022/03/21,252,10404875,50
US,3/22/22,1335776,11933,,,3721,,13332428.386066474,,,Colorado,8,84000008,USA,2022/03/22,,10412056,7181
US,3/23/22,1337108,11942,,,1332,,13345723.126060486,,,Colorado,8,84000008,USA,2022/03/23,9,10412056,0
US,3/24/22,1338331,11946,,,1223,,13357929.933127059,,,Colorado,8,84000008,USA,2022/03/24,4,10422016,9960
US,3/25/22,1340626,11951,,,2295,,13380836.410819443,,,Colorado,8,84000008,USA,2022/03/25,5,10425638,3622
US,3/28/22,1342303,11966,,,1677,,13397574.608244335,,,Colorado,8,84000008,USA,2022/03/28,15,10429835,56
US,3/29/22,1343645,11966,,,1342,,13410969.158598663,,,Colorado,8,84000008,USA,2022/03/29,0,10435998,6163
US,3/30/22,1345099,11968,,,1454,,13425481.584988521,,,Colorado,8,84000008,USA,2022/03/30,2,10438916,2918
US,3/31/22,1346626,11974,,,1527,,13440722.627008684,,,Colorado,8,84000008,USA,2022/03/31,6,10438916,0
US,4/1/22,1348081,11977,,,1455,,13455245.034434574,,,Colorado,8,84000008,USA,2022/04/01,3,,
US,3/5/22,724833,10543,,,0,,620671.8501138875,,,Connecticut,9,84000009,USA,2022/03/05,0,7311818,4778
US,3/7/22,727542,10542,,,2709,,622991.5569180181,,,Connecticut,9,84000009,USA,2022/03/07,,7320095,3782
US,3/8/22,728733,10591,,,1191,,624011.4058673426,,,Connecticut,9,84000009,USA,2022/03/08,49,7322039,1944
US,3/9/22,729063,10609,,,330,,624293.9836618657,,,Connecticut,9,84000009,USA,2022/03/09,18,7324849,2810
US,3/10/22,729354,10615,,,291,,624543.1658988543,,,Connecticut,9,84000009,USA,2022/03/10,6,7328468,3619
US,3/11/22,729697,10648,,,343,,624836.8755458889,,,Connecticut,9,84000009,USA,2022/03/11,33,7331717,3249
US,3/14/22,730506,10655,,,809,,625529.6192906441,,,Connecticut,9,84000009,USA,2022/03/14,7,7345482,2579
US,3/15/22,730811,10675,,,305,,625790.7896764913,,,Connecticut,9,84000009,USA,2022/03/15,20,7346862,1380
US,3/16/22,731128,10677,,,317,,626062.2356185028,,,Connecticut,9,84000009,USA,2022/03/16,2,7349027,2165
US,3/17/22,731532,10677,,,404,,626408.1793427069,,,Connecticut,9,84000009,USA,2022/03/17,0,7351934,2907
US,3/18/22,731868,10717,,,336,,626695.8949153123,,,Connecticut,9,84000009,USA,2022/03/18,40,7354764,2830
US,3/21/22,732471,10723,,,603,,627212.2416125772,,,Connecticut,9,84000009,USA,2022/03/21,6,7363698,2865
US,3/22/22,732932,10742,,,461,,627606.9942285626,,,Connecticut,9,84000009,USA,2022/03/22,19,7365208,1510
US,3/23/22,733328,10740,,,396,,627946.0875819904,,,Connecticut,9,84000009,USA,2022/03/23,,7365208,0
US,3/24/22,733767,10744,,,439,,628322.0016783408,,,Connecticut,9,84000009,USA,2022/03/24,4,7370693,5485
US,3/25/22,734196,10759,,,429,,628689.3528112209,,,Connecticut,9,84000009,USA,2022/03/25,15,7374651,3958
US,3/28/22,735210,10759,,,1014,,629557.6373071192,,,Connecticut,9,84000009,USA,2022/03/28,0,7383729,6144
US,3/29/22,735575,10779,,,365,,629870.1854737888,,,Connecticut,9,84000009,USA,2022/03/29,20,7385158,1429
US,3/30/22,736033,10779,,,458,,630262.369200733,,,Connecticut,9,84000009,USA,2022/03/30,0,7387685,2527
US,4/1/22,737276,10779,,,1243,,631326.7455601034,,,Connecticut,9,84000009,USA,2022/04/01,0,,
US,3/5/22,257181,2751,,,116,,109800.832532821,,,Delaware,10,84000010,USA,2022/03/05,38,1737698,11
US,3/6/22,257270,2751,,,89,,109838.83018465151,,,Delaware,10,84000010,USA,2022/03/06,0,1737708,10
US,3/7/22,257325,2751,,,55,,109862.31187960294,,,Delaware,10,84000010,USA,2022/03/07,0,1737712,4
US,3/8/22,257367,2752,,,42,,109880.24335574768,,,Delaware,10,84000010,USA,2022/03/08,1,1740978,3266
US,3/9/22,257438,2752,,,71,,109910.55608923043,,,Delaware,10,84000010,USA,2022/03/09,0,1741678,700
US,3/10/22,257848,2753,,,410,,110085.60145159569,,,Delaware,10,84000010,USA,2022/03/10,1,1742565,887
US,3/11/22,258024,2753,,,176,,110160.74287544028,,,Delaware,10,84000010,USA,2022/03/11,0,1743325,760
US,3/13/22,258185,2807,,,161,,110229.48020066175,,,Delaware,10,84000010,USA,2022/03/13,54,1744145,15
US,3/14/22,258226,2807,,,41,,110246.98473689829,,,Delaware,10,84000010,USA,2022/03/14,0,1745360,1215
US,3/15/22,258287,2811,,,61,,110273.02807129896,,,Delaware,10,84000010,USA,2022/03/15,4,1745360,0
US,3/16/22,258347,2812,,,60,,110298.64446579144,,,Delaware,10,84000010,USA,2022/03/16,1,1746240,880
US,3/17/22,258428,2812,,,81,,110333.22659835628,,,Delaware,10,84000010,USA,2022/03/17,0,1747068,828
US,3/18/22,258513,2812,,,85,,110369.51649055396,,,Delaware,10,84000010,USA,2022/03/18,0,1747804,736
US,3/19/22,258595,2833,,,82,,110404.525563027,,,Delaware,10,84000010,USA,2022/03/19,21,1748454,650
US,3/20/22,258671,2833,,,76,,110436.97299605081,,,Delaware,10,84000010,USA,2022/03/20,0,1748508,54
US,3/21/22,258709,2833,,,38,,110453.19671256271,,,Delaware,10,84000010,USA,2022/03/21,0,1748508,0
US,3/22/22,258737,2835,,,28,,110465.15102999253,,,Delaware,10,84000010,USA,2022/03/22,2,1750058,1550
US,3/23/22,258803,2835,,,66,,110493.32906393424,,,Delaware,10,84000010,USA,2022/03/23,0,1750058,0
US,3/24/22,259003,2836,,,200,,110578.71704557583,,,Delaware,10,84000010,USA,2022/03/24,1,1751749,1691
US,3/25/22,259185,2837,,,182,,110656.42010886967,,,Delaware,10,84000010,USA,2022/03/25,1,1752395,646
US,3/27/22,259374,2846,,,189,,110737.11175152098,,,Delaware,10,84000010,USA,2022/03/27,9,1753053,5
US,3/28/22,259405,2846,,,31,,110750.34688867541,,,Delaware,10,84000010,USA,2022/03/28,0,1753053,0
US,3/29/22,259453,2846,,,48,,110770.8400042694,,,Delaware,10,84000010,USA,2022/03/29,0,1753053,0
US,3/30/22,259539,2846,,,86,,110807.55683637528,,,Delaware,10,84000010,USA,2022/03/30,0,1754908,1855
US,3/31/22,259647,2846,,,108,,110853.66634646173,,,Delaware,10,84000010,USA,2022/03/31,0,1754908,0
US,4/1/22,259746,2846,,,99,,110895.93339737432,,,Delaware,10,84000010,USA,2022/04/01,0,,
US,3/5/22,49,0,,,0,,,,,Diamond Princess,88888,84088888,USA,2022/03/05,0,,
US,4/1/22,49,0,,,0,,,,,Diamond Princess,88888,84088888,USA,2022/04/01,0,,
US,3/5/22,134678,1321,,,0,,19082.98842789717,,,District of Columbia,11,84000011,USA,2022/03/05,0,1688286,0
US,3/8/22,135086,1324,,,408,,19140.799349343746,,,District of Columbia,11,84000011,USA,2022/03/08,3,1688286,0
US,3/10/22,135223,1326,,,137,,19160.211349927526,,,District of Columbia,11,84000011,USA,2022/03/10,2,1688286,0
US,3/16/22,135575,1327,,,352,,19210.087439018687,,,District of Columbia,11,84000011,USA,2022/03/16,1,1688286,0
US,3/17/22,135681,1327,,,106,,19225.106943120005,,,District of Columbia,11,84000011,USA,2022/03/17,0,1688286,0
US,3/18/22,135752,1327,,,71,,19235.167176999188,,,District of Columbia,11,84000011,USA,2022/03/18,0,1688286,0
US,3/21/22,135884,1329,,,132,,19253.870710408373,,,District of Columbia,11,84000011,USA,2022/03/21,2,1688286,0
US,3/22/22,135955,1329,,,71,,19263.93094428756,,,District of Columbia,11,84000011,USA,2022/03/22,0,1688286,0
US,3/23/22,136062,1329,,,107,,19279.092141823792,,,District of Columbia,11,84000011,USA,2022/03/23,0,1688286,0
US,3/24/22,136213,1331,,,151,,19300.48785049642,,,District of Columbia,11,84000011,USA,2022/03/24,2,1688286,0
US,3/25/22,136322,1331,,,109,,19315.932434902494,,,District of Columbia,11,84000011,USA,2022/03/25,0,1688286,0
US,3/28/22,136506,1331,,,184,,19342.00402692742,,,District of Columbia,11,84000011,USA,2022/03/28,0,1727997,39711
US,3/29/22,136598,1331,,,92,,19355.039822939885,,,District of Columbia,11,84000011,USA,2022/03/29,0,1727997,0
US,3/31/22,136886,1333,,,288,,19395.84753219629,,,District of Columbia,11,84000011,USA,2022/03/31,2,1727997,0
US,4/1/22,136886,1333,,,0,,19395.84753219629,,,District of Columbia,11,84000011,USA,2022/04/01,0,,
US,3/5/22,5858052,70997,,,0,,22997102.814745024,,,Florida,12,84000012,USA,2022/03/05,0,36213088,16118
US,3/7/22,5858052,71326,,,0,,22997102.814745024,,,Florida,12,84000012,USA,2022/03/07,329,36241610,13113
US,3/9/22,5858052,71397,,,0,,22997102.814745024,,,Florida,12,84000012,USA,2022/03/09,71,36272804,21681
US,3/10/22,5858052,71474,,,0,,22997102.814745024,,,Florida,12,84000012,USA,2022/03/10,77,36287516,14712
US,3/11/22,5868330,71860,,,10278,,23037451.41914969,,,Florida,12,84000012,USA,2022/03/11,386,36300747,13231
US,3/12/22,5868263,71860,,,,,23037188.395556077,,,Florida,12,84000012,USA,2022/03/12,0,36313190,12443
US,3/14/22,5868263,72039,,,0,,23037188.395556077,,,Florida,12,84000012,USA,2022/03/14,179,36336507,10419
US,3/15/22,5868263,72055,,,0,,23037188.395556077,,,Florida,12,84000012,USA,2022/03/15,16,36344519,8012
US,3/16/22,5868263,72246,,,0,,23037188.395556077,,,Florida,12,84000012,USA,2022/03/16,191,36344605,86
US,3/17/22,5868263,72443,,,0,,23037188.395556077,,,Florida,12,84000012,USA,2022/03/17,197,36371536,26931
US,3/18/22,5868263,72592,,,0,,23037188.395556077,,,Florida,12,84000012,USA,2022/03/18,149,36389007,17471
US,3/19/22,5868263,72704,,,0,,23037188.395556077,,,Florida,12,84000012,USA,2022/03/19,112,36402492,13485
US,3/21/22,5868263,72767,,,0,,23037188.395556077,,,Florida,12,84000012,USA,2022/03/21,63,36427701,11357
US,3/22/22,5868263,72828,,,0,,23037188.395556077,,,Florida,12,84000012,USA,2022/03/22,61,36435939,8238
US,3/23/22,5868263,72880,,,0,,23037188.395556077,,,Florida,12,84000012,USA,2022/03/23,52,36435939,0
US,3/24/22,5868263,72946,,,0,,23037188.395556077,,,Florida,12,84000012,USA,2022/03/24,66,36462698,26759
US,3/25/22,5885004,73027,,,16741,,23102908.96243081,,,Florida,12,84000012,USA,2022/03/25,81,36475323,12625
US,3/28/22,5885004,73134,,,0,,23102908.96243081,,,Florida,12,84000012,USA,2022/03/28,107,36512359,10594
US,3/29/22,5885004,73136,,,0,,23102908.96243081,,,Florida,12,84000012,USA,2022/03/29,2,36521987,9628
US,3/30/22,5885004,73138,,,0,,23102908.96243081,,,Florida,12,84000012,USA,2022/03/30,2,36533381,11394
US,4/1/22,5885004,73282,,,0,,23102908.96243081,,,Florida,12,84000012,USA,2022/04/01,144,,
US,3/5/22,2470384,35782,,,0,,12201234.750827283,,,Georgia,13,84000013,USA,2022/03/05,0,14408792,18425
US,3/7/22,2472140,35848,,,1756,,12209907.640638119,,,Georgia,13,84000013,USA,2022/03/07,66,14409100,7
US,3/8/22,2473056,35946,,,916,,12214431.767669285,,,Georgia,13,84000013,USA,2022/03/08,98,14425571,16471
US,3/9/22,2474277,36026,,,1221,,12220462.290709734,,,Georgia,13,84000013,USA,2022/03/09,80,14429495,3924
US,3/10/22,2475489,36129,,,1212,,12226448.362720404,,,Georgia,13,84000013,USA,2022/03/10,103,14441599,12104
US,3/11/22,2476516,36193,,,1027,,12231520.719118882,,,Georgia,13,84000013,USA,2022/03/11,64,14448702,7103
US,3/14/22,2477737,36247,,,1221,,12237551.242159333,,,Georgia,13,84000013,USA,2022/03/14,54,14462068,3
US,3/15/22,2478986,36294,,,1249,,12243720.057292439,,,Georgia,13,84000013,USA,2022/03/15,47,14485399,23331
US,3/16/22,2480368,36367,,,1382,,12250545.759865658,,,Georgia,13,84000013,USA,2022/03/16,73,14485449,50
US,3/17/22,2481419,36444,,,1051,,12255736.652343556,,,Georgia,13,84000013,USA,2022/03/17,77,14490924,5475
US,3/18/22,2482518,36507,,,1099,,12261164.616980294,,,Georgia,13,84000013,USA,2022/03/18,63,14496559,5635
US,3/21/22,2483456,36576,,,938,,12265797.40208426,,,Georgia,13,84000013,USA,2022/03/21,69,14503611,0
US,3/22/22,2483910,36615,,,454,,12268039.709586605,,,Georgia,13,84000013,USA,2022/03/22,39,14525779,22168
US,3/23/22,2484385,36658,,,475,,12270385.736158444,,,Georgia,13,84000013,USA,2022/03/23,43,14525779,0
US,3/24/22,2485113,36706,,,728,,12273981.330567492,,,Georgia,13,84000013,USA,2022/03/24,48,14532099,6320
US,3/25/22,2485736,36771,,,623,,12277058.32962908,,,Georgia,13,84000013,USA,2022/03/25,65,14532154,55
US,3/28/22,2486866,36825,,,1130,,12282639.4033684,,,Georgia,13,84000013,USA,2022/03/28,54,14538341,2
US,3/29/22,2487464,36868,,,598,,12285592.927347261,,,Georgia,13,84000013,USA,2022/03/29,43,14538341,0
US,3/30/22,2496503,36923,,,9039,,12330236.578258507,,,Georgia,13,84000013,USA,2022/03/30,55,14563133,24792
US,3/31/22,2499431,36987,,,2928,,12344697.979947647,,,Georgia,13,84000013,USA,2022/03/31,64,14563133,0
US,4/1/22,2500259,37057,,,828,,12348787.474687608,,,Georgia,13,84000013,USA,2022/04/01,70,,
US,3/5/22,103,3,,,0,,,,,Grand Princess,99999,84099999,USA,2022/03/05,0,,
US,4/1/22,103,3,,,0,,,,,Grand Princess,99999,84099999,USA,2022/04/01,0,,
US,3/5/22,45489,331,,,54,,27698.51853204976,,,Guam,66,316,GUM,2022/03/05,0,333797,11
US,3/6/22,45542,331,,,53,,27730.790542474228,,,Guam,66,316,GUM,2022/03/06,0,333803,6
US,3/8/22,45837,334,,,295,,27910.417770308533,,,Guam,66,316,GUM,2022/03/08,3,334627,824
US,3/9/22,46000,335,,,163,,28009.6694250102,,,Guam,66,316,GUM,2022/03/09,1,335306,679
US,3/11/22,46299,337,,,299,,28191.732276272767,,,Guam,66,316,GUM,2022/03/11,2,335832,22
US,3/12/22,46331,337,,,32,,28211.217263698858,,,Guam,66,316,GUM,2022/03/12,0,337584,1752
US,3/14/22,46411,338,,,80,,28259.929732264096,,,Guam,66,316,GUM,2022/03/14,1,337594,0
US,3/15/22,46528,339,,,117,,28331.17171754075,,,Guam,66,316,GUM,2022/03/15,1,338288,694
US,3/16/22,46593,339,,,65,,28370.750598250004,,,Guam,66,316,GUM,2022/03/16,0,338991,703
US,3/17/22,46650,341,,,57,,28405.458232102734,,,Guam,66,316,GUM,2022/03/17,2,340048,1057
US,3/18/22,46723,341,,,73,,28449.908359668512,,,Guam,66,316,GUM,2022/03/18,0,340065,17
US,3/20/22,46730,341,,,7,,28454.170700667968,,,Guam,66,316,GUM,2022/03/20,0,341194,2
US,3/21/22,46809,341,,,79,,28502.27426337614,,,Guam,66,316,GUM,2022/03/21,0,341382,188
US,3/22/22,46893,341,,,84,,28553.422355369636,,,Guam,66,316,GUM,2022/03/22,0,341599,217
US,3/23/22,46942,341,,,49,,28583.258742365844,,,Guam,66,316,GUM,2022/03/23,0,341599,0
US,3/24/22,47009,341,,,67,,28624.05543478923,,,Guam,66,316,GUM,2022/03/24,0,342257,658
US,3/25/22,47078,340,,,69,,28666.069938926743,,,Guam,66,316,GUM,2022/03/25,,342585,328
US,3/27/22,47080,340,,,2,,28667.287750640873,,,Guam,66,316,GUM,2022/03/27,0,342598,6
US,3/28/22,47122,342,,,42,,28692.861796637622,,,Guam,66,316,GUM,2022/03/28,2,342817,219
US,3/29/22,47181,343,,,59,,28728.787242204482,,,Guam,66,316,GUM,2022/03/29,1,343240,423
US,3/30/22,47220,344,,,39,,28752.534570630036,,,Guam,66,316,GUM,2022/03/30,1,343495,255
US,3/31/22,47265,346,,,45,,28779.93533419798,,,Guam,66,316,GUM,2022/03/31,2,343495,0
US,4/1/22,47330,349,,,65,,28819.514214907234,,,Guam,66,316,GUM,2022/04/01,3,,
US,3/5/22,237167,1353,,,184,,141662.4357144137,,,Hawaii,15,84000015,USA,2022/03/05,5,2811411,0
US,3/6/22,237363,1354,,,196,,141779.50865204848,,,Hawaii,15,84000015,USA,2022/03/06,1,2811411,0
US,3/7/22,237455,1354,,,92,,141834.46125542806,,,Hawaii,15,84000015,USA,2022/03/07,0,2814153,2742
US,3/8/22,237518,1354,,,63,,141872.09184252494,,,Hawaii,15,84000015,USA,2022/03/08,0,2815723,1570
US,3/9/22,237672,1354,,,154,,141964.07772209513,,,Hawaii,15,84000015,USA,2022/03/09,0,2816807,1084
US,3/16/22,238764,1368,,,1092,,142616.34123177454,,,Hawaii,15,84000015,USA,2022/03/16,14,2823360,6553
US,3/23/22,239591,1373,,,827,,143110.31735128452,,,Hawaii,15,84000015,USA,2022/03/23,5,2823360,0
US,3/30/22,240778,1379,,,1187,,143819.32539706244,,,Hawaii,15,84000015,USA,2022/03/30,6,2834300,4460
US,4/1/22,240778,1379,,,0,,143819.32539706244,,,Hawaii,15,84000015,USA,2022/04/01,0,,
US,3/5/22,432483,4788,,,0,,4242525.014714538,,,Idaho,16,84000016,USA,2022/03/05,0,2372372,1433
US,3/7/22,434157,4796,,,1674,,4258946.439081813,,,Idaho,16,84000016,USA,2022/03/07,8,2374641,659
US,3/8/22,434981,4796,,,824,,4267029.625269767,,,Idaho,16,84000016,USA,2022/03/08,0,2374923,282
US,3/9/22,436033,4807,,,1052,,4277349.421228173,,,Idaho,16,84000016,USA,2022/03/09,11,2375705,782
US,3/10/22,437061,4814,,,1028,,4287433.784579164,,,Idaho,16,84000016,USA,2022/03/10,7,2377374,1669
US,3/11/22,437931,4819,,,870,,4295968.2165979985,,,Idaho,16,84000016,USA,2022/03/11,5,2378226,852
US,3/14/22,439103,4819,,,1172,,4307465.175593486,,,Idaho,16,84000016,USA,2022/03/14,0,2381269,583
US,3/15/22,439928,4819,,,825,,4315558.171473416,,,Idaho,16,84000016,USA,2022/03/15,0,2381695,426
US,3/16/22,440783,4831,,,855,,4323945.458112615,,,Idaho,16,84000016,USA,2022/03/16,12,2382727,1032
US,3/17/22,441375,4834,,,592,,4329752.795762213,,,Idaho,16,84000016,USA,2022/03/17,3,2383661,934
US,3/18/22,441938,4834,,,563,,4335275.6523445165,,,Idaho,16,84000016,USA,2022/03/18,0,2384638,977
US,3/21/22,442611,4834,,,673,,4341877.575044144,,,Idaho,16,84000016,USA,2022/03/21,0,2386737,415
US,3/22/22,443035,4861,,,424,,4346036.884441828,,,Idaho,16,84000016,USA,2022/03/22,27,2386962,225
US,3/23/22,443309,4860,,,274,,4348724.740043162,,,Idaho,16,84000016,USA,2022/03/23,,2386962,0
US,3/24/22,443479,4864,,,170,,4350392.387679026,,,Idaho,16,84000016,USA,2022/03/24,4,2389645,2683
US,3/25/22,443549,4867,,,70,,4351079.066117324,,,Idaho,16,84000016,USA,2022/03/25,3,2390790,1145
US,3/28/22,443666,4868,,,117,,4352226.800078478,,,Idaho,16,84000016,USA,2022/03/28,1,2393147,386
US,3/29/22,443792,4870,,,126,,4353462.821267412,,,Idaho,16,84000016,USA,2022/03/29,2,2393518,371
US,3/30/22,443930,4873,,,138,,4354816.558760055,,,Idaho,16,84000016,USA,2022/03/30,3,2394304,786
US,4/1/22,444210,4876,,,280,,4357563.272513243,,,Idaho,16,84000016,USA,2022/04/01,3,,
US,3/5/22,3037199,35359,,,0,,7897238.617748772,,,Illinois,17,84000017,USA,2022/03/05,0,21834492,24373
US,3/7/22,3039806,35389,,,2607,,7904017.265139499,,,Illinois,17,84000017,USA,2022/03/07,30,21863349,11690
US,3/8/22,3040861,35411,,,1055,,7906760.446189448,,,Illinois,17,84000017,USA,2022/03/08,22,21869915,6566
US,3/9/22,3042495,35443,,,1634,,7911009.126602355,,,Illinois,17,84000017,USA,2022/03/09,32,21889900,19985
US,3/10/22,3043893,35485,,,1398,,7914644.16651499,,,Illinois,17,84000017,USA,2022/03/10,42,21906684,16784
US,3/11/22,3045718,35508,,,1825,,7919389.479705661,,,Illinois,17,84000017,USA,2022/03/11,23,21866352,
US,3/14/22,3048042,35540,,,2324,,7925432.278530383,,,Illinois,17,84000017,USA,2022/03/14,32,21919246,11062
US,3/15/22,3049616,35572,,,1574,,7929524.948646611,,,Illinois,17,84000017,USA,2022/03/15,32,21926809,7563
US,3/16/22,3050647,35597,,,1031,,7932205.725577888,,,Illinois,17,84000017,USA,2022/03/16,25,21946996,20187
US,3/17/22,3051797,35613,,,1150,,7935195.922930913,,,Illinois,17,84000017,USA,2022/03/17,16,21961680,14684
US,3/18/22,3053185,35631,,,1388,,7938804.961127435,,,Illinois,17,84000017,USA,2022/03/18,18,21929174,
US,3/21/22,3055636,35649,,,2451,,7945177.981746796,,,Illinois,17,84000017,USA,2022/03/21,18,21972538,11185
US,3/22/22,3057078,35693,,,1442,,7948927.429210328,,,Illinois,17,84000017,USA,2022/03/22,44,21981777,9239
US,3/23/22,3058192,35711,,,1114,,7951824.020385345,,,Illinois,17,84000017,USA,2022/03/23,18,21981777,0
US,3/24/22,3059915,35726,,,1723,,7956304.116071661,,,Illinois,17,84000017,USA,2022/03/24,15,22022005,40228
US,3/25/22,3061225,35740,,,1310,,7959710.340882498,,,Illinois,17,84000017,USA,2022/03/25,14,21999431,
US,3/26/22,3061224,35740,,,,,7959707.740710887,,,Illinois,17,84000017,USA,2022/03/26,0,22017677,18246
US,3/28/22,3063735,35761,,,2511,,7966236.771626927,,,Illinois,17,84000017,USA,2022/03/28,21,22043499,7191
US,3/29/22,3065321,35781,,,1586,,7970360.643802491,,,Illinois,17,84000017,USA,2022/03/29,20,22049573,6074
US,3/30/22,3066645,35791,,,1324,,7973803.271015887,,,Illinois,17,84000017,USA,2022/03/30,10,22057972,8399
US,3/31/22,3068237,35810,,,1592,,7977942.744221118,,,Illinois,17,84000017,USA,2022/03/31,19,22057972,0
US,4/1/22,3069650,35827,,,1413,,7981616.786707923,,,Illinois,17,84000017,USA,2022/04/01,17,,
US,3/5/22,1683739,23002,,,0,,4957422.565068897,,,Indiana,18,84000018,USA,2022/03/05,0,9225413,4867
US,3/7/22,1685176,23017,,,1437,,4961653.515486986,,,Indiana,18,84000018,USA,2022/03/07,15,9233360,3058
US,3/8/22,1685532,23038,,,356,,4962701.684136144,,,Indiana,18,84000018,USA,2022/03/08,21,9235025,1665
US,3/9/22,1685997,23115,,,465,,4964070.780826758,,,Indiana,18,84000018,USA,2022/03/09,77,9238538,3513
US,3/10/22,1686379,23126,,,382,,4965195.501118831,,,Indiana,18,84000018,USA,2022/03/10,11,9243373,4835
US,3/11/22,1686671,23164,,,292,,4966055.234954658,,,Indiana,18,84000018,USA,2022/03/11,38,9247702,4329
US,3/14/22,1687268,23178,,,597,,4967812.978447768,,,Indiana,18,84000018,USA,2022/03/14,14,9260610,2483
US,3/15/22,1687591,23193,,,323,,4968763.985396302,,,Indiana,18,84000018,USA,2022/03/15,15,9262116,1506
US,3/16/22,1687920,23229,,,329,,4969732.6581085855,,,Indiana,18,84000018,USA,2022/03/16,36,9265595,3479
US,3/17/22,1688240,23250,,,320,,4970674.832175245,,,Indiana,18,84000018,USA,2022/03/17,21,9269896,4301
US,3/18/22,1688770,23290,,,530,,4972235.307973148,,,Indiana,18,84000018,USA,2022/03/18,40,9273971,4075
US,3/21/22,1689142,23300,,,372,,4973330.585325639,,,Indiana,18,84000018,USA,2022/03/21,10,9284318,2534
US,3/22/22,1689360,23309,,,218,,4973972.44140855,,,Indiana,18,84000018,USA,2022/03/22,9,9285619,1301
US,3/23/22,1689663,23334,,,303,,4974864.562477917,,,Indiana,18,84000018,USA,2022/03/23,25,9285619,0
US,3/24/22,1689919,23340,,,256,,4975618.301731245,,,Indiana,18,84000018,USA,2022/03/24,6,9293218,7599
US,3/25/22,1690144,23356,,,225,,4976280.767871864,,,Indiana,18,84000018,USA,2022/03/25,16,9296603,3385
US,3/28/22,1690578,23360,,,434,,4977558.59144977,,,Indiana,18,84000018,USA,2022/03/28,4,9308189,2100
US,3/29/22,1690823,23373,,,245,,4978279.943469556,,,Indiana,18,84000018,USA,2022/03/29,13,9309342,1153
US,4/1/22,1691470,24352,,,647,,4980184.901660582,,,Indiana,18,84000018,USA,2022/04/01,979,,
US,3/5/22,755547,9171,,,525,,6014543.862442287,,,Iowa,19,84000019,USA,2022/03/05,0,4936697,2087
US,3/8/22,755968,9171,,,421,,6017895.239611527,,,Iowa,19,84000019,USA,2022/03/08,0,4941050,4336
US,3/9/22,756257,9262,,,289,,6020195.828689699,,,Iowa,19,84000019,USA,2022/03/09,91,4942614,1564
US,3/10/22,756359,9262,,,102,,6021007.801305525,,,Iowa,19,84000019,USA,2022/03/10,0,4944249,1635
US,3/12/22,756778,9262,,,419,,6024343.2574430825,,,Iowa,19,84000019,USA,2022/03/12,0,4947585,1596
US,3/15/22,757017,9262,,,239,,6026245.820729183,,,Iowa,19,84000019,USA,2022/03/15,0,4951157,3555
US,3/16/22,757265,9349,,,248,,6028220.028657857,,,Iowa,19,84000019,USA,2022/03/16,87,4952757,1600
US,3/17/22,757334,9349,,,69,,6028769.304250916,,,Iowa,19,84000019,USA,2022/03/17,0,4954495,1738
US,3/19/22,757551,9349,,,217,,6030496.736188505,,,Iowa,19,84000019,USA,2022/03/19,0,4957602,1500
US,3/22/22,757807,9349,,,256,,6032534.62824391,,,Iowa,19,84000019,USA,2022/03/22,0,4960723,3120
US,3/23/22,757985,9402,,,178,,6033951.600063684,,,Iowa,19,84000019,USA,2022/03/23,53,4960723,0
US,3/24/22,758064,9402,,,79,,6034580.480815156,,,Iowa,19,84000019,USA,2022/03/24,0,4963635,2912
US,3/26/22,758294,9402,,,230,,6036411.399458685,,,Iowa,19,84000019,USA,2022/03/26,0,4966812,1597
US,3/29/22,758463,9402,,,169,,6037756.726635886,,,Iowa,19,84000019,USA,2022/03/29,0,4971111,4299
US,3/30/22,758463,9445,,,0,,6037756.726635886,,,Iowa,19,84000019,USA,2022/03/30,43,4972344,1233
US,4/1/22,758463,9445,,,0,,6037756.726635886,,,Iowa,19,84000019,USA,2022/04/01,0,,
US,3/5/22,768243,7983,,,0,,464394.39276064053,,,Kansas,20,84000020,USA,2022/03/05,0,4457284,3957
US,3/7/22,768562,7988,,,319,,464587.2247308513,,,Kansas,20,84000020,USA,2022/03/07,5,4459838,2
US,3/8/22,768593,7988,,,31,,464605.963887831,,,Kansas,20,84000020,USA,2022/03/08,0,4461541,1703
US,3/9/22,769119,8003,,,526,,464923.92506755167,,,Kansas,20,84000020,USA,2022/03/09,15,4464567,3026
US,3/10/22,769120,8003,,,1,,464924.52955648646,,,Kansas,20,84000020,USA,2022/03/10,0,4470240,5673
US,3/11/22,769425,8007,,,305,,465108.89868160966,,,Kansas,20,84000020,USA,2022/03/11,4,4472153,1913
US,3/14/22,769511,8028,,,86,,465160.884730005,,,Kansas,20,84000020,USA,2022/03/14,21,4475386,0
US,3/15/22,769512,8028,,,1,,465161.48921893985,,,Kansas,20,84000020,USA,2022/03/15,0,4476791,1405
US,3/16/22,769776,8088,,,264,,465321.074297735,,,Kansas,20,84000020,USA,2022/03/16,60,4478344,1553
US,3/18/22,769945,8146,,,169,,465423.2329277213,,,Kansas,20,84000020,USA,2022/03/18,58,4482107,1747
US,3/21/22,770054,8150,,,109,,465489.1222216177,,,Kansas,20,84000020,USA,2022/03/21,4,4486229,0
US,3/23/22,770314,8197,,,260,,465646.28934467357,,,Kansas,20,84000020,USA,2022/03/23,47,4487577,0
US,3/25/22,770391,8220,,,77,,465692.83499265544,,,Kansas,20,84000020,USA,2022/03/25,23,4493042,1634
US,3/26/22,770410,8220,,,19,,465704.32028241723,,,Kansas,20,84000020,USA,2022/03/26,0,4494659,1617
US,3/28/22,770556,8221,,,146,,465792.5756669024,,,Kansas,20,84000020,USA,2022/03/28,1,4496448,0
US,3/30/22,770775,8292,,,219,,465924.9587436302,,,Kansas,20,84000020,USA,2022/03/30,71,4499032,1344
US,3/31/22,770776,8292,,,1,,465925.563232565,,,Kansas,20,84000020,USA,2022/03/31,0,4499032,0
US,4/1/22,770957,8395,,,181,,466034.97572976927,,,Kansas,20,84000020,USA,2022/04/01,103,,
US,3/5/22,1286697,14018,,,0,,4812961.023415875,,,Kentucky,21,84000021,USA,2022/03/05,0,6325758,2325
US,3/10/22,1288706,14097,,,2009,,4820475.798608514,,,Kentucky,21,84000021,USA,2022/03/10,79,6347335,3537
US,3/17/22,1298238,14380,,,9532,,4856130.769806239,,,Kentucky,21,84000021,USA,2022/03/17,283,6367748,2918
US,3/21/22,1306877,14659,,,8639,,4888445.425301115,,,Kentucky,21,84000021,USA,2022/03/21,279,6376382,516
US,3/28/22,1312407,14895,,,5530,,4909130.694995137,,,Kentucky,21,84000021,USA,2022/03/28,236,6393863,652
US,4/1/22,1315185,14965,,,2778,,4919521.957058428,,,Kentucky,21,84000021,USA,2022/04/01,70,,
US,3/5/22,1164620,16754,,,0,,8376150.747986191,,,Louisiana,22,84000022,USA,2022/03/05,0,6070338,3263
US,3/7/22,1165084,16785,,,464,,8379487.917146145,,,Louisiana,22,84000022,USA,2022/03/07,31,6075240,1537
US,3/8/22,1165373,16813,,,289,,8381566.455696203,,,Louisiana,22,84000022,USA,2022/03/08,28,6076092,852
US,3/9/22,1165736,16832,,,363,,8384177.215189873,,,Louisiana,22,84000022,USA,2022/03/09,19,6078577,2485
US,3/10/22,1165872,16862,,,136,,8385155.350978136,,,Louisiana,22,84000022,USA,2022/03/10,30,6089784,11207
US,3/11/22,1166002,16887,,,130,,8386090.333716916,,,Louisiana,22,84000022,USA,2022/03/11,25,6099188,9404
US,3/14/22,1166487,16913,,,485,,8389578.538550058,,,Louisiana,22,84000022,USA,2022/03/14,26,6106598,1481
US,3/15/22,1166698,16950,,,211,,8391096.087456847,,,Louisiana,22,84000022,USA,2022/03/15,37,6107603,1005
US,3/16/22,1166866,16960,,,168,,8392304.372842347,,,Louisiana,22,84000022,USA,2022/03/16,10,6110191,2588
US,3/17/22,1167026,16981,,,160,,8393455.12082854,,,Louisiana,22,84000022,USA,2022/03/17,21,6113102,2911
US,3/18/22,1167207,16996,,,181,,8394756.904487917,,,Louisiana,22,84000022,USA,2022/03/18,15,6116269,3167
US,3/21/22,1167421,17016,,,214,,8396296.029919447,,,Louisiana,22,84000022,USA,2022/03/21,20,6122888,1227
US,3/22/22,1167553,17034,,,132,,8397245.397008056,,,Louisiana,22,84000022,USA,2022/03/22,18,6123634,746
US,3/23/22,1167697,17045,,,144,,8398281.070195626,,,Louisiana,22,84000022,USA,2022/03/23,11,6123634,0
US,3/24/22,1167806,17065,,,109,,8399065.01726122,,,Louisiana,22,84000022,USA,2022/03/24,20,6132103,8469
US,3/25/22,1167962,17076,,,156,,8400186.996547757,,,Louisiana,22,84000022,USA,2022/03/25,11,6134309,2206
US,3/28/22,1168136,17086,,,174,,8401438.43498274,,,Louisiana,22,84000022,USA,2022/03/28,10,6139949,1131
US,3/29/22,1168214,17104,,,78,,8401999.424626008,,,Louisiana,22,84000022,USA,2022/03/29,18,6140474,525
US,3/30/22,1168329,17117,,,115,,8402826.524741082,,,Louisiana,22,84000022,USA,2022/03/30,13,6142166,1692
US,3/31/22,1168464,17127,,,135,,8403797.46835443,,,Louisiana,22,84000022,USA,2022/03/31,10,6142166,0
US,4/1/22,1168537,17138,,,73,,8404322.49712313,,,Louisiana,22,84000022,USA,2022/04/01,11,,
US,3/5/22,230720,2135,,,447,,111114.85689242491,,,Maine,23,84000023,USA,2022/03/05,26,2709506,1262
US,3/6/22,230720,2136,,,0,,111114.85689242491,,,Maine,23,84000023,USA,2022/03/06,1,2709575,69
US,3/8/22,231285,2138,,,565,,111386.96114929132,,,Maine,23,84000023,USA,2022/03/08,2,2712242,2575
US,3/9/22,231469,2136,,,184,,111475.5756329434,,,Maine,23,84000023,USA,2022/03/09,,2713108,866
US,3/10/22,231758,2140,,,289,,111614.75816433171,,,Maine,23,84000023,USA,2022/03/10,4,2714243,1135
US,3/11/22,232011,2142,,,253,,111736.60307935331,,,Maine,23,84000023,USA,2022/03/11,2,2715458,1215
US,3/12/22,232293,2145,,,282,,111872.4144075592,,,Maine,23,84000023,USA,2022/03/12,3,2716556,1098
US,3/15/22,232647,2147,,,354,,112042.90096849852,,,Maine,23,84000023,USA,2022/03/15,2,2718610,1876
US,3/16/22,232953,2167,,,306,,112190.27070761555,,,Maine,23,84000023,USA,2022/03/16,20,2719394,784
US,3/17/22,233237,2179,,,284,,112327.0452367307,,,Maine,23,84000023,USA,2022/03/17,12,2720365,971
US,3/18/22,233537,2179,,,300,,112471.52537311995,,,Maine,23,84000023,USA,2022/03/18,0,2721460,1095
US,3/19/22,233696,2182,,,159,,112548.09984540625,,,Maine,23,84000023,USA,2022/03/19,3,2722547,1087
US,3/21/22,233696,2184,,,0,,112548.09984540625,,,Maine,23,84000023,USA,2022/03/21,2,2722666,51
US,3/22/22,233968,2188,,,272,,112679.09516906584,,,Maine,23,84000023,USA,2022/03/22,4,2724356,1690
US,3/23/22,234159,2190,,,191,,112771.08085590033,,,Maine,23,84000023,USA,2022/03/23,2,2724356,0
US,3/24/22,234413,2193,,,254,,112893.40737137655,,,Maine,23,84000023,USA,2022/03/24,3,2726115,1759
US,3/25/22,234651,2193,,,238,,113008.02827957869,,,Maine,23,84000023,USA,2022/03/25,0,2727002,887
US,3/26/22,234839,2195,,,188,,113098.5691650493,,,Maine,23,84000023,USA,2022/03/26,2,2727913,911
US,3/29/22,235293,2200,,,454,,113317.2157714517,,,Maine,23,84000023,USA,2022/03/29,5,2729990,1860
US,3/30/22,235584,2201,,,291,,113457.36150374926,,,Maine,23,84000023,USA,2022/03/30,1,2730713,723
US,3/31/22,235790,2202,,,206,,113556.57119740322,,,Maine,23,84000023,USA,2022/03/31,1,2730713,0
US,4/1/22,236046,2202,,,256,,113679.8609137887,,,Maine,23,84000023,USA,2022/04/01,0,,
US,3/5/22,1004290,14176,,,382,,169217.67847815464,,,Maryland,24,84000024,USA,2022/03/05,5,11555122,7523
US,3/6/22,1004539,14183,,,249,,169259.63369222733,,,Maryland,24,84000024,USA,2022/03/06,7,11560219,5097
US,3/7/22,1004762,14188,,,223,,169297.20804057355,,,Maryland,24,84000024,USA,2022/03/07,5,11562934,2715
US,3/8/22,1005056,14206,,,294,,169346.74552224975,,,Maryland,24,84000024,USA,2022/03/08,18,11567865,4931
US,3/9/22,1005333,14218,,,277,,169393.41859172017,,,Maryland,24,84000024,USA,2022/03/09,12,11573727,5862
US,3/10/22,1005716,14229,,,383,,169457.9521137677,,,Maryland,24,84000024,USA,2022/03/10,11,11579870,6143
US,3/11/22,1006062,14237,,,346,,169516.25132689683,,,Maryland,24,84000024,USA,2022/03/11,8,11585506,5636
US,3/12/22,1006432,14249,,,370,,169578.59441608115,,,Maryland,24,84000024,USA,2022/03/12,12,11591740,6234
US,3/13/22,1006636,14261,,,204,,169612.96736255035,,,Maryland,24,84000024,USA,2022/03/13,12,11595204,3464
US,3/14/22,1006782,14263,,,146,,169637.5676085528,,,Maryland,24,84000024,USA,2022/03/14,2,11597145,1941
US,3/15/22,1007040,14271,,,258,,169681.03927614618,,,Maryland,24,84000024,USA,2022/03/15,8,11601427,4282
US,3/16/22,1007372,14280,,,332,,169736.97956157645,,,Maryland,24,84000024,USA,2022/03/16,9,11606157,4730
US,3/17/22,1007748,14282,,,376,,169800.33361977455,,,Maryland,24,84000024,USA,2022/03/17,2,11611964,5807
US,3/18/22,1008178,14286,,,430,,169872.78639909686,,,Maryland,24,84000024,USA,2022/03/18,4,11617044,5080
US,3/19/22,1008536,14293,,,358,,169933.1075502536,,,Maryland,24,84000024,USA,2022/03/19,7,11622472,5428
US,3/20/22,1008740,14298,,,204,,169967.48049672277,,,Maryland,24,84000024,USA,2022/03/20,5,11626180,3708
US,3/21/22,1008915,14304,,,175,,169996.9670929586,,,Maryland,24,84000024,USA,2022/03/21,6,11628216,2036
US,3/22/22,1009097,14303,,,182,,170027.63315304386,,,Maryland,24,84000024,USA,2022/03/22,,11632728,4512
US,3/23/22,1009343,14311,,,246,,170069.08288260965,,,Maryland,24,84000024,USA,2022/03/23,8,11632728,0
US,3/24/22,1009705,14316,,,362,,170130.0780131089,,,Maryland,24,84000024,USA,2022/03/24,5,11643639,10911
US,3/25/22,1010096,14318,,,391,,170195.9594938415,,,Maryland,24,84000024,USA,2022/03/25,2,11652526,8887
US,3/26/22,1010497,14324,,,401,,170263.52592293045,,,Maryland,24,84000024,USA,2022/03/26,6,11669555,17029
US,3/27/22,1010722,14326,,,225,,170301.43726094795,,,Maryland,24,84000024,USA,2022/03/27,2,11676871,7316
US,3/28/22,1010934,14327,,,212,,170337.15816610222,,,Maryland,24,84000024,USA,2022/03/28,1,11679076,2205
US,3/29/22,1011211,14331,,,277,,170383.83123557264,,,Maryland,24,84000024,USA,2022/03/29,4,11688265,9189
US,3/30/22,1011498,14343,,,287,,170432.18925339938,,,Maryland,24,84000024,USA,2022/03/30,12,11701167,12902
US,3/31/22,1011919,14345,,,421,,170503.125579201,,,Maryland,24,84000024,USA,2022/03/31,2,11701167,0
US,4/1/22,1012357,14347,,,438,,170576.9263172084,,,Maryland,24,84000024,USA,2022/04/01,2,,
US,3/5/22,1675767,23577,,,0,,201748.4487528623,,,Massachusetts,25,84000025,USA,2022/03/05,0,14312150,7230
US,3/7/22,1677619,23614,,,1852,,201971.41419321907,,,Massachusetts,25,84000025,USA,2022/03/07,37,14312362,84
US,3/8/22,1678247,23679,,,628,,202047.02018487352,,,Massachusetts,25,84000025,USA,2022/03/08,65,14330116,17754
US,3/9/22,1679034,23708,,,787,,202141.7684578545,,,Massachusetts,25,84000025,USA,2022/03/09,29,14335625,5509
US,3/10/22,1679921,23732,,,887,,202248.55590148107,,,Massachusetts,25,84000025,USA,2022/03/10,24,14342533,6908
US,3/11/22,1680673,23751,,,752,,202339.09046473607,,,Massachusetts,25,84000025,USA,2022/03/11,19,14348489,5956
US,3/14/22,1682693,19981,,,2020,,202582.28171177744,,,Massachusetts,25,84000025,USA,2022/03/14,,14354114,69
US,3/15/22,1683224,19997,,,531,,202646.20970790565,,,Massachusetts,25,84000025,USA,2022/03/15,16,14367584,13470
US,3/16/22,1684036,20012,,,812,,202743.967773548,,,Massachusetts,25,84000025,USA,2022/03/16,15,14371860,4276
US,3/17/22,1685055,20023,,,1019,,202866.64692242682,,,Massachusetts,25,84000025,USA,2022/03/17,11,14377119,5259
US,3/18/22,1685937,20029,,,882,,202972.8324075211,,,Massachusetts,25,84000025,USA,2022/03/18,6,14383035,5916
US,3/21/22,1687720,20041,,,1783,,203187.49082013237,,,Massachusetts,25,84000025,USA,2022/03/21,12,14388552,72
US,3/22/22,1688534,20056,,,814,,203285.48966918766,,,Massachusetts,25,84000025,USA,2022/03/22,15,14401665,13113
US,3/23/22,1689750,20058,,,1216,,203431.88598423832,,,Massachusetts,25,84000025,USA,2022/03/23,2,14401665,0
US,3/24/22,1690983,20063,,,1233,,203580.32895829872,,,Massachusetts,25,84000025,USA,2022/03/24,5,14412068,10403
US,3/25/22,1692177,20072,,,1194,,203724.07665580732,,,Massachusetts,25,84000025,USA,2022/03/25,9,14416893,4825
US,3/28/22,1694801,20081,,,2624,,204039.9844935482,,,Massachusetts,25,84000025,USA,2022/03/28,9,14417140,76
US,3/29/22,1695750,20097,,,949,,204154.23622297507,,,Massachusetts,25,84000025,USA,2022/03/29,16,14429657,12517
US,3/30/22,1697165,20098,,,1415,,204324.5904876105,,,Massachusetts,25,84000025,USA,2022/03/30,1,14433455,3798
US,3/31/22,1698761,20105,,,1596,,204516.73565111446,,,Massachusetts,25,84000025,USA,2022/03/31,7,14433455,0
US,4/1/22,1700361,20115,,,1600,,204709.36238144425,,,Massachusetts,25,84000025,USA,2022/04/01,10,,
US,3/5/22,2365827,34841,,,0,,7034661.473045702,,,Michigan,26,84000026,USA,2022/03/05,0,15302740,13724
US,3/7/22,2367688,34858,,,1861,,7040195.058130891,,,Michigan,26,84000026,USA,2022/03/07,17,15347785,33164
US,3/9/22,2369853,35135,,,2165,,7046632.571139722,,,Michigan,26,84000026,USA,2022/03/09,277,15357930,4953
US,3/11/22,2371788,35188,,,1935,,7052386.191311588,,,Michigan,26,84000026,USA,2022/03/11,53,15368643,5043
US,3/14/22,2373336,35210,,,1548,,7056989.087449079,,,Michigan,26,84000026,USA,2022/03/14,22,15383062,2836
US,3/16/22,2375430,35353,,,2094,,7063215.485712587,,,Michigan,26,84000026,USA,2022/03/16,143,15389332,4340
US,3/18/22,2378439,35418,,,3009,,7072162.588088371,,,Michigan,26,84000026,USA,2022/03/18,65,15399383,5044
US,3/21/22,2380155,35425,,,1716,,7077265.02334156,,,Michigan,26,84000026,USA,2022/03/21,7,15413701,3577
US,3/23/22,2382197,35533,,,2042,,7083336.80235497,,,Michigan,26,84000026,USA,2022/03/23,108,15415774,0
US,3/25/22,2384088,35572,,,1891,,7088959.590853677,,,Michigan,26,84000026,USA,2022/03/25,39,15430326,5466
US,3/28/22,2385536,35578,,,1448,,7093265.142279444,,,Michigan,26,84000026,USA,2022/03/28,6,15449817,2847
US,3/30/22,2387521,35662,,,1985,,7099167.434807172,,,Michigan,26,84000026,USA,2022/03/30,84,15455717,4156
US,4/1/22,2389506,35706,,,1985,,7105069.727334899,,,Michigan,26,84000026,USA,2022/04/01,44,,
US,3/5/22,1417811,12373,,,0,,14603059.01740653,,,Minnesota,27,84000027,USA,2022/03/05,0,9930619,4860
US,3/7/22,1418694,12391,,,883,,14612153.67185086,,,Minnesota,27,84000027,USA,2022/03/07,18,9939576,2703
US,3/8/22,1420149,12411,,,1455,,14627139.767226284,,,Minnesota,27,84000027,USA,2022/03/08,20,9940704,1128
US,3/9/22,1420720,12428,,,571,,14633020.908435471,,,Minnesota,27,84000027,USA,2022/03/09,17,9945044,4340
US,3/10/22,1421312,12455,,,592,,14639118.343804717,,,Minnesota,27,84000027,USA,2022/03/10,27,9949570,4526
US,3/11/22,1421869,12464,,,557,,14644855.2889072,,,Minnesota,27,84000027,USA,2022/03/11,9,9953812,4242
US,3/14/22,1422344,12480,,,475,,14649747.656813266,,,Minnesota,27,84000027,USA,2022/03/14,16,9964151,1748
US,3/15/22,1422815,12489,,,471,,14654598.825831702,,,Minnesota,27,84000027,USA,2022/03/15,9,9965080,929
US,3/16/22,1423683,12512,,,868,,14663538.98444742,,,Minnesota,27,84000027,USA,2022/03/16,23,9968531,3451
US,3/17/22,1424107,12522,,,424,,14667906.066536203,,,Minnesota,27,84000027,USA,2022/03/17,10,9972230,3699
US,3/18/22,1424613,12531,,,506,,14673117.725821402,,,Minnesota,27,84000027,USA,2022/03/18,9,9976055,3825
US,3/21/22,1425032,12538,,,419,,14677433.309300648,,,Minnesota,27,84000027,USA,2022/03/21,7,9985961,5479
US,3/22/22,1426056,12550,,,1024,,14687980.224533938,,,Minnesota,27,84000027,USA,2022/03/22,12,9985981,20
US,3/23/22,1426326,12562,,,270,,14690761.149448965,,,Minnesota,27,84000027,USA,2022/03/23,12,9985981,0
US,3/24/22,1426787,12582,,,461,,14695509.321248326,,,Minnesota,27,84000027,USA,2022/03/24,20,9993291,7310
US,3/25/22,1427270,12589,,,483,,14700484.086929653,,,Minnesota,27,84000027,USA,2022/03/25,7,9997064,3773
US,3/28/22,1427734,12602,,,464,,14705263.157894736,,,Minnesota,27,84000027,USA,2022/03/28,13,10006211,1437
US,3/29/22,1428704,12610,,,970,,14715253.88814502,,,Minnesota,27,84000027,USA,2022/03/29,8,10007018,807
US,3/30/22,1429051,12621,,,347,,14718827.891646925,,,Minnesota,27,84000027,USA,2022/03/30,11,10010588,3570
US,3/31/22,1429550,12638,,,499,,14723967.452878771,,,Minnesota,27,84000027,USA,2022/03/31,17,10010588,0
US,4/1/22,1430089,12640,,,539,,14729519.00298692,,,Minnesota,27,84000027,USA,2022/04/01,2,,
US,3/5/22,791208,12151,,,0,,2664897.27180869,,,Mississippi,28,84000028,USA,2022/03/05,0,3771535,2043
US,3/7/22,791817,12171,,,609,,2666948.467497474,,,Mississippi,28,84000028,USA,2022/03/07,20,3771587,6
US,3/8/22,791966,12206,,,149,,2667450.319973055,,,Mississippi,28,84000028,USA,2022/03/08,35,3775148,3561
US,3/9/22,792129,12228,,,163,,2667999.326372516,,,Mississippi,28,84000028,USA,2022/03/09,22,3776683,1535
US,3/10/22,792289,12247,,,160,,2668538.228359717,,,Mississippi,28,84000028,USA,2022/03/10,19,3778600,1917
US,3/11/22,792560,12255,,,271,,2669450.993600539,,,Mississippi,28,84000028,USA,2022/03/11,8,3780616,2016
US,3/14/22,792950,12275,,,390,,2670764.5671943417,,,Mississippi,28,84000028,USA,2022/03/14,20,3782434,0
US,3/15/22,793103,12288,,,153,,2671279.8922196026,,,Mississippi,28,84000028,USA,2022/03/15,13,3785638,3204
US,3/16/22,793201,12308,,,98,,2671609.9696867634,,,Mississippi,28,84000028,USA,2022/03/16,20,3787172,1534
US,3/17/22,793278,12319,,,77,,2671869.3162681037,,,Mississippi,28,84000028,USA,2022/03/17,11,3789095,1923
US,3/18/22,793390,12330,,,112,,2672246.5476591443,,,Mississippi,28,84000028,USA,2022/03/18,11,3790885,1790
US,3/21/22,793635,12336,,,245,,2673071.741327046,,,Mississippi,28,84000028,USA,2022/03/21,6,3792788,0
US,3/22/22,793741,12368,,,106,,2673428.763893567,,,Mississippi,28,84000028,USA,2022/03/22,32,3795584,2796
US,3/23/22,793870,12369,,,129,,2673863.253620748,,,Mississippi,28,84000028,USA,2022/03/23,1,3795584,0
US,3/24/22,793960,12369,,,90,,2674166.3859885484,,,Mississippi,28,84000028,USA,2022/03/24,0,3799925,4341
US,3/25/22,794093,12378,,,133,,2674614.348265409,,,Mississippi,28,84000028,USA,2022/03/25,9,3801363,1438
US,3/28/22,794225,12383,,,132,,2675058.94240485,,,Mississippi,28,84000028,USA,2022/03/28,5,3802846,1
US,3/29/22,794292,12396,,,67,,2675284.6076119905,,,Mississippi,28,84000028,USA,2022/03/29,13,3805191,2345
US,3/30/22,794427,12396,,,135,,2675739.3061636914,,,Mississippi,28,84000028,USA,2022/03/30,0,3806340,1149
US,3/31/22,794558,12397,,,131,,2676180.532165712,,,Mississippi,28,84000028,USA,2022/03/31,1,3806340,0
US,4/1/22,794721,12399,,,163,,2676729.5385651733,,,Mississippi,28,84000028,USA,2022/04/01,2,,
US,3/5/22,1404926,19321,,,80,,467411.23709145107,,,Missouri,29,84000029,USA,2022/03/05,3,8676845,4127
US,3/7/22,1405954,19320,,,1028,,467753.24709890346,,,Missouri,29,84000029,USA,2022/03/07,,8676901,1
US,3/8/22,1406726,19527,,,772,,468010.0872990525,,,Missouri,29,84000029,USA,2022/03/08,207,8687181,10280
US,3/9/22,1407120,19534,,,394,,468141.16895560524,,,Missouri,29,84000029,USA,2022/03/09,7,8691796,4615
US,3/10/22,1407716,19539,,,596,,468339.45491323323,,,Missouri,29,84000029,USA,2022/03/10,5,8695633,3837
US,3/11/22,1408095,19546,,,379,,468465.5461513893,,,Missouri,29,84000029,USA,2022/03/11,7,8699496,3863
US,3/14/22,1409110,19554,,,1015,,468803.2311295646,,,Missouri,29,84000029,USA,2022/03/14,8,8703014,0
US,3/15/22,1409670,19853,,,560,,468989.54008304054,,,Missouri,29,84000029,USA,2022/03/15,299,8709112,6098
US,3/16/22,1410021,19856,,,351,,469106.31587352284,,,Missouri,29,84000029,USA,2022/03/16,3,8711919,2807
US,3/17/22,1410068,19855,,,47,,469121.95251783245,,,Missouri,29,84000029,USA,2022/03/17,,8715204,3285
US,3/21/22,1411611,19879,,,1543,,469635.3002235707,,,Missouri,29,84000029,USA,2022/03/21,24,8722200,0
US,3/22/22,1410068,19855,,,,,469121.95251783245,,,Missouri,29,84000029,USA,2022/03/22,,8728555,6355
US,3/23/22,1412752,20040,,,2684,,470014.9047162781,,,Missouri,29,84000029,USA,2022/03/23,185,8728555,0
US,3/24/22,1413477,20042,,,725,,470256.10827211756,,,Missouri,29,84000029,USA,2022/03/24,2,8734276,5721
US,3/25/22,1414075,20046,,,598,,470455.05961886514,,,Missouri,29,84000029,USA,2022/03/25,4,8736870,2594
US,3/28/22,1414886,20056,,,811,,470724.8749068455,,,Missouri,29,84000029,USA,2022/03/28,10,8740962,0
US,3/29/22,1415385,20142,,,499,,470890.889492175,,,Missouri,29,84000029,USA,2022/03/29,86,8746700,5738
US,3/30/22,1416017,20153,,,632,,471101.1524539551,,,Missouri,29,84000029,USA,2022/03/30,11,8748681,1981
US,3/31/22,1416599,20166,,,582,,471294.7806877462,,,Missouri,29,84000029,USA,2022/03/31,13,8748681,0
US,4/1/22,1416676,20166,,,77,,471320.3981688491,,,Missouri,29,84000029,USA,2022/04/01,0,,
US,3/5/22,271030,3204,,,0,,168028.51828890268,,,Montana,30,84000030,USA,2022/03/05,0,1538754,773
US,3/7/22,271191,3208,,,161,,168128.332300062,,,Montana,30,84000030,USA,2022/03/07,4,1538788,4
US,3/8/22,271336,3209,,,145,,168218.22690638562,,,Montana,30,84000030,USA,2022/03/08,1,1539977,1189
US,3/9/22,271464,3211,,,128,,168297.5821450713,,,Montana,30,84000030,USA,2022/03/09,2,1540606,629
US,3/10/22,271590,3221,,,126,,168375.6974581525,,,Montana,30,84000030,USA,2022/03/10,10,1541224,618
US,3/11/22,271641,3223,,,51,,168407.31556106632,,,Montana,30,84000030,USA,2022/03/11,2,1541812,588
US,3/14/22,271774,3223,,,133,,168489.77061376316,,,Montana,30,84000030,USA,2022/03/14,0,1542353,0
US,3/15/22,271875,3226,,,101,,168552.3868567886,,,Montana,30,84000030,USA,2022/03/15,3,1543241,888
US,3/16/22,271948,3228,,,73,,168597.6441413515,,,Montana,30,84000030,USA,2022/03/16,2,1543262,21
US,3/17/22,272036,3231,,,88,,168652.20086794792,,,Montana,30,84000030,USA,2022/03/17,3,1544575,1313
US,3/18/22,272105,3234,,,69,,168694.97830130192,,,Montana,30,84000030,USA,2022/03/18,3,1545129,554
US,3/21/22,272183,3236,,,78,,168743.335399876,,,Montana,30,84000030,USA,2022/03/21,2,1545256,2
US,3/22/22,272258,3237,,,75,,168789.8326100434,,,Montana,30,84000030,USA,2022/03/22,1,1546917,1661
US,3/23/22,272311,3238,,,53,,168822.69063856167,,,Montana,30,84000030,USA,2022/03/23,1,1546917,0
US,3/24/22,272356,3240,,,45,,168850.5889646621,,,Montana,30,84000030,USA,2022/03/24,2,1549212,2295
US,3/25/22,272397,3242,,,41,,168876.00743955362,,,Montana,30,84000030,USA,2022/03/25,2,1549733,521
US,3/28/22,272454,3245,,,57,,168911.34531928084,,,Montana,30,84000030,USA,2022/03/28,3,1549803,1
US,3/29/22,272509,3246,,,55,,168945.4432734036,,,Montana,30,84000030,USA,2022/03/29,1,1549803,0
US,3/30/22,272543,3246,,,34,,168966.5220086795,,,Montana,30,84000030,USA,2022/03/30,0,1549860,57
US,3/31/22,272555,3247,,,12,,168973.96156230627,,,Montana,30,84000030,USA,2022/03/31,1,1549860,0
US,4/1/22,272621,3249,,,66,,169014.87910725357,,,Montana,30,84000030,USA,2022/04/01,2,,
US,3/5/22,476194,4013,,,0,,3481204.7664302946,,,Nebraska,31,84000031,USA,2022/03/05,0,3088418,37
US,3/7/22,476481,4013,,,287,,3483302.8730170336,,,Nebraska,31,84000031,USA,2022/03/07,0,3088452,0
US,3/8/22,476572,4017,,,91,,3483968.126325024,,,Nebraska,31,84000031,USA,2022/03/08,4,3088453,1
US,3/9/22,476690,4022,,,118,,3484830.7624826375,,,Nebraska,31,84000031,USA,2022/03/09,5,3093913,5460
US,3/10/22,476807,4025,,,117,,3485686.0881643393,,,Nebraska,31,84000031,USA,2022/03/10,3,3095065,1152
US,3/11/22,476844,4026,,,37,,3485956.5757730827,,,Nebraska,31,84000031,USA,2022/03/11,1,3095113,48
US,3/14/22,476952,4026,,,108,,3486746.107171577,,,Nebraska,31,84000031,USA,2022/03/14,0,3095197,0
US,3/15/22,477029,4034,,,77,,3487309.0138167995,,,Nebraska,31,84000031,USA,2022/03/15,8,3099837,4640
US,3/16/22,477109,4044,,,80,,3487893.851889758,,,Nebraska,31,84000031,USA,2022/03/16,10,3101078,1241
US,3/17/22,477187,4046,,,78,,3488464.0690108924,,,Nebraska,31,84000031,USA,2022/03/17,2,3101085,7
US,3/18/22,477198,4047,,,11,,3488544.4842459243,,,Nebraska,31,84000031,USA,2022/03/18,1,3102435,1350
US,3/21/22,477240,4047,,,42,,3488851.524234228,,,Nebraska,31,84000031,USA,2022/03/21,0,3102453,0
US,3/22/22,477227,4050,,,,,3488756.488047372,,,Nebraska,31,84000031,USA,2022/03/22,3,3107069,4616
US,3/23/22,477227,4051,,,0,,3488756.488047372,,,Nebraska,31,84000031,USA,2022/03/23,1,3107069,0
US,3/24/22,477183,4053,,,,,3488434.8271072446,,,Nebraska,31,84000031,USA,2022/03/24,2,3109028,1959
US,3/28/22,477803,4053,,,620,,3492967.3221726734,,,Nebraska,31,84000031,USA,2022/03/28,0,3109070,0
US,3/29/22,477831,4123,,,28,,3493172.015498209,,,Nebraska,31,84000031,USA,2022/03/29,70,3109070,0
US,3/30/22,477830,4144,,,,,3493164.705022297,,,Nebraska,31,84000031,USA,2022/03/30,21,3134548,25478
US,4/1/22,477723,4162,,,,,3492382.484099715,,,Nebraska,31,84000031,USA,2022/04/01,18,,
US,3/5/22,685346,9798,,,0,,1225670.6488303884,,,Nevada,32,84000032,USA,2022/03/05,0,4723894,1816
US,3/7/22,685865,9819,,,519,,1226598.826811646,,,Nevada,32,84000032,USA,2022/03/07,21,4729072,2178
US,3/8/22,686236,9843,,,371,,1227262.3220545102,,,Nevada,32,84000032,USA,2022/03/08,24,4730118,1046
US,3/9/22,686806,9874,,,570,,1228281.7082767007,,,Nevada,32,84000032,USA,2022/03/09,31,4732614,2496
US,3/10/22,687506,9894,,,700,,1229533.5860934258,,,Nevada,32,84000032,USA,2022/03/10,20,4745377,12763
US,3/11/22,688054,9921,,,548,,1230513.6275842334,,,Nevada,32,84000032,USA,2022/03/11,27,4749728,4351
US,3/16/22,704466,9948,,,16412,,1259864.7971957936,,,Nevada,32,84000032,USA,2022/03/16,27,4765079,1850
US,3/19/22,704466,9949,,,0,,1259864.7971957936,,,Nevada,32,84000032,USA,2022/03/19,1,4770137,1457
US,3/23/22,705614,10031,,,1148,,1261917.876815223,,,Nevada,32,84000032,USA,2022/03/23,82,4774758,0
US,3/30/22,706772,10091,,,1158,,1263988.8404034623,,,Nevada,32,84000032,USA,2022/03/30,60,4786943,1404
US,4/1/22,706772,10091,,,0,,1263988.8404034623,,,Nevada,32,84000032,USA,2022/04/01,0,,
US,3/5/22,299213,2402,,,0,,693489.547119084,,,New Hampshire,33,84000033,USA,2022/03/05,0,2627136,0
US,3/7/22,299651,2403,,,438,,694504.7049552682,,,New Hampshire,33,84000033,USA,2022/03/07,1,2627136,0
US,3/8/22,299749,2408,,,98,,694731.8407268345,,,New Hampshire,33,84000033,USA,2022/03/08,5,2627136,0
US,3/9/22,299873,2408,,,124,,695019.2370092245,,,New Hampshire,33,84000033,USA,2022/03/09,0,2627136,0
US,3/10/22,299999,2414,,,126,,695311.268715524,,,New Hampshire,33,84000033,USA,2022/03/10,6,2627136,0
US,3/13/22,300185,2415,,,186,,695742.3631391091,,,New Hampshire,33,84000033,USA,2022/03/13,1,2627136,0
US,3/14/22,300511,2417,,,326,,696497.9372363603,,,New Hampshire,33,84000033,USA,2022/03/14,2,2627136,0
US,3/15/22,300550,2424,,,39,,696588.3280025958,,,New Hampshire,33,84000033,USA,2022/03/15,7,2627136,0
US,3/16/22,300692,2428,,,142,,696917.4431001715,,,New Hampshire,33,84000033,USA,2022/03/16,4,2627136,0
US,3/17/22,300799,2431,,,107,,697165.4382793306,,,New Hampshire,33,84000033,USA,2022/03/17,3,2627136,0
US,3/18/22,300941,2434,,,142,,697494.5533769063,,,New Hampshire,33,84000033,USA,2022/03/18,3,2627136,0
US,3/21/22,301308,2436,,,367,,698345.1536643025,,,New Hampshire,33,84000033,USA,2022/03/21,2,2627136,0
US,3/22/22,301385,2442,,,77,,698523.617484819,,,New Hampshire,33,84000033,USA,2022/03/22,6,2627136,0
US,3/24/22,301687,2445,,,302,,699223.566495156,,,New Hampshire,33,84000033,USA,2022/03/24,3,2627136,0
US,3/25/22,301777,2445,,,90,,699432.1605710842,,,New Hampshire,33,84000033,USA,2022/03/25,0,2627136,0
US,3/28/22,302181,2447,,,404,,700368.5162008066,,,New Hampshire,33,84000033,USA,2022/03/28,2,2627136,0
US,3/29/22,302253,2451,,,72,,700535.3914615492,,,New Hampshire,33,84000033,USA,2022/03/29,4,2627136,0
US,3/30/22,302383,2452,,,130,,700836.6940156678,,,New Hampshire,33,84000033,USA,2022/03/30,1,2627136,0
US,3/31/22,302541,2452,,,158,,701202.8925045196,,,New Hampshire,33,84000033,USA,2022/03/31,0,2627136,0
US,4/1/22,302541,2452,,,0,,701202.8925045196,,,New Hampshire,33,84000033,USA,2022/04/01,0,,
US,3/5/22,2173813,33005,,,1042,,2065046.9757853837,,,New Jersey,34,84000034,USA,2022/03/05,6,16621331,10046
US,3/6/22,2174473,33011,,,660,,2065673.9529007191,,,New Jersey,34,84000034,USA,2022/03/06,6,16630880,9549
US,3/7/22,2175439,33027,,,966,,2066591.6194058917,,,New Jersey,34,84000034,USA,2022/03/07,16,16637111,6231
US,3/8/22,2176633,33050,,,1194,,2067725.8780054527,,,New Jersey,34,84000034,USA,2022/03/08,23,16644656,7545
US,3/9/22,2177598,33054,,,965,,2068642.5945452992,,,New Jersey,34,84000034,USA,2022/03/09,4,16653771,9115
US,3/10/22,2178976,33067,,,1378,,2069951.646764893,,,New Jersey,34,84000034,USA,2022/03/10,13,16662231,8460
US,3/11/22,2180216,33087,,,1240,,2071129.6037694623,,,New Jersey,34,84000034,USA,2022/03/11,20,16665159,2928
US,3/12/22,2180930,33102,,,714,,2071807.8790124161,,,New Jersey,34,84000034,USA,2022/03/12,15,16676406,11247
US,3/13/22,2181398,33106,,,468,,2072252.4627851082,,,New Jersey,34,84000034,USA,2022/03/13,4,16682452,6046
US,3/14/22,2181828,33114,,,430,,2072660.9478754026,,,New Jersey,34,84000034,USA,2022/03/14,8,16686479,4027
US,3/15/22,2182557,33126,,,729,,2073353.4725982503,,,New Jersey,34,84000034,USA,2022/03/15,12,16693565,7086
US,3/16/22,2184240,33136,,,1683,,2074952.2642423552,,,New Jersey,34,84000034,USA,2022/03/16,10,16700701,7136
US,3/17/22,2185323,33149,,,1083,,2075981.0766907008,,,New Jersey,34,84000034,USA,2022/03/17,13,16707522,6821
US,3/18/22,2186846,33155,,,1523,,2077427.8738826034,,,New Jersey,34,84000034,USA,2022/03/18,6,16712980,5458
US,3/19/22,2187715,33167,,,869,,2078253.393751128,,,New Jersey,34,84000034,USA,2022/03/19,12,16719870,6890
US,3/20/22,2188228,33169,,,513,,2078740.7259635024,,,New Jersey,34,84000034,USA,2022/03/20,2,16727357,7487
US,3/21/22,2188780,33178,,,552,,2079265.1068236008,,,New Jersey,34,84000034,USA,2022/03/21,9,16731796,4439
US,3/22/22,2189639,33186,,,859,,2080081.127038863,,,New Jersey,34,84000034,USA,2022/03/22,8,16738746,6950
US,3/23/22,2190743,33192,,,1104,,2081129.8887590603,,,New Jersey,34,84000034,USA,2022/03/23,6,16738746,0
US,3/24/22,2192294,33195,,,1551,,2082603.2849800983,,,New Jersey,34,84000034,USA,2022/03/24,3,16751636,12890
US,3/25/22,2193470,33203,,,1176,,2083720.4442037866,,,New Jersey,34,84000034,USA,2022/03/25,8,16755351,3715
US,3/26/22,2194379,33210,,,909,,2084583.962685362,,,New Jersey,34,84000034,USA,2022/03/26,7,16761883,6532
US,3/27/22,2195320,33211,,,941,,2085477.880057378,,,New Jersey,34,84000034,USA,2022/03/27,1,16768564,6681
US,3/28/22,2195963,33217,,,643,,2086088.7077621666,,,New Jersey,34,84000034,USA,2022/03/28,6,16772152,3588
US,3/29/22,2196970,33225,,,1007,,2087045.322845716,,,New Jersey,34,84000034,USA,2022/03/29,8,16778046,5894
US,3/30/22,2198339,33230,,,1369,,2088345.8253773737,,,New Jersey,34,84000034,USA,2022/03/30,5,16784084,6038
US,3/31/22,2199807,33232,,,1468,,2089740.3744763315,,,New Jersey,34,84000034,USA,2022/03/31,2,16784084,0
US,4/1/22,2201324,33238,,,1517,,2091181.4718762764,,,New Jersey,34,84000034,USA,2022/04/01,6,,
US,3/5/22,513311,6972,,,0,,669349.8330899228,,,New Mexico,35,84000035,USA,2022/03/05,0,3780431,2788
US,3/7/22,513994,6988,,,683,,670240.4548299604,,,New Mexico,35,84000035,USA,2022/03/07,16,3784942,1327
US,3/8/22,514170,7010,,,176,,670469.9561861047,,,New Mexico,35,84000035,USA,2022/03/08,22,3785361,419
US,3/9/22,514511,7026,,,341,,670914.6150636345,,,New Mexico,35,84000035,USA,2022/03/09,16,3787068,1707
US,3/10/22,514901,7040,,,390,,671423.1692050907,,,New Mexico,35,84000035,USA,2022/03/10,14,3789313,2245
US,3/11/22,515164,7050,,,263,,671766.1172543293,,,New Mexico,35,84000035,USA,2022/03/11,10,3791804,2491
US,3/14/22,515531,7078,,,367,,672244.6797412894,,,New Mexico,35,84000035,USA,2022/03/14,28,3796914,1113
US,3/15/22,515625,7103,,,94,,672367.2543292302,,,New Mexico,35,84000035,USA,2022/03/15,25,3797556,642
US,3/16/22,515818,7116,,,193,,672618.9234300021,,,New Mexico,35,84000035,USA,2022/03/16,13,3799157,1601
US,3/17/22,516026,7128,,,208,,672890.1523054454,,,New Mexico,35,84000035,USA,2022/03/17,12,3800944,1787
US,3/18/22,516171,7145,,,145,,673079.2301272689,,,New Mexico,35,84000035,USA,2022/03/18,17,3804557,3613
US,3/21/22,516512,7157,,,341,,673523.8890047987,,,New Mexico,35,84000035,USA,2022/03/21,12,3806426,26
US,3/22/22,516628,7171,,,116,,673675.1512622575,,,New Mexico,35,84000035,USA,2022/03/22,14,3809493,3067
US,3/23/22,516858,7180,,,230,,673975.0678072189,,,New Mexico,35,84000035,USA,2022/03/23,9,3809493,0
US,3/24/22,517060,7197,,,202,,674238.4727727936,,,New Mexico,35,84000035,USA,2022/03/24,17,3812885,3392
US,3/25/22,517206,7206,,,146,,674428.8545795953,,,New Mexico,35,84000035,USA,2022/03/25,9,3814852,1967
US,3/28/22,517521,7219,,,315,,674839.6098476945,,,New Mexico,35,84000035,USA,2022/03/28,13,3819592,898
US,3/29/22,517608,7234,,,87,,674953.0565407886,,,New Mexico,35,84000035,USA,2022/03/29,15,3819941,349
US,3/30/22,517742,7255,,,134,,675127.7905278531,,,New Mexico,35,84000035,USA,2022/03/30,21,3821386,1445
US,3/31/22,517858,7274,,,116,,675279.052785312,,,New Mexico,35,84000035,USA,2022/03/31,19,3821386,0
US,4/1/22,517951,7279,,,93,,675400.3233882745,,,New Mexico,35,84000035,USA,2022/04/01,5,,
US,3/5/22,4934709,67523,,,3372,,19807767.02926183,,,New York,36,84000036,USA,2022/03/05,12,37975671,21181
US,3/6/22,4937052,67556,,,2343,,19817171.757716853,,,New York,36,84000036,USA,2022/03/06,33,37993938,18267
US,3/7/22,4938085,67571,,,1033,,19821318.187291775,,,New York,36,84000036,USA,2022/03/07,15,38005878,11940
US,3/8/22,4939110,67607,,,1025,,19825432.50511781,,,New York,36,84000036,USA,2022/03/08,36,38017515,11637
US,3/9/22,4940801,67611,,,1691,,19832220.126038615,,,New York,36,84000036,USA,2022/03/09,4,38035493,17978
US,3/10/22,4942548,67619,,,1747,,19839232.529201623,,,New York,36,84000036,USA,2022/03/10,8,38051819,16326
US,3/11/22,4944777,67643,,,2229,,19848179.665235016,,,New York,36,84000036,USA,2022/03/11,24,38067917,16098
US,3/12/22,4946173,67657,,,1396,,19853783.165415645,,,New York,36,84000036,USA,2022/03/12,14,38083998,16081
US,3/13/22,4948375,67682,,,2202,,19862621.92429655,,,New York,36,84000036,USA,2022/03/13,25,38097367,13369
US,3/14/22,4949357,67688,,,982,,19866563.641472325,,,New York,36,84000036,USA,2022/03/14,6,38104180,6813
US,3/15/22,4952485,67724,,,3128,,19879119.3352868,,,New York,36,84000036,USA,2022/03/15,36,38113774,9594
US,3/16/22,4954524,67764,,,2039,,19887303.81728415,,,New York,36,84000036,USA,2022/03/16,40,38129707,15933
US,3/17/22,4956880,67792,,,2356,,19896760.727331113,,,New York,36,84000036,USA,2022/03/17,28,38144703,14996
US,3/18/22,4958932,67810,,,2052,,19904997.390920404,,,New York,36,84000036,USA,2022/03/18,18,38160074,15371
US,3/19/22,4961120,67813,,,2188,,19913779.954240758,,,New York,36,84000036,USA,2022/03/19,3,38175817,15743
US,3/20/22,4963787,67817,,,2667,,19924485.20852567,,,New York,36,84000036,USA,2022/03/20,4,38190519,14702
US,3/21/22,4964964,67822,,,1177,,19929209.649580542,,,New York,36,84000036,USA,2022/03/21,5,38198524,8005
US,3/22/22,4966567,67842,,,1603,,19935644.0412636,,,New York,36,84000036,USA,2022/03/22,20,38209012,10488
US,3/23/22,4967118,67862,,,551,,19937855.73796813,,,New York,36,84000036,USA,2022/03/23,20,38209012,0
US,3/24/22,4973714,67867,,,6596,,19964331.874924738,,,New York,36,84000036,USA,2022/03/24,5,38238797,29785
US,3/25/22,4977256,67907,,,3542,,19978549.35174407,,,New York,36,84000036,USA,2022/03/25,40,38253730,14933
US,3/26/22,4977256,67917,,,0,,19978549.35174407,,,New York,36,84000036,USA,2022/03/26,10,38267957,14227
US,3/27/22,4983164,67929,,,5908,,20002263.878296472,,,New York,36,84000036,USA,2022/03/27,12,38274701,6744
US,3/28/22,4985450,67939,,,2286,,20011439.81054068,,,New York,36,84000036,USA,2022/03/28,10,38278324,3623
US,3/29/22,4987844,67953,,,2394,,20021049.251394853,,,New York,36,84000036,USA,2022/03/29,14,38298545,20221
US,3/30/22,4990971,67960,,,3127,,20033600.93124072,,,New York,36,84000036,USA,2022/03/30,7,38309963,11418
US,3/31/22,4995734,67967,,,4763,,20052719.463733792,,,New York,36,84000036,USA,2022/03/31,7,38309963,0
US,4/1/22,4999568,67983,,,3834,,20068109.01938747,,,New York,36,84000036,USA,2022/04/01,16,,
US,3/5/22,2598014,22763,,,0,,14378294.316232221,,,North Carolina,37,84000037,USA,2022/03/05,0,16164007,10435
US,3/7/22,2602244,22802,,,4230,,14401704.576899663,,,North Carolina,37,84000037,USA,2022/03/07,39,16181619,6908
US,3/8/22,2603138,22817,,,894,,14406652.27738115,,,North Carolina,37,84000037,USA,2022/03/08,15,16184512,2893
US,3/9/22,2604971,22864,,,1833,,14416796.723670375,,,North Carolina,37,84000037,USA,2022/03/09,47,16191201,6689
US,3/10/22,2606754,22892,,,1783,,14426664.452930434,,,North Carolina,37,84000037,USA,2022/03/10,28,16201828,10627
US,3/11/22,2608603,22922,,,1849,,14436897.44866899,,,North Carolina,37,84000037,USA,2022/03/11,30,16209282,7454
US,3/14/22,2611733,22961,,,3130,,14454219.934694782,,,North Carolina,37,84000037,USA,2022/03/14,39,16235815,6015
US,3/15/22,2612382,22966,,,649,,14457811.721733356,,,North Carolina,37,84000037,USA,2022/03/15,5,16240003,4188
US,3/17/22,2615124,23030,,,2742,,14472986.883612817,,,North Carolina,37,84000037,USA,2022/03/17,64,16252421,6361
US,3/18/22,2616864,23058,,,1740,,14482616.636227794,,,North Carolina,37,84000037,USA,2022/03/18,28,16257965,5544
US,3/21/22,2619372,23078,,,2508,,14496496.762410758,,,North Carolina,37,84000037,USA,2022/03/21,20,16264909,0
US,3/22/22,2620191,23091,,,819,,14501029.387348497,,,North Carolina,37,84000037,USA,2022/03/22,13,16264909,0
US,3/23/22,2621793,23130,,,1602,,14509895.400962975,,,North Carolina,37,84000037,USA,2022/03/23,39,16264909,0
US,3/24/22,2623081,23159,,,1288,,14517023.631634291,,,North Carolina,37,84000037,USA,2022/03/24,29,16286180,21271
US,3/25/22,2624305,23174,,,1224,,14523797.664508274,,,North Carolina,37,84000037,USA,2022/03/25,15,16291629,5449
US,3/28/22,2626596,23190,,,2291,,14536476.83878466,,,North Carolina,37,84000037,USA,2022/03/28,16,16310239,4903
US,3/29/22,2627220,23194,,,624,,14539930.26730865,,,North Carolina,37,84000037,USA,2022/03/29,4,16313892,3653
US,3/30/22,2628287,23203,,,1067,,14545835.408711052,,,North Carolina,37,84000037,USA,2022/03/30,9,16318216,4324
US,3/31/22,2629362,23207,,,1075,,14551784.82483812,,,North Carolina,37,84000037,USA,2022/03/31,4,16318216,0
US,4/1/22,2630506,23215,,,1144,,14558116.110465437,,,North Carolina,37,84000037,USA,2022/04/01,8,,
US,3/5/22,238702,2211,,,73,,635031.5251802389,,,North Dakota,38,84000038,USA,2022/03/05,5,1064926,154
US,3/6/22,238753,2211,,,51,,635167.2031711405,,,North Dakota,38,84000038,USA,2022/03/06,0,1064964,38
US,3/7/22,238784,2211,,,31,,635249.6741067866,,,North Dakota,38,84000038,USA,2022/03/07,0,1064964,0
US,3/8/22,238863,2214,,,79,,635459.8419750459,,,North Dakota,38,84000038,USA,2022/03/08,3,1065085,121
US,3/9/22,238955,2218,,,92,,635704.5944292214,,,North Dakota,38,84000038,USA,2022/03/09,4,1065205,120
US,3/10/22,239043,2223,,,88,,635938.7054723456,,,North Dakota,38,84000038,USA,2022/03/10,5,1065336,131
US,3/11/22,239125,2223,,,82,,636156.8543988933,,,North Dakota,38,84000038,USA,2022/03/11,0,1253050,187714
US,3/12/22,239189,2226,,,64,,636327.116975711,,,North Dakota,38,84000038,USA,2022/03/12,3,1253050,0
US,3/13/22,239216,2226,,,27,,636398.9465003059,,,North Dakota,38,84000038,USA,2022/03/13,0,1253050,0
US,3/14/22,239230,2226,,,14,,636436.1914389848,,,North Dakota,38,84000038,USA,2022/03/14,0,1253050,0
US,3/15/22,239283,2228,,,53,,636577.1901354119,,,North Dakota,38,84000038,USA,2022/03/15,2,1253050,0
US,3/16/22,239339,2229,,,56,,636726.1698901274,,,North Dakota,38,84000038,USA,2022/03/16,1,1253050,0
US,3/17/22,239391,2232,,,52,,636864.5082337918,,,North Dakota,38,84000038,USA,2022/03/17,3,1253050,0
US,3/23/22,239426,2232,,,35,,636957.6205804889,,,North Dakota,38,84000038,USA,2022/03/23,0,1253050,0
US,3/25/22,239672,2232,,,246,,637612.067360132,,,North Dakota,38,84000038,USA,2022/03/25,0,1253050,0
US,4/1/22,239863,2232,,,191,,638120.1947378223,,,North Dakota,38,84000038,USA,2022/04/01,0,,
US,3/5/22,10074,30,,,75,,18268.533294646742,,,Northern Mariana Islands,69,580,MNP,2022/03/05,0,108223,0
US,3/6/22,10126,30,,,52,,18362.83185840708,,,Northern Mariana Islands,69,580,MNP,2022/03/06,0,108260,37
US,3/7/22,10155,30,,,29,,18415.42144204265,,,Northern Mariana Islands,69,580,MNP,2022/03/07,0,108284,24
US,3/8/22,10229,30,,,74,,18549.615552009283,,,Northern Mariana Islands,69,580,MNP,2022/03/08,0,108317,33
US,3/9/22,10284,30,,,55,,18649.354417525024,,,Northern Mariana Islands,69,580,MNP,2022/03/09,0,108349,32
US,3/10/22,10326,30,,,42,,18725.51864210068,,,Northern Mariana Islands,69,580,MNP,2022/03/10,0,108444,95
US,3/11/22,10379,30,,,53,,18821.630639779487,,,Northern Mariana Islands,69,580,MNP,2022/03/11,0,108582,138
US,3/14/22,10472,31,,,93,,18990.27999419701,,,Northern Mariana Islands,69,580,MNP,2022/03/14,1,108680,42
US,3/15/22,10535,31,,,63,,19104.526331060497,,,Northern Mariana Islands,69,580,MNP,2022/03/15,0,108729,49
US,3/16/22,10575,31,,,40,,19177.06368779922,,,Northern Mariana Islands,69,580,MNP,2022/03/16,0,108560,
US,3/17/22,10634,31,,,59,,19284.056288988828,,,Northern Mariana Islands,69,580,MNP,2022/03/17,0,109077,517
US,3/18/22,10689,31,,,55,,19383.79515450457,,,Northern Mariana Islands,69,580,MNP,2022/03/18,0,109243,166
US,3/21/22,10734,31,,,45,,19465.39968083563,,,Northern Mariana Islands,69,580,MNP,2022/03/21,0,109289,46
US,3/22/22,10777,31,,,43,,19543.377339329756,,,Northern Mariana Islands,69,580,MNP,2022/03/22,0,109317,28
US,3/23/22,10985,31,,,208,,19920.5715943711,,,Northern Mariana Islands,69,580,MNP,2022/03/23,0,109317,0
US,3/24/22,10997,32,,,12,,19942.332801392717,,,Northern Mariana Islands,69,580,MNP,2022/03/24,1,109446,129
US,3/25/22,11022,33,,,25,,19987.66864935442,,,Northern Mariana Islands,69,580,MNP,2022/03/25,1,109580,134
US,3/28/22,11065,33,,,43,,20065.646307848543,,,Northern Mariana Islands,69,580,MNP,2022/03/28,0,109627,47
US,4/1/22,11153,33,,,88,,20225.228492673727,,,Northern Mariana Islands,69,580,MNP,2022/04/01,0,,
US,3/5/22,2659138,37914,,,862,,12213567.885357339,,,Ohio,39,84000039,USA,2022/03/05,18,17267990,8254
US,3/6/22,2659498,37932,,,360,,12215221.385265479,,,Ohio,39,84000039,USA,2022/03/06,18,17276301,8311
US,3/7/22,2659929,37948,,,431,,12217200.992099945,,,Ohio,39,84000039,USA,2022/03/07,16,17281088,4787
US,3/8/22,2660728,37962,,,799,,12220870.843284953,,,Ohio,39,84000039,USA,2022/03/08,14,17283669,2581
US,3/9/22,2661557,37969,,,829,,12224678.486128973,,,Ohio,39,84000039,USA,2022/03/09,7,17290315,6646
US,3/10/22,2662425,37977,,,868,,12228665.258129708,,,Ohio,39,84000039,USA,2022/03/10,8,17297241,6926
US,3/11/22,2663019,37982,,,594,,12231393.532978138,,,Ohio,39,84000039,USA,2022/03/11,5,17304361,7120
US,3/12/22,2663518,37990,,,499,,12233685.46757303,,,Ohio,39,84000039,USA,2022/03/12,8,17311637,7276
US,3/13/22,2663835,38002,,,317,,12235141.466103252,,,Ohio,39,84000039,USA,2022/03/13,12,17318408,6771
US,3/14/22,2663835,38008,,,0,,12235141.466103252,,,Ohio,39,84000039,USA,2022/03/14,6,17322904,4496
US,3/15/22,2663835,38016,,,0,,12235141.466103252,,,Ohio,39,84000039,USA,2022/03/15,8,17325237,2333
US,3/16/22,2663835,38021,,,0,,12235141.466103252,,,Ohio,39,84000039,USA,2022/03/16,5,17330784,5547
US,3/17/22,2666030,38026,,,2195,,12245223.222487599,,,Ohio,39,84000039,USA,2022/03/17,5,17337160,6376
US,3/18/22,2666030,38030,,,0,,12245223.222487599,,,Ohio,39,84000039,USA,2022/03/18,4,17344590,7430
US,3/19/22,2666030,38032,,,0,,12245223.222487599,,,Ohio,39,84000039,USA,2022/03/19,2,17350832,6242
US,3/20/22,2666030,38035,,,0,,12245223.222487599,,,Ohio,39,84000039,USA,2022/03/20,3,17357074,6242
US,3/21/22,2666030,38037,,,0,,12245223.222487599,,,Ohio,39,84000039,USA,2022/03/21,2,17361040,3966
US,3/22/22,2666030,38041,,,0,,12245223.222487599,,,Ohio,39,84000039,USA,2022/03/22,4,17362967,1927
US,3/23/22,2666030,38042,,,0,,12245223.222487599,,,Ohio,39,84000039,USA,2022/03/23,1,17362967,0
US,3/24/22,2669698,38042,,,3668,,12262070.549329413,,,Ohio,39,84000039,USA,2022/03/24,0,17375094,12127
US,3/31/22,2672801,38042,,,3103,,12276322.799926512,,,Ohio,39,84000039,USA,2022/03/31,0,17404620,0
US,4/1/22,2672801,38042,,,0,,12276322.799926512,,,Ohio,39,84000039,USA,2022/04/01,0,,
US,3/5/22,1024471,14835,,,0,,5068878.333580723,,,Oklahoma,40,84000040,USA,2022/03/05,0,5734183,3507
US,3/10/22,1026650,15053,,,2179,,5079659.5913116615,,,Oklahoma,40,84000040,USA,2022/03/10,218,5745840,5375
US,3/17/22,1029634,15173,,,2984,,5094423.828608184,,,Oklahoma,40,84000040,USA,2022/03/17,120,5756328,404
US,3/24/22,1031448,15383,,,1814,,5103399.139082678,,,Oklahoma,40,84000040,USA,2022/03/24,210,5774857,4381
US,3/31/22,1033258,15520,,,1810,,5112354.658354362,,,Oklahoma,40,84000040,USA,2022/03/31,137,5784281,0
US,4/1/22,1033258,15520,,,0,,5112354.658354362,,,Oklahoma,40,84000040,USA,2022/04/01,0,,
US,3/5/22,696717,6709,,,0,,650529.4117647059,,,Oregon,41,84000041,USA,2022/03/05,0,7466861,4068
US,3/7/22,697775,6743,,,1058,,651517.2735760971,,,Oregon,41,84000041,USA,2022/03/07,34,7471658,0
US,3/8/22,698127,6772,,,352,,651845.9383753501,,,Oregon,41,84000041,USA,2022/03/08,29,7472879,1221
US,3/9/22,698564,6800,,,437,,652253.9682539683,,,Oregon,41,84000041,USA,2022/03/09,28,7476091,3212
US,3/10/22,698982,6854,,,418,,652644.2577030812,,,Oregon,41,84000041,USA,2022/03/10,54,7479579,3488
US,3/11/22,699362,6869,,,380,,652999.066293184,,,Oregon,41,84000041,USA,2022/03/11,15,7483133,3554
US,3/14/22,699960,6885,,,598,,653557.4229691877,,,Oregon,41,84000041,USA,2022/03/14,16,7494391,7686
US,3/15/22,700361,6899,,,401,,653931.8394024277,,,Oregon,41,84000041,USA,2022/03/15,14,7496510,2119
US,3/16/22,700660,6933,,,299,,654211.0177404295,,,Oregon,41,84000041,USA,2022/03/16,34,7499331,2821
US,3/17/22,700960,6960,,,300,,654491.1297852474,,,Oregon,41,84000041,USA,2022/03/17,27,7502272,2941
US,3/18/22,701198,6971,,,238,,654713.3520074696,,,Oregon,41,84000041,USA,2022/03/18,11,7505536,3264
US,3/21/22,701729,6975,,,531,,655209.1503267974,,,Oregon,41,84000041,USA,2022/03/21,4,7514301,2001
US,3/22/22,701992,6983,,,263,,655454.7152194211,,,Oregon,41,84000041,USA,2022/03/22,8,7515384,1083
US,3/23/22,702285,7011,,,293,,655728.2913165266,,,Oregon,41,84000041,USA,2022/03/23,28,7515384,0
US,3/24/22,702566,7033,,,281,,655990.6629318394,,,Oregon,41,84000041,USA,2022/03/24,22,7520565,5181
US,3/25/22,702750,7035,,,184,,656162.4649859944,,,Oregon,41,84000041,USA,2022/03/25,2,7523466,2901
US,3/28/22,703132,7074,,,382,,656519.1409897292,,,Oregon,41,84000041,USA,2022/03/28,39,7531218,4657
US,3/29/22,703465,7115,,,333,,656830.0653594771,,,Oregon,41,84000041,USA,2022/03/29,41,7531755,537
US,3/30/22,703838,7139,,,373,,657178.3380018674,,,Oregon,41,84000041,USA,2022/03/30,24,7534423,2668
US,3/31/22,704152,7144,,,314,,657471.5219421102,,,Oregon,41,84000041,USA,2022/03/31,5,7534423,0
US,4/1/22,704515,7147,,,363,,657810.4575163398,,,Oregon,41,84000041,USA,2022/04/01,3,,
US,3/5/22,2763033,43525,,,940,,615295.3516026883,,,Pennsylvania,42,84000042,USA,2022/03/05,0,22159961,209
US,3/6/22,2763589,43600,,,556,,615419.1663437685,,,Pennsylvania,42,84000042,USA,2022/03/06,75,22160167,206
US,3/7/22,2764367,43600,,,778,,615592.4179059275,,,Pennsylvania,42,84000042,USA,2022/03/07,0,22160761,594
US,3/8/22,2765682,43692,,,1315,,615885.2531298852,,,Pennsylvania,42,84000042,USA,2022/03/08,92,22164396,3635
US,3/9/22,2766523,43730,,,841,,616072.5340601882,,,Pennsylvania,42,84000042,USA,2022/03/09,38,22180705,16309
US,3/10/22,2767631,43767,,,1108,,616319.2727888157,,,Pennsylvania,42,84000042,USA,2022/03/10,37,22192408,11703
US,3/11/22,2768513,43808,,,882,,616515.6839428315,,,Pennsylvania,42,84000042,USA,2022/03/11,41,22201225,8817
US,3/12/22,2769336,43834,,,823,,616698.9564822362,,,Pennsylvania,42,84000042,USA,2022/03/12,26,22213929,12704
US,3/13/22,2769702,43839,,,366,,616780.4604305011,,,Pennsylvania,42,84000042,USA,2022/03/13,5,22214070,141
US,3/14/22,2770077,43845,,,375,,616863.9685742153,,,Pennsylvania,42,84000042,USA,2022/03/14,6,22228804,14734
US,3/15/22,2771090,43909,,,1013,,617089.5519064353,,,Pennsylvania,42,84000042,USA,2022/03/15,64,22234754,5950
US,3/16/22,2772116,43962,,,1026,,617318.0301876372,,,Pennsylvania,42,84000042,USA,2022/03/16,53,22243436,8682
US,3/17/22,2772886,43992,,,770,,617489.5002427304,,,Pennsylvania,42,84000042,USA,2022/03/17,30,22252378,8942
US,3/18/22,2773762,44011,,,876,,617684.5752664467,,,Pennsylvania,42,84000042,USA,2022/03/18,19,22261305,8927
US,3/19/22,2774453,44011,,,691,,617838.452939264,,,Pennsylvania,42,84000042,USA,2022/03/19,0,22270174,8869
US,3/20/22,2774815,44049,,,362,,617919.066133996,,,Pennsylvania,42,84000042,USA,2022/03/20,38,22270325,151
US,3/21/22,2775183,44050,,,368,,618001.0154590276,,,Pennsylvania,42,84000042,USA,2022/03/21,1,22286111,15786
US,3/22/22,2775728,44091,,,545,,618122.3806278922,,,Pennsylvania,42,84000042,USA,2022/03/22,41,22289088,2977
US,3/23/22,2776302,44115,,,574,,618250.2037598706,,,Pennsylvania,42,84000042,USA,2022/03/23,24,22289088,0
US,3/24/22,2777260,44152,,,958,,618463.5392310125,,,Pennsylvania,42,84000042,USA,2022/03/24,37,22314165,25077
US,3/25/22,2777986,44180,,,726,,618625.2109972431,,,Pennsylvania,42,84000042,USA,2022/03/25,28,22323987,9822
US,3/26/22,2778646,44208,,,660,,618772.1853301801,,,Pennsylvania,42,84000042,USA,2022/03/26,28,22333948,9961
US,3/27/22,2779049,44209,,,403,,618861.9287486249,,,Pennsylvania,42,84000042,USA,2022/03/27,1,22334165,217
US,3/28/22,2779328,44211,,,279,,618924.0588075483,,,Pennsylvania,42,84000042,USA,2022/03/28,2,22345972,11807
US,3/29/22,2779921,44238,,,593,,619056.1130188083,,,Pennsylvania,42,84000042,USA,2022/03/29,27,22350739,4767
US,3/30/22,2780481,44260,,,560,,619180.8185134215,,,Pennsylvania,42,84000042,USA,2022/03/30,22,22357701,6962
US,3/31/22,2781353,44275,,,872,,619375.0027836048,,,Pennsylvania,42,84000042,USA,2022/03/31,15,22357701,0
US,4/1/22,2782174,44295,,,821,,619557.829946243,,,Pennsylvania,42,84000042,USA,2022/04/01,20,,
US,3/5/22,475007,4133,,,316,,,,,Puerto Rico,72,630,PRI,2022/03/05,3,6971581,28
US,3/6/22,475195,4134,,,188,,,,,Puerto Rico,72,630,PRI,2022/03/06,1,6971613,32
US,3/7/22,475341,4135,,,146,,,,,Puerto Rico,72,630,PRI,2022/03/07,1,6971613,0
US,3/8/22,475364,4140,,,23,,,,,Puerto Rico,72,630,PRI,2022/03/08,5,6994023,22410
US,3/9/22,475546,4144,,,182,,,,,Puerto Rico,72,630,PRI,2022/03/09,4,6994072,49
US,3/10/22,475813,4146,,,267,,,,,Puerto Rico,72,630,PRI,2022/03/10,2,6994077,5
US,3/11/22,476023,4148,,,210,,,,,Puerto Rico,72,630,PRI,2022/03/11,2,7012591,18514
US,3/12/22,476202,4150,,,179,,,,,Puerto Rico,72,630,PRI,2022/03/12,2,7012593,2
US,3/13/22,476497,4150,,,295,,,,,Puerto Rico,72,630,PRI,2022/03/13,0,7012597,4
US,3/14/22,476536,4150,,,39,,,,,Puerto Rico,72,630,PRI,2022/03/14,0,7012597,0
US,3/15/22,476643,4152,,,107,,,,,Puerto Rico,72,630,PRI,2022/03/15,2,7025324,12727
US,3/16/22,476848,4152,,,205,,,,,Puerto Rico,72,630,PRI,2022/03/16,0,7026497,1173
US,3/17/22,477293,4153,,,445,,,,,Puerto Rico,72,630,PRI,2022/03/17,1,7027871,1374
US,3/18/22,477547,4153,,,254,,,,,Puerto Rico,72,630,PRI,2022/03/18,0,7034058,6187
US,3/19/22,477768,4154,,,221,,,,,Puerto Rico,72,630,PRI,2022/03/19,1,7040342,6284
US,3/20/22,478055,4154,,,287,,,,,Puerto Rico,72,630,PRI,2022/03/20,0,7040344,2
US,3/21/22,478184,4154,,,129,,,,,Puerto Rico,72,630,PRI,2022/03/21,0,7040344,0
US,3/22/22,478222,4155,,,38,,,,,Puerto Rico,72,630,PRI,2022/03/22,1,7048800,8456
US,3/23/22,478473,4158,,,251,,,,,Puerto Rico,72,630,PRI,2022/03/23,3,7048800,0
US,3/24/22,478719,4159,,,246,,,,,Puerto Rico,72,630,PRI,2022/03/24,1,7048803,3
US,3/25/22,479033,4159,,,314,,,,,Puerto Rico,72,630,PRI,2022/03/25,0,7059736,10933
US,3/26/22,479647,4159,,,614,,,,,Puerto Rico,72,630,PRI,2022/03/26,0,7067846,8110
US,3/27/22,479903,4159,,,256,,,,,Puerto Rico,72,630,PRI,2022/03/27,0,7067847,1
US,3/28/22,480072,4159,,,169,,,,,Puerto Rico,72,630,PRI,2022/03/28,0,7067847,0
US,3/29/22,480110,4163,,,38,,,,,Puerto Rico,72,630,PRI,2022/03/29,4,7078081,10234
US,3/30/22,480515,4166,,,405,,,,,Puerto Rico,72,630,PRI,2022/03/30,3,7083158,5077
US,3/31/22,481010,4170,,,495,,,,,Puerto Rico,72,630,PRI,2022/03/31,4,7083158,0
US,4/1/22,481611,4170,,,601,,,,,Puerto Rico,72,630,PRI,2022/04/01,0,,
US,3/5/22,356783,3417,,,0,,284114.92550387414,,,Rhode Island,44,84000044,USA,2022/03/05,0,2136621,1087
US,3/7/22,357136,3419,,,353,,284396.0279350518,,,Rhode Island,44,84000044,USA,2022/03/07,2,2138830,902
US,3/8/22,357266,3419,,,130,,284499.5500768453,,,Rhode Island,44,84000044,USA,2022/03/08,0,2139290,460
US,3/9/22,357440,3419,,,174,,284638.110482015,,,Rhode Island,44,84000044,USA,2022/03/09,0,2140229,939
US,3/10/22,357647,3421,,,207,,284802.94958471693,,,Rhode Island,44,84000044,USA,2022/03/10,2,2141380,1151
US,3/11/22,357802,3421,,,155,,284926.3798307015,,,Rhode Island,44,84000044,USA,2022/03/11,0,2142366,986
US,3/14/22,358209,3422,,,407,,285250.48376693187,,,Rhode Island,44,84000044,USA,2022/03/14,1,2144985,656
US,3/15/22,358429,3423,,,220,,285425.67508381314,,,Rhode Island,44,84000044,USA,2022/03/15,1,2145436,451
US,3/16/22,358637,3427,,,208,,285591.3105106827,,,Rhode Island,44,84000044,USA,2022/03/16,4,2146406,970
US,3/17/22,358880,3429,,,243,,285784.8172834197,,,Rhode Island,44,84000044,USA,2022/03/17,2,2147310,904
US,3/18/22,359064,3429,,,184,,285931.3409302659,,,Rhode Island,44,84000044,USA,2022/03/18,0,2148186,876
US,3/21/22,359470,3431,,,406,,286254.6485423286,,,Rhode Island,44,84000044,USA,2022/03/21,2,2150533,645
US,3/22/22,359610,3431,,,140,,286366.1339257985,,,Rhode Island,44,84000044,USA,2022/03/22,0,2151069,536
US,3/23/22,359823,3433,,,213,,286535.7509735063,,,Rhode Island,44,84000044,USA,2022/03/23,2,2151069,0
US,3/24/22,360016,3435,,,193,,286689.44153786125,,,Rhode Island,44,84000044,USA,2022/03/24,2,2152910,1841
US,3/25/22,360172,3438,,,156,,286813.6681080134,,,Rhode Island,44,84000044,USA,2022/03/25,3,2153864,954
US,3/28/22,360594,3521,,,422,,287149.7169067584,,,Rhode Island,44,84000044,USA,2022/03/28,83,2156374,528
US,3/29/22,360759,3522,,,165,,287281.11039441935,,,Rhode Island,44,84000044,USA,2022/03/29,1,2156696,322
US,3/30/22,360959,3522,,,200,,287440.3752279478,,,Rhode Island,44,84000044,USA,2022/03/30,0,2157555,859
US,3/31/22,361262,3522,,,303,,287681.6614507434,,,Rhode Island,44,84000044,USA,2022/03/31,0,2157555,0
US,4/1/22,361508,3522,,,246,,287877.55719598336,,,Rhode Island,44,84000044,USA,2022/04/01,0,,
US,3/5/22,1462846,16961,,,0,,520624.67301826825,,,South Carolina,45,84000045,USA,2022/03/05,0,7295104,3380
US,3/7/22,1463842,17186,,,996,,520979.14790785074,,,South Carolina,45,84000045,USA,2022/03/07,225,7308583,3188
US,3/8/22,1463920,17221,,,78,,521006.90798956505,,,South Carolina,45,84000045,USA,2022/03/08,35,7309834,1251
US,3/9/22,1464224,17251,,,304,,521115.1011285541,,,South Carolina,45,84000045,USA,2022/03/09,30,7312221,2387
US,3/10/22,1464590,17331,,,366,,521245.35997352115,,,South Carolina,45,84000045,USA,2022/03/10,80,7328492,16271
US,3/11/22,1465127,17372,,,537,,521436.4774591696,,,South Carolina,45,84000045,USA,2022/03/11,41,7331455,2963
US,3/15/22,1465739,17380,,,612,,521654.2873310817,,,South Carolina,45,84000045,USA,2022/03/15,8,7339799,1259
US,3/22/22,1467115,17493,,,1376,,522144.00364440045,,,South Carolina,45,84000045,USA,2022/03/22,113,7356754,1275
US,3/29/22,1468140,17591,,,1025,,522508.79959000496,,,South Carolina,45,84000045,USA,2022/03/29,98,7372113,14666
US,4/1/22,1468140,17591,,,0,,522508.79959000496,,,South Carolina,45,84000045,USA,2022/04/01,0,,
US,3/5/22,236276,2827,,,0,,8573149.492017416,,,South Dakota,46,84000046,USA,2022/03/05,0,1359355,1030
US,3/7/22,236351,2834,,,75,,8575870.827285921,,,South Dakota,46,84000046,USA,2022/03/07,7,1359570,45
US,3/8/22,236432,2843,,,81,,8578809.869375907,,,South Dakota,46,84000046,USA,2022/03/08,9,1360525,955
US,3/9/22,236503,2844,,,71,,8581386.066763425,,,South Dakota,46,84000046,USA,2022/03/09,1,1361178,653
US,3/10/22,236552,2848,,,49,,8583164.005805515,,,South Dakota,46,84000046,USA,2022/03/10,4,1361824,646
US,3/11/22,236602,2853,,,50,,8584978.229317851,,,South Dakota,46,84000046,USA,2022/03/11,5,1362541,717
US,3/14/22,236648,2859,,,46,,8586647.314949201,,,South Dakota,46,84000046,USA,2022/03/14,6,1363509,50
US,3/15/22,236715,2861,,,67,,8589078.374455733,,,South Dakota,46,84000046,USA,2022/03/15,2,1364375,866
US,3/16/22,236750,2870,,,35,,8590348.330914369,,,South Dakota,46,84000046,USA,2022/03/16,9,1365121,746
US,3/17/22,236797,2871,,,47,,8592053.701015966,,,South Dakota,46,84000046,USA,2022/03/17,1,1365848,727
US,3/18/22,236845,2875,,,48,,8593795.355587808,,,South Dakota,46,84000046,USA,2022/03/18,4,1366541,693
US,3/23/22,236955,2880,,,110,,8597786.647314949,,,South Dakota,46,84000046,USA,2022/03/23,5,1368137,0
US,3/30/22,237109,2883,,,154,,8603374.455732947,,,South Dakota,46,84000046,USA,2022/03/30,3,1373393,1801
US,4/1/22,237109,2883,,,0,,8603374.455732947,,,South Dakota,46,84000046,USA,2022/04/01,0,,
US,3/5/22,2012773,24687,,,338,,1391410.7163842744,,,Tennessee,47,84000047,USA,2022/03/05,1,9624302,5457
US,3/6/22,2013051,24688,,,278,,1391602.8951243286,,,Tennessee,47,84000047,USA,2022/03/06,1,9624353,51
US,3/7/22,2013654,24714,,,603,,1392019.7432547335,,,Tennessee,47,84000047,USA,2022/03/07,26,9624354,1
US,3/8/22,2014357,24786,,,703,,1392505.7204283236,,,Tennessee,47,84000047,USA,2022/03/08,72,9634533,10179
US,3/9/22,2014989,24835,,,632,,1392942.6159812522,,,Tennessee,47,84000047,USA,2022/03/09,49,9638988,4455
US,3/10/22,2015425,25018,,,436,,1393244.0186095384,,,Tennessee,47,84000047,USA,2022/03/10,183,9644453,5465
US,3/11/22,2015898,25232,,,473,,1393570.998983803,,,Tennessee,47,84000047,USA,2022/03/11,214,9648899,4446
US,3/12/22,2016037,25232,,,139,,1393667.0883538302,,,Tennessee,47,84000047,USA,2022/03/12,0,9653526,4627
US,3/13/22,2016210,25238,,,173,,1393786.68159854,,,Tennessee,47,84000047,USA,2022/03/13,6,9653556,30
US,3/14/22,2016578,25384,,,368,,1394041.0764774606,,,Tennessee,47,84000047,USA,2022/03/14,146,9653557,1
US,3/15/22,2016974,25392,,,396,,1394314.8274884727,,,Tennessee,47,84000047,USA,2022/03/15,8,9661414,7857
US,3/16/22,2017338,25409,,,364,,1394566.4572056658,,,Tennessee,47,84000047,USA,2022/03/16,17,9665002,3588
US,3/17/22,2017648,25424,,,310,,1394780.757239539,,,Tennessee,47,84000047,USA,2022/03/17,15,9669251,4249
US,3/18/22,2017983,25435,,,335,,1395012.3395342084,,,Tennessee,47,84000047,USA,2022/03/18,11,9673268,4017
US,3/19/22,2018150,25435,,,167,,1395127.7850363273,,,Tennessee,47,84000047,USA,2022/03/19,0,9677342,4074
US,3/20/22,2018308,25439,,,158,,1395237.0089245595,,,Tennessee,47,84000047,USA,2022/03/20,4,9677357,15
US,3/21/22,2018608,25467,,,300,,1395444.3960541142,,,Tennessee,47,84000047,USA,2022/03/21,28,9677357,0
US,3/22/22,2018948,25477,,,340,,1395679.434800943,,,Tennessee,47,84000047,USA,2022/03/22,10,9685567,8210
US,3/23/22,2019274,25508,,,326,,1395904.7954817258,,,Tennessee,47,84000047,USA,2022/03/23,31,9685567,0
US,3/24/22,2019526,25516,,,252,,1396079.0006705518,,,Tennessee,47,84000047,USA,2022/03/24,8,9693506,7939
US,3/25/22,2019744,25516,,,218,,1396229.701984695,,,Tennessee,47,84000047,USA,2022/03/25,0,9697482,3976
US,3/26/22,2019886,25516,,,142,,1396327.8652260173,,,Tennessee,47,84000047,USA,2022/03/26,0,9701683,4201
US,3/27/22,2019535,25519,,,,,1396085.2222844383,,,Tennessee,47,84000047,USA,2022/03/27,3,9701693,10
US,3/29/22,2019965,25522,,,430,,1396382.4771701335,,,Tennessee,47,84000047,USA,2022/03/29,3,9709355,7662
US,3/30/22,2020262,25590,,,297,,1396587.7904283926,,,Tennessee,47,84000047,USA,2022/03/30,68,9714188,4833
US,3/31/22,2020500,25599,,,238,,1396752.3175511728,,,Tennessee,47,84000047,USA,2022/03/31,9,9714188,0
US,4/1/22,2020805,25611,,,305,,1396963.1611328868,,,Tennessee,47,84000047,USA,2022/04/01,12,,
US,3/5/22,6638712,85711,,,4018,,56070202.7027027,,,Texas,48,84000048,USA,2022/03/05,101,44567405,33344
US,3/6/22,6639270,85757,,,558,,56074915.54054054,,,Texas,48,84000048,USA,2022/03/06,46,44568037,632
US,3/7/22,6642949,85800,,,3679,,56105988.175675675,,,Texas,48,84000048,USA,2022/03/07,43,44604992,36955
US,3/8/22,6647959,85914,,,5010,,56148302.36486486,,,Texas,48,84000048,USA,2022/03/08,114,44629969,24977
US,3/9/22,6653227,86046,,,5268,,56192795.60810811,,,Texas,48,84000048,USA,2022/03/09,132,44661265,31296
US,3/10/22,6659163,86197,,,5936,,56242930.74324324,,,Texas,48,84000048,USA,2022/03/10,151,44693438,32173
US,3/11/22,6667445,86298,,,8282,,56312880.067567565,,,Texas,48,84000048,USA,2022/03/11,101,44726431,32993
US,3/12/22,6670677,86389,,,3232,,56340177.36486486,,,Texas,48,84000048,USA,2022/03/12,91,44755582,29151
US,3/13/22,6671818,86426,,,1141,,56349814.18918919,,,Texas,48,84000048,USA,2022/03/13,37,44777465,21883
US,3/14/22,6673290,86453,,,1472,,56362246.62162162,,,Texas,48,84000048,USA,2022/03/14,27,44788647,11182
US,3/15/22,6676625,86524,,,3335,,56390413.85135135,,,Texas,48,84000048,USA,2022/03/15,71,44832725,44078
US,3/16/22,6679619,86626,,,2994,,56415701.01351351,,,Texas,48,84000048,USA,2022/03/16,102,44868529,35804
US,3/17/22,6684621,86746,,,5002,,56457947.63513514,,,Texas,48,84000048,USA,2022/03/17,120,44896223,27694
US,3/18/22,6687899,86589,,,3278,,56485633.44594595,,,Texas,48,84000048,USA,2022/03/18,,44926745,30522
US,3/19/22,6689421,86650,,,1522,,56498488.175675675,,,Texas,48,84000048,USA,2022/03/19,61,44952276,25531
US,3/20/22,6691638,86654,,,2217,,56517212.83783784,,,Texas,48,84000048,USA,2022/03/20,4,44970104,17828
US,3/21/22,6693045,86928,,,1407,,56529096.283783786,,,Texas,48,84000048,USA,2022/03/21,274,44979974,9870
US,3/22/22,6698424,86987,,,5379,,56574527.027027026,,,Texas,48,84000048,USA,2022/03/22,59,45000129,20155
US,3/23/22,6710903,87062,,,12479,,56679923.98648649,,,Texas,48,84000048,USA,2022/03/23,75,45000129,0
US,3/24/22,6717152,87119,,,6249,,56732702.7027027,,,Texas,48,84000048,USA,2022/03/24,57,45071300,71171
US,3/25/22,6721453,86948,,,4301,,56769028.716216214,,,Texas,48,84000048,USA,2022/03/25,,45095059,23759
US,3/26/22,6726451,87012,,,4998,,56811241.55405405,,,Texas,48,84000048,USA,2022/03/26,64,45119358,24299
US,3/27/22,6726810,87036,,,359,,56814273.64864865,,,Texas,48,84000048,USA,2022/03/27,24,45140170,20812
US,3/28/22,6727341,87045,,,531,,56818758.44594595,,,Texas,48,84000048,USA,2022/03/28,9,45150458,10288
US,3/29/22,6732766,87308,,,5425,,56864577.7027027,,,Texas,48,84000048,USA,2022/03/29,263,45171210,20752
US,3/30/22,6735219,87355,,,2453,,56885295.60810811,,,Texas,48,84000048,USA,2022/03/30,47,45197271,26061
US,3/31/22,6738919,87393,,,3700,,56916545.60810811,,,Texas,48,84000048,USA,2022/03/31,38,45197271,0
US,4/1/22,6741563,87426,,,2644,,56938876.68918919,,,Texas,48,84000048,USA,2022/04/01,33,,
US,3/5/22,924248,4453,,,0,,355189.0182273753,,,Utah,49,84000049,USA,2022/03/05,0,5070331,43
US,3/7/22,924791,4461,,,543,,355397.6934280762,,,Utah,49,84000049,USA,2022/03/07,8,5070380,2
US,3/8/22,924891,4485,,,100,,355436.12348345394,,,Utah,49,84000049,USA,2022/03/08,24,5073910,3530
US,3/9/22,925089,4494,,,198,,355512.2149931018,,,Utah,49,84000049,USA,2022/03/09,9,5079864,5954
US,3/10/22,925275,4518,,,186,,355583.69489610434,,,Utah,49,84000049,USA,2022/03/10,24,5079891,27
US,3/11/22,925519,4539,,,244,,355677.46423122595,,,Utah,49,84000049,USA,2022/03/11,21,5080032,141
US,3/14/22,925872,4545,,,353,,355813.1223267093,,,Utah,49,84000049,USA,2022/03/14,6,5080108,0
US,3/15/22,925966,4550,,,94,,355849.24657876435,,,Utah,49,84000049,USA,2022/03/15,5,5099773,19665
US,3/16/22,926149,4553,,,183,,355919.57358010556,,,Utah,49,84000049,USA,2022/03/16,3,5100934,1161
US,3/17/22,926322,4556,,,173,,355986.05757590896,,,Utah,49,84000049,USA,2022/03/17,3,5100962,28
US,3/18/22,926442,4561,,,120,,356032.17364236224,,,Utah,49,84000049,USA,2022/03/18,5,5100977,15
US,3/21/22,926785,4572,,,343,,356163.98873230774,,,Utah,49,84000049,USA,2022/03/21,11,5101060,0
US,3/22/22,926894,4610,,,109,,356205.87749266945,,,Utah,49,84000049,USA,2022/03/22,38,5101060,0
US,3/23/22,927013,4645,,,119,,356251.60925856896,,,Utah,49,84000049,USA,2022/03/23,35,5101060,0
US,3/24/22,927165,4681,,,152,,356310.0229427431,,,Utah,49,84000049,USA,2022/03/24,36,5116039,14979
US,3/25/22,927296,4702,,,131,,356360.3663152879,,,Utah,49,84000049,USA,2022/03/25,21,5116856,817
US,3/28/22,927551,4706,,,255,,356458.362956501,,,Utah,49,84000049,USA,2022/03/28,4,5116903,0
US,3/29/22,927649,4711,,,98,,356496.02441077115,,,Utah,49,84000049,USA,2022/03/29,5,5121644,4741
US,3/30/22,927782,4714,,,133,,356547.13638442353,,,Utah,49,84000049,USA,2022/03/30,3,5121659,15
US,3/31/22,927922,4714,,,140,,356600.9384619523,,,Utah,49,84000049,USA,2022/03/31,0,5121659,0
US,4/1/22,927922,4714,,,0,,356600.9384619523,,,Utah,49,84000049,USA,2022/04/01,0,,
US,3/5/22,113107,607,,,0,,205417.5293305728,,,Vermont,50,84000050,USA,2022/03/05,0,1350110,1724
US,3/7/22,113407,607,,,300,,205962.3696923468,,,Vermont,50,84000050,USA,2022/03/07,0,1351340,534
US,3/8/22,113454,608,,,47,,206047.7280156914,,,Vermont,50,84000050,USA,2022/03/08,1,1351579,239
US,3/9/22,113651,608,,,197,,206405.506519923,,,Vermont,50,84000050,USA,2022/03/09,0,1351752,173
US,3/10/22,113762,608,,,111,,206607.09745377937,,,Vermont,50,84000050,USA,2022/03/10,0,1352416,664
US,3/11/22,113948,608,,,186,,206944.89847807927,,,Vermont,50,84000050,USA,2022/03/11,0,1353093,677
US,3/14/22,114206,608,,,258,,207413.46118920489,,,Vermont,50,84000050,USA,2022/03/14,0,1354724,424
US,3/15/22,114289,608,,,83,,207564.20035596236,,,Vermont,50,84000050,USA,2022/03/15,0,1354887,163
US,3/16/22,114535,609,,,246,,208010.96945261705,,,Vermont,50,84000050,USA,2022/03/16,1,1354989,102
US,3/17/22,114709,611,,,174,,208326.97686244597,,,Vermont,50,84000050,USA,2022/03/17,2,1355454,465
US,3/18/22,114868,611,,,159,,208615.7422541862,,,Vermont,50,84000050,USA,2022/03/18,0,1355976,522
US,3/21/22,115232,611,,,364,,209276.81522647198,,,Vermont,50,84000050,USA,2022/03/21,0,1357384,379
US,3/22/22,115312,613,,,80,,209422.1059896117,,,Vermont,50,84000050,USA,2022/03/22,2,1357565,181
US,3/23/22,115531,614,,,219,,209819.83945370672,,,Vermont,50,84000050,USA,2022/03/23,1,1357565,0
US,3/24/22,115675,615,,,144,,210081.36282735824,,,Vermont,50,84000050,USA,2022/03/24,1,1358173,608
US,3/25/22,115849,615,,,174,,210397.37023718716,,,Vermont,50,84000050,USA,2022/03/25,0,1358637,464
US,3/28/22,116157,615,,,308,,210956.73967527514,,,Vermont,50,84000050,USA,2022/03/28,0,1359472,388
US,3/29/22,116246,617,,,89,,211118.3756492681,,,Vermont,50,84000050,USA,2022/03/29,2,1360020,548
US,3/30/22,116465,617,,,219,,211516.1091133631,,,Vermont,50,84000050,USA,2022/03/30,0,1360149,129
US,3/31/22,116639,617,,,174,,211832.11652319203,,,Vermont,50,84000050,USA,2022/03/31,0,1360149,0
US,4/1/22,116800,617,,,161,,212124.51418401074,,,Vermont,50,84000050,USA,2022/04/01,0,,
US,3/5/22,15426,109,,,0,,14380.803221836895,,,Virgin Islands,78,850,VIR,2022/03/05,0,140401,100
US,3/7/22,15440,109,,,14,,14393.854644441959,,,Virgin Islands,78,850,VIR,2022/03/07,0,140401,0
US,3/9/22,15444,109,,,4,,14397.583622329119,,,Virgin Islands,78,850,VIR,2022/03/09,0,140690,227
US,3/10/22,15449,109,,,5,,14402.244844688072,,,Virgin Islands,78,850,VIR,2022/03/10,0,140729,39
US,3/11/22,15556,109,,,107,,14501.995003169632,,,Virgin Islands,78,850,VIR,2022/03/11,0,140777,48
US,3/14/22,15567,109,,,11,,14512.249692359324,,,Virgin Islands,78,850,VIR,2022/03/14,0,140852,0
US,3/16/22,15572,109,,,5,,14516.910914718275,,,Virgin Islands,78,850,VIR,2022/03/16,0,141092,214
US,3/17/22,15575,110,,,3,,14519.707648133646,,,Virgin Islands,78,850,VIR,2022/03/17,1,141133,41
US,3/18/22,15578,110,,,3,,14522.504381549017,,,Virgin Islands,78,850,VIR,2022/03/18,0,141164,31
US,3/21/22,15584,110,,,6,,14528.097848379759,,,Virgin Islands,78,850,VIR,2022/03/21,0,141223,0
US,3/22/22,15589,110,,,5,,14532.75907073871,,,Virgin Islands,78,850,VIR,2022/03/22,0,141382,159
US,3/23/22,15596,110,,,7,,14539.284782041243,,,Virgin Islands,78,850,VIR,2022/03/23,0,141382,0
US,3/24/22,15606,110,,,10,,14548.607226759146,,,Virgin Islands,78,850,VIR,2022/03/24,0,141433,51
US,3/25/22,15611,110,,,5,,14553.268449118097,,,Virgin Islands,78,850,VIR,2022/03/25,0,141456,23
US,3/28/22,15623,111,,,12,,14564.45538277958,,,Virgin Islands,78,850,VIR,2022/03/28,1,141492,0
US,3/29/22,15632,111,,,9,,14572.845583025693,,,Virgin Islands,78,850,VIR,2022/03/29,0,141510,18
US,3/30/22,15636,111,,,4,,14576.574560912853,,,Virgin Islands,78,850,VIR,2022/03/30,0,141527,17
US,4/1/22,15656,111,,,20,,14595.219450348659,,,Virgin Islands,78,850,VIR,2022/04/01,0,,
US,3/5/22,1645791,18955,,,0,,5861496.545337987,,,Virginia,51,84000051,USA,2022/03/05,0,15921527,7810
US,3/7/22,1648179,19060,,,2388,,5870001.424602892,,,Virginia,51,84000051,USA,2022/03/07,105,15936208,6079
US,3/8/22,1649266,19098,,,1087,,5873872.7829617495,,,Virginia,51,84000051,USA,2022/03/08,38,15940304,4096
US,3/10/22,1651940,19165,,,2674,,5883396.253294394,,,Virginia,51,84000051,USA,2022/03/10,67,15951612,6440
US,3/11/22,1653212,19212,,,1272,,5887926.490490776,,,Virginia,51,84000051,USA,2022/03/11,47,15958233,6621
US,3/14/22,1654893,19315,,,1681,,5893913.38414417,,,Virginia,51,84000051,USA,2022/03/14,103,15976546,4861
US,3/15/22,1656187,19356,,,1294,,5898521.974499608,,,Virginia,51,84000051,USA,2022/03/15,41,15979403,2857
US,3/16/22,1657409,19392,,,1222,,5902874.136334497,,,Virginia,51,84000051,USA,2022/03/16,36,15986497,7094
US,3/17/22,1658568,19430,,,1159,,5907001.923213904,,,Virginia,51,84000051,USA,2022/03/17,38,15992551,6054
US,3/18/22,1659710,19466,,,1142,,5911069.164470403,,,Virginia,51,84000051,USA,2022/03/18,36,15999145,6594
US,3/21/22,1661484,19520,,,1774,,5917387.2782961745,,,Virginia,51,84000051,USA,2022/03/21,54,16016714,4731
US,3/23/22,1663035,19563,,,1551,,5922911.176009688,,,Virginia,51,84000051,USA,2022/03/23,43,16019872,0
US,3/24/22,1664080,19586,,,1045,,5926632.95106489,,,Virginia,51,84000051,USA,2022/03/24,23,16034785,14913
US,3/25/22,1665082,19609,,,1002,,5930201.5813092105,,,Virginia,51,84000051,USA,2022/03/25,23,16039019,4234
US,3/28/22,1666422,19631,,,1340,,5934974.000997222,,,Virginia,51,84000051,USA,2022/03/28,22,16056874,5568
US,3/29/22,1667289,19653,,,867,,5938061.82776551,,,Virginia,51,84000051,USA,2022/03/29,22,16059894,3020
US,3/30/22,1668087,19673,,,798,,5940903.910534939,,,Virginia,51,84000051,USA,2022/03/30,20,16064392,4498
US,3/31/22,1668891,19692,,,804,,5943767.362347745,,,Virginia,51,84000051,USA,2022/03/31,19,16064392,0
US,4/1/22,1669750,19714,,,859,,5946826.697058195,,,Virginia,51,84000051,USA,2022/04/01,22,,
US,3/5/22,1430235,12025,,,0,,570103.1996269028,,,Washington,53,84000053,USA,2022/03/05,0,13895843,8831
US,3/7/22,1432321,12076,,,2086,,570934.6960414234,,,Washington,53,84000053,USA,2022/03/07,51,13895932,4
US,3/9/22,1434783,12133,,,2462,,571916.0690867491,,,Washington,53,84000053,USA,2022/03/09,57,13921494,6583
US,3/11/22,1437914,12183,,,3131,,573164.1109246511,,,Washington,53,84000053,USA,2022/03/11,50,13935772,6626
US,3/14/22,1440632,12219,,,2718,,574247.5276335038,,,Washington,53,84000053,USA,2022/03/14,36,13942770,6
US,3/16/22,1440633,12219,,,1,,574247.9262415644,,,Washington,53,84000053,USA,2022/03/16,0,13963937,9501
US,3/17/22,1442947,12273,,,2314,,575170.3052939137,,,Washington,53,84000053,USA,2022/03/17,54,13970789,6852
US,3/18/22,1445223,12333,,,2276,,576077.5372399581,,,Washington,53,84000053,USA,2022/03/18,60,13977176,6387
US,3/21/22,1446845,12355,,,1622,,576724.079514336,,,Washington,53,84000053,USA,2022/03/21,22,13982912,0
US,3/23/22,1448779,12395,,,1934,,577494.9875036373,,,Washington,53,84000053,USA,2022/03/23,40,13994932,0
US,3/24/22,1448779,12392,,,0,,577494.9875036373,,,Washington,53,84000053,USA,2022/03/24,,14011159,16227
US,3/25/22,1451227,12432,,,2448,,578470.7800361139,,,Washington,53,84000053,USA,2022/03/25,40,14019506,8347
US,3/28/22,1453251,12454,,,2024,,579277.562750874,,,Washington,53,84000053,USA,2022/03/28,22,14025225,0
US,3/30/22,1454772,12478,,,1521,,579883.8456111259,,,Washington,53,84000053,USA,2022/03/30,24,14041205,5984
US,4/1/22,1456264,12510,,,1492,,580478.568837619,,,Washington,53,84000053,USA,2022/04/01,32,,
US,3/5/22,492276,6440,,,0,,2413827.596351868,,,West Virginia,54,84000054,USA,2022/03/05,0,2641724,1341
US,3/7/22,493361,6452,,,1085,,2419147.788565264,,,West Virginia,54,84000054,USA,2022/03/07,12,2641765,1
US,3/8/22,493653,6470,,,292,,2420579.582230068,,,West Virginia,54,84000054,USA,2022/03/08,18,2643630,1865
US,3/9/22,494030,6488,,,377,,2422428.1651466116,,,West Virginia,54,84000054,USA,2022/03/09,18,2644394,764
US,3/10/22,494406,6544,,,376,,2424271.844660194,,,West Virginia,54,84000054,USA,2022/03/10,56,2645509,1115
US,3/11/22,494875,6550,,,469,,2426571.5406492106,,,West Virginia,54,84000054,USA,2022/03/11,6,2646548,1039
US,3/14/22,495539,6559,,,664,,2429827.4002157496,,,West Virginia,54,84000054,USA,2022/03/14,9,2647544,0
US,3/15/22,495728,6598,,,189,,2430754.1433755024,,,West Virginia,54,84000054,USA,2022/03/15,39,2649152,1608
US,3/16/22,495960,6622,,,232,,2431891.7328626066,,,West Virginia,54,84000054,USA,2022/03/16,24,2649826,674
US,3/17/22,496182,6635,,,222,,2432980.2883200943,,,West Virginia,54,84000054,USA,2022/03/17,13,2650912,1086
US,3/18/22,496409,6646,,,227,,2434093.36079239,,,West Virginia,54,84000054,USA,2022/03/18,11,2651958,1046
US,3/21/22,496748,6651,,,339,,2435755.614396391,,,West Virginia,54,84000054,USA,2022/03/21,5,2652980,1
US,3/22/22,496838,6660,,,90,,2436196.92066294,,,West Virginia,54,84000054,USA,2022/03/22,9,2654714,1734
US,3/23/22,496983,6680,,,145,,2436907.91409238,,,West Virginia,54,84000054,USA,2022/03/23,20,2654714,0
US,3/24/22,497111,6687,,,128,,2437535.549671472,,,West Virginia,54,84000054,USA,2022/03/24,7,2654779,65
US,3/25/22,497230,6739,,,119,,2438119.054623909,,,West Virginia,54,84000054,USA,2022/03/25,52,2656944,2165
US,3/28/22,497459,6743,,,229,,2439241.933902128,,,West Virginia,54,84000054,USA,2022/03/28,4,2657733,2
US,3/29/22,497553,6794,,,94,,2439702.853780524,,,West Virginia,54,84000054,USA,2022/03/29,51,2659116,1383
US,3/30/22,497681,6823,,,128,,2440330.4893596154,,,West Virginia,54,84000054,USA,2022/03/30,29,2659677,561
US,3/31/22,497769,6831,,,88,,2440761.9888202413,,,West Virginia,54,84000054,USA,2022/03/31,8,2659677,0
US,4/1/22,497864,6835,,,95,,2441227.8121015984,,,West Virginia,54,84000054,USA,2022/04/01,4,,
US,3/5/22,1574581,13489,,,0,,2156989.8217783803,,,Wisconsin,55,84000055,USA,2022/03/05,0,9892155,4966
US,3/7/22,1575712,13514,,,1131,,2158539.1580706583,,,Wisconsin,55,84000055,USA,2022/03/07,25,9899988,2501
US,3/8/22,1576128,13562,,,416,,2159109.0288908067,,,Wisconsin,55,84000055,USA,2022/03/08,48,9901313,1325
US,3/9/22,1576701,13620,,,573,,2159893.9711502898,,,Wisconsin,55,84000055,USA,2022/03/09,58,9905439,4126
US,3/10/22,1577169,13662,,,468,,2160535.0758229564,,,Wisconsin,55,84000055,USA,2022/03/10,42,9909880,4441
US,3/11/22,1577659,13713,,,490,,2161206.3178947656,,,Wisconsin,55,84000055,USA,2022/03/11,51,9914338,4458
US,3/14/22,1578362,13768,,,703,,2162169.344785545,,,Wisconsin,55,84000055,USA,2022/03/14,55,9929440,1795
US,3/15/22,1578877,13820,,,515,,2162874.833901834,,,Wisconsin,55,84000055,USA,2022/03/15,52,9930361,921
US,3/16/22,1579385,13868,,,508,,2163570.7338456693,,,Wisconsin,55,84000055,USA,2022/03/16,48,9933799,3438
US,3/17/22,1579906,13901,,,521,,2164284.4422526336,,,Wisconsin,55,84000055,USA,2022/03/17,33,9937464,3665
US,3/18/22,1580313,13960,,,407,,2164841.984136769,,,Wisconsin,55,84000055,USA,2022/03/18,59,9941152,3688
US,3/21/22,1581137,13994,,,824,,2165970.766722832,,,Wisconsin,55,84000055,USA,2022/03/21,34,9945300,48
US,3/22/22,1581507,14032,,,370,,2166477.6229811367,,,Wisconsin,55,84000055,USA,2022/03/22,38,9951724,6424
US,3/23/22,1581946,14102,,,439,,2167079.0010822066,,,Wisconsin,55,84000055,USA,2022/03/23,70,9951724,0
US,3/24/22,1582381,14145,,,435,,2167674.89965616,,,Wisconsin,55,84000055,USA,2022/03/24,43,9958715,6991
US,3/25/22,1582815,14201,,,434,,2168269.4283483336,,,Wisconsin,55,84000055,USA,2022/03/25,56,9962350,3635
US,3/28/22,1583706,14284,,,891,,2169489.993013603,,,Wisconsin,55,84000055,USA,2022/03/28,83,9969800,25
US,3/29/22,1584157,14291,,,451,,2170107.8096960234,,,Wisconsin,55,84000055,USA,2022/03/29,7,9971966,2166
US,3/30/22,1584731,14296,,,574,,2170894.1218372853,,,Wisconsin,55,84000055,USA,2022/03/30,5,9974930,2964
US,3/31/22,1585260,14302,,,529,,2171618.7892984836,,,Wisconsin,55,84000055,USA,2022/03/31,6,9974930,0
US,4/1/22,1585768,14317,,,508,,2172314.6892423183,,,Wisconsin,55,84000055,USA,2022/04/01,15,,
US,3/5/22,155426,1741,,,0,,2243770.752129349,,,Wyoming,56,84000056,USA,2022/03/05,0,732665,313
US,3/7/22,155492,1741,,,66,,2244723.5455464125,,,Wyoming,56,84000056,USA,2022/03/07,0,732703,6
US,3/8/22,155558,1749,,,66,,2245676.3389634765,,,Wyoming,56,84000056,USA,2022/03/08,8,733209,506
US,3/9/22,155629,1749,,,71,,2246701.3137000143,,,Wyoming,56,84000056,USA,2022/03/09,0,733410,201
US,3/10/22,155686,1749,,,57,,2247524.180742024,,,Wyoming,56,84000056,USA,2022/03/10,0,733464,54
US,3/11/22,155744,1749,,,58,,2248361.4840479284,,,Wyoming,56,84000056,USA,2022/03/11,0,733950,486
US,3/15/22,155815,1769,,,71,,2249386.4587844666,,,Wyoming,56,84000056,USA,2022/03/15,20,734793,508
US,3/18/22,155907,1769,,,92,,2250714.595062798,,,Wyoming,56,84000056,USA,2022/03/18,0,735631,315
US,3/22/22,155988,1783,,,81,,2251883.932438285,,,Wyoming,56,84000056,USA,2022/03/22,14,736404,406
US,3/25/22,156056,1783,,,68,,2252865.5983831384,,,Wyoming,56,84000056,USA,2022/03/25,0,737639,253
US,3/29/22,156112,1791,,,56,,2253674.029161253,,,Wyoming,56,84000056,USA,2022/03/29,8,738286,323
US,4/1/22,156167,1791,,,55,,2254468.023675473,,,Wyoming,56,84000056,USA,2022/04/01,0,,
